listing_id;agent_name;agent_phone;category;description;displayable_address;first_publish_date;image_url;last_publish_date;latitude;listing_status;longitude;new_home;num_bathrooms;num_beedrooms;num_floors;num_recepts;outcode;post_town;price;price_change;property_type;status;street_name42113089;Hawes & Co - Raynes Park;020 3478 3570;Residential;Brand new top floor apartment with large westerly aspect roof terrace & own balcony forming part of this brand new development. The property is luxuriously equipped offering spacious accommodation with two bedrooms, two bath/shower rooms and parking space. Six apartments reserved only four remaining.New Apartment, Show Property Now Open, Wimbledon SW20;2017-03-29 12:11:36;https://lid.zoocdn.com/354/255/754819f7e73228d20ddc779eeb252951f67c41d8.jpg;2017-04-03 12:22:08;51.40935;51.40935;sale;-0.218396;true;2;2;0;1;SW20;London;550000;;Flat;for_sale;New Apartment, Show Property Now Open42113103;Hawes & Co - Raynes Park;020 3478 3570;Residential;Brand new first floor apartment with own terrace and balcony forming part of this brand new development. The property is luxuriously equipped offering spacious accommodation with two bedrooms, two bath/shower rooms and parking space. Six apartments reserved only four remaining.New Apartment, Show Property Now Open, Wimbledon SW20;2017-03-29 12:10:21;https://lid.zoocdn.com/354/255/754819f7e73228d20ddc779eeb252951f67c41d8.jpg;2017-04-03 12:24:04;51.40935;51.40935;sale;-0.218396;true;2;2;0;1;SW20;London;540000;;Flat;for_sale;New Apartment, Show Property Now Open43383416;Paul Meakin Estate Agents Ltd;020 8166 1636;Residential;Entrance hall  Double glazed glass panel front door, power points, laminate flooring, dado rail, cupboard housing warm air boiler, storage cupboard, doors to bedrooms, bathroom and lounge.Kitchen 12' 9" x 5' 9" (3.89m x 1.75m) Sky light, wall and base units, 1 1/2 sink and drainer unit, space for cooker, space and plumbing for washing machine, tumble dryer and fridge/freezer, power points, part tiled walls.Living room 18' 4" x 10' 8" (5.59m x 3.25m) Double glazed window to side, double glazed sliding patio doors to balcony, power points, television aerial point, telephone point, laminate flooring, dado rail, archway to kitchen, two electric heaters.Bedroom one 12' 0" x 9' 3" (3.66m x 2.82m) Double glazed window to side, power points, dado rail, electric heater.Bedroom two 9' 8" x 7' 9" (2.95m x 2.36m) Double glazed window to side, power points, built in wardrobes.Bathroom  Double glazed frosted window to front, low level w.C, pedestal wash hand basin, enclosed bath with wall mounted electric shower, fully tiled walls, tiled flooring, large cupboard, heated towel rail.Private balcony parking  Allocated parking space and storage shed.Cascades, Courtwood Lane, Forestdale CR0;2017-03-29 12:10:08;https://lid.zoocdn.com/354/255/323fc3f3e6f0e06e62c92c82d54d5937f47a8808.jpg;2017-03-30 01:43:34;51.34292;51.34292;sale;-0.038462;false;0;2;0;0;CR0;Croydon;265000;;Maisonette;for_sale;Court Wood Lane43383415;Paul Meakin Estate Agents Ltd;020 3544 6101;Residential;Porch  Double glazed sliding doors to porch, front door to:Entrance hall  Wood flooring, radiator, stairs to first floor, doors to :Lounge  Double glazed Georgian style bay window, radiator, power points, television aerial point, coving.Dining room  Feature fire place surround, double glazed window, double glazed sliding doors to garden, radiator, coving, power points, archway to study.Study  Double glazed window, power point.Play room / optional bedroom  Window, door to lean to storage area, power points.Lean to  Storage area, plumbing for washing machine, space for tumble dryer, power points, door to garden.Shower room  Tiled flooring, fully tiled walls, window to side, separate shower cubicle with wall mounted shower, pedestal wash hand basin, low level w.C. Wall mounted heated towel rail.Kitchen  Fitted wall and base units, gas point for cooker, part tiled walls, power points, plumbing for slim line dish washer, tiled flooring, double glazed window, double glazed door to side, space for American style fridge freezer.Landing  Window, access to loft, doors to bedrooms and bathroom.Bedroom one  Double glazed Georgian style window, fitted wardrobes to one wall, power points, radiator.Bedroom two  Double glazed Georgian style window, power points, radiator.Bedroom three  Double glazed Georgian style window, radiator, power points.Bathroom  Corner bath, low level w.C., pedestal wash hand basin, fully tiled walls, double glazed window.Garage  Door to single garage.Driveway  Off street parking for up to three cars via the gravel driveway.Planning permission  Plans are available to see on viewing appointments. The current owners have approved planning permission for a two storey side extension where the garage currents stands, plus permission for a single storey garage to the rear of the garden which would be accessed via Barn Crescent.Lower Barn Road, Purley CR8;2017-03-29 12:10:08;https://lid.zoocdn.com/354/255/6367dcfcdbeca7bb4858dae2e863281ba78c67ac.jpg;2017-03-30 01:43:34;51.331814;51.331814;sale;-0.097476;false;2;3;0;3;CR8;Purley;575000;;Detached house;for_sale;43383408;Hawes & Co - Raynes Park;020 3478 3570;Residential;Brand new first floor apartment with own balcony forming part of this brand new development. The property is luxuriously equipped offering spacious accommodation with two bedrooms, two bath/shower rooms and parking space. Six apartments reserved only four remaining.New Apartment, Show Property Now Open, Wimbledon SW20;2017-03-29 12:10:07;https://lid.zoocdn.com/354/255/754819f7e73228d20ddc779eeb252951f67c41d8.jpg;2017-04-03 12:23:23;51.40935;51.40935;sale;-0.218396;true;2;2;0;1;SW20;London;525000;;Flat;for_sale;New Apartment, Show Property Now Open43383407;Hawes & Co - Raynes Park;020 3478 3570;Residential;Brand new top floor apartment with own balcony forming part of this brand new development. The property is luxuriously equipped offering spacious accommodation with two bedrooms, two bath/shower rooms and parking space. Six apartments reserved only four remaining.New Apartment, Show Property Now Open, Wimbledon SW20;2017-03-29 12:10:07;https://lid.zoocdn.com/354/255/754819f7e73228d20ddc779eeb252951f67c41d8.jpg;2017-04-03 12:23:28;51.40935;51.40935;sale;-0.218396;true;2;2;0;1;SW20;London;535000;;Flat;for_sale;New Apartment, Show Property Now Open43383388;Chelsea Square - Cricklewood;020 8022 0766;Residential;An extremely bright fully refurbished one bedroom first floor flat converted from this detached double fronted house moments from Kilburn Jubilee line station. Features include high ceilings, a south facing reception room, communal gardens off street parking and being yards from the award wining Mapesbury Dell.Walm Lane, Mapesbury NW2;2017-03-29 12:07:41;https://li.zoocdn.com/cc537ce0208ddbb33b73413cfbd64b2c2766da59_354_255.jpg;2017-04-07 07:56:25;51.552406;51.552406;sale;-0.213678;false;1;1;0;1;NW2;London;458950;;Flat;for_sale;43383363;Dexters - Bloomsbury;020 8022 5540;Residential;A beautifully presented seventh floor studio on the quieter Coram Street side of the famous Russell Court in WC1. The flat has been thoughtfully renovated by the current owners, and comes with a share of the freehold.DirectionsRussell Court is a purpose built mansion building moments from Russell Square and The Brunswick shopping centre which contains many well known high street shops and restaurants as well as a Waitrose.You may download, store and use the material for your own personal use and research. You may not republish, retransmit, redistribute or otherwise make the material available to any party or make the same available on any website, online service or bulletin board of your own or of any other party or make the same available in hard copy or in any other media without the website owner's express prior written consent. The website owner's copyright must remain on all reproductions of material taken from this website.Woburn Place, London WC1H;2017-03-29 12:06:23;https://lid.zoocdn.com/354/255/05f515830f47caf5c54061d05967ebef88da1168.jpg;2017-03-30 01:43:33;51.523415;51.523415;sale;-0.126145;false;1;0;0;1;WC1H;London;359950;;Studio;for_sale;Woburn Place43383362;London Property Guru;020 3641 9263;Residential;LondonPropertyGuru welcome to the Sales market this wonderful opportunity to acquire a two double bedroom ground floor garden maisonette within a short walking distance of both Colliers Wood and South Wimbledon Stations. With this location bracing itself to boom this property will equally attract both First Time Buyers and Buy to Let investors with an eye for the future. The property briefly comprises two large double bedrooms, centrally located reception room, separate modern kitchen and a rear hard landscaped garden with South aspect. The current owners have decorated to the highest of standards and maintained the property in excellent condition. No chain. Share of freehold - For an immediate viewing call our Sales team team on .Reception Room4.2M/3.1M - Centrally located within the property this good sized, warm reception room hosts dark tanned high spec laminate floors and double glazed windows that capture plenty of natural daylight through the South faced view.Master Bedroom4.2M/3.6M - A wonderfully sized bedroom located at the front of the property with tall standing double glazed bay windows, laminate floors and built in storage cupboards.Bedroom Two3.6M/3.2M - Located down the hallway which offers additional storage space this large second bedroom offers a view of the garden.Kitchen3.1M/2.7M - Located to the rear of the accommodation this bright kitchen is floored with 'pine style' laminate and hosts a gas hob, oven plenty of cupboard storage space and leads you to the rear garden.BathroomFamily size white walls, with artistic tiles and and charcoal coloured floor. Tall windows allow for plentiful natural daylightGardenHard landscaped 'L' shaped garden soaking up the sun during the Summer. Ample space to entertain and complete with a storage shed. With share of the freehold there is scope to extend the property as you see fit.LondonPropertyGuru endeavour to maintain accurate depictions of properties in Virtual Tours, Floor Plans and descriptions, however, these are intended only as a guide and purchasers must satisfy themselves by personal inspection.Abbey Road, London SW19;2017-03-29 12:06:23;https://li.zoocdn.com/6e88626984623ddd862ee656f1c78506b41fe11c_354_255.jpg;2017-04-04 09:08:07;51.414818;51.414818;sale;-0.185898;false;1;2;0;1;SW19;London;450000;;Maisonette;for_sale;Abbey Road43383356;Dexters - Richmond;020 8166 7534;Residential;A very slick and modern apartment positioned on the second floor of this contemporary block with plush communal areas, a direct dial intercom system and the choice of two private balconies.DirectionsBardolph Road is just half a mile from central Richmond and the station with it's fast train service into London Waterloo, South West Trains and the District Line (Zone 4).You may download, store and use the material for your own personal use and research. You may not republish, retransmit, redistribute or otherwise make the material available to any party or make the same available on any website, online service or bulletin board of your own or of any other party or make the same available in hard copy or in any other media without the website owner's express prior written consent. The website owner's copyright must remain on all reproductions of material taken from this website.Bardolph Road, Richmond TW9;2017-03-29 12:06:23;https://lid.zoocdn.com/354/255/038ee2b59acc14722c17d4ebbe9c1931394ee030.jpg;2017-03-30 10:31:43;51.46649;51.46649;sale;-0.289539;false;2;2;0;1;TW9;Richmond;649950;;Flat;for_sale;Bardolph Road43383365;Dexters - Kennington;020 3641 0075;Residential;A well proportioned one bedroom apartment offering versatile living and entertaining space with large reception room, eat in kitchen/breakfast room and three piece bathroom.DirectionsVictoria Mansions is a red brick mansion flat located moments from Vauxhall Station as well as the green open spaces of Vauxhall Park & Albert Embankment.You may download, store and use the material for your own personal use and research. You may not republish, retransmit, redistribute or otherwise make the material available to any party or make the same available on any website, online service or bulletin board of your own or of any other party or make the same available in hard copy or in any other media without the website owner's express prior written consent. The website owner's copyright must remain on all reproductions of material taken from this website.South Lambeth Road, London SW8;2017-03-29 12:06:23;https://li.zoocdn.com/e6079daf864c88a3415dbfa2e07a0ac15db0b17a_354_255.jpg;2017-04-07 12:07:44;51.4797;51.4797;sale;-0.123689;false;1;1;0;1;SW8;London;430000;;Flat;for_sale;South Lambeth Road43383334;Dexters - Putney;020 8166 1770;Residential;A bright and spacious two double bedroom, two bathroom apartment. The property is in good condition throughout and has a large open plan living room and kitchen leading onto a private balcony.DirectionsIdeally located for a buyer seeking a convenient lifestyle. Wandsworth Town and East Putney Tube stations are within walking distance as is the the river taxi service. There is a convenience store and restaurants close by.You may download, store and use the material for your own personal use and research. You may not republish, retransmit, redistribute or otherwise make the material available to any party or make the same available on any website, online service or bulletin board of your own or of any other party or make the same available in hard copy or in any other media without the website owner's express prior written consent. The website owner's copyright must remain on all reproductions of material taken from this website.Point Pleasant, London SW18;2017-03-29 12:05:14;https://lid.zoocdn.com/354/255/80b044ef97e2d9e0f957b730c0050b1d02119f7f.jpg;2017-04-04 14:18:07;51.461235;51.461235;sale;-0.199289;false;1;2;0;1;SW18;London;599999;;Flat;for_sale;Point Pleasant43383331;Dexters - St Johns Wood;020 7768 7036;Residential;A well presented two bedroom apartment situated within this semi detached house. Located at the rear of the building on the first floor the apartment benefits from a spacious reception room with Juliette balcony and separate kitchen.DirectionsConveniently located for local shops, restaurants and amenities, whilst a combination of Jubilee, Metropolitan, Overground and Thameslink transport links can be found at West Hampstead, Finchley Road and Finchley Road & Frognal.You may download, store and use the material for your own personal use and research. You may not republish, retransmit, redistribute or otherwise make the material available to any party or make the same available on any website, online service or bulletin board of your own or of any other party or make the same available in hard copy or in any other media without the website owner's express prior written consent. The website owner's copyright must remain on all reproductions of material taken from this website.Finchley Road, London NW3;2017-03-29 12:05:14;https://li.zoocdn.com/62218a2e5a79305616517f87d311d130a61f35b7_354_255.jpg;2017-03-30 01:43:32;51.556435;51.556435;sale;-0.194377;false;1;2;0;1;NW3;London;665000;;Flat;for_sale;Finchley Road43383335;Dexters - Isleworth;020 8166 7640;Residential;Upon entering the wide entrance hall of this beautiful family home on one of Isleworths premier roads you will be astounded by its space and potential and will want to make it yours!DirectionsCollege Road is a beautiful tree lined road and is a short walk to Isleworth train station and Osterley tube station. It is also in the catchment area of some of the finest schools.You may download, store and use the material for your own personal use and research. You may not republish, retransmit, redistribute or otherwise make the material available to any party or make the same available on any website, online service or bulletin board of your own or of any other party or make the same available in hard copy or in any other media without the website owner's express prior written consent. The website owner's copyright must remain on all reproductions of material taken from this website.College Road, Osterley, Isleworth TW7;2017-03-29 12:05:14;https://lid.zoocdn.com/354/255/78849f4c3ac77bda98295ea1d24e75fb80f86e2c.jpg;2017-03-30 01:43:32;51.47814;51.47814;sale;-0.336208;false;1;4;0;2;TW7;Isleworth;799950;;Semi-detached house;for_sale;College Road43383304;Real Estates;020 3478 3532;Residential;*chain free* A spacious detached family home comprising almost 3000 sq ft of living accommodation, located in this highly desirable location, close to several popular schools and within easy reach of both Mill Hill Village and The Broadway's shops, cafes and Thameslink station.The entrance hall leads to a generously sized front aspect drawing room, tv room with doors onto the patio and garden, study, recently fitted high specification kitchen/dining room, utility room and guest cloakroom. To the 1st floor there are 3 double bedrooms. The air-conditioned master bedroom has the benefit of a walk-in dressing room and 4 piece en suite bathroom, as well as a good size family bathroom with separate shower cubicle. The 2nd floor offers a 4th bedroom and a shower room plus a 5th bedroom which could be utilised for a multitude of purposes but is currently a living room/kitchenette.The delightful south-easterly aspect rear garden has the benefit of 2 patios areas and a well maintained lawn with mature plant and shrub borders. The large driveway provides off street parking for 3/4 cars.Entrance HallReception Room (29'1 x 15'1 (8.86m x 4.60m))Study (14'1 x 10'5 (4.29m x 3.18m))Reception Room (17'11 x 11'11 (5.46m x 3.63m))Kitchen/Diner (21'1 x 12'6 (6.43m x 3.81m))Utility Room (15'3 x 5'5 (4.65m x 1.65m))Guest Cloakroom1st Floor:Master Bedroom (17'11 x 11'4 (5.46m x 3.45m))En Suite BathroomDressing Area (11'11 x 9'4 (3.63m x 2.84m))Bedroom Two (16'6 x 15'3 (5.03m x 4.65m))Bedroom Three (12'6 x 10'4 (3.81m x 3.15m))Family Bathroom (10'6 x 8'2 (3.20m x 2.49m))2nd Floor:Bedroom Four (19'7 x 9'6 (5.97m x 2.90m))Bedroom Five (19'2 x 11'6 (5.84m x 3.51m))Shower Room (11'10 x 4'10 (3.61m x 1.47m))You may download, store and use the material for your own personal use and research. You may not republish, retransmit, redistribute or otherwise make the material available to any party or make the same available on any website, online service or bulletin board of your own or of any other party or make the same available in hard copy or in any other media without the website owner's express prior written consent. The website owner's copyright must remain on all reproductions of material taken from this website.Marsh Lane, London NW7;2017-03-29 12:04:01;https://lid.zoocdn.com/354/255/25dcfe9318217dd6a77f96cd5daedb567d57d5ab.jpg;2017-03-30 01:43:30;51.623985;51.623985;sale;-0.251435;false;3;5;0;4;NW7;London;1395000;;;for_sale;Marsh Lane43383301;Dexters - Maida Vale;020 3463 2635;Residential;A two bedroom garden flat available chain free and presented in very good condition. With a separate kitchen/living room and a large family bathroom.DirectionsShirland Road provides great to transport links to Central London. The flat is half a mile from Maida Vale station, Paddington Rec and amenities on Elgin Avenue and Lauderdale Parade.You may download, store and use the material for your own personal use and research. You may not republish, retransmit, redistribute or otherwise make the material available to any party or make the same available on any website, online service or bulletin board of your own or of any other party or make the same available in hard copy or in any other media without the website owner's express prior written consent. The website owner's copyright must remain on all reproductions of material taken from this website.Shirland Road, London W9;2017-03-29 12:04:01;https://li.zoocdn.com/f5caf8efc84d73cd6947df8e860a7ee7e0d90f16_354_255.jpg;2017-04-05 14:55:09;51.527084;51.527084;sale;-0.195654;false;1;2;0;1;W9;London;599950;;Flat;for_sale;Shirland Road41534288;Central Estates;020 3463 1592;Residential;A charming one double bedroom apartment situated on the second (top) floor of this small period building. The bright south/west facing accommodation (517 .) is full of character, including high ceilings, part exposed brickwork, wood flooring and an attractive skylight feature in the reception room. It has been fully refurbished throughout benefitting from a new bespoke kitchen and modern bathroom (with large window) and has a spacious 17ft double bedroom with plenty of storage and added desk area.Harcourt Street is a quiet, one-way street located off York Street and is now home to the new trendy Harcourt Restaurant as well as one of Marylebone???s best kept secrets, Dinings Japanese Restaurant. It is within early walking distance of the extensive facilities at Baker Street and there are many transport links close by including Marylebone, Baker Street, Edgware Road and Paddington stations. Oxford Street and the fashionable Marylebone High Street are also only a 10 minute walk away.Harcourt Street, London W1H;2017-03-29 12:01:17;https://lid.zoocdn.com/354/255/45c2684eb50f3adf04891fdf22f097bee46b17a1.jpg;2017-03-31 13:59:06;51.51976;51.51976;sale;-0.164002;false;1;1;0;1;W1H;London;845000;;Flat;for_sale;Harcourt Street43383243;Century 21;020 8166 7398;Residential;Century21 Cameron Adams are delighted to offer this 3 bedroom ground floor flat with sole use of rear garden also benefiting from off street parking, the property is a stone throw away from leytonstone underground station (central line)This property has just been refurbished throughout new bathroom, new kitchen, wood flooring throughout flat, large basement with planning premission to make two further rooms.Fairlop Road, London E11;2017-03-29 12:00:00;https://lid.zoocdn.com/354/255/5c205b05c51d9dd9465ca2b56807c437d404650f.jpg;2017-03-30 01:43:29;51.56908;51.56908;sale;0.005341;false;1;3;0;1;E11;London;410000;;Flat;for_sale;Fairlop Road43383236;Estates 17 Ltd;020 7768 0484;Residential;A Charming First Floor Flat.This two bedroom first floor flat forms part of Gladioli House, a development of two semi detached period homes located on this stunning road in Central Walthamstow. The location of this flat couldn???t be better with the high street and everything that it has to offer just to the end of the road. Fancy a short stroll? Stoneydown Park is quite literally at the end of the road. Fancy a longer stroll? Head down Coppermill Lane for a cup of coffee at Springfield Marina (perhaps stopping at The Coppermill on the way). Can???t face cooking on a Sunday? Head over to The Chequers for a spot of lunch. Weekend over and need to get to work? Take your pick of Walthamstow Central, Blackhorse Road and St James Street stations.Living Here...Set on such an idyllic street this really is an excellent purchase for any first time buyer. Perfectly placed in the heart of it all you will soon start to experience the many wonders of Walthamstow. Presented in fantastic working order this flat allows you to move straight in and start enjoying live in this wonderful part of East London. Featuring a 18'10 combined lounge kitchen, a contemporary bathroom, a communal garden, and two bedrooms with such amazing transport links on to the city it is most definitely a commuters dream.In This Area - By Walthamstow DiaryGet off the tube at Walthamstow Central and find the world waiting for you. Honestly, this is no exaggeration, if you want something, you???ll likely find it not too far from the station. The market, the longest in Europe, is busy and thriving. Pick up fresh fruit and veg, or visit the rotisserie stall on a Saturday for the best pork or chicken baguettes in town. Next to the market we have a shopping centre packed with high street names, and right at the top of the High Street you???ll find our new cinema and retail complex. Called the Scene, it is home to a ten screen Empire cinema, Pizza Express, and loads of other bars and restaurants. Just around the corner from this new cinema, is a very old one. The Granada opened in 1930, and after a long campaign by local residents it has recently reopened as a bar and live music venue. Now called Mirth, Marvel and Maud, this building is simply stunning. The hustle and bustle of the High Street is contrasted by the quiet residential streets that surround it. This part of Walthamstow really gives you the best of both worlds, a shopping hub, nightlife, and peace and quiet at home.Dimensions:Communal EntranceDoor To Flat.EntranceVia front door leading into:Entrance HallwayDoor To Lounge/Kitchen, Bedroom One & Bathroom.Lounge/Kitchen (5.74m x 3.12m (18'10 x 10'3))Bedroom One (3.53m x 3.25m (11'7 x 10'8))Bedroom Two (3.40m x 2.01m (11'2 x 6'7))Bathroom (2.16m x 2.08m (7'1 x 6'10))Gladioli House, Carisbrooke Road, Walthamstow, London E17;2017-03-29 11:59:25;https://li.zoocdn.com/6530f2729b32b6e5f676527bdcb230c57d3c4760_354_255.jpg;2017-03-30 01:43:28;51.58326;51.58326;sale;-0.032748;false;1;2;0;1;E17;London;365000;;Flat;for_sale;Gladioli House