listing_id;agent_name;agent_phone;category;description;displayable_address;first_publish_date;image_url;last_publish_date;latitude;listing_status;longitude;new_home;num_bathrooms;num_beedrooms;num_floors;num_recepts;outcode;post_town;price;price_change;property_type;status;street_name43400204;Douglas Allen;020 8166 7328;Residential;The fact that this property falls within the Beal school catchment area is one thing but once you???ve stepped through the front door you will feel as though you???re in the sheiks palace!The enormous open plan lounge area has enough room for the whole family to do their own thing, without getting in each other???s way.The kitchen / dining area has plenty of storage and an island breakfast bar making life super convenient if you fancy a quick meal and don???t want to dress the formal dining table.Leading out from the lounge area you walk out to the landscaped rear garden with the sun shining and gentle trickle from the water feature, you will want to relax and not move. Whether you work from home, require some office space or just want some additional living space, the annexe in the rear garden will benefit almost all families.There are 3 bedrooms on the 1st floor plus a family bathroom with a state of the are bathtub/shower. There is also a 4th loft room, which has plenty of space and has a en-suite bathroom, allowing you to use this as your own private recluse.Bigger and better than your standard house, be sure to arrange a viewing quick before this house gets snapped up!What the Owner says:After spending years on building works and high quality materials, our house has now been made into a dream home.There is annexe in the garden, which has a lovely shower room, kitchen / lounge area and 2 additional rooms making it more like a 2 bedroom flat rather than an annexe. There is also a utility room and a prayer room in the garden.We are sad to be leaving this dream home but are sure the new owners will love living here as much as we have.Room sizes:Entrance HallLounge Area 15'8 x 11'4 (4.78m x 3.46m)Kitchen / Dining Area 26'4 x 19'2 (8.03m x 5.85m)LandingBedroom 1 15'9 x 11'11 (4.80m x 3.63m)Bedroom 2 14'8 x 10'1 (4.47m x 3.08m)Bedroom 3 6'10 x 6'10 (2.08m x 2.08m)Family BathroomLandingLoft RoomEn-Suite BathroomAnnexeEntranceKitchen / Lounge Area 13'3 x 12'5 (4.04m x 3.79m)Bedroom 1Bedroom 2Shower RoomGym 11'0 x 9'11 (3.36m x 3.02m)Off Road ParkingRear GardenThe information provided about this property does not constitute or form part of an offer or contract, nor may be it be regarded as representations. All interested parties must verify accuracy and your solicitor must verify tenure/lease information, fixtures & fittings and, where the property has been extended/converted, planning/building regulation consents. All dimensions are approximate and quoted for guidance only as are floor plans which are not to scale and their accuracy cannot be confirmed. Reference to appliances and/or services does not imply that they are necessarily in working order or fit for the purpose.Herent Drive, Ilford, Essex IG5;2017-03-30 16:20:33;https://li.zoocdn.com/b884874b656c89d413b986239bba07cac4c87954_354_255.jpg;2017-03-31 01:45:20;51.58656;51.58656;sale;0.056505;false;0;4;0;0;IG5;Ilford;600000;;Semi-detached house;for_sale;Herent Drive43400208;Ellisons;020 3641 4166;Residential;A beautifully refurbished three bedroom, three bathroom Victorian family home situated in the popular Ministers area of Wimbledon being within easy reach of both Mainline and Northern Line Stations. The property has been recently refurbished by the current owners and has a fantastic open plan living area with brand new modern fitted kitchen and double doors opening onto a pretty garden. Offered to the market with the great benefit of no onward chain this would ideally suit a buyer looking for a ready made family home.Russell Road, London SW19;2017-03-30 16:20:33;https://lid.zoocdn.com/354/255/8b59e7948e378dc8bec9b1f197366989b36f1669.jpg;2017-04-06 10:36:54;51.41603;51.41603;sale;-0.199973;false;3;3;0;1;SW19;London;950000;;Terraced house;for_sale;Russell Road43400198;Cubitt & West - Sutton;020 8166 7333;Residential;Looking for a home should be an exciting affair, whether it is a first time purchase, you are downsizing or even looking for that rock solid investment. The reality is that there are very few properties that give you everything that you need - but we are pleased to now give you that opportunity!Inside, this spacious two bedroom first floor maisonette offers fantastic living and entertaining space to really impress your family and friends. The lounge has more than enough room to relax and entertain in excellent for when you have all you friends over for gatherings.The rest of the property also doesn't disappoint with a generously proportioned kitchen/diner that is wonderful to sit in and enjoy dinner and a glass of wine after a long day. The two double bedrooms have both have a bright and airy feel to them. There is also a family bathroom to relax in after a hard day at work. Now this is where this home really excels ??? there are stairs that lead down to a utility space which then has direct access to your very own private garden! The loft has been all boarded so is wonderful for extra storage.On the outside, the location really doesn't get any better. Ever fancied a convenient road? Well this home ticks these boxes, being within a short distance to Sutton???s excellent local amenities including a vast array of shops, restaurants and train station within a mile. I am sure you will agree that this is an absolute must view for any first time buyer of investment purchaser.Please refer to the footnote regarding the services and appliances.What the Owner says:We have owned this property for almost 10 years now and we can honestly say it has been a wonderful home and investment.When we were looking a property we really wanted a nice safe location. When we saw that it had it own private garden we were sold!In the recent past we have rented the property out and it has always been easy to find a tenant. We wish the new owners every happiness in their new home.Room sizes:Entrance HallLounge 17'1 x 13'2 (5.21m x 4.02m)Bedroom 1 10'8 x 10'8 (3.25m x 3.25m)Bedroom 2 8'7 x 7'8 (2.62m x 2.34m)Kitchen/Diner 11'8 x 11'1 (3.56m x 3.38m)Bathroom 7'7 x 6'3 (2.31m x 1.91m)Utility Area 8'6 x 7'2 (2.59m x 2.19m)Front GardenRear GardenThe information provided about this property does not constitute or form part of an offer or contract, nor may be it be regarded as representations. All interested parties must verify accuracy and your solicitor must verify tenure/lease information, fixtures & fittings and, where the property has been extended/converted, planning/building regulation consents. All dimensions are approximate and quoted for guidance only as are floor plans which are not to scale and their accuracy cannot be confirmed. Reference to appliances and/or services does not imply that they are necessarily in working order or fit for the purpose.Carshalton Grove, Sutton, Surrey SM1;2017-03-30 16:20:33;https://lid.zoocdn.com/354/255/da75fd3de5a879e09c32b0e82b5d00b3565ebf9a.jpg;2017-04-06 16:15:47;51.363613;51.363613;sale;-0.179447;false;0;2;0;0;SM1;Sutton;350000;;Maisonette;for_sale;Carshalton Grove39645036;Atkinson Mcleod - Kennington;020 3478 3505;Residential;This attractive period house set within the sought after Liverpool Grove conservation area has been beautifully presented by the current owners and offers deceptively spacious living accommodation with the added benefit of a superb converted loft (3rd bedroom). Having been renovated by the owners the house now benefits from full re-wiring, new plumbing plus installation of new boiler. Further accommodation comprise of two inter-connecting reception rooms, newly fitted kitchen inclusive of integrated appliances, stylish bathroom, two further double bedrooms with built in cupboards, eaves storage, period features and a pretty west facing garden to the rear.Our Ref: Rps/iupload/KEN160145Portland Street, Walworth, London SE17;2017-03-30 16:20:33;https://lid.zoocdn.com/354/255/e933cd4bf16294ab5e713fcd45b641f862cbe498.jpg;2017-03-30 16:20:33;51.484917;51.484917;sale;-0.089166;false;1;3;0;1;SE17;London;735000;;Terraced house;sold;Walworth London43400187;Morris & Joel;020 7768 7008;Residential;Detailed DescriptionWe are pleased to present on the market as sole agents, this spacious and well planned ground floor maisonette accessed via its own entrance. The property is presented in good condition throughout and comprises Two double bedrooms with fully fitted wardrobes, Two bathrooms (One en-suite shower room), large reception, separate fully fitted kitchen/breakfast room and direct access to a patio with large well maintained communal gardens.Resident parking. Leasehold with share of freehold.Hardwick Close, Stanmore HA7;2017-03-30 16:18:33;https://lid.zoocdn.com/354/255/2a495b5a907f4e1bf154b3508fba8c6168fbec03.jpg;2017-03-31 01:45:19;51.616966;51.616966;sale;-0.308039;false;2;2;0;1;HA7;Stanmore;450000;;Flat;for_sale;Hardwick Close43400167;Goldschmidt & Howland - West Hampstead;020 3551 9697;Residential;A charming three double bedroom upper maisonette occupying the upper floors of well-maintained Victorian house on a desirable street in West Hampstead. This spacious property extends to approximately 1170 sq ft of well-planned accommodation comprising a kitchen/breakfast room, reception room with feature fireplace and bay window, large double bedroom with direct access to a private south facing terrace providing exceptional views of Central and West London, two further double bedrooms, family bathroom, family shower room, guest cloakroom and ample storage throughout. Burrard Road allows easy access to the cafes, shops, restaurants and fantastic transport facilities of the Thameslink, Jubilee Line and Overground at West End Lane.Burrard Road, West Hampstead, London NW6;2017-03-30 16:14:08;https://li.zoocdn.com/78ebfe58e467e53efd13c292fea6968f525ef8ea_354_255.jpg;2017-03-30 16:14:08;51.55435;51.55435;sale;-0.195196;false;2;3;0;1;NW6;London;850000;;Flat;for_sale;West Hampstead London43400169;MyLondonHome New Homes - Central and West End;020 8033 9068;Residential;A striking brand new one bedroom apartment has come onto the market in the stunning Rathbone Square development seconds from Oxford Street!This second floor apartment features a large open plan reception room, one double bedroom with fitted wardrobe, shower room and private balcony. Taking the traditional public square that gives so many beautiful corners of London their character and atmospheric finesse, Rathbone Square has been designed to embody an air of relaxation and leafy tranquility in dazzling Fitzrovia.Beautifully designed with modern, high spec appliances, this property really promotes luxurious living. From the hustle and bustle of Oxford street shopping, to the excitement of theatre life in the West End, there really is no better place to live in London. As the new home of Facebook on its doorstep from Q1 2017 and some of Londons finest Universities within walking distance, whether youre buying as a home to live in, a pied-a-tier or an investment, this apartment really is a spectacular purchase.Residents of Rathbone Square can expect amazing amenities such as a 24hr concierge service, gymnasium, screening room, swimming pool, sauna and steam room, wine storage and tasting room, residents' lounge and private resident's garden.Wonderfully located with some of London's most popular destinations close by, as well as a variety of transport links such as Tottenham Court Road underground and Goodge Street underground station within walking distance, for convenience. Completion expected Q3 2017** Images shown are not of the actual unit being sold and are for illustration purposes only. The images may or will include furniture, floor coverings, blinds and curtains, fixtures, decoration and fittings not included in the asking price. Please check with us on any point that is important to you **These particulars are not intended to, and do not offer or form part of any contract and whilst these sales particulars are believed to be correct, their accuracy is in no way guaranteed. Any measurements are for general guidance and interest only and should not be relied on. None of the services to the property, or any of the appliances, fixtures or fittings have been or will be tested by MyLondonHome. Photographs may depict general images of the development and may not show the actual flat for sale. Internal photographs may show items not included in the sale.Rathbone Square, Fitzrovia, London W1T;2017-03-30 16:14:08;https://lid.zoocdn.com/354/255/e5cf6582bbaa75a4433f6aae76a6d1c3547ac19b.jpg;2017-04-04 09:14:12;51.517914;51.517914;sale;-0.13420503;true;1;1;0;1;W1T;;1100000;;Flat;for_sale;Rathbone Square43400158;MyLondonHome Sales and Lettings;020 3478 2913;Residential;This duplex apartment is excellently located just moments from Shad Thames, London Bridge, and Bermondsey Street, in an area of huge regeneration.This larger than average apartment comprises a separate kitchen, a bright reception room on the sixth floor, and two double bedrooms and a family bathroom on the seventh floor. Whitworth House is situated just 0.3 miles from Elephant and Castle's underground and mainline stations. The apartment would benefit from some cosmetic work.Wharton House is excellently located just a short walk to Maltby Street market, trendy Bermondsey Street, Borough market, The Old Vic, and the Globe. Living so centrally 1 means youre more likely to walk or cycle to your destination, but when you use the train, there are National Rail, Northern and Jubilee services from Nearby London Bridge and Bermondsey Stations.These particulars are not intended to, and do not offer or form part of any contract and whilst these sales particulars are believed to be correct, their accuracy is in no way guaranteed. Any measurements are for general guidance and interest only and should not be relied on. None of the services to the property, or any of the appliances, fixtures or fittings have been or will be tested by MyLondonHome. Photographs may depict general images of the development and may not show the actual flat for sale. Internal photographs may show items not included in the sale.Wharton House, St Saviours Estate, London Bridge, London SE1;2017-03-30 16:13:17;https://lid.zoocdn.com/354/255/ebc70442fc764efa8bcbf4534321d6db2a427547.jpg;2017-03-31 01:45:18;51.4987;51.4987;sale;-0.075407;false;1;2;0;1;SE1;London;420000;;Flat;for_sale;Wharton House43400159;Kings Group - Enfield Highway;020 3641 0065;Residential;Kings Group are delighted to offer to the market this Three Bedroom Semi Detached House. This property benefits from a lounge/dining area, fitted kitchen, first floor bathroom, approx 95ft rear garden, scope for a loft conversion stp, cavity wall insulation and a south facing garden and the potential for off street parking. In need of slight modernisation this house would be an ideal investment or first time buy and is situated within close proximity to all local amenities, including Enfield Lock Station & Turkey Street which has great links into the City.Double Glazed Porch To Front Door To:Entrance HallwayWith storage, carpet, doors to:Lounge (5.54m x 5.16m (18'2 x 16'11))With double glazed window and patio doors to rear gardens, Tv point, telephone point, gas fire, carpet.Kitchen (3.30m x 2.90m (10'10 x 9'6))With double glazed window to front, range of wall and base units work tops over, sink unit, plumbing for washing machine, gas oven, hob, gas heater, carpet. Fridge/Freezer, Washing Machine and Gas cooker l included.Staircase To First Floor LandingWith doors to:Bedroom One (4.29m x 3.05m (14'1 x 10'0))With double glazed window to rear gardens, electric heater, carpet.Bedroom Two (3.20m x 3.10m (10'6 x 10'2))With double glazed window to front, electric heater, carpet.Bedroom Three (3.15m x 2.03m (10'4 x 6'8))With double glazed window to rear gardens, electric heating, carpet.Bathroom/Wc (2.31m' x 2.01m (7'7' x 6'7))With double glazed frosted window to front, low level wc. Pedestal wash hand basin, panel enclosed bath with shower, carpet.Exterior: 95'0(Approx) Rear GardensWith lawn, timber shed, lighting.Front GardensWith potential Off Street Parking.Totteridge Road, Enfield EN3;2017-03-30 16:13:17;https://lid.zoocdn.com/354/255/357dcefff35ba4c7cbd309e8aa4eb8f36995f886.jpg;2017-04-07 17:17:25;51.672855;51.672855;sale;-0.037647;false;1;3;0;2;EN3;Enfield;395000;;Semi-detached house;for_sale;Totteridge Road43400132;Camerons Stiff & Co;020 3478 3249;Residential;We are delighted to offer for sale this larger than average detached family home spanning 2982 sq ft (with permitted development for a further 1021 sq ft in the loft), situated in this exclusive cul de sac in the heart of Brondesbury Park, just moments away to the Overground Station (Zone 2) and the open spaces of Queens Park with its numerous gastropubs and restaurants. It is also a short drive to Central & West London.The property boasts four bedrooms, two receptions & family room, spacious kitchen/diner, 60 ft landscaped rear garden, three modern bathrooms (two en-suite), utility room, off street parking & excellent loft space. This beautiful family home is also well positioned close to good local schools of the area and local amenities & sport clubs such as South Hampstead Cricket Club and Nuffield Gym.Ground FloorGarden (Approximate) (57'10 (17.63m))Entrance Hall (12'4x11'6 (3.76m x 3.51m))Reception Room (29'0x15'0 (8.84m x 4.57m))Kitchen/Breakfast Room (19'3x12'0 (5.87m x 3.66m))Dining Room (19'5x13'0 (5.92m x 3.96m))Utility Room (16'0x9'0 (4.88m x 2.74m))Family Room (23'8x8'10 (7.21m x 2.69m))Garden (Approximate) (60'0x44'0 (18.29m x 13.41m))First FloorBedroom 1 (23'0x13'6 (7.01m x 4.11m))Bedroom 2 (19'11x13'3 (6.07m x 4.04m))Dressing Room (9'6x8'8 (2.90m x 2.64m))Bedroom 3 (12'0x10'10 (3.66m x 3.30m))Bedroom 4 (12'8x11'9 (3.86m x 3.58m))Second FloorLoft (38'10x27'6 (11.84m x 8.38m))You may download, store and use the material for your own personal use and research. You may not republish, retransmit, redistribute or otherwise make the material available to any party or make the same available on any website, online service or bulletin board of your own or of any other party or make the same available in hard copy or in any other media without the website owner's express prior written consent. The website owner's copyright must remain on all reproductions of material taken from this website.Manor House Drive, Brondesbury Park NW6;2017-03-30 16:08:53;https://lid.zoocdn.com/354/255/e561d31b238de180f19a54830d03665394a4f8ac.jpg;2017-04-07 11:09:54;51.542816;51.542816;sale;-0.215871;false;3;4;0;1;NW6;London;2775000;;Detached house;for_sale;Manor House Drive43400109;Henleys;020 3641 4899;Residential;A ground floor apartment in a modern purpose built block located within close proximity to the river Thames, conveniently situated for schools, nearby shops and amenities. The property features two generous size bedrooms, bespoke fitted kitchen, modern bathroom suite, further benefiting from a private rear garden as well as a brick built storage area. An internal viewing is highly recommendedCommunal EntraceEntry phone systemHallwayHardwood door leading to entrance hall, ceramic field flooring, radiator, power points, fuse box, and electric meter, doors to:Bedroom One (12 x 12)Front aspect glazed window, radiator, fitted wardrobe with mirror fronted sliding doors, power points, wood flooringBedroom Two (12 x 9)Rear aspect glazed window, radiator, power points. Wood flooring, air ventReception Room (13m x 12m)Front aspect glazed window, ceramic tile flooring, power points, TV Ariel point, telephone point, radiatorKitchen (12 x 8)A range of matching eye and base level units, work surfaces, enamel sink unit, with mixer tap, electric hob, integrated electric oven and grill, part tiled walls, power points rear aspect windows, side aspect glazed door leading to:Utility RoomWall mounted combination boiler, power points, plumbing for automatic washing machine, rear aspect patio door leading to rear gardenBathroomThree piece matching suite comprising of panel enclosed bath suite with power shower, hand wash basin with mixer tap, low level WC, rear aspect frosted glazed window, extractor fan, heated towel rail, tiled walls and flooringRear GardenApprox 30ft patio laid lawn, timber panel fencing, timber built out shedPercy Gardens, Isleworth TW7;2017-03-30 16:07:54;https://lid.zoocdn.com/354/255/3be36a5dbd22334e8025510a0121bf21656d8b3e.jpg;2017-03-31 01:45:16;51.470455;51.470455;sale;-0.323788;false;1;2;0;0;TW7;Isleworth;375000;;Flat;for_sale;Percy Gardens43400108;Rocket Estate Agents;020 3641 5408;Residential;Newly Refurbished with- New windows with 10 years warranty, new central heating system, new flooring throughout the house, New decking in garden rear AccessThree Bedroom Semi-Detached House. Offered with Vacant Possession.Potential to Extend into the Loft Area to Create an Additional Bedroom with En-Suite (subject to obtaining all relevant consents).Key FeaturesFront reception roomseparate dining spacespacious fully fitted kitchendownstairs W/Cfamily bathroomPlenty of scope for further extensions (stpp)Side and rear accessno forward chainSt. Dunstans Road, Hounslow TW4;2017-03-30 16:07:54;https://li.zoocdn.com/974a15fc68188f8dcf14f5f9805ff504841d4af9_354_255.jpg;2017-03-31 01:45:16;51.47347;51.47347;sale;-0.403809;false;1;3;0;1;TW4;Hounslow;448000;;Semi-detached house;for_sale; St. Dunstans Road, 43400121;Blue Dwellings;020 8022 4970;Residential;Blue Dwellings are proud to offer this large two double bedroom apartment situated within an impressive modern development with views of the Olympic stadium, in an area with some of the highest densities of fine artists, designers and artisans in Europe. The main open plan reception/kitchen is very large, providing an excellent space for cooking, dining and entertaining, with direct access to a private balcony overlooking the communal Japanese style gardens. A contemporary family bathroom, along with some storage space and a second entrance to the property, round off this splendid home, which is just shy of 1100sqft.The property sits equidistant between Victroia Park and the Olympic Park, with amenities such as an Olympic sized swimming pool, the Velopark and Copper Box Gym, as well as being close to Westfield shopping centre, one of the largest urban shopping centres in Europe. There are good transport links including Hackney Wick Overground  Bow Church DLR and Bow Road Underground are also within 1.2km. There is also easy access to the A12.Reception (14'3 x 22'2)Bedroom One (5.00 x 4.52 (16'4" x 14'9"))Bedroom Two (4.55 x 4.17 (14'11" x 13'8"))Kitchen (12'3 x 5'9)BathroomRiverside, 417 Wick Lane, London E3;2017-03-30 16:07:54;https://li.zoocdn.com/42901d8aae31e8e9636dae951290cc04bd1017fb_354_255.jpg;2017-04-07 12:11:40;51.536255;51.536255;sale;-0.022014;false;1;2;0;1;E3;London;465000;;Flat;for_sale;Wick Lane43400111;Unico Property Group;020 3544 5594;Residential;Detailed DescriptionWe are happy to present a great investment opportunity in the form of this Edwardian House arranged over five floors and converted into three maisonettes.All flats are in need of refurbishment  currently they consist of a 2 bedroom split level flat with rear courtyard on the ground and lower ground floor and two 1 bedroom split level flats arranged over the upper stories.This attractive property is situated moments from the wide range of trendy bars, shops and caf??s of Brick Lane as well as local amenities  it is within easy reach of Shoreditch, Aldgate East, Liverpool Street Station and Spitalfield Market.Transport links include the underground Station of Shoreditch, Old Street, Whitechapel and the forth coming Crossrail Link situated only minutes away, and a number of regular bus services. This property is sold chain free and offers a fantastic opportunity you don???t want to miss.Chicksand Street, Aldgate E1;2017-03-30 16:07:54;https://lid.zoocdn.com/354/255/5192ec2ee120102fadd8befc9293a9c62237fde7.jpg;2017-04-07 15:38:59;51.518482;51.518482;sale;-0.070393;false;3;4;5;3;E1;London;1300000;;Terraced house;for_sale;Chicksand Street