listing_id;agent_name;agent_phone;category;description;displayable_address;first_publish_date;image_url;last_publish_date;latitude;listing_status;longitude;new_home;num_bathrooms;num_beedrooms;num_floors;num_recepts;outcode;post_town;price;price_change;property_type;status;street_name43400036;RE/MAX Grand;020 8033 9521;Residential;Ref: NT2769Four bedroom stunning penthouse in Central London at the price of ??8,500,000Pimlico, Westminster SW1P??8,500,000The Penthouses phaseNorth West aspectTerrace4 bathrooms4 bedroom penthouse10th & 11th floor2 SpacesCompletedTenure: 999 years leaseEstimated service charge: ??5.96 per square ftGround Rent: ??1250 per annum2 allocated car park space are included with penthouseAbell and Cleland is a prestigious development at the heart of Westminster, designed to complement its remarkable location in an area world renowned for government and grand private dwellings.The Penthouses:Discover an unparalleled lifestyle in the heart of London. A prestigious collection of 4 bedroom duplex penthouses delivering exceptional levels of style and luxury in keeping with the culture and history of Westminster. The Penthouses offer the height of London living with extensive entertaining space and private terraces showcasing views across Westminster and the city.Site Plan:Abell and Cleland is a luxury development comprising 2 and 3 bedroom apartments and penthouses located in the heart of Westminster, the governmental powerhouse of the United Kingdom.All residents' facilities are conveniently situated within easy reach of each apartment and the site benefits from a gym, pool, sauna facilities and business suite.The Business Suite is located on the ground floor of Cleland House.Gym, pool and sauna are located on the lower ground floor of Abell House.Prestigious Concierge Golden Keys Award:Abell & Cleland has become the first private residential development in the UK to be officially recognised by Les Clefs d'Or, Society of the Golden Keys, an internationally recognised golden standard for top concierges working exclusively in the hotel industry. This milestone award recognises the exceptional concierge service at Abell & Cleland where along with the exclusive room service style dining options provided by the Hilton Hotel, the concierge provide residents with exclusive luxury London living.Bathroom:- Double ended white bath with bath filler & removable bath panels- Bespoke stone and veneer vanity units to selected bathrooms- Bespoke mirrored cabinets with integrated lighting to selected bathrooms- Polished chrome ladder style heated towel rail to all bathrooms-Large fixed mirror above vanity units to selected bathroomsInterior Finishes:- Feature engineered Oak veneer entrance doors- Bespoke fitted or walk-in wardrobes/dressing areas to master bedrooms- Carpet floor finishes to all bedrooms- Bespoke veneered/glazed double doors to principal reception rooms- Veneered architraves and skirtings, tile skirtings to wet areas- Engineered timber floor board finishes to hallways and principle reception roomsKitchen:- Individually designed layouts- Composite stone worktops with back painted glass splash backs- Large format limestone/engineered timber floor finishes- Satin veneered finishes to cabinets- Recessed LED down lighters and concealed LED lighting to wall units- Multi-gang appliance panel & brushed stainless steel socket outletsCulture:An important cultural and political destination but also a thriving yet tranquil local neighbourhood, with an array of entertainment amenities. The finest names in retail are within easy reach and Westminster is home to no less than 36 Michelin star restaurants. The immediate location boasts green squares and is within walking distance of the River Thames, Downing Street and St James's Park. In addition, there is the wealth of museums, galleries, music venues and theatres.- Westminster, legislative heart of the UK- Long standing local gourmet tradition- Top fashion & tailoring close by- An array of niche independent shops- World-class theatre, musicals & operaTransport:The area is a true hub of London's local and national transport network. Nearby Westminster Underground Station provides access to Circle, District and Jubilee lines, and within Westminster virtually all of London's 11 Underground lines may be accessed, as well as the river bus service at Westminster, Embankment and Millbank pier. International travel hubs are within easy reach, including Eurostar at St Pancras, and Heathrow, Gatwick and London City airports less than an hour away.- Bond Street 4 mins- The City (Bank) 14 mins- Canary Wharf 11 mins- Heathrow Airport 53 mins- London City Airport 25 minsSchool:London is a leading global educational centre, having one of the largest populations of overseas students of any city in the world. There are a number of world-class schools, colleges and universities within the immediate vicinity of Abell and Cleland, including the prestigious Westminster School and University of the Arts London, ensuring the best quality of education.- Close to renowned Westminster School- Top local University of the Arts- Easy access to leading universities- Well-regarded primary and prep schools- Education with a global reachAbell House, Westminster SW1P;2017-03-30 16:01:51;https://lid.zoocdn.com/354/255/a9f11aa9aa3742e8ca42099e54c2f96f4dd19d61.png;2017-03-31 13:12:26;51.49444;51.49444;sale;-0.127117;false;4;4;0;0;SW1P;London;8500000;;Flat;for_sale;Abell House43400037;RE/MAX Grand;020 8033 9521;Residential;Ref: NT27723 bedroom stunning flat in Central London at the price of ??2,325,000Westminster SW1P??2,325,000West aspect2 bathrooms3 bedroom apartment2nd floorCompletedTenure: 999 years leaseEstimated service charge: ??5.96 per square ftGround Rent: ??900 per annumAn allocated car park space is available to purchase at the price of ??75,000Abell and Cleland is a prestigious development at the heart of Westminster, designed to complement its remarkable location in an area world renowned for government and grand private dwellings.Site Plan:Abell and Cleland is a luxury development comprising 2 and 3 bedroom apartments and penthouses located in the heart of Westminster, the governmental powerhouse of the United Kingdom.All residents' facilities are conveniently situated within easy reach of each apartment and the site benefits from a gym, pool, sauna facilities and business suite.The Business Suite is located on the ground floor of Cleland House.Gym, pool and sauna are located on the lower ground floor of Abell House.Prestigious Concierge Golden Keys Award:Abell & Cleland has become the first private residential development in the UK to be officially recognised by Les Clefs d'Or, Society of the Golden Keys, an internationally recognised golden standard for top concierges working exclusively in the hotel industry. This milestone award recognises the exceptional concierge service at Abell & Cleland where along with the exclusive room service style dining options provided by the Hilton Hotel, the concierge provide residents with exclusive luxury London living.Bathroom:- Double ended white bath with bath filler & removable bath panels- Bespoke stone and veneer vanity units to selected bathrooms- Bespoke mirrored cabinets with integrated lighting to selected bathrooms- Polished chrome ladder style heated towel rail to all bathrooms-Large fixed mirror above vanity units to selected bathroomsInterior Finishes:- Feature engineered Oak veneer entrance doors- Bespoke fitted or walk-in wardrobes/dressing areas to master bedrooms- Carpet floor finishes to all bedrooms- Bespoke veneered/glazed double doors to principal reception rooms- Veneered architraves and skirtings, tile skirtings to wet areas- Engineered timber floor board finishes to hallways and principle reception roomsKitchen:- Individually designed layouts- Composite stone worktops with back painted glass splash backs- Large format limestone/engineered timber floor finishes- Satin veneered finishes to cabinets- Recessed LED down lighters and concealed LED lighting to wall units- Multi-gang appliance panel & brushed stainless steel socket outletsCulture:An important cultural and political destination but also a thriving yet tranquil local neighbourhood, with an array of entertainment amenities. The finest names in retail are within easy reach and Westminster is home to no less than 36 Michelin star restaurants. The immediate location boasts green squares and is within walking distance of the River Thames, Downing Street and St James's Park. In addition, there is the wealth of museums, galleries, music venues and theatres.- Westminster, legislative heart of the UK- Long standing local gourmet tradition- Top fashion & tailoring close by- An array of niche independent shops- World-class theatre, musicals & operaTransport:The area is a true hub of London's local and national transport network. Nearby Westminster Underground Station provides access to Circle, District and Jubilee lines, and within Westminster virtually all of London's 11 Underground lines may be accessed, as well as the river bus service at Westminster, Embankment and Millbank pier. International travel hubs are within easy reach, including Eurostar at St Pancras, and Heathrow, Gatwick and London City airports less than an hour away.- Bond Street 4 mins- The City (Bank) 14 mins- Canary Wharf 11 mins- Heathrow Airport 53 mins- London City Airport 25 minsSchool:London is a leading global educational centre, having one of the largest populations of overseas students of any city in the world. There are a number of world-class schools, colleges and universities within the immediate vicinity of Abell and Cleland, including the prestigious Westminster School and University of the Arts London, ensuring the best quality of education.- Close to renowned Westminster School- Top local University of the Arts- Easy access to leading universities- Well-regarded primary and prep schools- Education with a global reachJohns Islip Street, Westminster SW1P;2017-03-30 16:01:51;https://lid.zoocdn.com/354/255/7b3752376373486f1341f54e2f9b423480f3794f.png;2017-04-07 10:53:27;51.49444;51.49444;sale;-0.127117;false;2;3;0;0;SW1P;London;2325000;;Flat;for_sale;Johns Islip Street43400026;Century 21;020 3641 1080;Residential;Guide Price GBP275,000 GBP300,000.Century 21 are pleased to offer for sale this first floor one bedroom flat in the modern Lumeire Building development close to Woodgrange Park Overground Station and Manor Park Station which will soon be a Crossrail link leading in to the West End. The property boasts a double bedroom, bright lounge, separate kitchen and bathroom along with storage space. Concierge upon entrance and allocated parking. The property is currently tenant occupied however is chain free. Call to arrange your viewing now.Property Measurements:Lounge 14'3" x 12'6"Kitchen 7'9" x 6'5"Bathroom 7'6" x 6'6"Bedroom 15'3" x 8'8"Lumeire Building, 544 Romford Road, London E7;2017-03-30 16:00:26;https://lid.zoocdn.com/354/255/f501b07d2a9e4921494ebc5d456330ed8cb3f7da.jpg;2017-04-03 17:03:59;51.54902;51.54902;sale;0.043936;false;1;1;0;1;E7;London;275000;;Flat;for_sale;544 Romford Road43400027;RE/MAX Grand;020 8033 9521;Residential;Ref: NT27712 bedroom stunning flat in Central London at the price of ??1,940,000Westminster SW1P??1,940,000West aspect2 bathrooms2 bedroom apartment1st floorCompletedTenure: 999 years leaseEstimated service charge: ??6.41 per square ftGround Rent: ??700 per annumAn allocated car park space is available to purchase at the price of ??75,000Abell and Cleland is a prestigious development at the heart of Westminster, designed to complement its remarkable location in an area world renowned for government and grand private dwellings.Site Plan:Abell and Cleland is a luxury development comprising 2 and 3 bedroom apartments and penthouses located in the heart of Westminster, the governmental powerhouse of the United Kingdom.All residents' facilities are conveniently situated within easy reach of each apartment and the site benefits from a gym, pool, sauna facilities and business suite.The Business Suite is located on the ground floor of Cleland House.Gym, pool and sauna are located on the lower ground floor of Abell House.Prestigious Concierge Golden Keys Award:Abell & Cleland has become the first private residential development in the UK to be officially recognised by Les Clefs d'Or, Society of the Golden Keys, an internationally recognised golden standard for top concierges working exclusively in the hotel industry. This milestone award recognises the exceptional concierge service at Abell & Cleland where along with the exclusive room service style dining options provided by the Hilton Hotel, the concierge provide residents with exclusive luxury London living.Bathroom:- Double ended white bath with bath filler & removable bath panels- Bespoke stone and veneer vanity units to selected bathrooms- Bespoke mirrored cabinets with integrated lighting to selected bathrooms- Polished chrome ladder style heated towel rail to all bathrooms-Large fixed mirror above vanity units to selected bathroomsInterior Finishes:- Feature engineered Oak veneer entrance doors- Bespoke fitted or walk-in wardrobes/dressing areas to master bedrooms- Carpet floor finishes to all bedrooms- Bespoke veneered/glazed double doors to principal reception rooms- Veneered architraves and skirtings, tile skirtings to wet areas- Engineered timber floor board finishes to hallways and principle reception roomsKitchen:- Individually designed layouts- Composite stone worktops with back painted glass splash backs- Large format limestone/engineered timber floor finishes- Satin veneered finishes to cabinets- Recessed LED down lighters and concealed LED lighting to wall units- Multi-gang appliance panel & brushed stainless steel socket outletsCulture:An important cultural and political destination but also a thriving yet tranquil local neighbourhood, with an array of entertainment amenities. The finest names in retail are within easy reach and Westminster is home to no less than 36 Michelin star restaurants. The immediate location boasts green squares and is within walking distance of the River Thames, Downing Street and St James's Park. In addition, there is the wealth of museums, galleries, music venues and theatres.- Westminster, legislative heart of the UK- Long standing local gourmet tradition- Top fashion & tailoring close by- An array of niche independent shops- World-class theatre, musicals & operaTransport:The area is a true hub of London's local and national transport network. Nearby Westminster Underground Station provides access to Circle, District and Jubilee lines, and within Westminster virtually all of London's 11 Underground lines may be accessed, as well as the river bus service at Westminster, Embankment and Millbank pier. International travel hubs are within easy reach, including Eurostar at St Pancras, and Heathrow, Gatwick and London City airports less than an hour away.- Bond Street 4 mins- The City (Bank) 14 mins- Canary Wharf 11 mins- Heathrow Airport 53 mins- London City Airport 25 minsSchool:London is a leading global educational centre, having one of the largest populations of overseas students of any city in the world. There are a number of world-class schools, colleges and universities within the immediate vicinity of Abell and Cleland, including the prestigious Westminster School and University of the Arts London, ensuring the best quality of education.- Close to renowned Westminster School- Top local University of the Arts- Easy access to leading universities- Well-regarded primary and prep schools- Education with a global reachJohn Islip Street, Westminster SW1P;2017-03-30 16:00:26;https://lid.zoocdn.com/354/255/f3bc4f340470a0294095543daddc13a65254be23.png;2017-04-03 14:33:06;51.49444;51.49444;sale;-0.127117;false;2;2;0;0;SW1P;London;1940000;;Flat;for_sale;John Islip Street43400016;RE/MAX Grand;020 8033 9521;Residential;Ref: NT27623 bedroom luxury and spacious new development in Edgware Road, Paddington for saleWestmark Tower in West End Gate projectPaddington W2??2,260,00022nd floor3 bedroom apartment2 bathroomBalconyNorth West aspectTenure: 999 year leaseEstimated service charge: ??5.32 per sq ftCar park: ??75000 for parking spaceExcellent transport connections, Zone 124 hour concierge & business loungePool, spa, gym, cinema room & private gardensIntroducing West End Gate, an exclusive development set in one of London's most prestigious postcodes moments away from stylish Marylebone. The scheme, comprising a landmark residential tower and surrounding mansion blocks, is inspired by the local architecture and character of the area. With first-class residential facilities and exemplar design, West End Gate also benefits from a Central London Zone 1 location and excellent transport connections.West End Gate to be finishing 2021Payment structure will be:Reservation fee:Under 1 mln - ??5000Over 1 mln - ??10,000Over 2 mln - ??20,000 per unit10% on exchange minus the reservation fee10% in 12 months10% in 24 months70% on completion in 2021Marylebone, Zone 1Crossrail in Paddington 2018: Get to Liverpool Street in 12 mins, Canary Wharf in 17 mins. Brand new line called Elizabeth line, will connect Bond Street, Liverpool Street, Canary Wharf, Woolwich, Heathrow, ReadingTube ??? 4 lines: Bakerloo, Hammersmith & City, District and CircleOverground train: Heathrow express 30 mins, Reading 30 mins5 mins walk to Hyde Park5 min drive to Mayfair20 min walk to Notting Hill10 min walk to Regent???s Park15 min walk to Regent???s University ??? so if you keep it and complete on this property then it will be easily rented by either International Students or professionals in tech industriesProperty prices will increase by 15.4% by 2020DevelopmentDesigned by renowned architects Squire & Partners, winner of The Sunday Times' Architect of the Year and Development of the Year in 2015, West End Gate combines contemporary architecture and traditional craftsmanship. The beautifully crafted and innovative architecture will capture the spirit and character of nearby period buildings, reinterpreting the values of mansion block living into homes designed for the 21st century.Westmark TowerReaching 30 storeys, Westmark Tower provides dramatic views towards the City, Regent's Park and Hyde Park. A sense of arrival is created by a sweeping entrance with water features at ground level that transitions into a grand lobby with secluded seating areas providing residents with pockets of privacy.Site PlanWestmark Tower at West End Gate comprises a range of 1,2 & 3 bedroom apartments situated in a Central London Zone 1 location. The site is close to the prestigious neighborhoods of Marylebone and Little Venice and also benefits from excellent transport connections.Edgware Road, Paddington W2;2017-03-30 15:58:25;https://lid.zoocdn.com/354/255/e6efe25ec7da8c25b5918c604c23f123348682c6.jpg;2017-03-31 13:16:20;51.521694;51.521694;sale;-0.171968;false;2;3;0;0;W2;London;2260000;;Flat;for_sale;Edgware Road43400015;RE/MAX Grand;020 8033 9521;Residential;Ref: NT27492 bedroom luxury and spacious new development in Edgware Road, Paddington for saleWestmark Tower in West End Gate projectPaddington W2??1,362,0007th floor2 bedroom apartment2 bathroomBalconyNorth West aspectTenure: 999 year leaseEstimated service charge: ??5.32 per sq ftCar park: ??75000 for parking spaceExcellent transport connections, Zone 124 hour concierge & business loungePool, spa, gym, cinema room & private gardensIntroducing West End Gate, an exclusive development set in one of London's most prestigious postcodes moments away from stylish Marylebone. The scheme, comprising a landmark residential tower and surrounding mansion blocks, is inspired by the local architecture and character of the area. With first-class residential facilities and exemplar design, West End Gate also benefits from a Central London Zone 1 location and excellent transport connections.West End Gate to be finishing 2021Payment structure will be:Reservation fee:Under 1 mln - ??5000Over 1 mln - ??10,000Over 2 mln - ??20,000 per unit10% on exchange minus the reservation fee10% in 12 months10% in 24 months70% on completion in 2021Marylebone, Zone 1Crossrail in Paddington 2018: Get to Liverpool Street in 12 mins, Canary Wharf in 17 mins. Brand new line called Elizabeth line, will connect Bond Street, Liverpool Street, Canary Wharf, Woolwich, Heathrow, ReadingTube ??? 4 lines: Bakerloo, Hammersmith & City, District and CircleOverground train: Heathrow express 30 mins, Reading 30 mins5 mins walk to Hyde Park5 min drive to Mayfair20 min walk to Notting Hill10 min walk to Regent???s Park15 min walk to Regent???s University ??? so if you keep it and complete on this property then it will be easily rented by either International Students or professionals in tech industriesProperty prices will increase by 15.4% by 2020DevelopmentDesigned by renowned architects Squire & Partners, winner of The Sunday Times' Architect of the Year and Development of the Year in 2015, West End Gate combines contemporary architecture and traditional craftsmanship. The beautifully crafted and innovative architecture will capture the spirit and character of nearby period buildings, reinterpreting the values of mansion block living into homes designed for the 21st century.Westmark TowerReaching 30 storeys, Westmark Tower provides dramatic views towards the City, Regent's Park and Hyde Park. A sense of arrival is created by a sweeping entrance with water features at ground level that transitions into a grand lobby with secluded seating areas providing residents with pockets of privacy.Site PlanWestmark Tower at West End Gate comprises a range of 1,2 & 3 bedroom apartments situated in a Central London Zone 1 location. The site is close to the prestigious neighborhoods of Marylebone and Little Venice and also benefits from excellent transport connections.Edgware Road, Paddington W2;2017-03-30 15:58:25;https://lid.zoocdn.com/354/255/1e6a33d590ddda36befab9ac49a717ec0582a118.jpg;2017-03-31 13:18:41;51.521694;51.521694;sale;-0.171968;false;2;2;0;0;W2;London;1362000;;Flat;for_sale;Edgware Road43400006;RE/MAX Grand;020 8033 9521;Residential;Ref: NT27191 bedroom luxury and spacious new development in Edgware Road, Paddington for salePaddington W2??928,0004th floor1 bedroom apartment1 bathroomBalconySouth aspectTenure: 999 year leaseEstimated service charge: ??5.32 per sq ftCar park: ??75000 for parking spaceExcellent transport connections, Zone 124 hour concierge & business loungePool, spa, gym, cinema room & private gardensIntroducing West End Gate, an exclusive development set in one of London's most prestigious postcodes moments away from stylish Marylebone. The scheme, comprising a landmark residential tower and surrounding mansion blocks, is inspired by the local architecture and character of the area. With first-class residential facilities and exemplar design, West End Gate also benefits from a Central London Zone 1 location and excellent transport connections.West End Gate to be finishing 2021Payment structure will be:Reservation fee:Under 1 mln - ??5000Over 1 mln - ??10,000Over 2 mln - ??20,000 per unit10% on exchange minus the reservation fee10% in 12 months10% in 24 months70% on completion in 2021Marylebone, Zone 1Crossrail in Paddington 2018: Get to Liverpool Street in 12 mins, Canary Wharf in 17 mins. Brand new line called Elizabeth line, will connect Bond Street, Liverpool Street, Canary Wharf, Woolwich, Heathrow, ReadingTube ??? 4 lines: Bakerloo, Hammersmith & City, District and CircleOverground train: Heathrow express 30 mins, Reading 30 mins5 mins walk to Hyde Park5 min drive to Mayfair20 min walk to Notting Hill10 min walk to Regent???s Park15 min walk to Regent???s University ??? so if you keep it and complete on this property then it will be easily rented by either International Students or professionals in tech industriesProperty prices will increase by 15.4% by 2020DevelopmentDesigned by renowned architects Squire & Partners, winner of The Sunday Times' Architect of the Year and Development of the Year in 2015, West End Gate combines contemporary architecture and traditional craftsmanship. The beautifully crafted and innovative architecture will capture the spirit and character of nearby period buildings, reinterpreting the values of mansion block living into homes designed for the 21st century.Edgware Road, Paddington W2;2017-03-30 15:57:33;https://lid.zoocdn.com/354/255/e6efe25ec7da8c25b5918c604c23f123348682c6.jpg;2017-03-31 13:29:52;51.521694;51.521694;sale;-0.171968;false;1;1;0;0;W2;London;928000;;Flat;for_sale;Edgware Road43399984;Property Inside London;020 8128 1323;Residential;Large unit3rd floor550 sq ft- Bedroom 14'1" x 2'7"- Reception 20'11" x 10'7"- Kitchen 7'10" x 7'7"Aspect: Looking onto the garden areaConciergeCycle storageComfort cooling & underfloor heatingAbout Osnaburgh Street- within the Regents Place development- between Regents Park and Euston Station- close to Great Portland Street Underground and Euston underground and mainline stations- close to various education establishments- easy access to areas like Regents Park, Bloomsbury, Fitzrovia, Marylebone, Oxford StreetNote: Whilst the apartment has a separate sleeping area, it is separated from the reception area by a sliding door/ wall and the sleeping area does not have its own windowRegents Place, Osnaburgh Street, London NW1;2017-03-30 15:54:54;https://lid.zoocdn.com/354/255/f83d76a580b33a5566e7f3c13073716e2b377cb5.jpg;2017-03-30 15:55:49;51.52476;51.52476;sale;-0.143014;false;1;1;1;1;NW1;London;700000;;Flat;for_sale;Regents Place, Osnaburgh street