listing_id;agent_name;agent_phone;category;description;displayable_address;first_publish_date;image_url;last_publish_date;latitude;listing_status;longitude;new_home;num_bathrooms;num_beedrooms;num_floors;num_recepts;outcode;post_town;price;price_change;property_type;status;street_name43468929;Purplebricks, Head Office;01926 267659;Residential;A beautifully presented two double bedroom, fourth floor flat conveniently placed close to local amenities and Old Street Station.The accommodation has been recently refurbished by the current owners and comprises of a superb and recently fitted modern kitchen with door leading to private balcony, spacious reception room with large full width picture windows, two double bedrooms and a recently refitted modern bathroom suite with underfloor heating. The property features wood flooring throughout.Charles Gardner Court is located to Shoreditch???s bars and restaurants and within easy reach of Upper Street. Within a short walk is the Geffrye Museum, which gives a history of British homes and gardens through the years and has a pretty great Latte in its cafe!Hoxton and Old Street Stations and less than 0.5miles away with excellent bus routes providing easy access into The City and West End.Entrance HallDoor into spacious entrance hallway with part tiled flooring. Mirrored sliding doors to built-in cupboards with overhead storage, further built-in cupboard. Entry phone. Recessed lighting. Wood flooring throughout.Reception Room16'3 x 14'2Light and spacious reception room with four large double glazed picture windows. Wood flooring. Large arch through to kitchen.Kitchen14'10 x 7'10Superb fitted kitchen with gloss fronted base and wall mounted units with complimentary work surfaces. Stainless steel sink unit with water filter. Integrated Bosh stainless steel gas hob, electric oven and overhead extractor hood. Plumbing for washing machine. Further tall storage cupboard. Double glazed picture window with overhead casement window. Fully double glazed door to balcony.Bedroom One12'7 x 11'7Two large double glazed picture windows. Built-in fitted wardrobe with mirrored sliding doorsBedroom Two12'7 x 10'4Large double glazed picture window. Wood flooring.BathroomSuperbly fitted modern bathroom suite with contemporary fittings, comprising bath with mixer taps and shower attachment with further overheard rainwater shower head. Vanity wash hand basin with granite top with integrated sink and single lever chrome mixer tap. Low level W.C. Ample storage cabinets. Chrome heated towel rail. Fully tiled walls. Tiled floor with underfloor heating.Haberdasher Street, London N1;2017-04-06 10:19:02;https://lid.zoocdn.com/354/255/cbd97c812e2acfff493fb459fe8fce48adcc5ff4.jpg;2017-04-06 14:42:00;51.52892;51.52892;sale;-0.086099;false;1;2;0;1;N1;London;525000;;Flat;for_sale;Haberdasher Street43468915;Phillip Laurence Estate Agents;020 8166 7497;Residential;Modern gated development, built 2013, corner sited, two bed end of terraced house, spacious accommodation, separate lounge, large ground floor cloakroom, luxury fitted kitchen diner, two good sized double bedrooms, luxury first floor family bathroom, double glazing, central heating, solar powered energy, approx. 45' easy maintenance garden, allocated parking, presented in superb order, viewing highly recommended.LocationBarra Wood Close is a gated development located off Wood End opposite Rosedale College Secondary School. The Uxbridge Road with its with it's eclectic mix of shops, takeaways, restaurants, and small businesses is approximately half a mile from the property. Local bus services provide access to Hayes Town with its Hayes & Harlington mainline station, Uxbridge, Ealing & the surrounding areas. The A 312 Hayes Bypass providing access to the A40, M25 & the West, Heathrow & the M4 is approximately 1.5 miles asway. Barra Hall Park is approximately 350 yards from the property whilst Rosedale College Secondary School, sixth form and nursery are located opposite the development.Barra Wood Close, Hayes UB3;2017-04-06 10:17:58;https://lid.zoocdn.com/354/255/2d3f8b0fddf8cb4f889be270d18d3a5c3167c3e1.jpg;2017-04-07 01:45:19;51.52102;51.52102;sale;-0.427588;false;2;2;2;1;UB3;Hayes;415000;;End terrace house;for_sale;Barra Wood Close43468911;Foxtons - London Bridge;020 3544 1626;Residential;Set on the first floor, this one bedroom flat boasts spacious accommodation including a large reception room with private balcony and a smart separate kitchen.Beckway street is ideally located close to the amenities along Old Kent Road.Beckway Street, Elephant And Castle SE17;2017-04-06 10:16:56;https://lid.zoocdn.com/354/255/fa3f26122b0d163b709cbf333302340aee72383b.jpg;2017-04-06 10:16:56;51.491257;51.491257;sale;-0.086006;false;0;1;0;0;SE17;London;329995;;Flat;for_sale;Beckway Street43468908;Coopers Residential - West Drayton;01895 647307;Residential;This light filled semi detached extended home is offered to the market with no onward chain, generously proportioned rooms and presented in good order with neutral tones throughout. The accommodation on offer consists of hallway, spacious through lounge, a 17ft kitchen/breakfast room and downstairs shower room, whilst upstairs are the three bedrooms and upstairs shower room.DirectionsFrom leaving our office on Tavistock Road proceed right onto Station Road. Proceed directly onto Harmondsworth Road and continue straight until you reach the A3044 roundabout. Take the first exit on to A3044 and continue straight for approximately 0.5 miles until you reach the Sipson Road roundabout and take the third exit. Onto Sipson Road. The property can be found just before the second roundabout.SituationSipson Road is extremely well situated for a variety of amenities including local shops, bus links, Heathrow Airport, Stockley Business Park, whilst for the motorist the M4 motorway with its links to London and The Home Counties is just a short drive away.DescriptionThis light filled semi detached extended home is offered to the market with no onward chain, generously proportioned rooms and presented in good order with neutral tones throughout. The accommodation on offer consists of hallway, spacious through lounge, a 17ft kitchen/breakfast room and downstairs shower room, whilst upstairs are the three bedrooms and upstairs shower room.OutsideTo the front of the property there is a block paved driveway that provides off street parking for two cars, there is also a gate that provides side access to the rear garden where there is a hardstanding area found closest to the house with a pathway that leads to the rear. The majority of the garden is laid to lawn.Sipson Road, Sipson UB7;2017-04-06 10:16:24;https://lid.zoocdn.com/354/255/fa638a6b983ec5ab39d8b8c597af1d12ddab1e79.jpg;2017-04-07 08:07:25;51.489933;51.489933;sale;-0.457509;false;2;3;0;1;UB7;West Drayton;440000;;Semi-detached house;for_sale;Sipson Road43468906;Foxtons - Kingston;020 3542 2187;Residential;A bright and stylish two bedroom apartment set in a contemporary, private development in the heart of Kingston, boasting a private balcony and communal rooftop gardens with river views.The property, which benefits from porterage and secure access, is located just off the Market Square, offering a wide range of shops, bars and restaurants and the riverside eateries within Charter Quay also offer ample entertaining options.Market Square, Kingston KT1;2017-04-06 10:16:24;https://lid.zoocdn.com/354/255/cd3fcfb562ace854de4af0b76f9307ad8b0bc6d0.jpg;2017-04-06 10:16:24;51.409557;51.409557;sale;-0.30682;false;0;2;0;0;KT1;Kingston upon Thames;579950;;Flat;for_sale;Market Square43468883;Warren & Co;020 8166 7553;Residential;A distinctive and substantial semi-detached Victorian villa offering over 4270 Sq Ft of accommodation and currently configured as two separate dwellings - a five double bedroom house and a self-contained two bedroom lower ground floor flat with access to a West facing and very private garden. This attractive property features generously proportioned rooms with high ceilings and period elements throughout and could be easily reinstated into a single family home, subject to personal requirements and the necessary consents. The villa is within easy walking distance of the many and varied amenities of Putney High Street and all major rail and road transport links in and out of Putney.Disclaimer???These particulars are intended to give a fair and substantially correct overall description for the guidance of intending purchasers and do not constitute an offer or part of a contract. Prospective purchasers and/or lessees ought to seek their own professional advice.???All descriptions, dimensions, areas, references to condition and necessary permissions for use and occupation and other details are given in good faith and are believed to be correct, but any intending purchasers should not rely on them as statements or representations of fact, but must satisfy themselves by inspection or otherwise as to the correctness of each of them.???All measurements are approximate.Putney Hill, Putney SW15;2017-04-06 10:14:20;https://lid.zoocdn.com/354/255/70026e9ce6777a230ed6647f125417cf9cda49c0.jpg;2017-04-07 01:45:18;51.45906;51.45906;sale;-0.218232;false;4;7;0;4;SW15;London;2250000;;Semi-detached house;for_sale;Putney Hill43468833;Foxtons - Croydon;020 8022 3893;Residential;This stunning five bedroom detached house with excellent accommodation has a beautiful interior, ample living and entertaining space.The property is situated on a quiet residential street, within close proximity to Lloyd Park and Shirley Hills. In addition to the variety of transport links  bus, tram and train it benefits from several renowned local schools and a variety of nearby sports, golf clubs and facilities.Conveniently located close to Sandilands tram stop and bus stop both servicing East Croydon station, providing excellent services to London main line stations.Fitzjames Avenue, Croydon CR0;2017-04-06 10:09:03;https://li.zoocdn.com/0cd01acfa6446fa099eebbff090e36ba48e793de_354_255.jpg;2017-04-06 14:08:21;51.372753;51.372753;sale;-0.071915;false;0;5;0;0;CR0;Croydon;1250000;;Detached house;for_sale;Fitzjames Avenue43468832;Foxtons - Croydon;020 8022 3893;Residential;Centrally located for Croydon, this fabulous one bedroom apartment, offers exquisite views from the eight floor, spacious accommodation and great communal facilities.Saffron Square is moments away from West Croydon rail station and West Croydon Tramlink. The many amenities of Croydon are all within easy reach.Saffron Central Square, Central Croydon CR0;2017-04-06 10:09:03;https://lid.zoocdn.com/354/255/259a2894a9b89fbbd79eba2d1d734551dff3ab54.jpg;2017-04-07 18:10:38;51.379185;51.379185;sale;-0.099493;false;0;1;0;0;CR0;Croydon;340000;;Flat;for_sale;Saffron Central Square43468816;Foxtons - Clerkenwell;020 3463 2552;Residential;This ground floor one bedroom flat offers generous living space combined with stylish modern d??cor, in a highly sought-after location and also benefits from a bright private garden.The local area boasts an excellent array of amenities as the shops, bars and restaurants of Clerkenwell, Islington and the City are within close proximity.Seward Street, Clerkenwell EC1V;2017-04-06 10:08:03;https://lid.zoocdn.com/354/255/31bd1b71f064cc5d6aa27f014bf3008befadfe7a.jpg;2017-04-07 10:08:23;51.526253;51.526253;sale;-0.098378;false;0;1;0;0;EC1V;London;599950;;Flat;for_sale;Seward Street43468792;Wilson Hawkins;020 8022 6350;Residential;A well presented and charming two bedroom, two bathroom Third Floor (top) Apartment well set in this Victorian villa on the summit of 'The Hill'. The property benefits from a fully fitted kitchen with a range of integrated appliances, two modern bathroom/shower suites, video entry-phone system, 110 year Lease, new boiler( 1 years old) with gas central heating. The property is conveniently situated with easy access to Harrow on the Hill High Street with its mix of wine bars and restaurants and Harrow Town Centre is approximately one mile distant.Communal Front Door:Video entry-phone system. Stairs to third floor (top).Own Front Door:Through to :Lounge (Front Aspect) (4.06m x 4.32 (13'4" x 14'2"))Two double panelled radiators. Sash windows with window shutters to front aspect. TV socket point. Telephone point. Open plan to:Kitchen: (2.77m x 2.06m (9'1" x 6'9"))Fully fitted with a range of matching wall and base units with roll top working surfaces. Stainless steel sink unit with mixer tap and cupboards under. Four burner gas hob with Bosch chrome extractor hood above and oven and grill below. Bosch integrated dishwasher, Bosch washing machine and integrated freezer. Part tiled walls. Display lighting. Tiled floor.Bedroom One( Front Aspect) (4.17m x 2.46m (13'8" x 8'1"))Sash windows with fitted shutters to rear aspect. Built in shelving/storage. Two double panelled radiators. Door to:En- SuiteWhite suite. Panelled bath with chrome mixer tap and chrome shower attachment. Pedestal wash hand basin with chrome mixer tap. Fully tiled walls. Tiled floor. Double glazed Velux window. Ladder style radiator.Bedroom Two (Rear Aspect) (2.92m x 2.06m (9'7" x 6'9"))Sash window to front aspect with window shutter. Panelled radiator. Two built-in wardrobes with storage and high level.Family Bathroom (l-Shaped) (2.21m x 2.06m (7'3" x 6'9"))Shower cubicle with folding doors. Aqualisa shower unit with adjustable head height. Pedestal wash hand basin with chrome mixer tap. WC with low level flush cistern. Fully tiled walls. Tiled floor. Ladder style radiator. Inset spot light. Extractor fan.Additional InformationLease: We have been advised the number of years remaining on the lease 110 years.Service Charge: We have been advised the service charge is ??1,750 Per annumGround Rent: We have been advised the Ground rent is ??125 Per annumViewings : Strictly through wilson hawkinsN. B.Please note that our room sizes are now quoted in metres to the nearest one tenth of a metre on a wall-to-wall basis. In every case the maximum room size has been given. The imperial equivalent (included in brackets) is only intended as an approximate guide for those of our applicants who may not yet be fully conversant with the metric measurements.Please note that we have not tested any apparatus, equipment, fixtures, fittings or services, and so cannot verify they are in working order, or fit for their purpose.Whilst we endeavour to make our sales details accurate and reliable, if there is any point which is of particular importance to you, please contact the office and we will be pleased to check the information for you, particularly if contemplating travelling some distance to view the property.All measurements have been taken by self levelling laser and should not be relied upon for carpets or furnishings as their accuracy cannot be guaranteed and could be subject to a small margin of error.Kingsley House, Harrow On The Hill, Middlesex HA1;2017-04-06 10:06:58;https://lid.zoocdn.com/354/255/e36e889bfe0d7d47c6f878e6896c4800d163ff4b.jpg;2017-04-07 01:45:13;51.56721;51.56721;sale;-0.339423;false;1;2;0;1;HA1;Harrow;395000;;Flat;for_sale;Kingsley House43468747;Foxtons - Beckenham;020 8128 9495;Residential;Situated moments from the centre of Beckenham this superb two bedroom flat is set within a lovely purpose-built development and offers bright spacious interiors including a fantastic reception room with space-to-dine.The Avenue is enviably situated close to the fantastic array of shops, restaurants and cafes of Beckenham as well as being only moments away from Beckenham Junction Station and the beautiful green open spaces of Beckenham Place Park.The Avenue, Beckenham BR3;2017-04-06 10:04:22;https://lid.zoocdn.com/354/255/354642ab8e1ec77437a71e54817e151b0afd2b02.jpg;2017-04-06 14:04:04;51.411743;51.411743;sale;-0.020979;false;0;2;0;0;BR3;Beckenham;435000;;Flat;for_sale;The Avenue43468754;Griffin;01375 318833;Residential;This extremely well maintained property benefits from own drive to garage with additional off street parking, double glazing, gas central heating and secluded rear garden. This property represents a comfortable family home and internal viewings are highly recommended. With easy access to Lakeside Shopping Centre and Grays with C2C station and A13 & M25. Contact the sales team now to arrange a viewing on . EPC: TbcProperty InformationEntrance Hall:Lounge: 13'2 x 12'4Dining: 11'7 x 7'9Kitchen: 11'7 x 7'6 White high gloss with all appliances to remainBedroom 1:12'10 x 9'2 and wardrobe spaceBedroom 2: 9 x 8'9 and wardrobe spaceBedroom 3: 9'7 x 6'4Wet room:GardenGarageAgents NotesDraft Details - Awaiting Vendor Approval.1. Money laundering regulations - Intending purchasers will be asked to produce identification documentation at a later stage and we would ask for your co-operation in order that there will be no delay in agreeing the sale.2: These particulars do not constitute part or all of an offer or contract.3: The measurements indicated are supplied for guidance only and as such must be considered incorrect.4: Potential buyers are advised to recheck the measurements before committing to any expense.5: Griffin has not tested any apparatus, equipment, fixtures, fittings or services and it is the buyers interests to check the working condition of any appliances.6: Griffin has not sought to verify the legal title of the property and the buyers must obtain verification from their solicitor.Continued...5: Griffin has not tested any apparatus, equipment, fixtures, fittings or services and it is the buyers interests to check the working condition of any appliances.6: Griffin has not sought to verify the legal title of the property and the buyers must obtain verification from their solicitor.Reservation FeeGriffin Grays provide a reservation fee service to protect both our buyers and our vendors from being gazumped or gazundered.A reservation fee is very similar to putting a holding deposit down when renting a property. It is a payment made by a buyer to provide exclusive rights to buy a property, under certain conditions and at an agreed price. The reservation fee is set at ??1,000 for properties available through us Full terms and conditions are available at the office or can be sent to you via email upon request.You may download, store and use the material for your own personal use and research. You may not republish, retransmit, redistribute or otherwise make the material available to any party or make the same available on any website, online service or bulletin board of your own or of any other party or make the same available in hard copy or in any other media without the website owner's express prior written consent. The website owner's copyright must remain on all reproductions of material taken from this website.Devereux Road, Chafford Hundred, Grays RM16;2017-04-06 10:04:22;https://lid.zoocdn.com/354/255/0f62a8fab864d7acd33e6e5da8d8c156fa9e70ac.jpg;2017-04-07 01:45:12;51.48861;51.48861;sale;0.31291;false;0;3;0;0;RM16;Grays;325000;;Semi-detached house;for_sale;Devereux Road43468728;Dexters - Marylebone;020 7768 7017;Residential;This fourth floor (with lift), corner aspect, three bedroom apartment benefits from a long lease, natural light throughout and 24-hour porterage.DirectionsMarathon House is a secure, modern building located opposite The Old Marylebone Town Hall on Marylebone Road. Baker Street & Marylebone Stations are moments away as are the open green spaces of Regent's Park.You may download, store and use the material for your own personal use and research. You may not republish, retransmit, redistribute or otherwise make the material available to any party or make the same available on any website, online service or bulletin board of your own or of any other party or make the same available in hard copy or in any other media without the website owner's express prior written consent. The website owner's copyright must remain on all reproductions of material taken from this website.Marylebone Road, London NW1;2017-04-06 10:02:09;https://lid.zoocdn.com/354/255/b3a4578bccefa22313d04fa817d7c1a8ea93fa29.jpg;2017-04-07 01:45:10;51.52187;51.52187;sale;-0.160861;false;2;3;0;1;NW1;London;1399000;;Flat;for_sale;Marylebone Road43468726;Dexters - Twickenham;020 8166 1787;Residential;This is a gorgeous one bedroom converted apartment, beautifully modernised by the current owners. Not only lovely on the inside, this flat comes with its very own large private garden which has also been recently landscaped.DirectionsThis lovely Victorian building sits proudly on the corner of Grove Road and Hampton Road. A great location with local shops on your door step and close to either Strawberry Hill or Fulwell Mainline Stations.You may download, store and use the material for your own personal use and research. You may not republish, retransmit, redistribute or otherwise make the material available to any party or make the same available on any website, online service or bulletin board of your own or of any other party or make the same available in hard copy or in any other media without the website owner's express prior written consent. The website owner's copyright must remain on all reproductions of material taken from this website.Hampton Road, Twickenham TW2;2017-04-06 10:02:09;https://lid.zoocdn.com/354/255/d3c804594ed50c0e7447ef9249592bcc96a65f14.jpg;2017-04-07 14:04:13;51.43663;51.43663;sale;-0.349989;false;1;1;0;1;TW2;Twickenham;349950;;Flat;for_sale;Hampton Road43468721;Dexters - St Johns Wood;020 7768 7036;Residential;A spacious three bedroom apartment situated on the third floor of this premier block benefiting from porterage and communal garden. This bright apartment is offered in good decorative condition throughout.DirectionsApsley House is located within short walking distance of the shops and cafes of St John's Wood High Street and underground station.You may download, store and use the material for your own personal use and research. You may not republish, retransmit, redistribute or otherwise make the material available to any party or make the same available on any website, online service or bulletin board of your own or of any other party or make the same available in hard copy or in any other media without the website owner's express prior written consent. The website owner's copyright must remain on all reproductions of material taken from this website.Finchley Road, London NW8;2017-04-06 10:01:39;https://lid.zoocdn.com/354/255/3e8edd9276edb353733a19d13766a806c6b84ff9.jpg;2017-04-06 10:02:55;51.53549;51.53549;sale;-0.176173;false;0;3;0;1;NW8;London;1245000;;Flat;for_sale;Finchley Road43468698;Cound;020 3641 4708;Residential;Detailed DescriptionA spacious and very well proportioned ground floor Victorian maisonette presented for sale in good decorative order with its own garden extending from the wider than average side return  giving the potential to extend into if required (stpp). The flat is finished in neutral tones and provides a separate reception room to the front, a good master bedroom and a spacious second bedroom which can easily accommodate a double bed. There is a smartly fitted bathroom and a fabulous kitchen/dining room leading out to the rear. A highly attractive property that also benefits from a share of the freehold enhancing its desirability.St Ann's Hill runs off Earlsfield Road which gives access to Earlsfield itself offering a variety of shops, bars and restaurants as well as the main line station to Waterloo or Wimbledon, Clapham Junction can also be reached on foot or by the no.77 bus. Further facilities can be found at the nearby Southside Centre with the open spaces of Wandsworth Common Westside or King George's Park to hand.St Ann's Hill, Wandsworth SW18;2017-04-06 09:58:10;https://lid.zoocdn.com/354/255/96cb77d0cc56ff35fcd21ad441ddc213505710ae.jpg;2017-04-07 01:45:09;51.451897;51.451897;sale;-0.186775;false;1;2;0;1;SW18;London;630000;;Maisonette;for_sale;St Ann&#39 s Hill43468699;Central Estates;020 3463 1592;Residential;A bright and spacious 2 double bedroom apartment located on the first floor of this well maintained 1930???s purpose-built portered block. The accommodation (approx 915 .) is presented in very good order throughout with well-proportioned rooms including a large double reception room with attractive bay windows and a sizeable separate eat-in kitchen. The property has a large east facing balcony accessed from both the reception room and master bedroom. It also has the added benefit of underfloor heating and is double glazed throughout.Sherwood Court is ideally located within early walking distance of Marble Arch, Oxford Street and the open spaces of Hyde Park. Marylebone, Paddington, Edgware Road, Marble Arch and Baker Street stations are easily accessible.Sherwood Court, Seymour Place, London W1H;2017-04-06 09:58:10;https://lid.zoocdn.com/354/255/ccde5909b08aecde18597e951bdf775d14eca3fb.jpg;2017-04-07 01:45:09;51.51825;51.51825;sale;-0.162838;false;1;2;0;1;W1H;London;1499950;;Flat;for_sale;Sherwood Court