listing_id;agent_name;agent_phone;category;description;displayable_address;first_publish_date;image_url;last_publish_date;latitude;listing_status;longitude;new_home;num_bathrooms;num_beedrooms;num_floors;num_recepts;outcode;post_town;price;price_change;property_type;status;street_name43416176;John D Wood & Co. - Notting Hill Gate Sales;020 3463 0280;Residential;Two bedroom raised ground floor apartment in a period building ideally located for the trendy Golborne Road, Portobello Road, and Ladbroke Grove. This property is well laid out with a bright open plan kitchen-reception room to the front of the property, a spacious bathroom, and two bedrooms to the back of the building.Currently used as a rental investment the property would also make an ideal home, and is situated within easy reach of Ladbroke Grove underground station (Hammersmith & City and Circle Line) and the many fantastic bus links the area has to offer.Ladbroke Grove, London W10;2017-04-01 00:40:30;https://lid.zoocdn.com/354/255/073e1a7d1f0c6db17579a4db087b664969518c00.jpg;2017-04-04 00:46:22;51.521294;51.521294;sale;-0.212042;false;1;2;0;1;W10;London;750000;;Flat;for_sale;London43416184;John D Wood & Co. - Earls Court Sales;020 3463 0462;Residential;A perfectly proportioned upper maisonette accessed via the first floor of this well maintained terraced house in Ifield Road SW10. Comprising three double bedrooms, two family bathrooms, a spacious open plan reception kitchen with underfloor heating and a west facing roof terrace, this property is ideal for anyone wishing to move straight in.Ifield Road is an attractive location ideally situated for the transport links available at Earl's Court via the underground as well as the extensive bus routes of the area and the excellent range of shops bars and restaurants nearby.Ifield Road, London SW10;2017-04-01 00:40:30;https://li.zoocdn.com/60b226d4ce2bb62234cf40b54f47c744a47c071c_354_255.jpg;2017-04-07 16:34:23;51.485855;51.485855;sale;-0.189879;false;1;3;0;1;SW10;London;1295000;;Maisonette;for_sale;London43416168;John D Wood & Co. - Battersea Sales;020 3463 0479;Residential;Boasting much charm and character this well proportioned Artisan Cottage which was built circa 1898 is located on the southerly side of a peaceful cul-de-sac within easy reach of the exciting Vauxhall & Nine Elms regeneration area.On the ground floor there is good living and entertaining space throughout and the four bedrooms provide ample accommodation, one of which leads out onto a very good sized roof terrace.Meadow Place is extremely well located for Vauxhall, Stockwell & Oval stations nearby and regular bus services from South Lambeth Road. Furthermore, the open and green spaces of Vauxhall Park are located close by.Meadow Place, London SW8;2017-04-01 00:36:19;https://lid.zoocdn.com/354/255/ea09bcb92c02714b83cc7fb2ac12759629d5eacd.jpg;2017-04-01 01:46:12;51.479214;51.479214;sale;-0.12247;false;2;4;0;2;SW8;London;999950;;Terraced house;for_sale;London43416173;John D Wood & Co. - Notting Hill Gate Sales;020 3463 0280;Residential;A well proportioned, ground floor two bedroom apartment situated within a charming period mansion building. The apartment is well organized with a spacious reception/dining room and separate kitchen, and two double bedrooms (one with en suite) towards the rear in addition to a modern family bathroom. The apartment benefits from high ceilings throughout, ensuring that there is an abundance of natural light.The property is being offered with the added benefit of an additional store cupboard within the communal area of the building, making the property hugely attractive to young families and investors alike. St. Stephens Mansions is located on the quiet Monmouth Road, but is moments away from the amenities and transport links of Westbourne Grove.Ground floor Bathroom  Fully tiled family bathroom. Bath including hand shower attachment. Wash basin one a tiled counter, with mirror over. WC with hidden cistern and shelving space above. Heated towel rail and a medicine cabinet.Master Bedroom  Lovely double bedroom which has large windows with dual aspect facing north and west.Bedroom 2  Spacious double bedroom that presently has two twin beds and large wooden cupboards.Kitchen  Well sized kitchen with tiled floors and plenty of cupboard space. The back granite counter top incorporates a one and half double bowl sink. Appliances include: Neff five ring gas hob with electric oven below and extractor fan over, and a Neff integrated dishwasher.Reception/Dining Room  A spacious room with oak flooring, a large window and modern working gas fireplace.Shower Room (En Suite)  Large shower room cubicle with rain showerhead over. Wash basin with illuminated mirror over. WC with hidden cistern and medicine cabinet over. Heated towel rail.Utility Closet  Currently housing a Bosch washer and drier, Worcester boiler. There is cupboard space and counter space for additional storage.Monmouth Road, Westbourne Grove, London W2;2017-04-01 00:36:19;https://lid.zoocdn.com/354/255/d74b3488378bc7542efcf3c4994ab1cb1d099cba.jpg;2017-04-01 01:46:12;51.515713;51.515713;sale;-0.192846;true;2;2;0;1;W2;London;1200000;;Flat;for_sale;Westbourne Grove London41370426;John D Wood & Co. - Chelsea Green Sales;020 3463 0483;Residential;This is the most lovely upper maisonette in a particularly broad west facing converted house just south of Fulham Road. Comprising approximately 1275sqft the flat has three bedrooms and two bathrooms, with the principal bedroom being en- suite. Approached from the first floor the flat is particularly light, unusually having windows to the side of the building.Beaufort Street, Chelsea, London SW3;2017-04-01 00:36:19;https://lid.zoocdn.com/354/255/1bc934b330180d1944bb3b2e56a623c8b44d1f6b.jpg;2017-04-01 00:36:19;51.486763;51.486763;sale;-0.178147;false;2;3;0;2;SW3;London;1695000;;Maisonette;for_sale;Chelsea London43416162;Brien Firmin;020 3641 4116;Residential;For sale is this extremely spacious 2 double bedroom 3rd floor flat forming part of this well established 1970 built development. Located ideally in the heart of Palmers Green and within 100m of its local shopping facilities including Morrisons Supermarket and Palmers Green rail station in Alderman's Hill offering direct access to the City (Moorgate).The property is both Upvc double glazed and gas centrally heated and comprises of main reception 19ft 4 x 12ft 7, bedrooms of 17ft 3 and 14ft 9 respectively a 12ft 7 kitchen and finally a 2 piece bathroom and separate wc. The property is immaculate although there is an argument for some further modernisation which has been considered within the asking price. It also benefits from its own garage-en-bloc for parking or storage as required.We are also informed there is to be a new extended lease in place for the new owners. A really fine opportunity.Reception 19ft 4 x 12ft 7 (5.93 x 3.65 metres)Bedroom One 17ft 3 x 10ft (6.02 x 3.04 metres)Bedroom Two 14ft 9 x 8ft ( 4.54 x 2.43 metres)Kitchen 12ft 7 x 8ft (3.65 x 2.43 metres)Garage en-blocLounge - 19' 4'' x 12' 7'' (5.89m x 3.83m)Dual aspect UPVC windows. Fitted cupboards and display unit. Power points. Telephone point. Communal TV aerial.Kitchen - 12' 7'' x 8' 0'' (3.83m x 2.44m)Fitted wall and base cupboards. Worktops. Double drain stainless steel sink unit and mixer tap. Plumbed for washing machine. Space for fridge/freezer. Electric cooker point. Gas supply. Floor mounted boiler. UPVC double glazed window to side aspect. Part tiled. Telephone point.Bedroom One - 17' 3'' x 10' 0'' (5.25m x 3.05m)UPVC double glazed window. Single radiator. Fitted wardrobes. Power points. Telephone point.Bedroom Two - 14' 9'' x 8' 0'' (4.49m x 2.44m)Radiator. UPVC windows to front aspect. Power points.GarageEn bloc. Up and over doorPellipar Close, London N13;2017-04-01 00:36:19;https://lid.zoocdn.com/354/255/1fe102a2bb86adc85258419ab9e5323f6a2bbf97.jpg;2017-04-05 00:06:13;51.62135;51.62135;sale;-0.106352;false;0;2;0;0;N13;London;375000;;Flat;for_sale;Pellipar Close43416127;Hobarts Estate & Letting Agents - London (North);020 7768 3134;Residential;A well presented split level 1st & 2nd floor two double bedroom apartment in the heart of bowes park. The property comprises a bright & spacious South facing frontal lounge, well-proportioned kitchen/diner, fitted bathroom. Ideally located to Bowes Park National Rail/Bounds Green/Wood Green Tube stations (20/25 mins City/West End) and also close proximity of ???independent shops??? in Myddleton Road & bus routes. Early viewing strongly recommended.Nightingale Road, Bowes Park, London N22;2017-04-01 00:33:28;https://lid.zoocdn.com/354/255/424d4f0c3576777cf40c33e6a9a463349b9b23d7.jpg;2017-04-04 16:20:14;51.6033;51.6033;sale;-0.115103;false;0;2;0;0;N22;London;419950;;Flat;for_sale;Bowes Park London43416125;Homesite;020 3463 2608;Residential;Stylish two bedroom, two bathroom apartment with two terrace's, underground parking & a secure storage unit in this iconic landmark building on the site of the old print works.Barlby Road runs off the northern end of Ladbroke Grove less than ten minutes??? walk from Ladbroke Grove tube station, both Portobello & Golborne Road Street markets are within five minutes plus Sainsbury???s Supermarket is two minutes away. The Regents Canal & Kensal Rise, with its mix of cafe's bars & restaurantsare both also just a short stroll away! The area is also very well served by a multiple of bus services and the A40, both East & West, is also easily accessible. Plus Paddington Mainline Station, including the Heathrow Airport Express, is within ten minutes.2 BedroomsPorter1002 Sqft / 93.5 SqmtsTwo BathroomsReception RoomSemi Open Plan KitchenTerraceBalconyUnderground ParkingSeparate Storage Unit5 Minutes To Ladbroke Grove Tube Station5 Minutes To Both Portobello & Golborne Street MarketsPorter1002 Sqft / 93.5 SqmtsTwo Double BedroomsTwo BathroomsReception RoomSemi Open Plan KitchenTerraceBalconyUnderground ParkingSeparate Storage Unit5 Minutes To Ladbroke Grove Tube Station5 Minutes To Both Portobello & Golborne Street MarketsBarlby Road, North Kensington W10;2017-04-01 00:32:46;https://lid.zoocdn.com/354/255/93959475215cbd0a7d1f8f56191b44534e39327f.jpg;2017-04-06 16:14:14;51.52333;51.52333;sale;-0.218175;false;0;2;0;0;W10;London;1075000;;Flat;for_sale;North Kensington43416104;Greene & Co - Muswell Hill Sales;020 3463 0154;Residential;Quietly situated with west-facing views over the delightful communal gardens, this spacious, one bedroom, second floor flat is located at the rear of this attractive 1930's built Art Deco block.Offering well-proportioned rooms finished to a good standard, the flat benefits from a modern kitchen and bathroom and an enclosed utility space that makes a great bike storage area.The block is accessible from both Pages Hill and Colney Hatch Lane making it extremely convenient for the open spaces of Alexandra Palace and the excellent transport, shopping and cafe facilities of Muswell Hill.The flat is available for sale with no upper chain.Seymour Court, Colney Hatch Lane, Muswell Hill, London N10;2017-04-01 00:30:24;https://li.zoocdn.com/96b40973791a921c9d207190f8113cb887ac7c6a_354_255.jpg;2017-04-05 16:31:46;51.597675;51.597675;sale;-0.146466;false;1;1;0;1;N10;London;390000;;Flat;for_sale;Colney Hatch Lane Muswell Hill London43416107;Greene & Co - Belsize Park;020 8022 0982;Residential;Situated within easy reach of the amenities of Finchley Road is this well presented apartment set on second floor of this mansion block with a lift.The property has been refurbished and comprises a spacious reception room, a separate modern fitted kitchen, two double bedrooms and a contemporary tiled bathroom.The apartment is offered chain free and further benefits from a private balcony, communal gardens and residents parking.Heathway Court, Finchley Road, London NW3;2017-04-01 00:30:24;https://lid.zoocdn.com/354/255/3c65048e4a4f63138080d5eb369999629ae52ee2.jpg;2017-04-01 01:46:10;51.563877;51.563877;sale;-0.196492;false;1;2;0;1;NW3;London;649999;;Flat;for_sale;Finchley Road London43416096;Greene & Co - Crouch End;020 3542 2180;Residential;Situated on the top floor of this charming grade 2 listed old Georgian boarding school, is a one bed apartment overlooking the communal gardens.There is a light and airy reception room with hard wood flooring, a separate kitchen, a double bedroom with fitted wardrobes and a modern bathroom.The property is in good condition throughout with beautiful sash windows and benefits further from off street parking on a first come first served basis.Located just a short walk from Hornsey over ground station, this property would make an ideal home or investment purchase.Eagle Court, 69 High Street, London N8;2017-04-01 00:29:28;https://li.zoocdn.com/f3d98f94b9287bc5afe5831ef3107a9471af1df6_354_255.jpg;2017-04-01 00:42:19;51.588177;51.588177;sale;-0.115946;false;1;1;0;1;N8;London;390000;;;for_sale;69 High Street London43416032;Currell - Islington;020 3478 3315;Residential; Key features: ??? Freehold??? Four double bedrooms??? Four en-suite bathrooms??? Guest cloakroom??? Open plan kitchen and reception room??? Dining area??? Landscaped garden??? EPC Rating: BA stylishly presented four bedroom, four bathroom (all en-suite) modern townhouse with an attractive landscaped garden located in the heart of De Beauvoir and only moments from Kingsland Road, Haggerston station, Regents Canal and Shoreditch.The property is presented in excellent condition with a spacious open plan reception room and kitchen complete with a dining area making a great entertaining space, which leads directly to the garden.The fashionable shops, bars and restaurants of De Beauvoir 'village', Kingsland Road, Broadway Market and Shoreditch are within easy reach.The house is freehold and offered chain free.Hertford Road, Islington N1;2017-04-01 00:28:34;https://lid.zoocdn.com/354/255/435c53d8e0d63bcf42d59d0ebfcbf789c684155a.jpg;2017-04-07 00:45:54;51.539944;51.539944;sale;-0.078268;false;0;4;0;0;N1;London;1275000;;;for_sale;Islington London43416026;Colliers International New Homes, East;020 8128 1351;Residential;A spacious and bright 586 sq. Ft. 1 bedroom flat located on the first floor facing south-west with a balcony within the Loncor Homes development of Arden Court.Colliers International is pleased to present this 1 bedroom apartment located within Arden Court, a brand new development set in Bermondsey, Zone 1.It is an excellent Zone 1 location within walking distance of 3 seperate underground stations being London Bridge, Borough and Elephant & Castle.The Shard, Globe Theatre and Tower Bridge are just some of the celebated landmarks within the area. Southwark Park is just one of the green open spaces in the area with a wildlife garden, boating lake, art gallery and numberous sporting facilites on the 62 acre area.Educational institutions such as London South Bank University, University College London (ucl) and Royal College of Art.Features to Note:- Bespoke contemporary kitchens with Quartz worktops and integrated Siemens appliance (hob, oven, microwave, fridge-freezer, dishwasher, washer-dryer)- Fitted wardrobes with mirrored doors in bedroom- Secure video door entry system- Individual room controlled underfloor heating- Dedicated concierge- Large landscaped communal gardens- Designated bicycle storageArden Court, Pages Walk, Bermondsey, London SE1;2017-04-01 00:28:33;https://lid.zoocdn.com/354/255/482ecef71fa7c227ce48d3de77c12512a910e9c3.jpg;2017-04-05 00:29:47;51.495327;51.495327;sale;-0.080332;true;0;1;0;0;SE1;London;560000;;Flat;for_sale;Bermondsey London43416011;Alan De Maid - Bromley Sales;020 3463 0089;Residential;Situated in a very desirable and sought-after area is this five bedroom detached family home. Superbly located for excellent local schooling and convenient for Bromley South mainline station giving direct access into Central London as well as Bromley town centre with its array of shops, restaurants, bars and leisure amenities. The property comprises upon entering  open porch with cloakroom, a large bright and airy reception room with feature fireplace and doors leading on to side patio, dining room, fully fitted kitchen with ample storage and preparation space, separate utility area, study and doors leading onto a delightful and private low maintenance garden with patio area. Upstairs comprises three double bedrooms all with built in storage, two further single bedrooms, family bathroom and separate shower room. We feel that this property really is perfect for family living and should be viewed to really appreciate all it has to offer. Benefits include garage, double glazing and off-street parking. Viewing is highly recommended.Hayesford Park Drive, Bromley BR2;2017-04-01 00:28:32;https://lid.zoocdn.com/354/255/3535b4789be24faa18dc41e4135d6cc6c3c988f5.jpg;2017-04-05 00:14:26;51.391533;51.391533;sale;0.009972;false;0;5;0;0;BR2;Bromley;650000;;Detached house;for_sale;Bromley43416013;Alan De Maid - Locksbottom Sales;01689 867057;Residential;New to the market offering fabulous potential is the four bedroom detached property in the heart of Keston Village. The property offers spacious open plan ground floor living, four bedrooms to first floor. Master with en suite shower room and further family bathroom. Externally the property offer fabulous gardens to the rear, off street parking and integral garage. Offered Chain freeKeston Gardens, Keston BR2;2017-04-01 00:28:32;https://li.zoocdn.com/1f22fac567975c88b0ce340738cfede7255f9631_354_255.jpg;2017-04-01 01:46:08;51.36274;51.36274;sale;0.030044;false;0;4;0;0;BR2;Keston;800000;;Detached house;for_sale;Keston43416017;Anthony Pepe;020 3463 0350;Residential;An impressive three bedroom bay fronted Victorian family home, located on a highly desirable road. This lovely property offers superb living space and would be perfect for a family or professional couple. Benefits include a through lounge, kitchen breakfast room with access to the rear  the first floor there is a three double bedrooms bedrooms, and contemporary bathroom. Further benefits include a downstairs cloakroom.Wightman Road is perfectly located for the fashionable Crouch End Broadway as well as the vibrant Harringay area offering an array of shops and amenities in addition to excellent transport links including local bus services into the City, access to Turnpike Lane Underground Station (Piccadilly Line) and Hornsey Rail station.**Sole Agents****Chain Free**Wightman Road, London, London N8;2017-04-01 00:28:32;https://lid.zoocdn.com/354/255/6edd52ba6e5d29c8220dd253a4a0b2dc2d546ad2.jpg;2017-04-01 01:46:08;51.586376;51.586376;sale;-0.108413;false;0;3;0;0;N8;London;745000;;;for_sale;London London43416016;Anthony Pepe;020 3463 0350;Residential;Investors only.Ground floor Studio flat being sold with tenants in situ until March 2018 (Break clause from Jan 2018). Currently achieving ??875pcm in rent giving a yield of over 5%. The property benefits from an open plan Studio Room / kitchen and a separate shower room. Eldon Road is ideally situated for the vibrant Wood Green shopping area with all its bars and restaurants and with easy access to both Wood Green and Turnpike Lane Underground station.**No Upper Chain****Sole Agents**Eldon Road, London, London N22;2017-04-01 00:28:32;https://lid.zoocdn.com/354/255/c5894498433286548ad64e78a2ca960988399ccf.jpg;2017-04-06 00:37:58;51.60033;51.60033;sale;-0.096801;false;0;1;0;0;N22;London;185000;;Flat;for_sale;London London43416012;Alan De Maid - Chislehurst Sales;020 3463 0101;Residential;Share of freehold:Located in arguably Chislehurst's finest private road is this spacious two double bedroom first floor apartment. The property is presented to the market in excellent decorative order and offers a spacious living room with feature bay window and fireplace, fully fitted kitchen, bathroom with separate WC and two bedrooms. The property also offers a garage en bloc and benefits from superbly maintained communal grounds. Viewing essential.Moorlands, Wilderness Road, Chislehurst BR7;2017-04-01 00:28:32;https://lid.zoocdn.com/354/255/486fb45a020759ff8058c1b2c6c7bb4b135b0202.jpg;2017-04-05 00:27:57;51.411976;51.411976;sale;0.066536;false;0;2;0;0;BR7;Chislehurst;600000;;Flat;for_sale;Wilderness Road Chislehurst38598056;Choices - Croydon;020 3478 3473;Residential;Calling all cash buyers - Choices are pleased to present to the market this three bedroom mid floor flat situated in close proximity to local transport links including Thornton Heath and Norbury train stations. Mayday University Hospital, shops and amenities are also within easy reach. The accommodation comprises: Hallway, fitted kitchen, lounge, three bedrooms and a modern bathroom with separate W/C. Benefits include: Gas central heating, double glazing a balcony and no onward chain! This is an ideal investment opportunity so what are you waiting for? Call Choices now and arrange your appointment to view. EPC Rating C.* Three bedroom mid floor flat* Fitted kitchen* Modern bathroom with separate W/C* Double glazing & gas central heating* Balcony* No onward chain* Investment opportunity* Cash buyers* Buyers Commission May Be Required* Draft details awaiting vendor approvalDraft details awaiting vendor approvalHallwayRadiator. Doors to:Kitchen - 10' 6'' x 6' 6'' (3.20m x 1.98m)Double glazed window to rear. Fitted with a range of wall and base level units with complementary work surface over. Stainless steel sink/drainer unit. Built in electric oven and gas hob. Extractor hood. Space for washing machine and fridge/freezer. Part tiled walls.Lounge - 14' 8'' x 11' 11'' (4.47m x 3.63m)Double glazed bay window to front. Double glazed door to front. TV aerial socket. Radiator. Access to:BalconyBedroom 1 - 14' 8'' x 9' 9'' (4.47m x 2.97m)Double glazed window to front. Radiator.Bedroom 2 - 10' 6'' x 9' 8'' (3.20m x 2.94m)Double glazed window to rear. Radiator.Bedroom 3 - 14' 6'' x 6' 6'' (4.42m x 1.98m)Double glazed window to front. Radiator.BathroomDouble glazed window to rear. Fitted with a white suite comprising: Panel enclosed bath with shower over and pedestal wash basin. Radiator. Part tiled walls.W/CDouble glazed window to rear. Fitted with a low level W/C.Buyers Commission May Be Required**Full details available upon request.Tenure - Leasehold.Term: 99 years from 1st January 1976.London Road, Thornton Heath CR7;2017-04-01 00:28:30;https://lid.zoocdn.com/354/255/40b6c437493adfe30e107af447c8de7b83505560.jpg;2017-04-01 00:28:30;51.39584;51.39584;sale;-0.116226;false;1;3;0;1;CR7;Thornton Heath;275000;;Flat;for_sale;London Road43415977;Foxtons - Kingston;020 3542 2187;Residential;A gorgeous one bedroom flat, well arranged on the lower ground floor of this imposing period conversion and boasting a private entrance, communal gardens and close to Kingston town centre.The property is ideally positioned for the leisure facilities, restaurants, shops and bars of Kingston.Pelham Lodge, Grove Crescent, Kingston KT1;2017-04-01 00:28:30;https://lid.zoocdn.com/354/255/42fa1fd8f5ed072373c680f4ab62bda12cd552c1.jpg;2017-04-07 10:17:31;51.40474;51.40474;sale;-0.302512;false;0;1;0;0;KT1;Kingston upon Thames;369950;;Flat;for_sale;Pelham Lodge, Grove Crescent