listing_id;agent_name;agent_phone;category;description;displayable_address;first_publish_date;image_url;last_publish_date;latitude;listing_status;longitude;new_home;num_bathrooms;num_beedrooms;num_floors;num_recepts;outcode;post_town;price;price_change;property_type;status;street_name43457032;Next Chapter;0330 038 8380;Residential;Found in the area of 'Warley, ' a location surrounded by plenty of hype with the imminent arrival of Crossrail, it's no wonder many of London's prospective buyers are choosing this location over anywhere else! This impressive, 2 bedroom, semi-detached family home, with parking and garage, found on ???Brackens Drive???, is definitely worth viewing! What's not to love?A lifestyle of shops, coffee culture and fine dining await the socialites amongst us, as Brentwood High Street is actually not too far from here either! For those needing Schools, you'll be pleased to hear that a selection of Primary and Secondary Schools can be found close by!When approaching this property for the first time, you'll notice off street parking for 1 car on the driveway, side access and the garage.Walk through the front door into the hallway, and to your right is where you'll find the modern kitchen, bathed in natural light, whilst to the end of the hallway, is where you'll find the lounge/diner, complete with patio doors leading out into a pristine garden. The dining area has plenty of room for a table and 4 chairs.Let's not forget! This family home also comes with a ground floor W.C.Upstairs to the first floor are where you'll find 2 bedrooms, loft access, and a modern family bathroom. Bedroom 1 (double in size), can be found overlooking the front, whilst bedroom 2 (again, double in size) and the family bathroom can be found overlooking the garden.Something to consider - This property has potential for a loft extension (subject to planning permission of course).Outside - The garden is partly decked, whilst the rest is mainly laid to lawn with trees and shrub borders. From the garden you???ll discover access into the garage, which has been partially converted to provide a home office, and behind the garage is a paved area with a brick built barbeque.We love it!We'd love to hear from you! Arrange a viewing and start your 'Next Chapter' with us today???Brackens Drive, Warley, Brentwood CM14;2017-04-05 16:15:18;https://li.zoocdn.com/a8a07dc53dbd38722cc4d54f701f5cf0425062c5_354_255.jpg;2017-04-06 16:06:46;51.60652;51.60652;sale;0.30216;false;0;2;0;0;CM14;Brentwood;400000;;Semi-detached house;for_sale;Brackens Drive43456999;eMoov National;01277 699033;Residential;We are delighted to offer for sale this 3 bedroom end of terrace house in this sought after and convenient location within easy reach of local amenities and public transport links.The impressive accommodation is well presented and of a good size and comprises ample living space and well appointed bedrooms.Please see the many photographs that accompany this listing and the indicative floor plan for further detail. To fully appreciate this property please arrange a viewing appointment which you can do 24/7 by clicking on the contact link provided.Bishopsford Road, Morden, Surrey SM4;2017-04-05 16:15:17;https://lid.zoocdn.com/354/255/f038aac69ea8dce8bac014baf9c9f0cdfad239be.jpg;2017-04-06 01:50:17;51.387947;51.387947;sale;-0.183656;false;1;3;0;2;SM4;Morden;425000;;End terrace house;for_sale;Bishopsford Road43456980;Hammonds;020 3478 3596;Residential;A compact studio apartment located on a Victorian tree lined street that oozes character. The property is near to Hammersmith Station and very close to local amenities including shops, pubs and local eateries.This studio has been decorated to a high standard and has wooden flooring throughout. It includes a fully fitted modern kitchen, a living area and a fully fitted bathroom. The property has 115 years remaining on its lease and is currently tenanted.Lena Gardens, London W6;2017-04-05 16:14:08;https://lid.zoocdn.com/354/255/3befa8c1523b60902dba434f0a14aee7340daf30.jpg;2017-04-05 16:15:22;51.498356;51.498356;sale;-0.223918;false;1;0;0;1;W6;London;250000;;;for_sale;Lena Gardens43456961;MyLondonHome New Homes - Shad Thames, South Bank, Nine Elms, Battersea & South London;020 3463 0040;Residential;Amazing opportunity to purchase a stunning apartment in an iconic new development in Croydon.This stunning forty second floor apartment in the Saffron Tower development, just moments from Croydon's vibrant city centre presents a stylish open plan reception and kitchen with dining space, two spacious double bedrooms, one en-suite bathroom and family bathroom.Saffron Square sets the benchmark for modern architecture in Croydon. The interiors will feature high-specification, contemporary fittings and will take take inspiration from six fashionable locations: London, Paris, Milan, New York, Manhattan and Knightsbridge. The Tower aims to offer a superior standard of living never before enjoyed in the area.Residents of Saffron Tower will benefit from 24 hr concierge, residents gymnasium and an array of transport links, under half an hour from Victoria Station, Central London, providing ease and convenience.The development is built around a landscaped public courtyard which will provide residents with a coffee shop and Tesco Express.Completion due Q2 2017** Images shown are not of the actual unit being sold and are for illustration purposes only. The images may or will include furniture, floor coverings, blinds and curtains, fixtures, decoration and fittings not included in the asking price. Please check with us on any point that is important to you **TransportSaffron Square is perfectly placed to take advantage of the transport links that both East and West Croydon stations offer. East Croydon benefits from the fast train from Brighton to London Bridge via Gatwick Airport, as well as six trains per hour to Victoria station. There is also the fast London Overground connection to the City, Canary Wharf and the London Underground network from West Croydon station, and a reliable tram network throughout Croydon that conveniently links The Tower to Wimbledon and Beckenham Junction. Well-planned bus routes are also available from a central bus station.LocationA dynamic business hub bordering the green belt, Croydon offers a desirable cost-effective alternative to the existing commercial centres of the City of London, Barbican and Canary Wharf. Croydon can already rival many of the larger cities in the UK for facilities and transport connections.Croydon offers rich cultural diversity, which has produced a superb range of restaurants within easy reach of Saffron Square. Among these is the Michelin Guides recommended Alberts Table. Newer and more upmarket eateries include the award-winning Banana Leaf and trendy gastro pubs such as The Tree House. Whether you're looking for a quiet romantic spot or an exciting night out, Croydon offers a wealth of choice.Within a short walk of Saffron Square are two shopping centres: The Whitgift Centre, with over 140 shops including Marks & Spencer, and Centrale, which has a flagship House of Fraser store and a cosmopolitan food hall. A short distance from Saffron Square is Purley Way Retail Park, providing shops such as ikea, Next, Snow & Rock and a John Lewis Home store, among others. Westfield shopping centre Croydon is anticipated to open in 2017 - 2018 creating 5,000 jobs, and will offer 1.5 million sq ft of retail space, a multi-screen cinema, bowling alley and a multitude of restaurants.Croydon is Londons greenest borough, with 32% of it being open or green space. It has seven Green Flag parks and was the 2009 silver-class winner of the prestigious rhs Britain in Bloom award. Several areas around and within Croydon are recognised nature walks and eco parks. Sporting facilities in the area include swimming baths, cricket and football pitches and clubs, and fivenearby golf courses.Within a five-minute walk of Saffron Square is Croydon Clocktower, an arts and cultural venue with a library and cinema. Seating up to 1,800 people, Fairfield Halls in East Croydon has been a major concert hall and comedy venue since the 1960s, with many famous acts gracing the stage, including The Beatles, Tom Jones and Simply Red.These particulars are not intended to, and do not offer or form part of any contract and whilst these sales particulars are believed to be correct, their accuracy is in no way guaranteed. Any measurements are for general guidance and interest only and should not be relied on. None of the services to the property, or any of the appliances, fixtures or fittings have been or will be tested by MyLondonHome. Photographs may depict general images of the development and may not show the actual flat for sale. Internal photographs may show items not included in the sale.Saffron Tower, Croydon, London CR0;2017-04-05 16:13:00;https://lid.zoocdn.com/354/255/dd28e1e6dcac4f68e1156f7cbd8fc9defe95db95.jpg;2017-04-05 16:14:44;51.379356;51.379356;sale;-0.098969;true;2;2;0;1;CR0;Croydon;530000;;Flat;for_sale;Saffron Tower43456949;Dexters - Tufnell Park;020 3641 4818;Residential;A large two bedroom first floor apartment within a stylish well maintained development. This flat has an open plan kitchen reception room with access to a private roof terrace.DirectionsTiltman Place is a secure development just off the high street and is within a mile from three overground stations and two underground stations.You may download, store and use the material for your own personal use and research. You may not republish, retransmit, redistribute or otherwise make the material available to any party or make the same available on any website, online service or bulletin board of your own or of any other party or make the same available in hard copy or in any other media without the website owner's express prior written consent. The website owner's copyright must remain on all reproductions of material taken from this website.Tiltman Place, London N7;2017-04-05 16:13:00;https://lid.zoocdn.com/354/255/486cf06a35e98ee6422b6f7a74ef8461b3067dc7.jpg;2017-04-06 01:50:13;51.561565;51.561565;sale;-0.114536;false;2;2;0;1;N7;London;499950;;Flat;for_sale;Tiltman Place43456952;Dexters - Wimbledon;020 8166 7538;Residential;Forming part of this exquisite private development is this beautifully decorated end of terrace townhouse. There are three bedrooms, two bath/shower suites and a twin aspect first floor reception room.DirectionsParklands Gardens is situated within a few hundred yards of Wimbledon Common. There is a frequent bus service to both Putney & Wimbledon. The area has some highly sought after schools and some awesome restaurants and popular bars nearby.You may download, store and use the material for your own personal use and research. You may not republish, retransmit, redistribute or otherwise make the material available to any party or make the same available on any website, online service or bulletin board of your own or of any other party or make the same available in hard copy or in any other media without the website owner's express prior written consent. The website owner's copyright must remain on all reproductions of material taken from this website.Parkland Gardens, London SW19;2017-04-05 16:13:00;https://lid.zoocdn.com/354/255/801e845e382ae2551f86aa80ddb17340ccce71e9.jpg;2017-04-06 01:50:13;51.444923;51.444923;sale;-0.219919;false;3;3;0;2;SW19;London;1100000;;;for_sale;Parkland Gardens43456959;MyLondonHome New Homes - Shad Thames, South Bank, Nine Elms, Battersea & South London;020 3463 0040;Residential;A generous one bedroom apartment on offer within the two fifty one development in Elephant and Castle.This apartment on the twenty-fifth floor features a spacious living and dining area, with modern fitted kitchen, double bedroom with fitted-wardrobes and an en-suite bathroom.Two fifty one is a stunning 41-storey tower which has been designed by award-winning Southwark architects, Allies & Morrison. Amenity spaces and apartments at two fifty one have been created to effortlessly combine contemporary style, beautiful materials and bespoke finishes. Special attention has been given to the quality of lighting, appliances, fixtures and fittings.Residents of this superb development benefit from a range of great on-site amentities including 24 hour staffed reception and security, concierge services, gymnasium & thermal suite, cinema club, 'get connected lounge', restaurant and cafe-bar.This apartment is the perfect opportunity to invest or live in a brand new development in an exciting zone 1 area, that is undergoing extensive regeneration. Just minutes from the South Bank, Westminster, Chelsea, the West End and the City and with excellent transport links, two fifty one is an outstanding place to purchase an apartment in Central London.Anticipated completion Q4 2017** Images shown are not of the actual unit being sold and are for illustration purposes only. The images may or will include furniture, floor coverings, blinds and curtains, fixtures, decoration and fittings not included in the asking price. Please check with us on any point that is important to you **Amazing LocationTwo fifty one Southwark Bridge Road is situated in the heart of Southwark, and is within minutes of central Londons most popular, recognisable and memorable destinations. Located at the junction of two major roads into central London: From the east, Newington Causeway connects to London Bridge, Borough Market and The Shard  whilst from the west, Southwark Bridge Road is the route of the CS7 Cycle Superhighway to Kings Cross.Southwark is undergoing an unprecedented and extensive regeneration process, making it one of the most dynamic and exciting areas of London. From two fifty one it is only a 16 minute walk to London Bridge, with it's abundance of things to do, see and places to eat, including The Shard, and the famous Borough Market. Also within easy reach is the vibrant Southbank, the London Eye, the amazing art at Tate Modern and exciting theatre at Shakespeare's Globe.Great Transport LinksLocal transport links are excellent, with Elephant & Castle Underground station only a 4 minute walk away with Northern and Bakerloo line services. London Bridge station is just two stops away on the Northern line, which allows for easy access to Canary Wharf via the Jubilee line. The West End is within easy reach with the Bakerloo line to Oxford Circus and Northern Line to Leicester Square.A great alternative to the tube, the new CS7 Cycle Superhighway also passes two fifty one on Southwark Bridge Road on its way to Kings Cross.These particulars are not intended to, and do not offer or form part of any contract and whilst these sales particulars are believed to be correct, their accuracy is in no way guaranteed. Any measurements are for general guidance and interest only and should not be relied on. None of the services to the property, or any of the appliances, fixtures or fittings have been or will be tested by MyLondonHome. Photographs may depict general images of the development and may not show the actual flat for sale. Internal photographs may show items not included in the sale.Two Fifty One, Elephant And Castle, London SE1;2017-04-05 16:13:00;https://lid.zoocdn.com/354/255/1eadd8f474f11a8e3d806cbb0e34a49e28b4bef2.jpg;2017-04-06 17:12:14;51.49765;51.49765;sale;-0.099209;true;1;1;0;1;SE1;;590000;;Flat;for_sale;Two Fifty One43456964;MyLondonHome - Central and West End Sales and Lettings;020 8033 8541;Residential;One of the most prestigious new developments in London, this beautiful apartment in Wolfe House in the heart of 375 Kensington High Street offers the pinnacle of luxury and quality. This two bedroom apartment comprises a bright open-plan reception and luxury kitchen with access to the large private terrace, two double bedrooms, and two stunning bathrooms.The development is situated in one of London's most prestigious locations with a concierge in each House and an array of shops, caf??s, supermarket, banks and other facilities all within just a short stroll. This property is ideal for investment or owner occupation. 375 Kensington High Street is located moments from Kensington Olympia mainline station and the boutique shops, restaurants and bars of Kensington High Street. The open spaces of Holland Park are also just 0.5 miles away. Residents of this luxury development benefit from a 24 hour concierge service, gymnasium, swimming pool, sauna, private cinema and business suite.Great Transport ConnectionsWith High Street Kensington underground station only an 11 minute walk from the apartment, access to some of London's main attractions are within easy reach. Only five stops away and in less than 15 minutes, you can enjoy the shops of Bond Street, or be walking through the beautiful Regents Park within 20 minutes.Enviable LocationSituated in the Royal Borough of Kensington and Chelsea, one of London's most prestigious neighbourhoods, 375 Kensington High Street is the perfect address for enjoying London life to the upmost. With some of the City's most famous cultural attractions, restaurants and bars close by, and an array of luxury shops and parks a short stroll away, Kensington is an enviable location for discovering all that London has to offer.These particulars are not intended to, and do not offer or form part of any contract and whilst these sales particulars are believed to be correct, their accuracy is in no way guaranteed. Any measurements are for general guidance and interest only and should not be relied on. None of the services to the property, or any of the appliances, fixtures or fittings have been or will be tested by MyLondonHome. Photographs may depict general images of the development and may not show the actual flat for sale. Internal photographs may show items not included in the sale.Wolfe House, Kensington, London W14;2017-04-05 16:13:00;https://lid.zoocdn.com/354/255/f54a83a51284d997de769276bce2cdb34179cf60.jpg;2017-04-05 16:14:45;51.49612;51.49612;sale;-0.206414;true;2;2;0;1;W14;London;1700000;;Flat;for_sale;Wolfe House43456933;EELEVEN;020 8033 9195;Residential;Detailed DescriptionThis one bedroom ground floor apartment, with parking, has a large open plan living space of almost 250ft2 and over 26ft in length. It's a nice room to be at home in and the perfect space for entertaining friends without having to disappear into a distant tiny room while cooking.The kitchen area is fitted with plentiful cupboards, integrated gas hob, electric oven and extractor hood in stainless steel, built-in washing machine and space for a tall fridge/freezer.There's a beautiful bathroom with large format and snazzy brick tiles along with a white suite that includes a corner bath (with shower) and inset washbasin with storage below.At the back of the apartment the double bedroom looks out onto - and leads directly to - the east facing rear garden that extends to around 50ft and offers a secluded space backing onto other gardens.Natural light has been maximised throughout the living and sleeping areas with laminate flooring in light oak, while other benefits including double glazed windows, gas-fired central heating and an off-road parking space at the front.The location is convenient for the excellent places to eat and drink on nearby Francis Road on the Abrahams Estate, with such local favourites at Yardarm wine bar, Marmelo Kitchen and The Northcote tavern, while High Road Leyton offers a good local shopping parade and serves up tapas at Caf?? Lolita, Deeney's for coffee'n'cake, Uptown Burger and the Leyton Technical pub.The Overground station at Leyton Midland Road is less than 10 minutes walk and has a useful link to the Victoria Line just two stops away at Blackhorse Road, meaning a journey time under 30 minutes to Oxford Circus. The City is also about half an hour by picking up the Central Line at Leyton.Plenty of buses (including a night route) stop nearby and from the end of Vicarage Road it's just 18 minutes to Stratford for theatre, cinema, Westfield shopping and East Village foodie goodness.Vicarage Road, Leyton E10;2017-04-05 16:12:59;https://lid.zoocdn.com/354/255/833966f055130ac303b578f87584a57f34fb9b39.jpg;2017-04-07 10:21:26;51.5686;51.5686;sale;-0.015445;false;1;1;0;1;E10;London;300000;;Flat;for_sale;Vicarage Road43456781;Camerons Stiff & Co;020 3478 3249;Residential;Situated on the coveted Brondesbury Park we are delighted to offer a beautifully presented extremely spacious three bedroom flat set across the whole ground floor of this imposing double fronted period house with sole use of a sunny south facing garden and driveway.Spread just over 1300 ss ft with some lovely period features including wood polished floorboards, original fireplaces, high corniced ceilings with ornate mouldings and magnificent tessellated flooring. Excellent room sizes throughout, large open plan kitchen and dining area opening out to a large garden. There is off street parking for at least two cars and the flat has sole use of both the front & back garden. Rarely do flats of this size & condition come on the market in this location. Viewing is highly recommended.Ground FloorReception Room (17'0x14'9 (5.18m x 4.50m))Kitchen/Breakfast Room (26'0x17'2 (7.92m x 5.23m))Bedroom 1 (18'1x13'4 (5.51m x 4.06m))Bedroom 2 (13'5x12'3 (4.09m x 3.73m))Bedroom 3 (13'9x9'10 (4.19m x 3.00m))Garden (Approximate) (94'4x39'4 (28.75m x 11.99m))You may download, store and use the material for your own personal use and research. You may not republish, retransmit, redistribute or otherwise make the material available to any party or make the same available on any website, online service or bulletin board of your own or of any other party or make the same available in hard copy or in any other media without the website owner's express prior written consent. The website owner's copyright must remain on all reproductions of material taken from this website.Brondesbury Park, Brondesbury Park NW2;2017-04-05 16:09:01;https://li.zoocdn.com/c8b9cadd766929045b63a8e16886c3ee037075a2_354_255.jpg;2017-04-06 09:10:05;51.545677;51.545677;sale;-0.225898;false;2;3;0;1;NW2;London;1200000;;Flat;for_sale;Brondesbury Park43456739;Town & City Homes;01322 352197;Residential;Cash buyers only!TenureLeasehold. The property is held on a 99 year lease from 1 January 2014 (thus approximately 96 years unexpired).LocationThe property is situated in the East London area of Forest Gate close to local shops and amenities. The open spaces of Forest Lane Park are within easy reach. Transport links are provided by Forest Gate rail station.DescriptionThe property comprises a lower ground floor two bedroom flat situated within a converted building arranged over lower ground, ground and first floors.AccommodationLower Ground FloorReception RoomTwo BedroomsKitchenBathroom with WC & wash basinCash buyers only!TenureLeasehold. The property is held on a 99 year lease from 1 January 2014 (thus approximately 96 years unexpired).LocationThe property is situated in the East London area of Forest Gate close to local shops and amenities. The open spaces of Forest Lane Park are within easy reach. Transport links are provided by Forest Gate rail station.DescriptionThe property comprises a lower ground floor two bedroom flat situated within a converted building arranged over lower ground, ground and first floors.AccommodationLower Ground FloorReception RoomTwo BedroomsKitchenBathroom with WC & wash basinCemetery Road, London E7;2017-04-05 16:07:55;https://li.zoocdn.com/6160c7beeea86a8728e21020a6adb23454646992_354_255.jpg;2017-04-06 15:00:45;51.551914;51.551914;sale;0.016342;false;1;2;0;1;E7;London;190000;;Flat;for_sale;Cemetery Road43439491;White Knight Estates;020 8033 8930;Residential;White Knight Estates are delighted to present this brand new duplex one bedroom apartment set within this fantastic, sought after and convenient location.This fantastic one bedroom duplex apartment arranged over the ground and first floor benefits from spacious rooms throughout, open-plan kitchen with a spacious lounge /dining room and a private terrace. The property is very close to the town centre, with all its excellent transport, schools, shopping and leisure facilities, which are within easy reach, as is Wimbledon station (District Line) & South Wimbledon, (Northern Line) station.Available with a long lease and a share of freehold this property is expected to receive plenty of interest from not only 1st time buyers looking for a new apartment, but also to investors looking to take advantage of the fantastic rental market we are currently in.Kingston Road, London SW19;2017-04-05 16:07:54;https://li.zoocdn.com/1fb6f8740ce51748074a9967c55ed3a328dc1eb5_354_255.jpg;2017-04-05 16:07:54;51.414787;51.414787;sale;-0.201503;true;1;1;2;1;SW19;London;399950;;Flat;for_sale;Kingston Road