listing_id;agent_name;agent_phone;category;description;displayable_address;first_publish_date;image_url;last_publish_date;latitude;listing_status;longitude;new_home;num_bathrooms;num_beedrooms;num_floors;num_recepts;outcode;post_town;price;price_change;property_type;status;street_name43344161;R Whitley & Co;01895 262388;Residential;A handsome 1930's built detached house with ground floor annex and located in a most sought after road - EPC D.DescriptionSituated in sought after West Drayton Park Avenue. A striking 1930s built detached residence with five bedrooms (including ground floor annex) which has been extended to the side and rear to create superb accommodation for the larger or growing family. The beautifully flowing home offers formal and informal living spaces and an annex with en-suite shower room offering the perfect retreat for an elderly relative.The hub of the house is the impressive and spacious kitchen/breakfast room fitted with a comprehensive range of white gloss wall and floor cupboard units with granite worksurfaces and a sociable breakfast bar. The balance of the ground floor accommodation includes a welcoming entrance hall with solid oak flooring, front aspect dining room/study with bay window and double doors to a fabulous living room with attractive open fire and French doors opening out onto the rear garden, modern cloakroom/WC with sparkle fleck tiled floor and an annex with en-suite shower room. Stairs from the entrance hall lead to the first floor landing which provides access to the master bedroom with imposing bay window flooding the room with natural light, two further double bedrooms, a fourth single bedroom currently used as a reading/chess room and a luxury well appointed family bathroom.OutsideFront: Low level brick wall to boundaries with wide opening providing vehicular access via dropped kerb to extensive block paved surface providing parking for 3 to 4 cars.Rear: Extensive paved terrace with slate chippings beyond and leading to gently curving lawn with stocked borders including Rhododendron, Hydrangea, Acer, Camellia, Hibiscus, Clematis, Climbing roses and Quince plus a selection of specimen trees including a Bay Tree and Olive Tree. Flowering Cherry Trees, a Crab apple tree and a Plum Tree provide a focal point at the rear of the garden. Rockery and timber garden shed.LocationThe town centre is within walking distance with shopping and mainline railway station (Crossrail from 2019). The Green, Closes Park, bus routes and schools are within easy walking distance. London Heathrow Airport, the motorway network, Stockley Business Park and Uxbridge town centre are within easy motoring distance.WindowsDouble glazed sealed unit windows.Heating & Hot WaterA gas fired boiler serves the radiator system and provides the domestic hot water. Electric immersion heater in hot water cylinder (in loft space).Council Tax BandWe understand that the current council tax band is F.ServicesMains, gas, electricity, water and drainage.ViewingsStrictly by appointment with R Whitley & Co.West Drayton Park Avenue, West Drayton, Middlesex UB7;2017-03-24 15:34:03;https://lid.zoocdn.com/354/255/633ce99cdfe468c5a63113640842f0f7e49992b1.jpg;2017-04-07 16:36:06;51.50186;51.50186;sale;-0.470174;false;2;5;0;2;UB7;West Drayton;775000;;Detached house;for_sale;West Drayton Park Avenue41355109;Fairview Homes - Edition;020 8022 1271;Residential;Selling fast!The Clearface is a 1 bedroom apartment with separate well-appointed kitchen, including Black Granite worktops, built in electric oven and induction hob, fully-integrated fridge freezer and White high-gloss units.This apartment also benefits from a balcony and a spacious living/dining room for relaxing and entertaining.Colindale Tube station is directly opposite Edition, there are buses into Town and around the area, while Brent Cross Shopping Centre is a short drive away.London Help To Buy is available with a 5% deposit.General specificationIdeal Easy Twist fitted carpet in magnolia to hallway and all main roomsBeech veneer internal doorsCarlisle Brass door ironmongery in chrome finishWalls painted in Almond White and ceilings in whiteYour kitchenKitchen units by Manhattan in High Gloss White, with Graphite plinth and soft close doors and drawers, Black granite worktops with cut and polished grooves for sink drainerStainless steel undermount 1?? bowl sink with single lever, monoblock mixer tapStainless steel Zanussi electric oven, with black induction hob and integrated canopy hoodFully integrated Zanussi 80/20 fridge/freezer*Fully integrated Zanussi washer dryerCeramic floor tiles in black satin finishWalls painted in Dove White and ceilings in whiteUnder counter LED lightingBrushed aluminium downlights to ceilings and under counter LED lightingSatin chrome finish appliance switches and socketsElectrical featuresCombined television/telephone and satellite outlet to living roomProvision for satellite systemProvision for internet broadbandYour bathroom and en-suiteWhite sanitaryware by Ideal Standard with chrome finish fittings and water saving baths and showersApartments with an en-suite feature clear glass shower enclosures with low-level shower tray, plus a chrome mixer/shower tap to bath in the main bathroomApartments without an en-suite feature a bath mixer tap and a separate thermostatic shower fitted over the bath, with a clear glass shower screenAffinity Jasmine brushed wall tiling to full height on all walls in main bathroom, 3 walls in en-suite, remaining wall painted Dove WhiteCeramic floor tiles in black satin finishPlain mosaic wall tiling in Warm White to full height in showers and splashbacks to handbasinsChrome downlights to ceilingsChrome heated towel railFor your securityAudio-video entry systemSecurity locks to all ground floor external doors and windowsFront door spy hole (with secure lock system)Smoke detector10-year NHBC buildmark warranty**The parts of the property benefiting from NHBC cover will be provided by our solicitors to your solicitors. Photography of typical Fairview show home interiors. Specification details are for guidance only. For a more detailed specification of your chosen property type, please ask the Sales Advisor. This is a guide and may be subject to change.Colindale Avenue, Colindale NW9;2017-03-24 15:33:01;https://li.zoocdn.com/8a754a5e7e3fadc6199b78656cb7d4527e6c2ac8_354_255.jpg;2017-03-24 15:34:04;51.599045;51.599045;sale;-0.24797662;true;1;1;0;0;NW9;;352000;;Flat;for_sale;Colindale Avenue43344140;Capital Bromley;020 3641 1731;Residential;Capital Estates are pleased to offer to the market this two bedroom 2nd floor purpose built property located just off one of Shortlands sought after roads and within walking distance to either Shortlands or Bromley North stations which offer fantastic links to central London, that include Blackfriars, Victoria and London Bridge. The property itself is in good condition, with large rooms and good storage space, the block is nicely set back on a private development giving the feeling or privacy and security. Whether you are a first time buyer or investor, this property ticks a fair number of boxes and is priced competitively to sell. The tenure is leasehold and there are 91 years remaining on the lease.Living / Dinning Room - 16.1 x 11.0Kitchen - 11.0 x 5.6Bedroom 1 - 12.9 x 9.6Bedroom 2 - 12.6 x 7.6Grasmere Road, Bromley BR1;2017-03-24 15:33:01;https://lid.zoocdn.com/354/255/2f9d6a1459ac38e8cf0688e5c925cedb04df3191.jpg;2017-03-25 02:43:11;51.41134;51.41134;sale;0.004931;false;1;2;0;1;BR1;Bromley;290000;;Flat;for_sale;Grasmere Road43344142;RE/MAX Grand;020 8033 9521;Residential;Ref: NT25192 bedroom Elite luxury flat in top floor of Constantine apartment, Beaufort Park, NW9 for saleNew Build Sales presents this well-presented 2 bedroom apartment set on the 7th floor to the vibrant Beaufort Park development in Colindale. Located within a short walk from Colindale Station, this elegantly designed elite apartment comprises a spacious open-plan living/dining area, custom designed fitted kitchen with integrated appliances and touch control ceramic hob, two double bedrooms each with its own en-suite, and two private balconies offering wonderful views over the beautifully landscaped gardens.Residents in this luxurious development will also benefit from a range of exclusive facilities and convenient amenities right on their doorstep including Beaufort Park's very own stylish health and fitness suite "The Spa", which offers an impressive range of treatments and facilities from the fully-equipped state-of-the-art gymnasium, indoor swimming pool, Jacuzzi and sauna.Amongst the many features of the Beaufort Park development, residents can socialise and relax in the Business Centre and Community Rooms where meetings, exhibitions and functions can be held. If you enjoy the outdoor lifestyle, the beautiful landscaped gardens are also a great place to relax and enjoy fun events.In just 9 minutes walk to Colindale London Underground Station, residents have quick and easy access to the Northern Line with superb transport links offering journey times of:- Hendon Central in 3 mins for the national rail network- Brent Cross in 5 mins for Brent Cross Shopping Centre- Hampstead in 12 mins- Camden Town in 19 mins- Euston in 22 mins- King's Cross St. Pancras in 24 mins- Leicester Square in 27 minsWithin Beaufort Park, there are a choice of gastro pubs, restaurants and a coffee house to offer residents the ultimate convenience. There is also a Tesco store just moments away with opening hours to accommodate the busiest schedules.- 2 bedroom luxury flat with Elite material and design- 7th floor and has lift- 998 years lease including 1 car park space- 2 en-suite bedroom with balcony- Tenanted till 29th July 2017- Service Charge - Approx. ??2000 per year- Ground Rent - ??260 per yearBoulevard Drive, London NW9;2017-03-24 15:33:01;https://li.zoocdn.com/96405e3137881db7d5a3b8145f91c87bded5dc90_354_255.jpg;2017-03-30 13:17:38;51.595642;51.595642;sale;-0.241075;false;2;2;0;0;NW9;London;595000;;Flat;for_sale;Boulevard Drive43344149;Jacksons Estate Agents - Tooting;020 8166 5311;Residential;A really exceptional and beautiful Edwardian house in a premier Tooting Bec location.The house has a particularly impressive and well proportioned living space that has a great flow. There is a 27 foot (8.20 sq. Mt) double reception room which goes through to a massive full width and finely finished kitchen/dining family room which in turn leads to an extremely attractive landscaped garden. On the ground floor there is also a separate WC/utility room. The entrance hall is spacious and wide. On the middle floor are two bedrooms and two bathrooms (one en suite) with two bedrooms and a further en suite bathroom on the top floor. This is a very stylish and substantial property and beautifully presented through out.Moring Road is a popular tree-lined residential road in Tooting Bec giving ease of access in and out of Central London, as well as providing easy access to both Tooting underground (Northern Line) and Tooting overground stations. The location also benefits from fantastic bus links and easy access to the shopping, dining and entertainment facilities of Tooting. Balham???s underground and overground station and its amenities on the high road are also within a short distance. Both areas have an array of both state and private schools to offer. The properties location further benefits frombeing within a short walk of Tooting Bec Common and Wandsworth Common.Moring Road, London SW17;2017-03-24 15:33:01;https://li.zoocdn.com/f6e431c96c5717b2caf2e5790915690a5068151d_354_255.jpg;2017-04-05 12:04:57;51.428783;51.428783;sale;-0.155395;false;3;4;0;0;SW17;London;1200000;;Terraced house;for_sale;Moring Road43344134;Barnard Marcus - Auctions;020 3641 4905;Residential;Summaryauction sale 10 April 2017 - For more information and legal documents visit our website descriptionLeasehold top floor purpose built self contained flatFull Vacant PossessionLocation:The property is situated on the corner of Eaton Rise and Montpelier Road. Public transport links include an 8 minute connection to Paddington from Ealing Broadway Rail Station together with Central Line and District Line Underground Stations. Further transport is provided by a network of local bus services withroad links including the A40 to the north, the North Circular Road to the east and the M4/A4 to the south. An extensive range of shops, bars and restaurants can be found locally within Ealing Broadway Shopping Centre and along the Broadway with recreational pursuits being found locally in Montpelier Park.Accommodation:One bedroom, reception room, kitchen, bathroom/WC, balconyEPC rating: TbcLease:Held on a lease for a term of 99 years less five days from 1st April 1974 at a ground rent of ??10 per annum.Note:Whilst the property will be sold with the lease as stated above, the vendor???s are currently in negotiations for an extension of the lease. For further information, please refer to the legal documentation.To View:29/3,31/3,1/4,4/4,6/4 at 9:15 amImportant Notice:For each Lot, a contract documentation fee of ??850 (inclusive of VAT) is payable to Barnard Marcus Auctions by the buyer. The seller may charge additional fees payable upon completion. If applicable, such fees are detailed within the Special Conditions of Sale. Buyers are deemed to bid in full knowledge of this.The Guide Price quoted must not be relied upon by prospective purchasers as a valuation or assessment of value of the property. It is intended to provide purchasers with an indication of the region at which the reserve may be set at the time of going to press. The guide price may be subject to variation and interested parties are advised to make regular checks for variations and should be aware that the reserve price may be either below or above the quoted guide price.Prospective purchasers should also be aware that the eventual sale price may be above or below the guide level dependent upon competition, and should therefore not presume the guide to be indicative of the final expected sale price or the price the property is available at.When setting the guide price, the auctioneers have given consideration to the seller???s instructions in respect of their indicated reserve price at the time of instruction. The reserve price, (the level below which the property will not be sold), remains confidential between the seller and the auctioneer. The guide price therefore, is intended to indicate the region at which the reserve price is intended to be set. The seller will confirm their final reserve price close to the auction date and if appropriate the auctioneers may adjust the guide price to reflect this.1. Money laundering regulations: Intending purchasers will be asked to produce identification documentation at a later stage and we would ask for your co-operation in order that there will be no delay in agreeing the sale. 2. General: While we endeavour to make our sales particulars fair, accurate and reliable, they are only a general guide to the property and, accordingly, if there is any point which is of particular importance to you, please contact the office and we will be pleased to check the position for you, especially if you are contemplating travelling some distance to view the property. 3. Measurements: These approximate room sizes are only intended as general guidance. You must verify the dimensions carefully before ordering carpets or any built-in furniture. 4. Services: Please note we have not tested the services or any of the equipment or appliances in this property, accordingly we strongly advise prospective buyers to commission their own survey or service reports before finalising their offer to purchase. 5. These particulars are issued in good faith but do not constitute representations of fact or form part of any offer or contract. The matters referred to in these particulars should be independently verified by prospective buyers or tenants. Neither sequence (UK) limited nor any of its employees or agents has any authority to make or give any representation or warranty whatever in relation to this property.Eaton Rise, London W5;2017-03-24 15:32:00;https://li.zoocdn.com/8196b60e880cc8efb6bab5d187b4d2b42c61f456_354_255.jpg;2017-03-27 09:33:39;51.52193;51.52193;sale;-0.306346;false;0;1;0;0;W5;London;260000;;Flat;for_sale;Eaton Rise43344126;Barnard Marcus;020 8166 7270;Residential;SummaryThis stunning apartment is offered to the market in immaculate order throughout with two double bedrooms, both with en-suites, integrated "Sonos" surround sound speakers with smart phone connectivitydescriptionThis stunning apartment is offered to the market in immaculate order throughout with two double bedrooms, both with en-suites, integrated "Sonos" surround sound speakers with smart phone connectivity. The main lounge area is open planned, flooded with natural light with the fully loaded kitchen diner and breakfast bar which then leads out to the private balcony accessed via sliding patio doors. Additional benefits include landscaped communal gardens, resident parking, gym, sauna and swimming pool facilities. The property must be seen internally. Call us now.Kitchen/ Reception Room 24' 8" x 13' 1" ( 7.52m x 3.99m )Bedroom 1 19' x 13' 10" ( 5.79m x 4.22m )Bedroom 2 15' x 12' 7" ( 4.57m x 3.84m )We currently hold lease details as displayed above, should you require further information please contact the branch. Please note additional fees could be incurred for items such as leasehold packs.1. Money laundering regulations: Intending purchasers will be asked to produce identification documentation at a later stage and we would ask for your co-operation in order that there will be no delay in agreeing the sale. 2. General: While we endeavour to make our sales particulars fair, accurate and reliable, they are only a general guide to the property and, accordingly, if there is any point which is of particular importance to you, please contact the office and we will be pleased to check the position for you, especially if you are contemplating travelling some distance to view the property. 3. Measurements: These approximate room sizes are only intended as general guidance. You must verify the dimensions carefully before ordering carpets or any built-in furniture. 4. Services: Please note we have not tested the services or any of the equipment or appliances in this property, accordingly we strongly advise prospective buyers to commission their own survey or service reports before finalising their offer to purchase. 5. These particulars are issued in good faith but do not constitute representations of fact or form part of any offer or contract. The matters referred to in these particulars should be independently verified by prospective buyers or tenants. Neither sequence (UK) limited nor any of its employees or agents has any authority to make or give any representation or warranty whatever in relation to this property.Aerodrome Road, Edgware NW9;2017-03-24 15:31:27;https://li.zoocdn.com/af8c83856c228caaba02ed1b27a256fa4611b534_354_255.jpg;2017-04-01 13:45:06;51.59511;51.59511;sale;-0.241095;false;0;2;0;0;NW9;Edgware;499950;;Flat;for_sale;Aviation Drive37882280;Ballymore - London City Island;020 8128 1092;Residential;Bridgewater House, London City IslandBA1804This eighteenth floor one bedroom unit is light and spacious throughout and benefits from a private East balcony.Boasting high specification fixtures and fittings this suite comprises a beautiful fully integrated kitchen, bedroom with built in wardrobe and ensuite.London City Island is an exclusive island comprising contemporary residential apartments, extensive services and facilities and beautifully landscaped waterways and parkland. The range of apartments available varies from one bedroom suites to expansive penthouses.City Island Bridge is located just minutes from Canning Town Station, providing fast access to Canary Wharf, The City, The West End and beyond.A new Bridge provides immediate access to Jubilee Line and DLR4 minutes to Canary Wharf (access to Cross Rail)6 minutes to London City Airport11 minutes to London Bridge18 minutes to Green Park20 minutes to Bond StreetOrchard Place, London E14;2017-03-24 15:30:56;https://lid.zoocdn.com/354/255/a8620b96cba09dd0ecd9896a64c4abdb1f5f501b.jpg;2017-04-07 11:50:39;51.509476;51.509476;sale;0.005619;true;1;1;18;1;E14;London;535000;;Flat;for_sale;Orchard Place43344097;RE/MAX Grand;020 8033 9521;Residential;Ref:GGE25803 bedroom???137 sq M / 1,475 sq ftGround floorReception & dining - 5.7m x 5.3m / 18.7ft x 17.4ftKitchen - 3.6m x 2.5m / 11.8ft x 8.2ftBedroom - 3 3.0m x 6.2m / 9.8ft x 20.3ftFamily bathroom 1.5m x 2.1m / 4.9ft x 6.9ftMezzanineBedroom 1 - 5.4m x 4.6m / 17.7ft x 15.1ftEn suite to bedroom 1 - 3.1m x 2.0m / 10.2ft x 6.6ftBedroom 2 - 3.3m x 3.9m / 10.8ft x 12.8ftEn-suite to bedroom 2 - 1.8m x 2.6m / 5.9ft x 8.5ftBedroomsBespoke luxury hinged or sliding Neatsmith of London wardrobes to master bedroomBathroomMetro tiles with contrasting groutBespoke cabinets by Neatsmith of London (master en-suites)Sanitary ware by Duravit Brassware by Vado Electric heated towel railKitchenGerman-engineered kitchen with soft closing doors and drawers on all units by NobiliaGranite stone worktopsUnder mounted stainless steel sinks by BlancoChrome taps by BlancoBosch built-in fan-assisted multifunction ovenBosch ceramic hob Bosch fridge freezerBosch recirculation telescopic extractor with integrated lightingBosch washer dryer (located in utility rooms or store cupboard)ElectronicsEnergy efficient LEDdown-lights throughout White screwless socketsDimmer switches to all bedroom and kitchen/living areasSky+ multiroom compatibleWired for Sonos audio system throughoutHeating and hot waterZoned, water-based underfloor heating systemGas fired ???Baxi??? efficient boilersFlooringEngineered wood flooring throughoutHigh quality carpet to bedroomsCommunal areasResident???s gymnasium (located in basement)Communal roof terrace Bespoke lift by Kone External cycle storage External bin storagePeace of mind10-year new home warranty provided by blpHardwired smoke & carbon monoxide alarm detectorsbpt ???Perla??? hands- free colour video entry systemGrand windows, mezzanine floors and double heighted ceilings add traditional elegance to expansive open-plan contemporary living spaces, underpinned by steel frames and solid concrete floors. Integrated high-specification appliances ensure every lifestyle convenience is catered for.A long term regeneration plan for South Kilburn will see 2,400 new homes built, allowing for a further influx of young families, as well as working professionals into the area. The regeneration will also enhance the employment sector within NW6 by creating a number of job opportunities.Over the next 5-10 years, South Kilburn will benefit from the use of new schools, retail units, restaurants and caf??s, which will contribute to what is an already incredibly vibrant and prosperous community atmosphere. The regeneration will fashion a new residential quarter of mansion terraces and apartment blocks, offering private landscaped communal gardens. A new civic square and pedestrian boulevard on Kilburn Park Road will help strengthen the neighborhood???s connections to the wider community.Residents will also profit from further open green spaces within the location. In addition to the popular Paddington Recreation Ground, Woodhouse Urban Park will provide a welcoming environment for the existing community and general public.Canterbury Road, Kilburn NW6;2017-03-24 15:29:54;https://lid.zoocdn.com/354/255/f57d751f73ac403e1c2c5e1649ba9a3a2eb7135d.jpg;2017-04-05 10:45:14;51.5348;51.5348;sale;-0.198103;true;3;3;0;0;NW6;London;1100000;;Flat;for_sale;Canterbury Road