listing_id;agent_name;agent_phone;category;description;displayable_address;first_publish_date;image_url;last_publish_date;latitude;listing_status;longitude;new_home;num_bathrooms;num_beedrooms;num_floors;num_recepts;outcode;post_town;price;price_change;property_type;status;street_name43452037;Maxwell Properties;020 8115 9722;Residential;Two Double BedroomsTwo BathroomsLarge LoungeSeparate KitchenParking Space IncludedLow Service ChargeFinchley, NW2A spacious two bedroom, two bathroom flat for sale in Finchley, NW2.This dual aspect property is situated on the 1st floor and comprises of a spacious lounge with a Juliet balcony, separate fitted kitchen, master bedroom with an en-suite bathroom, large second bedroom and a shower room of the hallway. It has a neutral d??cor through out, laminate flooring to the lounge and hallway, carpet to the bedrooms and tiled floor in the kitchen and bathrooms.Well located just of Finchley Road, surrounded by the green spaces and in between Golders Greed Underground and Cricklewood Overground, both within 10 minutes reach. Close by you will find lots of amenities required for the daily life and a choice of restaurants, cafes and bars. Plenty of Bus route to choose form which will take you into City of London under 20 minutes.Area: Sq m / sq ftBrought: BarnetCouncil Tax Band: D (??1,397 per annum)Lease: 999 years from 2004Approximate Service Charge: ??1,800 per annumApproximate Ground Rent: ??300 per annum1 Llanvanor Road, Childs Hill, Finchley, London NW2;2017-04-05 12:33:14;https://lid.zoocdn.com/354/255/476d8ad9861b95e0181e76480ece991f33fd56a4.jpg;2017-04-05 12:33:14;51.565136;51.565136;sale;-0.19826;false;2;2;0;1;NW2;London;675000;;Flat;for_sale;1 Llanvanor Road, Childs Hill,43452068;Anscombe & Ringland;020 3478 3186;Residential;Property DescriptionAmazing ground floor garden flat carved out of this Character Edwardian Property with south facing rear garden, situated off Regents Park Road.Property DetailsThis fabulous modernised flat with the luxuries of contemporary living, benefits from a basement cinema room and we recommended it be viewed to avoid disappointment.Mountfield Road, Finchley N3;2017-04-05 12:32:35;https://lid.zoocdn.com/354/255/116f9786dba939a2072d4178ec0cd7717745d13f.jpg;2017-04-07 09:33:15;51.594326;51.594326;sale;-0.197668;false;0;2;0;0;N3;London;650000;;Flat;for_sale;Mountfield Road43452052;Christopher Rawlinson & Co;020 3551 9623;Residential;An Extended Semi Detached House situated in quiet cul de sac, convenient for both South Kenton and Preston Road's transport & shopping facilities. Double Glazing, Central Heating, Three Reception Rooms, Conservatory, Kitchen, Downstairs WC, Four Bedrooms, Two Bathrooms, Garden, Off Street Parking for several cars.Chain Free Sale.Ambleside Gardens, Wembley HA9;2017-04-05 12:30:10;https://lid.zoocdn.com/354/255/573016a380f89ae06cd55372cc519890dee20b18.jpg;2017-04-06 13:12:32;51.573517;51.573517;sale;-0.304934;false;2;4;0;3;HA9;Wembley;640000;;Semi-detached house;for_sale;Ambleside Gardens43452028;Truepenny's;020 3478 3483;Residential;You enter through the front immediately into the living room that overlooks the front of the property through a large box bay window. Coupled with high ceilings, there is a light and airy welcome to the room. The master bedroom is situated just behind the living room with French doors that lead out onto the side return, which is a sun trap and makes for a great patio space.The main bathroom is next to the bedroom complete with a three piece suite.The second bedroom is at the back of the property next to the kitchen. The kitchen is fully fitted with another door leading out onto the private rear garden.The local neighbourhood delivers many excellent options for primary and secondary schools, with Goodrich Primary at the end of the roadHillcourt Road is situated in a leafy part of East Dulwich with an eclectic array of independent caf??s, grocers, bars, fishmongers, butchers, stores and restaurants all nearby. Close to Peckham Rye Common and Dulwich Park. Peckham Rye is a trip down Forest Hill Road and has a thriving cultural community and a wide range of fashionable places to eat, drink and shop.Transport is convenient: Peckham Rye is a short bus ride on the 63 at end of the road (London Overground network via Canada Water, Whitechapel, Highbury & Islington with service also leading to Clapham High Street and Clapham Junction and the national rail to Victoria and London Bridge). East Dulwich is also a short bus ride (connection to London Bridge via South Bermondsey). The service is frequent and quick to central and wider London.Bus links are also plentiful nearby ??? the 63,363,12,40,185,176, P13 - all offer rapid and comfortable travel in and around London.Information and servicesTenure: Share of FreeholdGround Rent: ?? N/AService Charge: ?? N/ACouncil Tax Band: C (approx ??1,072.33 per annum)local authorities: London Borough of Southwark Services: Mains water and gas, electricity.Fixtures & Fittings: Curtains, fixtures and fittings not mentioned in these particulars are not included. Various items may be available by separate negotiation.Viewing: By appointment via Truepenny???s.Hillcourt Road, East Dulwich SE22;2017-04-05 12:26:39;https://li.zoocdn.com/3d790c29fc6c40422c367c61031713825aecf1a3_354_255.jpg;2017-04-05 12:28:45;51.44999;51.44999;sale;-0.065194;false;1;2;0;0;SE22;London;475000;;Flat;for_sale;Hillcourt Road43451972;Matthew James;020 8022 4449;Residential;An excellent, two double bedroom split level apartment built over the first and second floor. Looking out onto Uxbridge Road, within the heart of Surbiton only minutes walk from the mainline station, high street and the river Thames. The numerous benefits include own private entrance, a large lounge dining room, a contemporary white high gloss fitted kitchen with integral appliances. On the first floor a large double master bedroom and a second double bedroom, white bathroom suite with a shower over the bath and a separate wc. Gas central heating and double glazing. There are well maintained communal gardens and some parking spaces (first come first serve). Sold with a Share of the Freehold.Maple Road, Surbiton KT6;2017-04-05 12:21:22;https://lid.zoocdn.com/354/255/33fed7fb094f3eaf5ead20da4e752708a7fcfa5b.jpg;2017-04-07 15:07:42;51.398064;51.398064;sale;-0.304671;false;1;2;0;1;KT6;Surbiton;465000;;Flat;for_sale;Maple Road43451962;Madley Property Services Ltd;020 3463 6951;Residential;Madley Property present a fantastic opportunity to secure a luxurious home in the heart of the city. Located just a stone???s throw from Moorgate tube station, The Barbican and Liverpool Station along with being walking distance from the trendiest places in London.Roman House exemplifies the high quality standard associated with modern living in London, as the development has a 24 hr Harrod's concierge service as well as a residents only gym.The apartment itself benefits from a engineered wood flooring that has underfloor heating, an open plan reception with a fully integrated kitchen and a surround sound music system built into every room. The bedroom benefits from excellent storage space and includes a juliette balcony. The bathroom is luxurious in specification and includes high quality fixture and fittings.The location of this development means that everything the capital has to offer is at your beckoned call, whether it be walking distance, or via one of the numerous transport links that surround the development. To avoid disappointment, call today to book your viewing.Wood Street, London EC2Y;2017-04-05 12:20:04;https://lid.zoocdn.com/354/255/e1207c056c7d477b87b5486acaf711d7ce65c5b6.jpg;2017-04-05 12:21:30;51.518356;51.518356;sale;-0.09297;false;1;1;0;1;EC2Y;London;825000;;Flat;for_sale;Wood Street43451956;Parkfields Estates Ltd;020 3641 4403;Residential;Parkfields Estates are delighted to offer for sale this Spacious first floor apartment located in a quiet residential street off Lady Margaret Road. The property has recently been decorated and presented to a good standard. Features include  Two Large Bedrooms, Reception Room, Kitchen, Bathroom/WC and Shared Communal Gardens. There is also one allocated Parking Space with further guest parking on site. The property is currently being sold with the benefit of a long lease and tenants insitu with ??1,185.00 gross rental income.Ground Floor EntranceStairs to First FloorFirst FloorHall WayElectric Radiator. Store Housing Hot Water Cylinder.Lounge (16'6 to 5'6 x 15'7 (5.03m to 1.68m x 4.75m))Electric Radiator. Double Doors to Kitchen.Kitchen (8'3 x 10'78 (2.51m x 5.03m))Plumbed for washing machine. Partly Tiled Walls. Ceramic Tiled Floor. Sink unit with mixer taps. Fitted Kitchen with Built in Oven, Extractor and Hob.Bedroom One (12'4 x 9'8 (3.76m x 2.95m))Radiator.Bedroom Two (11'1 x 9'11 (3.38m x 3.02m))Radiator. Built in cupboards.Bathroom/WcCeramic tiled floor. Majority tiled walls. Dimplex Heater. Low level WC. Hand basin with pedestal. Panelled bath with mixer taps. Extractor fan.OutsideCommunal GardensLease DetailsWe have been advised by our client that the following Lease information applies:Lease Length - Approximately 104 Years RemainGround Rent - ??100.00 Per AnnumService Charges - In the region of ??100.00 Per Month approximately.We advise that you have this information verified by your solicitor prior to purchase.You may download, store and use the material for your own personal use and research. You may not republish, retransmit, redistribute or otherwise make the material available to any party or make the same available on any website, online service or bulletin board of your own or of any other party or make the same available in hard copy or in any other media without the website owner's express prior written consent. The website owner's copyright must remain on all reproductions of material taken from this website.St. Crispins Court, Southall, Middlesex UB1;2017-04-05 12:18:58;https://li.zoocdn.com/5014a891ff0fe00ee915cd6d7f75e8912b43f213_354_255.jpg;2017-04-06 01:46:37;51.519653;51.519653;sale;-0.373656;false;1;2;0;1;UB1;Southall;285000;;Flat;for_sale;St. Crispins Court43451948;Chancellors;020 3478 3564;Residential;Property DescriptionA spacious two bedroom top floor contemporary apartment for sale in this highly sought after gated development adjacent to Richmond Park with far reaching views.Property DetailsA spacious two bedroom top floor contemporary apartment for sale in this highly sought after gated development adjacent to Richmond Park with far reaching views.The accommodation provides an approximate 32ft double reception room, fully fitted modern kitchen, two double bedrooms, two bathrooms, Two bathrooms (one en-suite), array of storage and a private balcony.Further benefits include a secure entrance with lift, two underground parking spaces and well maintained communal gardens.Eversham Court, Richmond TW10;2017-04-05 12:18:20;https://lid.zoocdn.com/354/255/a0b6886b7108e347550899ada46483cd6d473246.jpg;2017-04-06 01:46:36;51.45642;51.45642;sale;-0.292175;false;0;2;0;0;TW10;Richmond;695000;;Flat;for_sale;Eversham Court,43451925;Hamptons International - Islington Sales;020 3589 0856;Residential;A mid-terrace Neo-Georgian house set on a sought after road in the heart of Canonbury. The accommodation is offered over two floors giving generous accommodation throughout. The ground floor comprises a front to back double reception room, separate kitchen and dining room. The rear of the house has been extended and opens onto a wonderful garden. On the first floor are three bedrooms and a family bathroom. The garden to the rear of the property offers access to the garage.SituationSt. Mary's Grove is just off Canonbury Place and moments from all the numerous shops, bars and transport facilities at Highbury & Islington and Angel. There are excellent connections to the City, West End and Canary Wharf.St. Mary's Grove, London N1;2017-04-05 12:13:03;https://li.zoocdn.com/12b7d923a3db44e1e618486c040f45b50d882322_354_255.jpg;2017-04-06 17:59:00;51.545338;51.545338;sale;-0.098001;false;1;3;0;1;N1;London;1225000;;Terraced house;sale_under_offer;London43451873;Steptons;020 8128 9959;Residential;Detailed DescriptionOffering for sale this excellent three bedroom terraced house situated in the heart of Forest Gate and with a short to Forest Gate station and the ever popular Village. Forest Gate station is soon to benefit from the much anticipated Cross Rail link. The property is a short bus ride to Stratford which will give any buyer great shopping facilities and more options with transport links.Property comprises of three bedrooms, family bathroom and stairs leading to the loft space on the first floor, three reception rooms, kitchen with access to the rear garden and also a W/C on the ground floor.Ideal home for a family or a buy to let investment with buy to let investment with buyers taking full advantage of the rising demand and prices in the area.Agents NotesAll dimensions are approximate and are quoted for guidance only, their accuracy cannot be confirmed. Reference to appliances and/or services does not imply they are necessarily in working order or fit for the purpose. Buyers are advised to obtain verification from their solicitors as to the Freehold/Leasehold status of the property, the position regarding any fixtures and fittings and where the property has been extended/converted as to Planning Approval and Building regulations compliance. These particulars do not constitute or form part of an offer or contract nor may be regarded as representations. All interested parties must themselves verify their accuracy.Wyatt Road, Forest Gate E7;2017-04-05 12:08:08;https://lid.zoocdn.com/354/255/3e308f855d06a504bce1e1f991fa310c10e45b2d.jpg;2017-04-06 01:46:33;51.543262;51.543262;sale;0.023228;false;1;3;0;3;E7;London;550000;;Terraced house;for_sale;Wyatt Road43451828;Balgores;01708 629412;Residential;Situated in the frequently requested Mawneys Location and conveniently located for local bus routes into Romford Town Centre is this three bedroom semi-detached family home. Internally the property benefits from 19' lounge, 11' fitted kitchen, downstairs WC, 11' master bedroom, 11' second room, 7' third bedroom, and family bathroom. Externally the property benefits from a 33' rear garden, off-street parking and its own detached garage. The property is conveniently located for Collier Row High street, King Georges playing fields, and A12 Eater Avenue East.Entrance Porch    Obscure double glazed windows to all aspects, door to Entrance Hall    Double glazed entry door, radiator, door to accommodation, stairs to first floor accomodation with storage cupboard under, textured ceiling.Kitchen 12' x 9'1"Double glazed window to front, range of eye and base level units with worktops over, stainless steel sink with mixer tap, complimentary splashback tiles, integrated Hotpoint electric hob, integrated Indesit oven with extractor fan over, radiator, textured ceiling with inset spotlights, vinyl flooring.Downsatirs WC    Glazed window to side, low level WC, wall mounted sink, tiled flooring, smooth ceiling.Lounge/Diner 19' x 15'Double glazed windows, radiator, feature fireplace, door to rear garden, textured ceiling with cornice coving.First Floor Landing    Double glazed windows to side, doors to accommodation, textured ceiling with loft access.Bedroom One 12' x 9'1"Double glazed window to front, radiator, range of fitted wardrobes, textured ceiling.Bedroom Two 11'10" x 9'1"Double glazed window to rear, radiator, two storage cupboards, textured ceiling with cornice coving.Bedroom Three 7'1" x 6'1"Double glazed window to rear, radiator, textured ceiling with cornice coving.Bathroom    Obscure double glazed windows to front, Suite comprising: Low level WC, pedestal wash hand basin with mixer tap, p-shaped bath with mixer tap and shower attachment over, heated towel rail, part-tiled walls, textured ceiling with cornice coving.Front Of property    Off-street parking, shared driveway giving access to detached garage.Garden    Approx 33'Commencing patio, laid to lawn, side access, access to Detached Garage    Up and over door.Birch Close, Romford RM7;2017-04-05 12:05:41;https://lid.zoocdn.com/354/255/0940e14697175de23123f8a5fe11fc284c443e15.jpg;2017-04-07 12:15:18;51.58647;51.58647;sale;0.160583;false;0;3;0;0;RM7;Romford;375000;;Semi-detached house;for_sale;Romford43451789;Arron James;01895 647740;Residential;Cash buyers only! Over 45's Only! This brand new two double bedroom park home is new to the market. Available with no upper chain and situated on a fantastic plot in Mayfield Park. This property has large lounge/dining room, brand new kitchen with all new appliances, ensuite and walk in wardrobe to master bedroom, and modern family bathroom, off street parking and the fact that it has never been lived in is sure to be a hit. If your thinking of downsizing and retiring and freeing up some of your hard earnt cash then this could be just for you. Available to view today please call the office now.HallwayFront door to hallway, door to dining room, bedroom one and bedroom two, door to bathroom, double panelled radiatorDining Room (2.906 x 2.300 (9'7" x 7'7"))Double glazed window to front aspect, double panelled radiator, arch way to living room and door to kitchenLiving Room (5.753 x 3.427 (18'10" x 11'3"))Double glazed bay window to front aspect, two double glazed window to side aspect, electric fire placeKitchen (3.780 x 2.753 (12'5" x 9'0"))Double glazed window to side aspect, range of eye and base level units incorporating stainless steel sink bowl with mixer taps, four ring gas hob with built in electric oven, integrated dishwasher, integrated fridge freezer, integrated washing machineBedroom OneDouble glazed window to rear aspect, double panelled radiator, walk in wardrobe, door to en suiteEn SuiteDouble glazed window to side aspect, three piece suite comprising of walk in shower cubicle, low level WC, wash basin with vanity unit, extractor fan, double panelled radiatorBedroom Two (2.849 x 2.804 (9'4" x 9'2"))Double glazed bay window to front aspect, double panelled radiator, fitted wardrobeYou may download, store and use the material for your own personal use and research. You may not republish, retransmit, redistribute or otherwise make the material available to any party or make the same available on any website, online service or bulletin board of your own or of any other party or make the same available in hard copy or in any other media without the website owner's express prior written consent. The website owner's copyright must remain on all reproductions of material taken from this website.Mayfield Park, West Drayton, Middx UB7;2017-04-05 12:03:00;https://lid.zoocdn.com/354/255/f68f1a9ae2c789740cbf8e56c2ed30da59c3a08e.jpg;2017-04-06 01:46:29;51.50157;51.50157;sale;-0.485139;false;2;2;0;2;UB7;West Drayton;275000;;Mobile/park home;for_sale;Mayfield Park43451787;Churchill Estates - South Woodford;020 3478 3344;Residential;Guide Price ??530,000-??550,000.Churchill's are delighted to offer for sale this purpose built fully detached home offering four double bedrooms. Further benefits include a very spacious lounge, kitchen/diner. On the first floor there are four bedrooms and a family bathroom and shower room.. The property also comes with off-street parking for two cars and a large secluded rear garden. The home is a approximate 15 minute walk to Woodford central line station.You may download, store and use the material for your own personal use and research. You may not republish, retransmit, redistribute or otherwise make the material available to any party or make the same available on any website, online service or bulletin board of your own or of any other party or make the same available in hard copy or in any other media without the website owner's express prior written consent. The website owner's copyright must remain on all reproductions of material taken from this website.Canfield Road, Woodford Green IG8;2017-04-05 12:03:00;https://lid.zoocdn.com/354/255/700d608dc6e90291398ca392f082abd2c351b845.jpg;2017-04-06 01:46:29;51.602905;51.602905;sale;0.051944;false;1;4;0;2;IG8;Woodford Green;530000;;Detached house;for_sale;Canfield Road43451763;R Whitley & Co;01895 262388;Residential;A charming 1930's bay fronted three bedroom semi-detached house enjoying views of 'The Green' to the North East - EPC D.DescriptionOffered to market for the first time in over 25 years and situated within The Conservation Area. This charming 1930's bay fronted three bedroom semi-detached house has been greatly improved by the vendor in recent years and boasts an enviable location abutting 'The Green' enjoying wonderful open views. Offering potential to extend (subject to planning permission) and further improve, the well planned accommodation is arranged over two floors and comprises an inviting entrance hall with oak flooring which flows to the through reception room with living and dining area, kitchen fitted with a comprehensive range of wood effect wall and floor cupboard units with granite effect laminate worksurfaces and a utility lobby. Stairs from the entrance hall lead to the first floor landing which provides access to the master bedroom with bay window, second double bedroom, third single bedroom and the well appointed bathroom with white suite and separate WC.OutsideFront: A dropped kerb provides vehicular access to a block paved surface providing good parking for two motor cars.Rear: Crazy paved surface with lawn beyond. Low level picket fence with pathway leading to the rear of the garden with three storage sheds (one of which is dilapidated) and a kennel.LocationThe town centre of Yiewsley and West Drayton (with mainline railway station (Crossrail from 2019), bus routes and schools are all within walking distance. London Heathrow Airport, the motorway network, Stockley Business Park and the town centres of Uxbridge are all within easy motoring distance.Heating & Hot WaterA gas fired combination boiler serves the radiator system and provides the domestic hot water.WindowsWhite UPVC double glazed sealed unit windows.Council Tax BandWe understand that the current council tax band is D.ServicesMains gas, electricity, water and drainage.TenureFreehold.ViewingsStrictly by appointment with R Whitley & Co.Mill Road, West Drayton, Middlesex UB7;2017-04-05 12:00:17;https://lid.zoocdn.com/354/255/4207a0e38f9514f2406acec3925d953323922b0c.jpg;2017-04-07 16:58:05;51.501816;51.501816;sale;-0.478374;false;1;3;0;2;UB7;West Drayton;485000;;Semi-detached house;for_sale;Mill Road43451361;Stonebridge;020 8115 8718;Residential;Stonebridge have the opportunity to offer a fantastic one double bedroom victorian conversion, the property located close to the famous Green Street and easy reach to a vast array of shops and eateries. Property is bright and spacious throughout with large kitchen diner as well a good size garden.The property is ideal investment or a great first step on to the property ladder. Available chain free or as ready rental investment.LettingsStonebridge also offer a professional Lettings and Management Service. If you are considering renting your property, to purchase or are looking at buy to let investments or would like a free review of your current portfolio then please call the lettings manager.Agents NotesAll dimensions are approximate and are quoted for guidance only, their accuracy cannot be confirmed. Reference to appliances and/or services does not imply they are necessarily in working order or fit for the purpose. Buyers are advised to obtain verification from their solicitors as to the Freehold/Leasehold status of the property, the position regarding any fixtures and fittings and where the property has been extended/converted as to Planning Approval and Building regulations compliance. These do not constitute or form part of an offer or contract nor may be regarded as representations. All interested parties must themselves verify their accuracy.Credon Road, Plaistow, London E13;2017-04-05 11:57:48;https://lid.zoocdn.com/354/255/b7bbfa37dc4fa7704626d9e668dc542ba770ccdd.jpg;2017-04-06 01:46:10;51.531776;51.531776;sale;0.032826;false;1;1;0;1;E13;London;220000;;Flat;for_sale;Credon Road 