listing_id;agent_name;agent_phone;category;description;displayable_address;first_publish_date;image_url;last_publish_date;latitude;listing_status;longitude;new_home;num_bathrooms;num_beedrooms;num_floors;num_recepts;outcode;post_town;price;price_change;property_type;status;street_name43486369;Homewise Ltd;01344 933993;Residential;Purchasing this property with A lifetime leaseThis property is offered at a reduced price for the over 60s under Homewise's Home for Life Plan. This is a lifetime lease.The above price represents a mid-range discount from the property's full market value, and is based on a single male applicant aged 69 years. The actual price you will pay depends on your age, personal circumstances and property criteria. Discounts range from 8.5% to 59%.For more information or a personalised quote, just give us a call. Alternatively, if you are under 60 or would like to purchase this property without a lifetime lease at its full market price of ??315,000, please contact Romans.Property descriptionLocated within walking distance of West Drayton train station is this spacious two double bedroom ground floor maisonette. The property benefits from a large lounge/diner, separate kitchen and private rear garden. There is allocated parking to the front and the property is close to local amenities and offers easy access to M4/M25 motorways.The information provided about this property does not constitute or form part of an offer or contract, nor may be it be regarded as representations. All interested parties must verify accuracy and your solicitor must verify tenure/lease information, fixtures & fittings and, where the property has been extended/converted, planning/building regulation consents. All dimensions are approximate and quoted for guidance only as are floor plans which are not to scale and their accuracy cannot be confirmed. Reference to appliances and/or services does not imply that they are necessarily in working order or fit for the purpose. Suitable as a retirement home.Station Road, West Drayton UB7;2017-04-07 14:07:58;https://lid.zoocdn.com/354/255/e5617df953bfdcf4708571a6f529a75f5621dfad.jpg;2017-04-07 14:10:43;51.504986;51.504986;sale;-0.468254;false;0;2;0;0;UB7;West Drayton;207900;;Maisonette;for_sale;West Drayton43486376;Tepilo;020 8128 1730;Residential;Highlights of the property includes: Private entrance with porch area  direct access from the bright, spacious living room into the shared communal garden  large entrance hallway (handy for storing bike, pushchair, etc.)  large, well-equipped kitchen/diner  two bedrooms and a white, tiled, family bathroom. The property also has its own garage, which is great for additional storage.PorchTerracotta type floor tiles, cupboard with storage, electricity meter and fuse box. UPVC double-glazed frosted glass front door. Exterior light. Small step onto the porch, then one further step over the base of the door frame, after which the floor is level throughout.Entrance hallSpacious hallway which all rooms lead off of - very useful for keeping bike/pushchair, etc. Dark grey tiled floor, radiator, large storage cupboard, which also contains water tank/heater.Kitchen/dining roomDark grey tiled floor, range of fitted units at eye and base level with granite effect work surface over base level units incorporating aluminium sink and drainer. Large double-glazed window fitted with slatted blinds with views onto front garden and street. Radiator.BathroomDark grey tiled floor, white tiled walls throughout. 3 piece bathroom suite in white with power-shower over bath. Chrome towel heater/radiator, wall mounted glass/chrome cabinet, UPVC double-glazing with frosted glass and slatted blinds.Living roomGood-sized living room with views onto rear garden via large UPVC double-glazed window and direct access to rear lawn via UPVC double-glazed door via steps. Oak laminate flooring, radiator, spotlights, slatted blinds.Bedroom 1Double bedroom featuring oak laminate flooring, radiator, fitted storage shelves/draws/rails along one wall, UPVC double glazing with view onto side lawn and bushes. Slatted blinds.Bedroom 2Smaller bedroom (can fit a double sofa-bed, but probably best suits a singe bed). Oak laminate floor, built-in cupboard, radiator. UPVC double glazing with view onto rear/side lawn and bushes. Slatted blinds.ExteriorThe property is surrounded by lawn and bushes and looks onto the large trees of The Avenue.Garage???A single garage belonging to the flat (number 14) is located at the rear of neighbouring Repton Close. It's excellent for parking, overflow storage, or could even be rented out.ParkingThere is no dedicated car parking on-site at Deanson Court, however, there is nearly always on-street parking very close to the flat. If you return home after normal office hours you???ll usually be able to park in front or to the side of the block  if you are arriving during the weekday office hours you may need to park 50 metres further along The Avenue.Lease/service chargesThe building is managed via a property management company appointed by the flats??? leaseholders. The service charge of ??1,100 per annum includes all garden maintenance, buildings insurance and all day to day running. There is no ground rent. Note that a new roof and insulation was fitted to the block in 2016, so no further major works/contributions are foreseen. The leasehold was extended in 2010, so there are more than 146 years remaining on the lease.Flat 6, Deanson Court, Beckenham, London BR3;2017-04-07 14:07:58;https://lid.zoocdn.com/354/255/a7552058031fd0e2c5fbf7bd43bbe966fa0a3444.jpg;2017-04-07 14:10:42;51.41135;51.41135;sale;-0.023239;false;0;2;0;0;BR3;Beckenham;360000;;Flat;for_sale;Flat 6, Deanson Court43486377;Foxtons - Croydon;020 8022 3893;Residential;This fantastic three bedroom semi-detached house comprises a great living space with two reception rooms, lovely garden and a garage.The property is situated just off Purley Way which offers a superb selection of amenities while local transport links include many bus services and tram links.Alton Road, Waddon CR0;2017-04-07 14:07:58;https://lid.zoocdn.com/354/255/28026aafd334b741922c1840e5b845d7dcc39a87.jpg;2017-04-07 14:10:42;51.369236;51.369236;sale;-0.1166;false;0;3;0;0;CR0;Croydon;575000;;;for_sale;Alton Road43486365;Homewise Ltd;020 8115 9644;Residential;Purchasing this property with A lifetime leaseThis property is offered at a reduced price for the over 60s under Homewise's Home for Life Plan. This is a lifetime lease.The above price represents a mid-range discount from the property's full market value, and is based on a single male applicant aged 69 years. The actual price you will pay depends on your age, personal circumstances and property criteria. Discounts range from 8.5% to 59%.For more information or a personalised quote, just give us a call. Alternatively, if you are under 60 or would like to purchase this property without a lifetime lease at its full market price of ??375,000, please contact Leaders.Property DescriptionFind your new retreat in this hot to trot, two bed abode found on the second floor of this sassy contemporary apartment that has recently graced the skyline of Brookbank Road.Light and bright yet not breezy! All thanks to the double glazing and benefit of a high spec build will mean should be nicely insulated. Inside as you might expect you find tidy communal hallway, take the stairs to the second floor and here we find home. A nice a big lounge, with Juliet balcony for lots of nice light, the layout allows space for a dining area and a zone for your sofa a perfect spot for movie night and glass of vino! The kitchen is a white glossy number. Take the hallway to find the bathroom that doesn't disappoint with its white suite (shower over the tub). Both the bedrooms are cosy doubles with oatie hue carpets are soft under foot.Brookbank Road is residential road that meanders from the Green open spaces of the stunning Hilly Fields down to Algernon Road which is very close to Lewisham Station a big junction with lots of connections including the Docklands (DLR) and is Zone 2 so that helps the purse strings. Lewisham Centre offers a plethora of shops and the much loved market pick up your veg a ?1 a bowl! You cupboards will be stacked full with all the many delights on offer at half the price. Take a trip to famous Blackheath or Greenwich for ample wining and dining options.Disclaimer - These particulars are believed to be correct and have been verified by or on behalf of the Vendor. However any interested party will satisfy themselves as to their accuracy and as to any other matter regarding the Property or its location or proximity to other features or facilities which is of specific importance to them. Distances and areas are only approximate and unless otherwise stated fixtures contents and fittings are not included in the sale. Prospective purchasers are always advised to commission a full inspection and structural survey of the Property before deciding to proceed with a purchase.The information provided about this property does not constitute or form part of an offer or contract, nor may be it be regarded as representations. All interested parties must verify accuracy and your solicitor must verify tenure/lease information, fixtures & fittings and, where the property has been extended/converted, planning/building regulation consents. All dimensions are approximate and quoted for guidance only as are floor plans which are not to scale and their accuracy cannot be confirmed. Reference to appliances and/or services does not imply that they are necessarily in working order or fit for the purpose. Suitable as a retirement home.Brookbank Road, Lewisham SE13;2017-04-07 14:07:04;https://lid.zoocdn.com/354/255/c5d628ddf45f5472d87af2752e0cac564e729acd.jpg;2017-04-07 14:08:55;51.46326;51.46326;sale;-0.019888;false;1;2;0;0;SE13;London;247500;;Flat;for_sale;Brookbank Road43486366;Homewise Ltd;020 8115 9644;Residential;Purchasing this property with A lifetime leaseThis property is offered at a reduced price for the over 60s under Homewise's Home for Life Plan. This is a lifetime lease.The above price represents a mid-range discount from the property's full market value, and is based on a single male applicant aged 69 years. The actual price you will pay depends on your age, personal circumstances and property criteria. Discounts range from 8.5% to 59%.For more information or a personalised quote, just give us a call. Alternatively, if you are under 60 or would like to purchase this property without a lifetime lease at its full market price of ??275,000, please contact Leaders.Property DescriptionThe information provided about this property does not constitute or form part of an offer or contract, nor may be it be regarded as representations. All interested parties must verify accuracy and your solicitor must verify tenure/lease information, fixtures & fittings and, where the property has been extended/converted, planning/building regulation consents. All dimensions are approximate and quoted for guidance only as are floor plans which are not to scale and their accuracy cannot be confirmed. Reference to appliances and/or services does not imply that they are necessarily in working order or fit for the purpose. Suitable as a retirement home.Highland Terrace, Algernon Road, London SE13;2017-04-07 14:07:04;https://lid.zoocdn.com/354/255/e7506714ef000e6f24d5e0875a6c252e5c547ae8.jpg;2017-04-07 14:09:54;51.456425;51.456425;sale;-0.020199;false;0;1;0;0;SE13;London;181500;;Studio;for_sale;Ladywell Road43486354;C.H. Peppiatt Estate Agents;020 3551 3250;Residential;A fabulous one bedroom apartment in a beautiful modern block in central kentish town Offering approximately 740 Sqft of internal accommodation, this very well presented and recently constructed one bedroom apartment is situated on the lower ground floor of a small modern block of luxury apartments. The apartment offers a 23' reception room with a modern open plan fitted kitchen, direct access to a small private terrace and hardwood flooring throughout.Other benefits include a modern bathroom, generous bedroom and a large storage room which can be used as a study or studio.Located moments away from the cfbl french school, a very short walk to Kentish Town Underground station as well as being a short distance to Talacre Sports centre and Kentish Town west Station. Secure underground parking can be acquired at an extra cost.Holmes Road, London NW5;2017-04-07 14:07:04;https://li.zoocdn.com/52a0ebbcc99b049f0ff80027e1e094d4ac6a0d3a_354_255.jpg;2017-04-07 14:12:38;51.54956;51.54956;sale;-0.143922;false;1;1;0;1;NW5;London;470000;;Flat;for_sale;Holmes Road43486335;Northwood - Lewisham;020 8022 0057;Residential;Investor opportunity! A rare chance to purchase this 8 bedroom, 7 bathroom semi-detached house. Situated in the desirable Rosenthal Road in the heart of Catford, this property is currently being used as a hmo, generating the current owner a yield of 7%!Description: The property comprises an seven bedroom semi-detached house arranged over ground and two upper floors. The property requires a program of refurbishment.Exterior: The property benefits from both front and rear gardens with off street parking.AccommodationLower Ground Floor:Basement Storage RoomGround Floor: Reception Room Four Bedrooms (Two En-suite) Kitchen Shower Room with WC & wash basinFirst Floor: Reception Room Two Bedrooms (Both with en-suite Shower Rooms) Kitchen Bathroom with WC & wash basinSecond Floor:Two Bedrooms (One with en-suite Shower Room)Tenancy: The property is currently let on eight individual tenancies on a month to month basis. The house is fully let with a passing rent of ??7,000 per month (??84,000 per annum).To arrange your viewing, contact Northwood today on .Rosenthal Road, London SE6;2017-04-07 14:05:13;https://lid.zoocdn.com/354/255/0b5fbc7072c506ab8115ca786af5c9cf5751561f.jpg;2017-04-07 14:06:16;51.448597;51.448597;sale;-0.014709;false;0;8;0;0;SE6;London;1200000;;Semi-detached house;for_sale;London43486208;Linea Homes - Newlands;020 8115 8546;Residential;50% Already Sold!NewlandsTenterden Grove, London NW4 1SYLocated in Hendon???s leafy, tree-lined avenue of Tenterden Grove, this bijou collection of just 6 oversized apartments is perfect for those looking for room to move, who place space at a premium, and who want luxury without compromise.The handsome exterior of Newlands blends classic lines and modern materials in a respectful interpretation of Hendon???s timeless 1930s and Victorian architecture. Beautiful London brickwork with stone reliefs and tiled pitched roofs reflect the characteristics of the surrounding streets, while bright white render, sleek glass fronted balconies and powder-coated aluminium window frames add an elegant contemporary edge.The interiors includes designer kitchens by Poggenpohl with integrated Miele appliances, hotel style bathrooms with italian porcelain tiles and top of the range Hansgrohe fittings, hardwood wide plank oak floors and slimline metal sockets and switches. Future proof touches include integral home automation, audio/visual wiring, Sky+ compatibility and energy efficient heating and lighting.Private outside spaces, communal gardens and an off-street parking space for every apartment complete the picture.Plot 23 bedroom, ground floor terrace apartment92.9m2 / 1000.6 sq ftLiving / Dining5.1m x 4m (16???9??? x 13???3???)Kitchen4.3m x 3.2m (14???4??? x 10???9???)Bedroom 14.3m x 3.6m (14???4??? x 11???10???)Bedroom 23.7m x 3m (12???2??? x 10???0???)Bedroom 34m x 2.5m (13???4??? x 8???2???)Terrace7.2m x 2.1m (23???7??? x 7???0???)Figures are based on the longest measurements in each room.Plot 2, Newlands House, Tenterden Grove, London NW4;2017-04-07 14:04:11;https://lid.zoocdn.com/354/255/11c34fdcc20a263e463dbc860925d22233185c51.jpg;2017-04-07 15:42:13;51.59068;51.59068;sale;-0.217273;true;1;3;0;0;NW4;London;1050000;;Flat;for_sale;Plot 2, Newlands House, Tenterden Grove43486319;Fresh Property;01375 318872;Residential;No onward chain. Immaculately presented two bedroom coach house benefiting from a garage. Close to railway station. EPC CLounge (16'8 x 16'3 (5.08m x 4.95m))Inner HallwayKitchen (12'11 x 6'7 (3.94m x 2.01m))Bedroom (12'11 max x 10'4 (3.94m max x 3.15m))Bedroom (10'6 x 7'5 (3.20m x 2.26m))BathroomGarageEnter the property via door to front aspect. Stairs lead to first landing.Open plan lounge offers double glazed window to front and rear aspect. Smooth to coved ceiling. Inner hallway gives access to remaining rooms.Kitchen is fitted with a range of white high gloss wall and base mounted units fitted with chrome bar handles. Ample work surfaces house gas hob, electric oven under. Stainless steel extractor hood over. Stainless steel sink drainer with swan neck mixer tap. Tiling to splash backs. Spaces for appliances. Window to front aspect. Highly polished tiled flooring.Two bedrooms are both of a good size. Both rooms have double glazed windows to rear.Three piece bathroom suite comprises. White panelled bath, hand held shower attachment, low level WC, vanity wash hand basin, tiling to splash backs. Chrome fitments. Complimentary tiled flooring. Obscure double glazed window.The property benefits from driveway parking & garage.Externally there is a garage and a further lock up storage cupboard.Caspian Way, Purfleet, Essex RM19;2017-04-07 14:03:17;https://li.zoocdn.com/12d6c5a7033634474c0bbc1b4c042c4a40fdf325_354_255.jpg;2017-04-07 14:08:53;51.484146;51.484146;sale;0.237007;false;1;2;0;1;RM19;Purfleet;230000;;Maisonette;for_sale;Caspian Way43486295;Homeview Estates Ltd;020 3641 5165;Residential;A spectacular 2 bedroom flat with garden which has been finished to an exceptional standard is offered for sale chain free in Messina Avenue NW6. The property features solid oak flooring, 28 jet Jacuzzi, ceiling speakers, electric chimney, built in TV facilities and even LED mood lighting throughout the apartment. Further benefits include usb power points, Ethernet cabling, alarm system, built in Bosch and Hotpoint appliances! The property features high ceilings, and a great use of the space, this could be an ideal first home or a great investment.Situated only moments away from West End Lane, West Hampstead Jubilee Line Station and Kilburn Station.Must be seen to be appreciated.Messina Avenue, London NW6;2017-04-07 14:00:13;https://lid.zoocdn.com/354/255/4095fceb7968e52bbcd207d35fbda2b944c732ab.jpg;2017-04-07 14:07:05;51.54262;51.54262;sale;-0.197073;false;1;2;0;1;NW6;London;549950;;Flat;for_sale;Messina Avenue43486288;Sell My Home;020 7768 6683;Residential;The property features open plan living/dining room with floor to ceiling fully lateral window (double glazed windows) with sliding door onto balcony.1 double bedroom with fitted wardrobe.  Wooden and tiled flooring throughout.Bathroom (with bath), double glazing, integrated appliances (including washer/dryer), 2 storage areas.Wooden staircase at entrance and tiled floors throughout.Fantastic location close to Gloucester Road (District, Circle and Piccadilly lines)  and easy access to Heathrow and West End.  Walking distance to Kensington Gardens and Kensington High Street with all amenities close by.  Waitrose just a short walk and Sainsbury???s superstore adjacent to the building.On-site David Lloyd gym, swimming pool and caf??.Due to high demand, we recommend booking in your viewing immediately!Please note: Viewings for all properties are arranged directly on the Sellmyhome website.Please note: Viewings for all properties are arranged directly on the Sellmyhome website.Point West, 116 Cromwell Road, London SW7;2017-04-07 13:59:21;https://lid.zoocdn.com/354/255/87c2eedbc79a11c797a503f4de2333202bda021b.jpg;2017-04-07 14:00:17;51.49538;51.49538;sale;-0.186995;false;0;1;0;0;SW7;London;725000;;Flat;for_sale;Point West, 116 Cromwell Road