listing_id;agent_name;agent_phone;category;description;displayable_address;first_publish_date;image_url;last_publish_date;latitude;listing_status;longitude;new_home;num_bathrooms;num_beedrooms;num_floors;num_recepts;outcode;post_town;price;price_change;property_type;status;street_name43406951;Next Move;020 3551 9662;Residential;Hugely characterful two bedroom Victorian duplex conversion, with sole use of garden, located a short walk from Church Street and Clissold Park. The property is arranged over two floors with the accommodation set out as follows  enter the property on the ground floor via its own entrance into a small lobby area and then through into a generous living/dining space, open-plan to the staircase, with dual-aspect windows and shutters to the front. To the rear a separate kitchen/breakfast room leads out to a delightful well-planted and landscaped 65' west-facing garden with direct access to Church Walk at the end. Back inside on the split-level first floor there is a large bathroom with windows to the side and rear and shower over the bath  and next to that two double bedrooms, both with built-in wardrobes. Milton Grove is located moments from leafy Clissold Park and fashionable Church Street's mix of independent shops, bars and restaurants. Transport links are excellent with numerous buses to The West End and City, and trains from Stoke Newington Overground to The City (Liverpool Street) taking under fifteen minutes.Milton Grove, London N16;2017-03-31 09:42:38;https://lid.zoocdn.com/354/255/e49b6513efd8d795706b4cbc79b488eeb73c54d2.jpg;2017-04-04 09:02:42;51.555664;51.555664;sale;-0.08287;false;1;2;0;2;N16;London;795000;;Flat;for_sale;Milton Grove43406950;Pattinson;0191 244 9567;Residential;SummaryFor sale by online auction. Starting Bid 440,000. Terms and conditions apply.Pattinsons are pleased to present this recently refurbished Two Double Bedroom, First Floor, Split Level Period Converted Flat offering a share of the Freehold. We feel that the property would be perfect for a working professional couple or someone who is looking to up-size from their current home.The First Floor benefits from a generous sized Living Room, a great sized newly fitted Kitchen including dining space, a brand new stylish Bathroom and a double sized Bedroom. The Second Floor consists of an amazing sized Master Bedroom presented in immaculate condition, including storage space and a lavish En-suite Shower Room. This split level flat has been fully refurbished within the last 6 months, boasting newly fitted radiators in all rooms, new electrics and a 5 year old boiler.The property is fantastically located, being only a short walk away from Haringey Green Lanes  giving you a great selection of Restaurants, Pubs, Bars, Parks and News Agents. Not to forget it is also moments away from Haringey Green Lanes Overground Station and Turn Pike Lane Tube Station. A wide of variety of sought after primary schools surround this well presented flat, including Chesnuts Primary School, Woodlands Park Primary School and the famous Belmont Primary School.Please Note: Pattinsons have not inspected this property.Bathroom (2.5m x 1.5m)UPVC Opaque Double Glazed Window to Side, Splash & Part Tiled Walls, Low Level Flush WC, Panel Enclosed Bath, Vanity Unit Below Wash Basin, Extractor Fan, Towel Rail, Shaver Points, Tiled FlooringLiving Room (4.7m x 3.5m)Upcv Double Glazed to Front, Double Radiator, Power, TV, Telephone Points, Carpet FlooringKitchen (4.7m x 2.8m)UPVC Double Glazed Window to Rear, Wall Units, Roll Top Work Surface, Space for Fridge/Freezer, Built in Cooker, Electric Oven & Gas Hobs, Power Points, Double Radiator, Tiled FlooringMaster Bedroom (5.7m x 4.3m)Upcv Double Glazed to Front & Rear, Double Radiator, Power, TV, Points, Carpet FlooringBedroom Two (3.6m x 3.0m)Upcv Double Glazed to Front & Rear, Double Radiator, Power, TV, Points, Carpet Flooring.EnsuiteUPVC Opaque Double Glazed Window to rear, Splash Walls, Low Level Flush WC, Double Shower Cubicle, Vanity Unit Below Wash Basin, Extractor Fan, Towel Rail, Shaver Points, Tiled FlooringWoodlands Park Road, London N15;2017-03-31 09:42:38;https://lid.zoocdn.com/354/255/3eb9fde3456bdb6ff371cee64c71050b34b77926.jpg;2017-04-01 01:41:26;51.582066;51.582066;sale;-0.096107;false;0;2;0;1;N15;London;440000;;Flat;for_sale;Woodlands Park Road43406910;Stones Residential;020 8128 2133;Residential;This exceptional and recently refurbished two bedroom apartment is situated on the second floor of a popular mansion block located just off Finchley Road.The apartment offers approximately 750 sqft of internal accommodation including two bedrooms, seperate kitchen, modern bathroom and balcony off the reception room.Offered chain free, the apartment is offered in excellent condition and has the benefit of communal gardens, and an on site porter.Heathway Court is located just off Finchley Road in Childs Hill and has easy access to a number of bus routes that connect to either Golders Green or Finchley Road Underground station.Heathway Court, Finchley Road, London NW3;2017-03-31 09:38:31;https://li.zoocdn.com/79877dcc9114c343c021f98bc7cd47feacebbf2e_354_255.jpg;2017-04-03 13:45:34;51.563877;51.563877;sale;-0.196492;false;1;2;0;1;NW3;London;649950;;Flat;for_sale;Finchley Road43406878;Property World, Sydenham;020 3478 3317;Residential;Cash buyer only cash buyers onlyProperty World is delighted to bring to market this incredible value one bedroom flat located in the heart of Sydenham. Well presented with a modern fitted kitchen and bathroom, this flat is the perfect starter home for a first time buyer, or buy to let investment. The property boasts a 100year lease, sensible service charges and is in Council tax band A. There is also off street parking in the cul-de-sac where it is based. The property is located off Sydenham road, within easy walking distance of both the high street, Sydenham train and Overground and Penge East train stations.Call Propertyworld on to book your appointment to view.Our Vendor Loves..."We purchased the flat as a buy-to-let investment, at this point it has always rented straight away without any empty periods. The flat has it's own front door and small balcony. It's a stones throw from Mayo Park, Sydenham High Street and the local shops"These particulars, whilst believed to be accurate are set out as a general outline only for guidance and do not constitute any part of an offer or contract. Intending purchasers should not rely on them as statements of representation of fact, but must satisfy themselves by inspection or otherwise as to their accuracy. No person in thiscompany's employment has the authority to make or give any representation or warranty in respect of the property.Hazel Grove, London SE26;2017-03-31 09:34:14;https://lid.zoocdn.com/354/255/b339f2af0d2853fa855fa033fa5ac47cde4cb109.jpg;2017-04-01 01:41:24;51.427483;51.427483;sale;-0.046221;false;0;1;0;0;SE26;London;235000;;Flat;for_sale;Hazel Grove43406867;Estates 17 Ltd;020 7768 0484;Residential;A Period Mid Terraced Home In The Village.This Victorian mid terrace house is located on one of Walthamstow???s premier streets, and as such the location could hardly be better. With Henry Maynard School opposite the family home it won't be far to walk the children into school in the morning, and picking up won't be much bother either! Literally a pebble???s throw from Orford Road, every imaginable amenity is on your doorstep. Need a pint of milk (and maybe grab a few freshly baked pastries for a Sunday morning)? Then pop into the award winning Spar. Need a bottle of bubbly or wine for the soon approaching Summer bbq's? In Vito Veritas will have the very thing you need. Don???t think the location of this house is just convenient for enjoying yourself (although of course that is very important). When the weekend ends and work eventually calls, it???s just a short stroll down to Walthamstow Central station for the commute into the City. Need a coffee for the morning walk to the station, have you pick of many down Orford Road or Huck???s on Grove Road who will be able to satisfy even the most voracious of caffeine cravings. This house is in a great spot for family life, schools, shops and transport what more can you ask for? Oh and don???t forget the gorgeous street it sits on!Living Here...Ever walked into a house and it just felt like it was somewhere you would really love to live? Well, that???s how we felt when we walked through the front door of this house, and we are pretty sure you will too. Walking into the bay fronted through lounge it is the perfect spot in which to relax, and equally a great place to entertain. Walking down the hallway into the kitchen, (which also boasts a bay window) feels like a breath of fresh air as the room is instantly flooded with sunlight. Moving upwards, there are three good size double bedrooms and family bathroom on the first floor, whilst the house itself is a good size there is potential to extend stpp, in the loft to add another two bedrooms along with en-suite, then for the ground floor with a variety of choices to extend the kitchen. And don???t forget the 50' private rear garden ??? ideal for relaxing or partying through the summer nights.In This Area - By Walthamstow DiaryDespite what people may tell you, Walthamstow Village was not invented by estate agents. It???s called Walthamstow Village because it was once exactly that, a village. Once the administrative heart of Walthamstow, the Village is now content to simply be the neon capital of Europe. An unlikely claim you might think, but visit God???s Own Junkyard on Ravenswood industrial estate and you???ll see what I mean.When your mind has been blown by the neon, pop in to Mother???s Ruin Gin Palace and Wildcard Brewery. All three businesses are based on Ravenswood, making it the most exciting industrial estate on the planet. The Village is full of quiet residential streets that all have easy access to bucket loads of pubs and restaurants. Take in the Jazz at the Nags Head on Sunday afternoon, enjoy the excellent food and beer at the Queen???s Arms, and sample the legendary chicken and bacon jam burger at Eat17.To walk off all the food you???ve eaten, wander to the 15th century Ancient House, check out St Mary???s Church and its ivy clad church yard, have a pint in the garden at the Castle Pub, then admire the art in the windows of the old iron mongers.Dimensions:EntranceVia front door leading into:Entrance HallwayDoor To:Reception Room One (3.96m x 3.35m (13'0 x 11'0))Reception Room Two (3.45m x 2.59m (11'4 x 8'6))Kitchen/Diner (4.60m x 3.35m (15'1 x 11'0))Door To Rear Garden.First Floor LandingDoor To All First Floor Rooms.Bedroom One (4.42m x 3.35m (14'6 x 11'0))Bedroom Two (3.66m x 2.67m (12'0 x 8'9))Bedroom Three (3.35m x 2.74m (11'0 x 9'0))First Floor Bathroom (2.74m x 1.52m (9'0 x 5'0))Rear Garden (South-Facing) (approx 15.24m (approx 50'))The information provided about this property does not constitute or form part of any offer or contract, nor may it be relied upon as representations or statements of fact. All measurements are approximate and should be used as a guide only. Any systems, services or appliances listed herein have not been tested by us and therefore we cannot verify or guarantee they are in working order. Details of planning and building regulations for any works carried out on the property should be specifically verified by the purchasers??? conveyancer or solicitor, as should tenure/lease information (where appropriate).Brunswick Street, Walthamstow, London E17;2017-03-31 09:33:28;https://li.zoocdn.com/305f62cccb04b6267ab9ee38b89663947249f11a_354_255.jpg;2017-04-06 17:14:30;51.581577;51.581577;sale;-0.008673;false;1;3;0;2;E17;London;750000;;Terraced house;sold;Brunswick Street43406851;Northfields - Ealing Broadway;020 7768 1892;Residential;GBP700,000 GBP865,000Set within a large period building in a highly sought after location are these five newly refurbished luxury apartments offering stylish yet functional communal areas, off street parking (limited), communal gardens for the upper level flats and private gardens for the two ground floor flats.All apartments come with a 125 year lease and offer two bedrooms, a family bathroom, an ensuite shower room and are finished to an extremely high specification. With LED down lighters in all rooms, hardwood flooring throughout the living areas, plush carpets in the bedrooms, branded bathroom ware and integrated Bosch & Neff appliances in the tastefully fitted kitchens these properties really do have the wow factor.Mortimer Road, London W13;2017-03-31 09:30:31;https://lid.zoocdn.com/354/255/acbfc3afedcb93239242cfebaa8deffc27bef742.jpg;2017-03-31 09:55:26;51.51832;51.51832;sale;-0.314018;false;2;2;0;1;W13;London;700000;;;for_sale;Mortimer Road43406729;Jacksons Estate Agents - Earlsfield;020 3478 3592;Residential;25% shared ownership- A first floor one bedroom modern apartment set within a secure development and finished to a very good specification. The property benefits from secure allocated parking and access to a beautiful communal roof terrace.The accommodation comprises: Entrance hall with large useful storage cupboard, good size bedroom, 23'6 ft reception room open plan to the kitchen/dining area and a modern family bathroom.The apartment is situated in a popular residential location equidistant between Earlsfield and Wandsworth Town centres with King George's Park within close proximity.Furmage Street, London SW18;2017-03-31 09:27:58;https://lid.zoocdn.com/354/255/efdf9ecfd03769738581a1cb3263d0a94ea19de8.jpg;2017-04-01 01:41:17;51.449654;51.449654;sale;-0.190404;false;1;1;0;1;SW18;London;98750;;Flat;for_sale;Furmage Street41845955;Purplebricks, Head Office;01926 267659;Residential;***Four Bedroom Semi Detached House***Four Double Bedrooms***Large Kitchen / Diner***Separate Reception***Stunning Views***Garden***Excellent Condition***Over 1600 Sq Ft***An extremely well presented four double bedroom period house in a quiet cul de sac road with incredible views overlooking Spa Hill Allotments.Offering generous space over three floors this gorgeous family home is in exceptional condition. Benefitting from a complete refurbishment from top to toe this home offers it???s new owner an opportunity a chance to acquire a prime house in a quiet location.On the ground floor there is a large reception to the front with a wonderfully bright southern aspect, featuring a wood burner and hardwood flooring.To the rear of the ground floor is a wonderful large open plan kitchen diner with double doors leading onto the patio, making a lovely space to entertain and cater for large groups and the family too. Off the hallway downstairs there is a recently installed downstairs cloakroom and plenty of storage under the stairs too.On the first floor is the master bedroom, taking advantage of the full width of the building which enjoys wonderful views and benefits from that south facing aspect.The rear bedroom on the first floor has a large wardrobe and overlooks the garden.The family bathroom is truly luxurious with a walk in shower including multiple jets and a rain shower there is also a decadent sunken bath. The whole bathroom is tiled from floor to ceiling and has a skylight providing a very bright and spacious environment.On the top floor are two double bedrooms, one of which has an en-suite shower room with another walk in shower.The garden is low maintenance and offers great entertaining space, with a ground level patio and tiered lawn and raised decked area.Dale Park Road, London SE19;2017-03-31 09:26:28;https://lid.zoocdn.com/354/255/7554643443979fb406c90d249217b0bf7d1f9eb0.jpg;2017-03-31 09:26:28;51.4118;51.4118;sale;-0.095092;false;2;4;0;2;SE19;London;650000;;Semi-detached house;for_sale;Dale Park Road43406706;Dexters - Fulham;020 7768 7027;Residential;This large Victorian home offers a huge living space and modern interior. The four bedrooms, 20' reception room and large sun terrace make this a great buy for any growing family.DirectionsThe closest transport links are at Imperial Wharf, Parsons Green and Wandsworth Town. Local shops, restaurants and South Park are also on the doorstep.You may download, store and use the material for your own personal use and research. You may not republish, retransmit, redistribute or otherwise make the material available to any party or make the same available on any website, online service or bulletin board of your own or of any other party or make the same available in hard copy or in any other media without the website owner's express prior written consent. The website owner's copyright must remain on all reproductions of material taken from this website.Wandsworth Bridge Road, London SW6;2017-03-31 09:24:01;https://li.zoocdn.com/c5ef24573fb76ac3d7b5d78ffa309ee195ae9603_354_255.jpg;2017-04-01 01:41:16;51.46724;51.46724;sale;-0.190328;false;1;4;0;1;SW6;London;895000;;Flat;for_sale;Wandsworth Bridge Road43406704;Dexters - Hampton;020 8166 7532;Residential;This three bedroom house is spacious and ideal for those looking to get their foot on the property ladder whilst also appealing to growing families alike. We love its extension potential and west facing garden.DirectionsSet in a quiet residential close with ample parking just in front of the house, located near the borders of Hanworth and Hampton with handy transport links and great local schools just around the corner.You may download, store and use the material for your own personal use and research. You may not republish, retransmit, redistribute or otherwise make the material available to any party or make the same available on any website, online service or bulletin board of your own or of any other party or make the same available in hard copy or in any other media without the website owner's express prior written consent. The website owner's copyright must remain on all reproductions of material taken from this website.Nene Gardens, Feltham TW13;2017-03-31 09:24:01;https://lid.zoocdn.com/354/255/9191d6ea1fa740e40c7a37c171e030e940fa701d.jpg;2017-04-01 01:41:16;51.440357;51.440357;sale;-0.380575;false;1;3;0;1;TW13;Feltham;369950;;;for_sale;Nene Gardens43406708;Dexters - Clapham;020 8166 5455;Residential;A magnificent two bedroom period conversion arranged over the ground and first floors of a handsome Victorian property, reaching to over 910sqft with potential to extend stpp.DirectionsDalyell Road is ideally located for both Brixton & Clapham's many local restaurants, bars and caf??s. Brixton, Stockwell & Clapham North are all just a short, equidistant walk making The City and West End very accessible from both Northern & Victoria lines.You may download, store and use the material for your own personal use and research. You may not republish, retransmit, redistribute or otherwise make the material available to any party or make the same available on any website, online service or bulletin board of your own or of any other party or make the same available in hard copy or in any other media without the website owner's express prior written consent. The website owner's copyright must remain on all reproductions of material taken from this website.Dalyell Road, London SW9;2017-03-31 09:24:01;https://li.zoocdn.com/aee22e9f4334ba4704959aaa49fca7acc56f09c3_354_255.jpg;2017-04-03 19:07:04;51.46681;51.46681;sale;-0.120647;false;0;2;0;1;SW9;London;700000;;Flat;for_sale;Dalyell Road43406653;Groves Residential;020 3641 4176;Residential;Set in over half an acre of land and located within the private roads on Coombeside, a detached residence with a separate annex and which has endless possibilities. The main house is approx. 2800 square feet and comprises three reception rooms, a further study, kitchen/breakfast room, three bedrooms, bathroom, cloakroom and a large utility room and the annex is laid out as a one bedroom property with living room, kitchen and bathroom and is approx. 700 square feet. There is also a triple garage and off-street parking. But the main feature of this property, apart from the wonderful location, is the grounds that it is set in  we estimate it to be within 0.62 of an acre and subject to planning, there is the possibility to extend this property, rebuild a new home or indeed to develop the land. EPC rating D. The gardens primarily face south and have fantastic views across a wide area. This will suit many different buyers and a viewing is absolutely necessary to fully appreciate what this property really offers.NoticePlease note we have not tested any apparatus, fixtures, fittings, or services. Interested parties must undertake their own investigation into the working order of these items. All measurements are approximate and photographs provided for guidance only.Warren Rise, New Malden KT3;2017-03-31 09:19:27;https://lid.zoocdn.com/354/255/e6759a1abd186487cc07c810101bc5a04c2f0afe.jpg;2017-04-07 13:06:15;51.415012;51.415012;sale;-0.26408;false;1;3;0;3;KT3;New Malden;3000000;;Detached house;for_sale;Warren Rise43368855;Coopers Residential - Ruislip;01895 262041;Residential;An impressive six bedroom character filled home set in between Eastcote village and Pinner. Boasting a substantial floorplan and meticulously arranged over three floors the residence offers light filled, spacious rooms throughout and is complemented by a beautiful private garden. The property also benefits from own driveway leading to a double garage and attractive views of Eastcote Cricket club to the front aspect.DirectionsFrom our Ruislip office turn left, take the second exit at the mini roundabout on to Eastcote Road. Go straight across three mini-roundabouts then, immediately after the double bend, Southill Lane is on the left. The property is the first house on the right.SituationSouthill lane is ideally located between Pinner and Eastcote Village and offers easy access to both Eastcote, Pinner and Northwood Hills. Old Eastcote village shops are a short distance away and there are bus routes towards Northwood, Eastcote and Ruislip within a few moments reach. For families with children in education Haydon Secondary school and Sixth form is closeby and within walking distance.DescriptionA stunning six bedroom detached residence boasting light filled and spacious rooms perfectly arranged over three levels. This charming and character filled home will immediately impress with it grand proportions, elegant floor plan and attractive views over Eastcote Cricket club grounds. Upon entering the property via the front entrance there is a good size, welcoming hallway leading to the 'Eat in' kitchen area to the front and boasting a wealth of storage, worktop space and a selection of integrated 'Miele' appliances along with easycare tiled flooring. There is also a useful study room to the front of the house. Heading to the rear of the property there is a wonderful double reception room enjoying views of the garden via the bay window and a single, wide-glazed door which leads to the conservatory. From the conservatory there is access to the garden via two separate sets of doors either side and further access into a separate office space to the side. Conveniently there are two guest cloakrooms on the ground floor. The stairs rise to the first and second floors from the hallway where between both floors there are an impressive six bedrooms. On the first floor are four double bedrooms. The substantial 18ft master bedroom boasts an original beamed vaulted ceiling and a luxury, spacious, en suite bathroom. There is also a main bathroom on this floor. Upstairs on the second floor are a further two bedrooms with access to a 'Jack and Jill' style bathroom. Designed for a busy lifestyle and growing family, it really is a fabulous home offering expansive living and entertainment space with pockets of privacy.OutsideTo the front of the property is a driveway with a lawned area and space for off street parking. There is a double garage providing useful space and convenient access through to the inside of the home. To the rear of the property there is a lovely 'L' shaped garden with a perfectly maintained lawn and surrounded with mature shrub borders.Southill Lane, Pinner HA5;2017-03-31 09:14:22;https://lid.zoocdn.com/354/255/46653fa90b032f75afdecbbc3da9759f1e3eadbf.jpg;2017-04-03 11:31:05;51.589546;51.589546;sale;-0.404767;false;3;6;0;1;HA5;Pinner;1200000;;Detached house;for_sale;Southill Lane43406594;Bradley & Co Estate Agents;01895 647006;Residential;Bradley & Co are delighted to present this extended two bedroom mid terrace home to the market. Located on the popular Beverley Road, this property enjoys parkland views, spacious living accommodation and only a mile from Ruislip Manor High Street.The property itself comprises of: Entrance way leading into the bright living room with white washed walls and walnut flooring, the back of the house is a large dining room and kitchen with an array of floor and wall cupboards and finished off with a breakfast bar.The first floor has two double bedrooms with the back bedroom enjoying parkland views. The bathroom is fully tiled with a white bath suite and over bath shower.Outside the property has off-street parking to the front whilst the secluded and peaceful rear garden has a good-sized garage to the back.Beverley Road is situated in Ruislip Manor and is only half a mile to Ruislip Manor high street with excellent links into Central London. This property is also in the catchment area for sought-after schools.Beverley Road, Ruislip Manor HA4;2017-03-31 09:12:10;https://li.zoocdn.com/89c60b68bb602ecab1ae2a812d5255a5d219eb4f_354_255.jpg;2017-03-31 09:13:12;51.567352;51.567352;sale;-0.403582;false;1;2;0;2;HA4;Ruislip;475000;;Terraced house;for_sale;Beverley Road