listing_id;agent_name;agent_phone;category;description;displayable_address;first_publish_date;image_url;last_publish_date;latitude;listing_status;longitude;new_home;num_bathrooms;num_beedrooms;num_floors;num_recepts;outcode;post_town;price;price_change;property_type;status;street_name43365968;Hobarts Estate & Letting Agents - London (North);020 7768 3134;Residential;Two double bedroom victorian mid-terraced 'cottage style' property. Ideally located in a popular residential enclave close to Alexandra Palace National Rail & Wood Green tube stations (20/25 Mins City/West End). The property comprises a frontal lounge, kitchen/dining room, two double bedrooms, fitted bathroom and own South/West facing garden. The property would benefit from some updating & is offered "chain free". Early viewing strongly recommended. Important note - Pictures depicted are from previous marketing and are intended as a guide only.Two double bedroom victorian mid-terraced 'cottage style' property. Ideally located in a popular residential enclave close to Alexandra Palace National Rail & Wood Green tube stations (20/25 Mins City/West End). The property comprises a frontal lounge, kitchen/dining room, two double bedrooms, fitted bathroom and own South/West facing garden. The property would benefit from some updating & is offered "chain free". Early viewing strongly recommended.Mportant note - Pictures depicted are from previous marketing and are intended as a guide only.Ringslade Road, London N22;2017-03-28 00:42:29;https://lid.zoocdn.com/354/255/2ce01864638ee8f8d91e00018976fec33461394a.jpg;2017-03-28 01:41:28;51.59795;51.59795;sale;-0.113477;false;0;2;0;0;N22;London;519950;;Terraced house;for_sale;London43365950;Greene & Co - Kensal & Queens Park;020 7768 0959;Residential;A fabulous cottage in the heart of Queens Park. This pretty house is set within the Queens Park Estate and offers easy access to transport links including Queens Park Station (Bakerloo & Overground Line). Offered in good condition, this well-maintained house comprises on the ground floor a spacious double reception, dining area and fully fitted kitchen offering direct access to a sunny garden. The kitchen and bathroom have been expanded via a rear extension with crittal windows and vaulted ceilings. On the first floor there are two bright and airy double bedrooms with access to a third bedroom in the loft. Lothrop Street is a quiet, tree-lined street conveniently located for the shops, bars, delis and cafes of Kensal Rise and Queens Park.Lothrop Street, Queens Park, London W10;2017-03-28 00:39:26;https://lid.zoocdn.com/354/255/81d79a5494fc39f3a311c9218e62c443ebd61a8b.jpg;2017-04-06 13:07:03;51.52966;51.52966;sale;-0.208773;false;1;3;0;1;W10;London;805000;;;for_sale;Queens Park London43365949;Greene & Co - Kensal & Queens Park;020 7768 0959;Residential;Radiant and bright three bedroom upper floor maisonette in the heart of Kensal Rise. The spacious flat has been recently refurbished to a high standard.With the flat entrance on the ground floor the split level accommodation is set across the first and second floors. The first floor has a south facing reception room with large windows, wooden flooring and inset lighting. A separate fully integrated kitchen, two double bedrooms (both with built-in wardbrobes) and modern bathroom. The converted second floor has a third double bedroom with en-suite shower room and ample storage spaceRainham Road is a quiet residential road in the Kensal Green triangle. Kensal Green station has both Bakerloo Line and London Overground connections. Nearby Chamberlayne Road offers many popular local amenities including Paradise By Way of Kensal Green. It is located close to Ladbroke Grove, the canal and Dock Kitchen within easy reach of North Kensington and Notting Hill and the open spaces of Queens Park.Rainham Road, Kensal Rise, London NW10;2017-03-28 00:39:26;https://lid.zoocdn.com/354/255/2653a1477c42b6a4ef5689f3297b93b7f7f44edc.jpg;2017-04-06 13:06:49;51.52991;51.52991;sale;-0.220974;false;2;3;0;1;NW10;London;799999;;Flat;for_sale;Kensal Rise London43365948;Greene & Co - Belsize Park;020 8022 0982;Residential;A stunning, larger-than-average garden flat set within this period conversion, ideally situated within easy reach of the extensive grounds of Hampstead Heath and the local amenities of South End Green.The property is in excellent decorative condition and comprises a bright and spacious bay fronted reception room with original wood flooring, period features and fireplace, a large modern fitted kitchen diner, a double bedroom, a bright skylit study area and a stylish bathroom.The apartment further benefits from ample storage space and a private rear garden.Mansfield Road is well located for both Hampstead Heath and Gospel Oak Overground stations and is within easy reach of Belsize Park Underground station (Northern Line) and the local shops, restaurants and cafes of Haverstock Hill and Hampstead High Street.Mansfield Road, Belsize Park, London NW3;2017-03-28 00:38:55;https://lid.zoocdn.com/354/255/6090ab226eacbcd6e74286e11e406f2fb21c8576.jpg;2017-03-29 00:37:17;51.553486;51.553486;sale;-0.157956;false;1;1;0;1;NW3;London;699950;;Flat;for_sale;Belsize Park London43365947;Greene & Co - Belsize Park;020 8022 0982;Residential;Ideally situated for the shops, restaurants and cafes of Haverstock Hill is this stunning split level penthouse apartment set in this well maintained purpose built block with a lift.The property is newly refurbished throughout and comprises a bright and spacious reception room with bi-folding doors leading to a large private south facing terrace, a beautiful modern fitted kitchen diner, three/four bedrooms, two contemporary bathrooms and a guest WC.The apartment further benefits from a parking space.The property is well located for Belsize Park Underground station (Northern Line) and the local amenities of Englands Lane.Haverstock Hill, Belsize Park, London NW3;2017-03-28 00:38:55;https://lid.zoocdn.com/354/255/a29fab7d8351a8c1151fc76a000b32b6bc770529.jpg;2017-03-30 00:37:11;51.54802;51.54802;sale;-0.161322;false;2;3;0;1;NW3;London;1695000;;;for_sale;Belsize Park London43365944;Fraser & Co - New Homes;020 7768 1816;Residential;1 bedroom, 1 bathroom apartment is for sale on the second floor of this new development Union Park, with courtyard facing aspects the 384 sq.Ft* apartment boasts a juliette balcony. Equally, there are high-specifications throughout, and an included parking space.Union Park is an exclusive development offering a stunning choice of studio, 1,2 & 3 bedroom apartments, set in a tranquil canal side setting. Union Park will comprise 118 luxury apartments, located in a semi-rural green-belt overlooking the waters of the Grand Union Canal, but will also offer residents convenient access to town centre amenities and excellent transport connections.Designed to a criteria of architectural innovation that delivers high-end luxury living sapce in a newly landscaped environment, Union Park will offer exclusive living from every point of view. The development will also benefit from a 12 hour concierge service.With close proximity to plentiful green space, Union Park offers an enviable position of tranquility, with Little Britain Lake just a five minute walk* and just a three minute walk* to Packet Boat Marina. Additionally, Union Park is well-placed for transport links, with the West Drayton rail station within a 20 minute walk*, which is set to soon be serviced by the Crossrail link, which will allow access to central London with ease.Current travel time to Bond Street is 49 minutes*, however with the arrival of Crossrail, this will be reduced to an impressive 23 minutes*. Heathrow is just 21 minutes away*, which is set to reduce to an incredible 8 minutes via Crossrail, whereas Paddington, Canary Wharf, and Liverpool Street (currently 22 minutes*, 1 hour 11 minutes* and 1 hour 2 minutes* respectively) will also benefit, reducing to just 20 minutes*, 37 minutes* and 31 minutes* respectively.Aqua House, Packet Boat Lane UB8;2017-03-28 00:38:24;https://lid.zoocdn.com/354/255/ea85976754b709e9545d2d889790480cd3637a84.jpg;2017-03-28 00:38:24;51.520725;51.520725;sale;-0.482486;true;0;1;0;0;UB8;Uxbridge;290000;;Flat;for_sale;Packet Boat Lane Uxbridge43365935;Fraser & Co - Kew Bridge & Brentford;020 7768 1663;Residential;Presenting to the market this fabulous studio apartment located within the boutique development, Westworth House. Sleek and contemporary, this apartment benefits from 258 sq.Ft* of space.Perfectly designed to complement London's sophisticated lifestyle, Westworth is a boutique collection of homes in one of West London's most vibrant and coveted neighbourhoods. The emphasis within this development is on high-specification features and fittings which fit in perfectly with the modern Londoner's lifestyle.Hammersmith itself has a range of bistros, bars and boutiques which provide an eclectic range of eateries for self-acclaimed foodies. Global cuisine can be found on your doorstep in renowned restaurants sure to satisfy every individual's taste buds.Hammersmith is at the hub of London transport and only a five minute walk from Westworth House. With four underground lines at travellers disposal it makes reaching each corner of London easy and fast. A commuter's paradise, Paddington, Euston, Waterloo and Kings Cross St Pancras are all reachable within 24 minutes. For weekend leisure, the West End is a short 17 minute tube ride away for all shopping and entertainment outlets.Westworth House, 1 Down Place W6;2017-03-28 00:37:54;https://li.zoocdn.com/5ec300ad76224bc9500119560b750146a1f9c7f1_354_255.jpg;2017-03-28 20:59:41;51.49218;51.49218;sale;-0.230683;true;0;0;0;0;W6;London;355000;;Studio;for_sale;1 Down Place London43365924;Brian Cox - Greenford & Southall;020 3478 3382;Residential;Brian Cox are delighted to offer this two double bedroom first floor apartment which is offered in good decorative order. The property is priced to sell so call now to arrange a viewing. Viewings available immediately!Ruislip Road, Greenford UB6;2017-03-28 00:34:52;https://li.zoocdn.com/d753fb82bbd522f709bf6a83d09ff3213e12b835_354_255.jpg;2017-04-05 23:57:47;51.53152;51.53152;sale;-0.364943;false;1;2;0;1;UB6;Greenford;300000;;Flat;for_sale;Ruislip Road43365922;Currell - Islington;020 3478 3315;Residential; Key features: ??? Premier Islington position??? Grade II listed property??? Barnsbury conservation area??? Semi-detached with garage to side??? Private shingle carriage driveway??? 6 bedrooms, 4 Receptions, 3 bathrooms??? over 3,500 sq ft.??? Delightful mature gardens.This impressive semi-detached Grade II listed house is set in arguably the most sought after location in Islington. This private crescent traces its history back to a former Reed moat Field and Pond Field. Mr Whowell Esquire then paid plans for a leasehold estate which became the Mountfort Estate, whilst the villas were built circa 1845 and now within the Barnsbury conservation area. This attractive semi-detached villa enjoys a generous plot and wonderful aspect with over 3,500 sq. Ft. Of internal space. The house offers flexible living, currently laid out as six bedrooms and three bathrooms to the first and second floors. The ground floor is entered via a spacious hallway of grand proportions. The inner central hallway leads to a delightful reception room to the front with a tall sash bay window, ornate coving and great views of the external carriage drive. To the rear is a light and spacious dining room and conservatory with direct access to the wonderful garden. A further breakfast room and kitchen are also set to the rear. A cloakroom and back door leads to the garage which is built to the side of the house. The generous garden is arranged with well stocked mature borders, central pond and patio area and extending lawn area all enjoying a westerly aspect.   The basement provides plenty of good storage space and scope, subject to planning and building consents. Islington Green, Angel and Highbury & Islington stations are close by, whilst King's Cross and St Pancras stations are within 1.3 miles. Islington has a sophisticated and wide range of shops, restaurants, and bars. Local and internationally acclaimed theatres such as Sadler's Wells, the Almeida, King's Head and Little Angel all add to the cultural wealth of the area. The financial and legal centre of London is a 10 minute taxi ride away, whilst the Cross Rail II proposal will add further strength to the good transport links.Mountfort Crescent, Barnsbury N1;2017-03-28 00:34:21;https://lid.zoocdn.com/354/255/b4fa35a04c619bb073be8c00002bba9b61d90372.jpg;2017-03-28 01:41:27;51.542362;51.542362;sale;-0.112056;false;0;6;0;0;N1;London;4950000;;Semi-detached house;for_sale;Barnsbury London39999027;Currell - Clerkenwell;020 3478 3310;Residential; Key features: ??? Two bedroom??? Two bathroom??? Clerkenwell/Barbican fringe??? Available Early September??? FurnishedOn the second floor of this highly sought-after development in the heart of Clerkenwell, is this perfectly-formed two bedroom, two bathroom flat. The apartment measures approximately 701sq/ft, and benefits from a bright open-plan kitchen/reception room, two bedrooms (the master with an en-suite shower) and a further family bathroom. The finish throughout is of a good standard with integrated Bosch appliances to the kitchen and Villeroy & Boch suites to the bathrooms. The development has a week-day concierge and a communal courtyard.Barbican and Farringdon Stations are a short stroll away and there are great bus links into the City and the West End.Clerkenwell Road, Clerkenwell EC1M;2017-03-28 00:33:51;https://lid.zoocdn.com/354/255/bd398ad20e5f838beac580a1443cae2cfb8f110f.jpg;2017-03-28 00:33:51;51.52286;51.52286;sale;-0.098894;false;0;2;0;0;EC1M;London;775000;;Flat;for_sale;Clerkenwell London43365920;CityWest Residential Victoria;020 3542 2194;Residential;Spacious Two double bedroom split level tenth and eleventh floor flat situated close to Maida Vale tube station in W9. The accommodation comprises of an entrance hallway, kitchen, living room with door opening on to balcony, stairs to next floor where there are two double bedrooms and a bathroom and seperate WC. Approx 91 years remaining on lease, service charge approx. ??1300 per annum. Currently let for ??1800pcm, can be sold with vacant possession or with tenant in situ.Edinburgh House, Lanark Road, Maida Vale Estate, London W9;2017-03-28 00:33:51;https://lid.zoocdn.com/354/255/dcf5d9b99f021813c20e603e039683f11e2c229b.jpg;2017-03-28 01:41:26;51.531113;51.531113;sale;-0.185619;false;0;2;0;0;W9;London;420000;;Flat;for_sale;Lanark Road Maida Vale Estate London43365911;Colliers International New Homes, East;020 8128 1351;Residential;A spacious and bright 710 sq. Ft. 2 bedroom / 1 bathroom dual aspect flat located on the 16th floor facing north-east and south-east with a balcony within the Lend Lease development of Glasshouse Gardens.Colliers International is pleased to present this 2 bedroom flat located within Glasshouse Gardens, a brand new development set in landscaped gardens overlooking the Olympic legacy landmarks.Soundproofing to outperform current building regulations24 hour central concierge serviceLift access to all floorsLandscaped gardens including play area and event spaceCycle storagePart of London's exciting new address, Stratford, London, E20.Adjacent to Queen Elizabeth Olympic Park and Westfield Stratford London.Directly fronting a newly created parkland.Within 5 miles of 5 major universities.Just minutes from Stratford station - a key London transport hub.Stratford station offers 9 rail links and direct access to 150 stations.Will be further enhanced by Crossrail in 2019.Easy access to the City and the West End.Within easy reach of Heathrow Airport.Anticipated completion: Summer/Autumn 2017West Tower, Glasshouse Gardens, Westfield Avenue, London E20;2017-03-28 00:33:20;https://lid.zoocdn.com/354/255/cad73a856a173f34c35446e6f84a386fde2c9b93.jpg;2017-03-28 00:34:21;51.54684;51.54684;sale;-0.008773138;true;0;2;0;0;E20;;580000;;Flat;for_sale;Westfield Avenue London43365913;Colliers International New Homes, East;020 8128 1351;Residential;A spacious and bright 549 sq. Ft. 1 bedroom dual aspect flat located on the 24th floor facing north-east and south-east with a balcony within the Lendlease development of Glasshouse Gardens.Colliers International is pleased to present this 1 bedroom apartment located within Glasshouse Gardens, a brand new development set in landscaped gardens overlooking the Olympic legacy landmarks.Soundproofing to outperform current building regulations.24 hour central concierge service.Lift access to all floors.Landscaped gardens including play area and event space.Cycle storage.Part of London's exciting new address, Stratford, London, E20.Adjacent to Queen Elizabeth Olympic Park and Westfield Stratford London.Directly fronting a newly created parkland.Within 5 miles of 5 major universities.Just minutes from Stratford station - a key London transport hub.Stratford station offers 9 rail links and direct access to 150 stations.Will be further enhanced by Crossrail in 2019.Easy access to the City and the West End.Within easy reach of Heathrow Airport.Anticipated completion: Summer / Autumn 2017West Tower, Glasshouse Gardens, Westfield Avenue, London E20;2017-03-28 00:33:20;https://lid.zoocdn.com/354/255/afe1bc247124ac99b68d2a7837c960234af10fe1.jpg;2017-03-28 00:34:21;51.54684;51.54684;sale;-0.008773138;true;0;1;0;0;E20;;544000;;Flat;for_sale;Westfield Avenue London43365918;Colliers International New Homes, East;020 8128 1351;Residential;A spacious and bright 549 sq. Ft. 1 bedroom dual aspect flat located on the 10th floor facing north-east and south-east with a balcony within the Lendlease development of Glasshouse Gardens.Colliers International is pleased to present this 1 bedroom apartment located within Glasshouse Gardens, a brand new development set in landscaped gardens overlooking the Olympic legacy landmarks.Soundproofing to outperform current building regulations.24 hour central concierge service.Lift access to all floors.Landscaped gardens including play area and event space.Cycle storage.Part of London's exciting new address, Stratford, London, E20.Adjacent to Queen Elizabeth Olympic Park and Westfield Stratford London.Directly fronting a newly created parkland.Within 5 miles of 5 major universities.Just minutes from Stratford station - a key London transport hub.Stratford station offers 9 rail links and direct access to 150 stations.Will be further enhanced by Crossrail in 2019.Easy access to the City and the West End.Within easy reach of Heathrow Airport.Anticipated completion: Summer / Autumn 2017West Tower, Glasshouse Gardens, Westfield Avenue, London E20;2017-03-28 00:33:20;https://lid.zoocdn.com/354/255/923e4af7df41d560007119fc5112c7d6a9347844.jpg;2017-03-28 00:34:21;51.54684;51.54684;sale;-0.008773138;true;0;1;0;0;E20;;490000;;Flat;for_sale;Westfield Avenue London43365919;Colliers International New Homes, East;020 8128 1351;Residential;A spacious and bright 549 sq. Ft. 1 bedroom dual aspect flat located on the 11th floor facing north-east and south-east with a balcony within the Lendlease development of Glasshouse Gardens.Colliers International is pleased to present this 1 bedroom apartment located within Glasshouse Gardens, a brand new development set in landscaped gardens overlooking the Olympic legacy landmarks.Soundproofing to outperform current building regulations24 hour central concierge serviceLift access to all floorsLandscaped gardens including play area and event spaceCycle storagePart of London's exciting new address, Stratford, London, E20.Adjacent to Queen Elizabeth Olympic Park and Westfield Stratford London.Directly fronting a newly created parkland.Within 5 miles of 5 major universities.Just minutes from Stratford station - a key London transport hub.Stratford station offers 9 rail links and direct access to 150 stations.Will be further enhanced by Crossrail in 2019.Easy access to the City and the West End.Within easy reach of Heathrow Airport.Anticipated completion: Summer/Autumn 2017West Tower, Glasshouse Gardens, Westfield Avenue, London E20;2017-03-28 00:33:20;https://lid.zoocdn.com/354/255/decfd7ffcc1a46684764423931f3ba4775ffd07f.jpg;2017-03-28 00:34:21;51.54684;51.54684;sale;-0.008773138;true;0;1;0;0;E20;;490000;;Flat;for_sale;Westfield Avenue London43365912;Colliers International New Homes, East;020 8128 1351;Residential;A spacious and bright 560 sq. Ft. 1 bedroom dual aspect flat located on the 21st floor facing south-east and south-west with a balcony within the Lend Lease development of Glasshouse Gardens.Colliers International is pleased to present this 1 bedroom flat located within Glasshouse Gardens, a brand new development set in landscaped gardens overlooking the Olympic legacy landmarks.Soundproofing to outperform current building regulations.24 hour central concierge service.Lift access to all floors.Landscaped gardens including play area and event space.Cycle storage.Part of London's exciting new address, Stratford, London, E20.Adjacent to Queen Elizabeth Olympic Park and Westfield Stratford London.Directly fronting a newly created parkland.Within 5 miles of 5 major universities.Just minutes from Stratford station - a key London transport hub.Stratford station offers 9 rail links and direct access to 150 stations.Will be further enhanced by Crossrail in 2019.Easy access to the City and the West End.Within easy reach of Heathrow Airport.Anticipated completion: Summer / Autumn 2017West Tower, Glasshouse Gardens, Westfield Avenue, London E20;2017-03-28 00:33:20;https://lid.zoocdn.com/354/255/362618cfa684703bfc8fa8fb851662361c1c4cad.jpg;2017-03-28 12:57:49;51.54684;51.54684;sale;-0.008773138;true;0;1;0;0;E20;;498000;;Flat;for_sale;Westfield Avenue London43365908;Foxtons - Wood Green;020 8115 9903;Residential;A fantastic one bedroom ground floor flat, which provides stylish accommodation including a conservatory and 58' garden with a smart decked bbq area.Sidney Avenue is close to amenities around Bowes Park and Palmers Green, with nearby transport links including Palmers Green (National Rail) and Bounds Green Underground Station (Piccadilly Line).Sidney Avenue, Bowes Park N13;2017-03-28 00:32:50;https://li.zoocdn.com/992c102cfa2c4bd4ec80678de53319acc3eb9946_354_255.jpg;2017-04-07 10:39:11;51.61183;51.61183;sale;-0.111818;false;0;1;0;0;N13;London;375000;;Flat;for_sale;Sidney Avenue43365902;Anthony Pepe;020 3463 0350;Residential;A stunning five bedroom Victorian house arranged over three floors, located on one of the most prestigious roads on the 'Harringay Ladder'. Occupying 2,000 Sq Ft of living space, this superb house combines both original Victorian charm and contemporary functionality. The ground floor features a spacious reception room, kitchen/breakfast room and dining room which leads out to a stunning, picturesque rear garden. The ground floor also benefits from a shower room and abundance of storage space. The first and second floors boast five bedrooms and a well-proportioned family bathroom. Located moments away from Green Lanes, with its superb selection of shops and restaurants including the always popular coffee shops Blend and Beans & Barley, local favourite restaurant Bun & Bar and the organic food store Harringey Local Store. Crouch End Broadway and Finsbury Park are in easy walking distance.**Sole Agents**Burgoyne Road, London N4;2017-03-28 00:32:19;https://li.zoocdn.com/01f53081b4dbe797c834ae6f68dfaa245928523b_354_255.jpg;2017-04-07 00:43:09;51.578186;51.578186;sale;-0.100267;false;0;5;0;0;N4;London;1050000;;Terraced house;sold;London43365898;Alan De Maid - Bromley Sales;020 3463 0089;Residential;Located in the highly desirable Trinity Village Development is this beautifully presented four bedroom mid-terrace townhouse. The ground floor comprises  and modern fully integrated kitchen with top of the range appliances, dining area and direct access onto a lovely low maintenance south facing garden. Study with a floor to ceiling window and a downstairs cloakroom. The first floor consists of a storage cupboard, a bright and airy reception room and a music room with Juliet balcony that has the flexibility to be used as a fourth bedroom, family room or additional reception room. To the second floor, there is a large double bedroom, single room and modern family bathroom. On the third floor buyers will find a fantastic master suite with separate dressing area and en suite with shower. This property really does offer spacious living and oozes modern family living. It is also positioned in a fantastic location convenient for commuters wanting direct access into Central London, excellent local schooling and Bromley town centre. We truly feel that this property is perfect for those buyers wanting to secure their first family home. Benefits to this property include gas central heating, allocated parking and access to loft via hatch. Immediate viewing is recommended.Sullivan Row, Bromley BR2;2017-03-28 00:31:18;https://lid.zoocdn.com/354/255/82cec692a890bfb25de0a28d790a2d30bfca6acd.jpg;2017-03-29 00:28:03;51.38704;51.38704;sale;0.038794;false;3;4;0;0;BR2;Bromley;575000;;Town house;for_sale;Bromley