listing_id;agent_name;agent_phone;category;description;displayable_address;first_publish_date;image_url;last_publish_date;latitude;listing_status;longitude;new_home;num_bathrooms;num_beedrooms;num_floors;num_recepts;outcode;post_town;price;price_change;property_type;status;street_name43365894;Space Residential;020 8022 4399;Residential;Offering huge potential a ground floor maisonette with direct access to a large private rear garden. Located only a few hundred meters from The Broadway Mill Hill with its excellent variety of shops, restaurants and transport network.Accommodation comprises a bright front living room with a double glazed Bay window, a fitted bathroom and kitchen, and a Master bedroom to the rear with direct access to garden.There is also a smaller room which ideally lends itself to a nursery/kids bedroom or office as you have to pass through it to reach the Master bedroom.The current layout could potentially be altered and/or extended to suit a new purchaser subject to obtaining the correct planning permissions if required.To the rear is a generous garden with a raised decking area.Entrance HallLiving Room - 13' 0'' x 12' 0'' (3.95m x 3.65m)Bright room with bay window to frontKitchen - 8' 10'' x 7' 0'' (2.69m x 2.13m)Fully fitted kitchen with a range of appliances, gas hob and extractor oven.Family BathroomWhite suite with bath and shower attachment, sink and W.C.Bedroom 1 - 11' 2'' x 9' 6'' (3.4m x 2.9m)Large double bedroom with fitted wardrobes spanning the length of one wall. Double doors leading out onto the garden and decking at the rearOffice/Nursery - 10' 10'' x 6' 7'' (3.3m x 2m)Please note that this room would ideally be used as a kids bedroom/nursery or possibly an office as you do need to pass through it to reach bedroom 1.Rear GardenAccessible from Bedroom 1 onto a raised decked area and leading out to a private rear garden.ParkingThere appears to be a hard standing driveway at the front suitable for off-street parking although this would need to be confirmed.Hale Grove Gardens, London NW7;2017-03-28 00:30:48;https://lid.zoocdn.com/354/255/024448c7c61e3595c565969f9b75516000dc0b15.jpg;2017-03-31 22:17:30;51.615253;51.615253;sale;-0.252016;false;1;1;0;1;NW7;London;300000;;Maisonette;for_sale;Hale Grove Gardens43365874;Aston Fox;020 8128 0178;Residential;Price Guide - ??250,000 to ??270,000Please be aware this is a sale by tender property and the prospective purchaser will incur an introductory fee to Aston Fox.Great first purchase!Ideally located on this premier turning in Beckton is this spacious two bedroom ground floor flat which is perfectly located for access to Beckton DLR and local amenities. The flat itself boasts of a spacious lounge, fitted kitchen and bathroom, two well sized bedrooms and externally there is a small courtyard garden and main front garden.The property also benefits from an allocated parking space which is located at the rear of the property. Close by to the property there are two shopping centres, Lidl and Asda.Transport links are excellent through Beckton with various DLR stations throughout the area. There are also bus stops scattered all over, and road links are good with the A406, A13 and M11 giving access to London and the surrounding area.This flat is a great first purchase ideal for a first time buyer or investment so call now to view!Ground FloorReception 1' 9" x 11' (0.53m x 3.35m)Kitchen 9' 5" x 8' 9" (2.87m x 2.67m)Bedroom One 12' x 9' 9" (3.66m x 2.97m)Bedroom Two 9' 4" x 7' 7" (2.84m x 2.31m)Bathroom 6' 6" x 6' 5" (1.98m x 1.96m)Garden 11' 11" x 5' 11" (3.63m x 1.80m)Evelyn Denington Road, Beckton, London E6;2017-03-28 00:26:14;https://lid.zoocdn.com/354/255/de5682b02156a6b42e3eb00ada3e513b2d0b66e1.jpg;2017-04-04 00:29:05;51.517925;51.517925;sale;0.055502;false;0;2;0;0;E6;London;250000;;Flat;for_sale;Evelyn Denington Road Beckton43365875;Foxtons - St John's Wood;020 3463 7508;Residential;A stunning two bedroom flat situated on the second floor of a secure purpose-built block boasting modern interiors throughout, a lovely private balcony and an excellent St Johns Wood location.The property is situated moments from a range of shops and amenities that can be found in St Johns Wood while the green open spaces of Regent's Park are also within close proximity.Grove End Road, St John's Wood NW8;2017-03-28 00:26:14;https://lid.zoocdn.com/354/255/cdf8481b296af7063b72ed952f9f0535d102dbb4.jpg;2017-03-30 10:32:41;51.52953;51.52953;sale;-0.176902;false;0;2;0;0;NW8;London;995000;;Flat;for_sale;Grove End Road43365876;Foxtons - St John's Wood;020 3463 7508;Residential;An exceptional three bedroom maisonette offering stylish and well presented accommodation set within an impressive period conversion close to local amenities and transport links.Mortimer Crescent offers a peaceful location moments from the bustling amenities of Kilburn High Road, with Maida Vale and St John's Wood also conveniently close by. Local transport links include Kilburn Park Underground Station.Mortimer Crescent, St John's Wood NW6;2017-03-28 00:26:14;https://li.zoocdn.com/39d91e33b5b343a3dc2cb77df59efefa5fbd289a_354_255.jpg;2017-04-07 10:31:16;51.53718;51.53718;sale;-0.187209;false;0;3;0;0;NW6;London;1150000;;Flat;for_sale;Mortimer Crescent43365865;Jeremy Leaf & Co;020 8022 1661;Residential;Located on the south side of this lovely bright tree-lined road, a spacious four bedroom semi-detached family house with home office, utility room, basement and garage. This property extends to 2,200 sq. Ft. And benefits from a south-facing landscaped mature garden. Offered chain free. Viewing advised.HallwayDouble radiator, fitted coat cupboard, cornice to ceiling.Through ReceptionBay window to front, double glazed casement doors to rear, four double radiators, cornice to ceiling, two marble fireplaces with automatic and remote gas fires.Morning RoomDouble glazed casement window to rear, double radiator, fitted cupboards, air conditioning unit, pantry.KitchenMatching fitted units incorporating oven, hob, extractor hood and single sink, integrated dishwasher, fully-tiled walls. Leading to garage, guest WC, utility area and study/office.Guest WCPedestal wash hand basin, WC, frosted window to side.Utility AreaWall mounted boiler.Study/OfficeFitted shelves and cupboards, double glazed windows, two single radiators, air conditioning unit.First Floor LandingAspect to side and front, single radiator, airing cupboard, access to loft.Bedroom 1Casement bay window to front, four double radiators, cornice to ceiling, fitted wardrobes, electric fire.Bedroom 2Double-glazed casement window to rear, fitted wardrobes, cornice to ceiling, vanity wash hand basin.Bedroom 3Double-glazed casement window to rear, fitted wardrobes, double radiator, cornice to ceiling, vanity wash hand basin, air conditioning unit.Bedroom 4Casement window to side, fitted wardrobes, single radiator.BathroomTiled bath with power shower attachment and shower screen, wash hand basin, frosted window to side, fully tiled walls, heated towel rail, fitted cupboards, heated mirror, shaver socket.Separate WCWC, pedestal wash hand basin, fully-tiled frosted PVC window to side.CellarAccessed from garden via entrance below French doors.GardenSplit level terraces overlooking south-facing 100ft landscaped mature garden, laid lawn, two sheds.Garageplease note that some archived photos have been used(EPC) eec OnlyFriern Watch Avenue, North Finchley N12;2017-03-28 00:23:42;https://lid.zoocdn.com/354/255/b68bb374e2ca06c66625ba06da7abb6aeafdf2cd.jpg;2017-03-31 21:47:57;51.61906;51.61906;sale;-0.174789;false;0;4;0;0;N12;London;1060000;;Semi-detached house;for_sale;Friern Watch Avenue North Finchley43365838;Fletcher Estates;020 8166 7820;Residential;A stunning five bedroom Victorian home with three bath/shower rooms, a large through reception, extended kitchen/dining room, downstairs WC and utility room, to the rear is an attractive 30' garden and to the front is off-street parking for one car.Barrowgate Road is a highly sought after road off Sutton Court Road, within a quarter of a mile of Chiswick Park and Gunnersbury underground stations and within 200 metres of the A4, providing easy access in and out of London.Barrowgate Road, London W4;2017-03-28 00:13:59;https://li.zoocdn.com/d59693c6206358d6507ad5760ea049d0d633bfc8_354_255.jpg;2017-03-28 00:15:50;51.48868;51.48868;sale;-0.268629;false;3;5;0;2;W4;London;1575000;;;for_sale;43365834;Foxtons - Earlsfield;020 3544 2580;Residential;Situated within a fantastic development this superb ninth floor one bedroom apartment is presented in excellent condition and benefits from a balcony with far-reaching views.Mapleton Road is located close to the many amenities of Wandsworth, with the popular Southside Shopping Centre and recreational facilities just moments away. The nearest station is Wandsworth Town and the motorist is well served by the nearby A3.Mapleton Road, Wandsworth Town SW18;2017-03-28 00:12:09;https://li.zoocdn.com/b92bde01c8fa18a3b0e1255175da00b95c4b2efb_354_255.jpg;2017-04-07 14:11:43;51.453087;51.453087;sale;-0.193752;false;0;1;0;0;SW18;London;395000;;Flat;for_sale;Mapleton Road43365815;Toomey Estate Agents;020 8166 7811;Residential;The property comprises two separate reception rooms and kitchen to the ground floor with three bedrooms and family bathroom to the first floor.Despite requiring modernisation the property still benefits from double glazing, garden and access to local amenities and transport links.Part glazed front door leading to entrance hallStairs to first floor, power points, under stairs storage cupboard, wall mounted gas heater.Reception room  12???8 x 10???11Double glazed window to front aspect, feature fireplace, power points, picture rail.Dining room  13??? x 11???Double glazed patio doors to garden, feature fireplace, power points, picture rail.Kitchen  9???3 x 5???9Range of base and wall mounted units, work surfaces with stainless steel sink unit. Space for appliances, ceramic tiled splash backs, power points, part glazed door to garden, tiled flooring.First floor landingHatch giving access to loft area, picture rail.Bedroom one  12???5 x 11???Double glazed window to front aspect, power points, picture rail.Bedroom two  12???5 x 11???Double glazed window to rear aspect, power points, cupboard housing hot water heater, ceiling coving, picture rail.Bedroom three  8???8 x 6???Double glazed window to front aspect, power points, picture rail.BathroomPanel enclosed bath with mixer tap and shower attachment, pedestal hand basin, low flush WC. Walls fully tiled in ceramics, double glazed window to rear aspect, vinyl flooring.GardenPatio area with balance laid mainly to lawn, flower bed borders, garden shed, gate giving rear access.Disclaimer : The details supplied by Toomey Estate Agents are a guideline and do not form any part of a contract. The services have not been tested and cannot be guaranteed to be in working order.Hatton Gardens, Mitcham CR4;2017-03-28 00:09:37;https://li.zoocdn.com/012f274b061ef6e64d62f0fb328f4768fe70e3bd_354_255.jpg;2017-04-01 00:42:12;51.394672;51.394672;sale;-0.162647;false;1;3;0;2;CR4;Mitcham;375000;;Terraced house;for_sale;43365787;Foxtons - Ealing;020 3542 2188;Residential;A fantastic three bedroom, two bathroom maisonettes with a shared patio, one en suite bedroom, bright contemporary interiors situated in a brilliant location near transport links and amenities.The Broadway has a number of shops, bars and restaurants and the property faces the green open spaced of Dean Gardens. West Ealing Station is also nearby.Witham Road, West Ealing W13;2017-03-28 00:09:36;https://lid.zoocdn.com/354/255/03a436d3860daa6d60c8156b7279a3a67301dbd9.jpg;2017-03-28 00:09:36;51.51094;51.51094;sale;-0.32128;false;0;3;0;0;W13;;549950;;Flat;for_sale;Witham Road43414683;Wilkinson Byrne;020 3544 2529;Residential;Wilkinson Byrne have the pleasure of offering for sale this very impressive and well proportioned two double bedroom first floor conversion. This attractive period conversion is conveniently sited to offer access to both Wood Green and Turnpike Lane Underground Stations (Piccadilly Line) and Wood Green High Road with its vast array of shops and restaurants is just a stones throw away. Well presented throughout the property boasts a modern and very well fitted kitchen, modern main bathroom and en-suite to main bedroom  there is also double glazing and the current vendor informs us that the property is being sold with a Share of the Freehold.Property Ref:84_1757_4398527Willingdon Road, London N22;2017-03-28 00:07:52;https://lid.zoocdn.com/354/255/60daaef57622d666aa5b24d30b0c7c9d27f47df6.jpg;2017-04-05 11:58:05;51.593548;51.593548;sale;-0.100463;false;0;2;0;0;N22;London;435000;;Flat;for_sale;Willingdon Road Wood Green43365774;Foxtons - Clerkenwell;020 3463 2552;Residential;This is an excellent one bedroom apartment set within a desirable development, boasting immaculate interiors, a vibrant and well equipped kitchen and a charming double bedroom.Queens Quay Apartments are situated just off the banks of the River Thames, while the nearest station is Mansion House. There can be found many amenities of all varieties in the City nearby.Upper Thames Street, Blackfriars EC4V;2017-03-28 00:07:52;https://lid.zoocdn.com/354/255/9f08c6e9862d24e167af9d704b0ed9fb04361e92.jpg;2017-03-30 10:08:21;51.510723;51.510723;sale;-0.095667;false;0;1;0;0;EC4V;London;699950;;Flat;for_sale;Upper Thames Street43365778;Wilkinson Byrne;020 3463 0327;Residential;Wilkinson Byrne have the pleasure of offering for sale this very impressive and well proportioned two double bedroom first floor conversion.This attractive period conversion is conveniently sited to offer access to both Wood Green and Turnpike Lane Underground Stations (Piccadilly Line) and Wood Green High Road with its vast array of shops and restaurants is just a stones throw away.Well presented throughout the property boasts a modern and very well fitted kitchen, modern main bathroom and en-suite to main bedroom  there is also double glazing and the current vendor informs us that the property is being sold with a Share of the Freehold.Property Ref:84_1884_4391857Willingdon Road, London N22;2017-03-28 00:07:52;https://lid.zoocdn.com/354/255/dd4141348edae4c14785a000dc783a5e21bfac44.jpg;2017-04-05 11:58:05;51.593548;51.593548;sale;-0.100463;false;0;2;0;0;N22;London;435000;;Flat;for_sale;Willingdon Road Wood Green43365775;Foxtons - Crouch End;020 3544 2505;Residential;Bright and airy throughout, this charming one bedroom ground floor flat features a lovely reception room and a spacious kitchen. It also benefits from direct access to a shared patio.Hollam House is quietly located on a private road close to the amenities around Turnpike Lane and Crouch End, while Alexandra Park and Finsbury Park are both close by.Denmark Road, Harringay N8;2017-03-28 00:07:52;https://li.zoocdn.com/0a2023fce5c71e4a0c278a81ca4b2dd3fd577212_354_255.jpg;2017-04-07 10:08:23;51.587772;51.587772;sale;-0.110795;false;0;1;0;0;N8;London;350000;;Flat;for_sale;Denmark Road35147156;Walter & Mair;020 7768 6703;Residential;Main Description:An extremely attractive semi-detached house situated in this sought after tree lined road on the favoured west side of Coulsdon. The property has been extended and improved and now comprises a wonderful bright Kitchen/Dining Room with part vaulted ceiling with large velux window. The Kitchen is fitted with a range of wood fronted units and drawers with granite work tops and inset sink, gas hob, integrated oven and heated tiled floor. The Lounge is a double aspect room with attractive fireplace and there is a double aspect Study with oriel bay windows to the front and side. There is a refitted Bathroom with jacuzzi bath, circular basin set in a shaped granite top and wc and heated floor.Upstairs, the Master Bedroom is at the front with a bay window, enjoying an open outlook and an En-Suite Shower Room with power shower, corner basin and wc. There are three further Bedrooms and a separate wc.Outside, the rear garden is laid to a well tended lawn with mature hedges to the rear boundary. The front comprises a nearly level lawn and driveway providing parking for several vehicles and access to a large Garage.EPC value: DNutfield Road, Coulsdon CR5;2017-03-28 00:05:07;https://li.zoocdn.com/7316e15e0c1a5e805fbe3bc3040f44ee40bf1eeb_354_255.jpg;2017-04-06 23:02:05;51.319626;51.319626;sale;-0.158543;false;0;4;0;0;CR5;Coulsdon;525000;;Semi-detached house;sold;West Coulsdon Surrey43476671;Foxtons - Greenwich;020 8128 2418;Residential;Situated on the peaceful Lenthorp Road, this charming two bedroom, mid-terrace house benefits from a bright and spacious interior with plenty of storage.Lenthorp Road is a residential no through road which benefits from a close proximity to the array of amenities found in nearby Greenwich Village. For excellent transport links into central London, Westcombe Park Station is also easily accessible.Lenthorp Road, Greenwich SE10;2017-03-28 00:05:07;https://lid.zoocdn.com/354/255/64cffdad1203237594f3223360728986f8eab15a.jpg;2017-04-07 10:34:46;51.488525;51.488525;sale;0.01062;false;0;2;0;0;SE10;London;425000;;;for_sale;Lenthorp Road43365743;Coombe Residential;020 3478 3571;Residential;Accommodation comprises:Entrance Hall with Wooden Floors and Cloaks Cupboard | Stunning Open Plan Reception Room/Kitchen with double aspect leading to decked Balcony with striking views | Fully Fitted Bespoke Kitchen with leathered granite worktop, range of high quality appliances including wine fridge with Wooden Flooring | Master Bedroom suite with range of fitted wardrobes and Spa inspired en-suite Shower Room | Two Further double Bedrooms | Impressive family bathroom with walk-in shower and mood lightingamenities include:Basement Storage and Two Secure Underground Parking Spaces | Under floor Heating | Electric Gates to DevelopmentContemporary Feature FireplaceLocationWarren Road, a tree lined through road, lies equidistant between Kingston and Wimbledon town centres. Both have excellent shopping facilities, from department stores housing concessions found in famous West End Streets and specialised boutiques to a wide range of restaurants meeting the palates from across the world. The A3 trunk road offers fast access to central London and both Gatwick and Heathrow airports via the M25 motorway network. The nearest train stations at Norbiton and New Malden are within walking distance, and the 57 bus route runs along nearby Coombe Lane West to Wimbledon from which there are frequent services to Waterloo with its underground links to points throughout the city. The immediate area offers a wide range of recreational facilities including five golf courses, tennis and squash clubs and many leisure centres. The 2,360 acres of Richmond Park, an area of outstanding beauty is easily accessed from Ladderstile Gate (pedestrian/cycle entrance only), and provides a picturesque setting in which to picnic, go horse riding, jogging or just take a leisurely walk. Theatres at Wimbledon and Richmond are also popular alternatives to the West End. There are numerous excellent local schools for all ages, private, state, and a variety of international educational establishments many within walking distance.Warren Road, Coombe, Kingston Upon Thames KT2;2017-03-27 23:59:27;https://lid.zoocdn.com/354/255/efbd25642d17a12e0040a05bdce37bcdc4b18f53.jpg;2017-04-04 00:05:20;51.423103;51.423103;sale;-0.271296;false;0;3;0;0;KT2;Kingston upon Thames;1645000;;Flat;for_sale;Warren Road Kingston upon Thames39057897;Lawrence Rand;01895 262111;Residential;This attractive three bedroom end of terrace house, has been extended and offers a versatile floorplan for the growing family.The accommodation comprises: Enclosed porch way opens into a lobby with stairs rising to the first floor and access into the lounge and bedroom three. The spacious light filled lounge boasts a modern inset fire and lovely parquet flooring, single door leads through into the large kitchen. The neatly appointed kitchen has a range of base and eye level units with built in oven, hob and extractor fan, from the kitchen an internal hallway leads to the study, utility room and WC.Rising to the first floor there are two double bedrooms and two bathrooms, one bathroom has a wash hand basin and bath tub with the other featuring a wash hand basin WC and shower cubicle.The rear garden is mainly paved for ease with the garage at the bottom accessed via a rear service road, while the neat paved frontage provides off street parking.Hartland Drive is a tranquil tree lined residential road enjoying its setting close to the great amenities of South Ruislip and Eastcote, with local transport links available (Metropolitan/Piccadilly and Central/Main lines) For the motorist the A40/M25 is a short drive away providing access to Central London and the Home Counties. For families, there are a number of highly regarded schools that cater for children of all ages within close proximity.Hartland Drive, Ruislip, Middlesex HA4;2017-03-27 23:47:15;https://lid.zoocdn.com/354/255/0e8e86a1d67cc68c625170af645bd05645fccf2b.jpg;2017-03-29 23:32:37;51.561234;51.561234;sale;-0.399266;false;0;3;0;0;HA4;Ruislip;550000;;End terrace house;for_sale;Ruislip Middlesex43365601;Greenfield Estate Agents;020 3641 4240;Residential;A great opportunity to purchase this larger than average two double bedroom ground floor maisonette situated opposite Tolworth Junior School. The property benefits from two good size bedrooms, modern kitchen and a extended living/dining room with double doors leading to a private garden and garage in block. The property also benefits from a family bathroom and ownership of the freehold. A early viewing is highly recommended to avoid disappointment.Douglas Road, Tolworth, Surbiton KT6;2017-03-27 23:31:31;https://lid.zoocdn.com/354/255/50f5855c64092f21bce76ea5913fe47a1df6f39a.jpg;2017-04-04 00:13:30;51.38292;51.38292;sale;-0.293619;false;1;2;0;1;KT6;Surbiton;469950;;Maisonette;for_sale;41509013;Tatlers;020 3542 2136;Residential;Set on the ground floor of a mid terraced period residence is a well-presented two bedroom purpose built Edwardian flat which benefits from its own private entrance and direct access to its own private rear garden. The property is being offered in very good condition throughout whilst retaining many original period features  added benefits also include an eat-in kitchen/breakfast room. Positioned within a short distance from Alexandra Park, Palace with its main line station providing easy access to the City (Moorgate and Old Street). Also close at hand is Bounds Green tube station (Piccadilly Line). Within catchment of Alexandra Park secondary school.Entrance HallwayOriginal black and white tiled flooring, dado rail, coving, under stairs storage cupboard, cloak cupboard.Reception Room15???1 x 12???6 (4.60m x 3.82m). Gas coal flame effect fireplace with tiled inserts, pine surround, slate hearth, original stripped and polished pine floorboards, fitted shelves in alcoves, coving, ceiling rose.Bedroom 111???8 x 11???8 (3.56m x 3.56m). Cast iron period fireplace with tiled inserts, slate hearth, built in cupboard.BathroomPanelled bath with hot and cold taps, wall mounted shower attachment, partly tiled walls, pedestal wash hand basin, low level wc, heated towel rail.Bedroom 28???7 x 6???8 (2.62m x 2.03m). Laminated wood effect flooring.Kitchen/Breakfast Room12???5 x 10???8 (3.78m x 3.25m). Fitted wall and base units, wood block work tops, stainless steel gas hob, tiled splash backs, stainless steel extractor hood, stainless steel built in under oven, stainless steel sink and drain unit with mixer tap, plumbing for dishwasher and washing machine, wall mounted gas central heating boiler, laminated wood effect flooring, door to garden.GardenBeautifully landscaped rear garden, mainly paved with various flower beds and ever greens,Albert Road, Alexandra Park, London N22;2017-03-27 23:30:01;https://lid.zoocdn.com/354/255/24e9f925891be501463b3c56af1cd0e717843a85.jpg;2017-03-27 23:31:02;51.60168;51.60168;sale;-0.129235;false;0;2;0;0;N22;London;569950;;Flat;for_sale;Albert Road Alexandra Park43365569;YOPA;020 8022 6348;Residential;Spacious semi-detached house conveniently situated for transport links and the wonderful shopping at Brent Cross and moments away from Tesco superstore. This house offers a large through reception room, fully fitted kitchen, guest cloakroom, 4 bedrooms fully carpeted, 2 shower rooms, a large garden and off street parking for 4 cars. Gas central heating and double glazed throughout. Scope for expansion subject to consent.Entrance hallWood flooring, under stairs storage and guest cloakroom.Reception room30'0 x 13'0Huge through reception room/dining area with dual aspect double glazed bay windows to front and sliding doors to rear garden.Kitchen12'8 x 7'3Fully fitted kitchen with wood flooring. Door to back garden. Washing machine, dishwasher, microwave oven and gas hob with extractor fan, space for fridge/freezer.Master bedroom14'5 x 10'9Rear aspect double glazed windows and fully fitted wardrobes.Bedroom two13'6 x 11'2Front aspect double glazed windows and fully fitted wardrobes.Bedroom three8'7 x 7'0Front aspect double glazed windows and fully fitted wardrobe.Bedroom four8'7 x 6'7Rear aspect double glazed windows and fully fitted wardrobe.Shower roomTiled floor with shower unit and W.C. And hand basin.Shower room twoTiled floor with shower unit.DrivewayLarge driveway for 4-6 carsGardenPatio leading onto large garden.Hocroft Walk, Hendon Way, London NW2;2017-03-27 23:11:52;https://li.zoocdn.com/c3d8cd020699bc98baa3e43b8e48207867902e70_354_255.jpg;2017-03-28 20:58:24;51.57089;51.57089;sale;-0.210356;false;3;4;0;2;NW2;London;795000;;Semi-detached house;for_sale;Hendon Way