listing_id;agent_name;agent_phone;category;description;displayable_address;first_publish_date;image_url;last_publish_date;latitude;listing_status;longitude;new_home;num_bathrooms;num_beedrooms;num_floors;num_recepts;outcode;post_town;price;price_change;property_type;status;street_name43380563;Andrew Pearce Estate Agents & Chartered Surveyors;020 8166 1799;Residential;  The accommodation on offer comprises  own communal front door with stairs leading to  front door, entrance hallway, fitted kitchen with a range of base and wall units and a wall mounted boiler, lounge with laminated wood flooring and two double glazed windows to overlooking the front aspect, two good sized bedrooms and a family shower room.Outside the property has access to a large communal roof terrace.Located on Kenton Road, above a well-established car garage( B1/B2  Light industrial use) the property is ideally positioned for convenience just approximately 100m from Kenton's Bakerloo and British Rail Line Stations. Northwick Park Hospital, Northwick Park Metropolitan Line, Westminster University and Harrow on the Hill are all located close by.The property is to be sold with a brand new lease, granted upon completion and is also offered for sale with no upward chain.Kenton Park Parade, Kenton Road, Queensbury, Harrow HA3;2017-03-29 07:10:00;https://li.zoocdn.com/5076ae573f88b1749b4f61e95bf35d39c1f423bb_354_255.jpg;2017-04-05 07:43:12;51.581066;51.581066;sale;-0.318394;false;1;2;0;1;HA3;Harrow;299950;;Flat;for_sale;43380463;Purplebricks, Head Office;01926 267659;Residential;Beautifully presented two bedroom conversion flat in central Wallington. With an open plan lounge-dining room, large kitchen and private garden, this is a fantastic property ideal for 1st time buyers and young families.The property is located on the 1st floor of this Victorian period conversion and has a large open plan lounge-dining room as the main reception room area. This is a great space and has room for a large sofa to one side and dining table & chairs. There is a lovely original open fire place and surround and all the windows have been replaced with sash windows and shutters.The large kitchen has plenty of cupboard space, integrated 5 ring has hob and electric fan oven, 'smeg' dishwasher and washing machine. There is also a 'Worcester' combi boiler to one side.The master bedroom has fitted wardrobes to one side and shutters across the window, the second bedroom has space for a single bed and cupboards/wardrobes. The modern fitted bathroom is fully tiled throughout with a shower over the bath, w/c, hand basin with storage below and heated towel rail.Share of Freehold.Service Charge - ??70 per calendar month.OutsideTo the front there is a communal lawn/garden area and driveway space down the side of the property. This driveway space is on a 'first come, first served' basis and there is parking on the road which is not permitted.At the rear of the property there is a private garden area currently in some need of attention but it could be an ideal private space for use during the Summer months. At the far end of the property there is a secure storage cabin area for use with this property.LocationThe property is located on Maldon Road which is just off Wallington High Street. Wallington train station is within 0.4 miles and has trains into London Victoria and London Bridge.For schools, Holy Trinity CofE Primary, Beddington Infants and Bandon Hill Primary are all within 0.6 miles and for secondary, Wallington County Grammar and St. Philomena's Catholic School for Girls are both within 0.9 miles.Wallington High Street has a great array of shops, restaurants and local amenities.Maldon Road, Wallington SM6;2017-03-29 06:46:19;https://lid.zoocdn.com/354/255/70013f3c17f76e7fa1239ca4f8542d35e9690afc.jpg;2017-03-30 20:40:45;51.365025;51.365025;sale;-0.147917;false;1;2;0;1;SM6;Wallington;325000;;Flat;for_sale;Maldon Road43380430;Brian Cox - North Harrow;020 8033 9322;Residential;This spacious and well presented three bedroom terraced property enters the market with Brian Cox Estate Agents. The property is situated close to shopping facilities, Metropolitan line train station and sought after schools including Vaughan school. Accommodation: Entrance hall, spacious lounge, dining room and a fitted kitchen. Upstairs are three good sized bedrooms and family bathroom. Further benefits include gas central heating, double glazing, own drive, detached garage and an attractive 70ft rear garden.Grosvenor Avenue, Harrow HA2;2017-03-29 06:38:17;https://lid.zoocdn.com/354/255/f87d33f0b54f195c15ddcde61a2187b418c43dd7.jpg;2017-03-30 01:41:52;51.580685;51.580685;sale;-0.357593;false;1;3;0;2;HA2;Harrow;549950;;Terraced house;for_sale;Grosvenor Avenue43380426;McMahon & Partners;020 8128 9393;Residential;Two fifty one Southwark Bridge Road, situated in the heart of Southwark, London, SE1. This stunning 41 storey tower, offering a variety of studio, one, two and three bedroom apartments, all with fabulous views of the London city skyline. With fantastic on site facilities including 24 hr concierge service, on site club, gymnasium and cinema. There is also a wonderful residents garden, cafes and restaurants. Due for completion in autumn 2017, these apartments offer an outstanding opportunity for the investor, with further ongoing development, this is the ideal time to buy in this fabulous development, and enjoy further long term capital growth.Southwark Bridge Road, London SE1;2017-03-29 06:35:46;https://lid.zoocdn.com/354/255/aabaa3a8b3d77573208354e045c6abcea9b2d7f1.jpg;2017-03-29 06:36:47;51.498512;51.498512;sale;-0.099778;false;2;2;0;1;SE1;London;825000;;Flat;for_sale;251 Southwark Bridge Road43380423;Hawes & Co - Wimbledon Broadway;020 3478 3352;Residential;Hawes & Company present to the market this fabulous four bedroom Victorian family residence restored and extended by the current owners, located in this ideal road within the heart of Wimbledon. Very close to Wimbledon Mainline Train Station, shopping and leisure amenities. The very popular Dundonald Primary School is close by.Graham Road, London SW19;2017-03-29 06:34:13;https://lid.zoocdn.com/354/255/7fa65dc5b595fa31e91eea8e65fc54b727855bb7.jpg;2017-03-30 01:41:52;51.418476;51.418476;sale;-0.206406;false;2;4;0;1;SW19;London;1095000;;;for_sale;Graham Road43380419;Move Revolution;01737 339305;Residential;Property overview  A spacious three double bedroom detached family home offered to the market in excellent condition throughout with many original features retained and enhanced by the current owners and superbly located for Purley Town centre and mainline station.Location   Purley Park Road is located just off the Brighton Road and is a residential area comprising of mainly Victorian era homes The road offers the perfect balance of convenience for local amenities but set within a quiet location as Purley Station is just 0.7 of a mile away.Purley town centre boasts an array of local bars and restaurants as well as a 24 hour Tesco superstore.Accommodation   The accommodation briefly comprises of entrance hall, spacious lounge with original feature fireplace, a wonderfully appointed kitchen / dining room which is absolutely perfect for entertaining with doors leading onto the garden.To the first floor there are three well proportioned double bedrooms, family bathroom with bath and separate shower and the added benefit of an en-suite shower room to the master bedroom.Externally to the front there is off street parking for two vehicles.The rear garden is mainly laid to lawn with a patio and selection of mature trees, shrubs and plants. There is also the benefit of a wooden outbuilding with power and light which is currently being used as an office.Internal viewings are strongly recommended so call us now to arrange your appointment.Purley Park Road, Purley CR8;2017-03-29 06:33:12;https://lid.zoocdn.com/354/255/6b85138bf7bd67083745436c9a8752117652d0ad.jpg;2017-03-30 01:41:52;51.342953;51.342953;sale;-0.106047;false;2;3;0;2;CR8;Purley;675000;;Detached house;for_sale;42170794;Move Revolution;01737 339305;Residential;Property overview  A modern family home in excellent decorative order throughout, situated in a quiet residential location on the borders of Colliers Wood and Mitcham.Location  Horner Lane is a modern residential road situated on the borders of Colliers Wood and Mitcham,The property is located just a short walk from Phipps Bridge tramlink stop which offers an excellent and regular service into both Wimbledon and East Croydon. Colliers Wood underground station is only a short walk from the property and from here you can catch the Northern Line into London.There are a choice of excellent local schools nearby such as The London Acorn School and Harris Academy.Morden Hall Park is only a short walk away for those Sunday afternoon strolls and there are a plethora of local dining options to choose from,accommodation  The property has been well cared for and improved throughout during the owners tenure of the property.The accommodation briefly comprises entrance hall, downstairs wc, spacious living room and an open plan kitchen / dining area with fitted appliances.Upstairs there are two double bedrooms, further single bedroom and a refitted family bathroom.Outside there is a well maintained south facing rear garden and a driveway providing off street parking for two cars.Call us now to arrange your internal viewing of the property.Horner Lane, Mitcham CR4;2017-03-29 06:33:12;https://lid.zoocdn.com/354/255/13c0de85428f0e868f400f3c267c1e17bf8fd65a.jpg;2017-04-04 10:09:10;51.40648;51.40648;sale;-0.178694;false;1;3;0;2;CR4;Mitcham;425000;;End terrace house;for_sale;43380389;Doorstep Agents National;020 8033 7497;Residential;Private gated off street parking, Share of freehold, a lift, Quiet one west facing bedroom apartment, situated in a very convenient location within walking distance of various local amenities including shops, various supermarkets and high street banks.Share of freehold This property comes with parking.There are very good transport links to the surrounding area and it is approximately a 30 minute drive to Westfield West London.Briefly the accommodation comprises bright and spacious open plan living room/kitchen with the kitchen area having an extensive range of white high gloss wall and base units with various built-in appliances including oven, hob, extractor and fridge/freezer. There is ample space for under unit appliances including washing machine and dishwasher and a space for a microwave plus there is also space in the open plan area for a dining table and chairs. Both the living/dining and kitchen areas have lots of natural light flooding in from a large picture window and there is the benefit of attractive wooden flooring throughout. The apartment is warmed by electric heating. Further accommodation includes a light and airy double bedroom and an attractively fitted bathroom with tasteful designer style fittings including bath with over bath shower. The property has an intercom entry system, is serviced by a lift and has the added benefit of allocated shared car parking.Viewing is a must on this property for any single first time buyer or couple or landlord looking to acquire an investment property with rental potential.AccommodationLiving Room/Kitchen ??? 5.29m (17???4???) x 4.22m (13???10???)Open plan living/dining room/kitchen ???Living area ??? space for living and dining furniture, wooden flooring, electric heater, power points, large picture window to side elevation.Kitchen ???extensive range of white high gloss wall and base units incorporating built-in oven, hob and extractor hood, built-in fridge/freezer, space for under unit appliances including dishwasher and washing machine, space for microwave, inset ceiling downlighting, multiple power points, wooden flooring.Bedroom ??? 3.55m (11???8???) x 3.35m (11???0)Wooden flooring, electric heater, power points, window to side elevation.Bathroom - 1.79m (5???10???) x 1.64m (5???5???)White fitted bathroom suite with low level W.C, wash hand basin, panelled bath with timber panelling and over bath shower with shower screen, tiled flooring.OutsideShared allocated car parking.Earls Court Road, London W8;2017-03-29 06:19:31;https://li.zoocdn.com/1b028e67b89d5d53ad2c4f9da8aadea3d01df908_354_255.jpg;2017-04-01 08:45:50;51.494873;51.494873;sale;-0.196148;false;1;1;0;1;W8;London;645000;;Flat;for_sale;Earls Court Road43380383;Doorstep Agents National;020 8033 7497;Residential;Doorstep Agents are pleased to bring to the market this impressive double fronted 1930???s detached true bungalow situated in a quiet residential street yet conveniently located for Hornchurch High Street with all its amenities and two district line stations. Both Elm Park and Hornchurch tube stations are approximately a 15 minute walk away and there is also a local bus service available. Harrow Lodge Park and Hornchurch Sports Centre are also nearby.The property has been well maintained and attractively decorated throughout. Briefly the accommodation comprises large extended lounge/dining room with attractive feature fireplace and attractive solid oak flooring and benefiting from beautiful views from floor to ceiling sliding patio doors leading out onto the rear patio and garden beyond, fully fitted separate kitchen with window also overlooking the rear garden, utility room off the kitchen and separate W.C/cloakroom. There are three double bedrooms situated to the front of the property and a beautifully fitted and fully tiled bathroom. There is also great potential to expand into the loft (subject to planning). The property further benefits from gas central heating, full double glazing, driveway, garage, and private and enclosed rear garden.Viewing is highly recommended as soon as possible in order to appreciate the full potential and the attractive and spacious accommodation on offer.AccommodationLounge/Diner ??? 6.71m (22???0???) x 4.45m (14???7???)Decorative coving to ceiling, decorative ceiling rose, decorative white feature fireplace with inset pebble effect fire, radiator, power points, solid oak flooring, double glazed sliding patio doors leading out to garden beyond.Kitchen ??? 3.36m (11???0???) x 2.45m (8???0???)Full range of wall and base units with complementary work surfaces and ceramic tiling, built-in extractor hood, space for under unit appliances, multiple power points, tiled flooring, window overlooking rear elevation, door to side elevation.Utility Room ??? 2.45m (8???0???) x 1.80m (5???11???)Wall mounted, boiler, power points, tiled flooring, window to side elevation, door leading to W.C/cloakroom off.Master Bedroom - 4.19m (13???9???) x 3.10m (10???2???)Coving to ceiling, radiator, power points, solid oak flooring, box bay window overlooking the front elevation.Bedroom 2 ??? 4.06m (13???4???) x 3.10m (10???2???)Coving to ceiling, radiator, power points, solid oak flooring, box bay window overlooking the front elevation.Bedroom 3/Reception Room ??? 3.12m (10???3???) x 3.07m (10???1???)Coving to ceiling, radiator, power points, solid oak flooring, window to side elevation, glazed Georgian style French doors leading through to utility area.Bathroom ??? 2.45m (8???0???) x 1.85m (6???1???)Low level W.C, wash hand basin, panelled bath with hand held shower attachment, walk-in shower cubicle, heated towel rail, tiled walls, tiled flooring, loft access, window to side elevation.OutsideSteps leading to the front entrance with stone walls to the boundary and artificial grass to both sides, planted flower beds, shared driveway to the side with lockable gates.Rear Garden 18.9m (62') x 9.75m (35')Private and enclosed rear garden laid to lawn with mature trees, shrub planting, paved patio area, concrete and timber fencing to the boundary, garage to the rear.The Avenue, Hornchurch RM12;2017-03-29 06:19:31;https://lid.zoocdn.com/354/255/f01cd85c4122b04777955dcdad92eae6730da169.jpg;2017-03-30 07:22:55;51.559258;51.559258;sale;0.212645;false;2;3;0;1;RM12;Hornchurch;525000;;Bungalow;for_sale;The Avenue43380372;Cockburn Estate Agents;020 3544 3920;Residential;  Chain free buyers only This 2 bedroom flat with great transport links. Comprising living room, fitted kitchen, family bathroom and two bedrooms. Perfect for those looking to buy their first property or as a buy to let! This property is offered to the market chain free.Service Charge: ??870 Per YearLease Length: 114 Yearsnational residential  'We are instructed by National Residential (an Agent based in Chester) as the local agent in the sale of this property in order to help facilitate viewings and help where we can.We will forward confirmation of your interest and any offers made to National Residential along with contact details for yourself, as National Residential will want to contact you to confirm any offer.National Residential are dealing with the owner.If you agree a purchase then National Residential may require you to pay a holding deposit and we advise that you speak to them directly at the time, to confirm the amount payable and the circumstances under which this may be forfeited or returned should your purchase not proceed to completion.You can contact National Residential direct at any time on: And at 'offer process  National residential operate an online auction - the following is taken from their website:'Buyers - How it worksThe Online National Residential Agency uses the very latest technology to enable buyers to monitor and make their offers online 24 hours a day from their pc's, tablets and mobile smartphones. We ensure that buyers get a fantastic service and have the best possible opportunity to buy the property they want at a discounted price, quickly.We market all properties at attractive 'Offers Over' prices to encourage a viewings and to achieve quick sale within 28 days. We send regular weekly sms messages to remind buyers of the current highest offers and the Best and Final date therefore ensuring buyers have every opportunity to make and increase their bid at any time and not to miss out on a great property.Bids made online are not binding. Our experienced sales agents call all buyers to financially qualify their offers and ensure they are happy with the process and to confirm their bids. Bids only become binding when buyers confirm they are 100% happy with the process and agree to pay a non-refundable holding deposit to secure their property once their final bid is accepted.'please note:The end date is not fixed and if an acceptable offer is made beforehand then it may be accepted and the property withdrawn from sale so it is advised to get make your offer as soon as possible.Portway Gardens, London SE18;2017-03-29 06:14:36;https://li.zoocdn.com/4ade00978ba3e25e89adda8dcaa562e5cfa6f706_354_255.jpg;2017-03-29 06:14:36;51.474483;51.474483;sale;0.03958;false;0;2;0;0;SE18;London;160000;;Flat;for_sale;43380311;Hotblack Desiato;020 8128 0510;Residential;A spectacular two bedroom apartment, offered end of chain, in this highly sought after block on one of Highbury???s most favoured streets, Aberdeen Park. This private road offers restricted access and therefore a quiet and peaceful location, whilst being within easy striking distance of Highbury Fields, Highbury Barn and the eclectic range of shops and eateries of Islington???s Upper Street. Aberdeen Court is a very attractive block, built in an Art Deco style, and very well presented throughout. The apartment is impeccably presented with a high standard of fittings and finish ??? an early viewing is highly recommended. Good access is available to Victoria, Overground and Piccadilly Lines.Aberdeen Park, London N5;2017-03-29 06:07:48;https://lid.zoocdn.com/354/255/a6cefd175922e61bcaeb694e4c24a54f8814c755.jpg;2017-03-29 06:10:50;51.55237;51.55237;sale;-0.09312;false;1;2;0;1;N5;London;925000;;Flat;for_sale;43380286;Franklyn James;020 8033 7599;Residential;Penthouse apartment! Stunning two bedroom 6th floor apartment being offered to the market as a contract reassignment with the build due to complete Q1 2018. The property forms part of Pavilion Square set within the prestigious Royal Arsenal Riverside development. The apartment will be of a high specification and will benefit from onsite facilities to include luxurious spa, 20m swimming pool, fitness gym, cinema room and 24/7 concierge services. Located only 300m to National Rail and DLR stations with Crossrail due to open in 2018. Please call for further details.Royal Arsenal Riverside, Woolwich SE18;2017-03-29 06:01:12;;2017-04-05 10:43:05;51.494446;51.494446;sale;0.068319;true;2;2;0;1;SE18;;699995;;Flat;for_sale;Royal Arsenal Riverside Woolwich43380247;Proctors;020 8022 2846;Residential;Key features:1st floor studio flat11' 8" X 9' 8" living room / bedroom7ft kitchenShower roomGas heatingCommunal garden. End of chain 161 year lease. EPC rating C"first time buy" or "buy to letCommunal EntranceStairs to first floor, front door to:-HallDoor to shower room, door to living room / bedroom, spotlight, entry phone, laminate flooring.Living room / Bedroom 11' 8" x 9' 8" (3.56m x 2.95m) Double glazed windows to front, double panelled radiator, spotlights, laminate floor. Open to:-Kitchen 7' 1" x 5' (2.16m x 1.52m) Double glazed window to front, wall and base units with work surfaces, inset stainless steel sink and drainer, gas hob with fitted electric oven beneath, integrated fridge, wall mounted boiler, built in cupboard, spotlights, part tiled walls, tiled flooring.Shower RoomLow level w/c, enclosed shower unit, wash hand basin, single panel radiator, extractor fan, part tiled walls & floor.Communal GardenSmall outdoor garden space from communal hallway.TransportExcellent Location  Penge West Mainline Train Station and with East London Line Extension. Penge East to Victoria.Lease DetailsLease: 161 yearsMaintenance: ??400 p/a (right to self manage), to be confirmedGround Rent: Peppercorn, to be confirmedAgents Note: Details of lease, maintenance etc to be checked prior to exchange of contracts.High Street, Penge, London SE20;2017-03-29 05:43:31;https://li.zoocdn.com/7df639cb1b3d045462e9ff9f7e766f1ef6c40664_354_255.jpg;2017-03-30 01:41:47;51.41788;51.41788;sale;-0.058942;false;0;1;0;0;SE20;London;199995;;Flat;for_sale;High Street Penge London43380227;Hunters - Brentford;020 3463 0143;Residential;Hunters are pleased to present this amazing two double bedroom apartment situated in the sort after over 60's development Golden Court. It is the largest apartment in the block and has a large reception room offering a dual aspect contributing to the wonderful light and airy presence. The top floor offers splendid views of parts of the London Skyline.The property also benefits from access via lift and is the largest apartment in the block. It also benefits from Non-resident Management staff, a communal lounge, guest facilities, a large well maintained garden, hobby room an a splendid library.The whole site also is designed in mind for wheel chair access. Viewings are highly recommended.Bathroom2.04m (6' 8") x 1.80m (5' 11")master bedroom6.16m (20' 3") x 5.12m (16' 10")bedroom 4.22m (13' 10") x 4.16m (13' 8")lavatory1.72m (5' 8") 1.47m (4' 10")reception room6.03m (19' 9") x 5.07m (16' 8")kitchen3.28m (10' 9") x 1.96m (6' 5")Golden Court, Isleworth TW7;2017-03-29 05:33:54;https://lid.zoocdn.com/354/255/18f14beb081076d0a02230c376530e86c562d540.jpg;2017-03-31 05:42:49;51.47267;51.47267;sale;-0.346313;false;0;2;0;0;TW7;Isleworth;325000;;Flat;for_sale;Isleworth43380213;Chase Buchanan, St Margarets;020 3463 9306;Residential;Key features:Stunning detached and extended bungalowThree bedroomsTwo modern bathroomsBeautiful sunny West facing garden Backing on to the river CraneIndoor heated swimming poolAmazing open plan kitchen/ reception roomSuperb entertaining spacePotential to add first floor extension stppOff street parkingFull description:This beautifully extended three bedroom house features an amazing river backing West facing garden and an indoor swimming pool.The house has been completely redesigned and modernised by the current owner with the bright and spacious accommodation now comprising, large welcoming entrance hall, three bedrooms, two contemporary bathrooms and an incredible open plan living area which overlooks the sunny garden, patio area and swimming pool. The kitchen is the real hub of the house and features beautiful marble work surfaces, a range of modern contemporary units and integrated appliances.The property offers prospective buyers an exciting opportunity to add an additional floor, subject to the necessary planning consents, almost doubling the already generous living and bedrooms.This astonishing property really has to be viewed to be believed. A fantastic but practical, modern home, with the most incredible entertaining space and a genuine wow factor that cannot be denied.Bored with the standard, same old, same old? We strongly recommend an appointment to view to view as quickly as possible.EPC Rating DBedroomBedroomBedroomBathroomBathroomReceptionHaliburton Road, St Margarets, Twickenham TW1;2017-03-29 05:29:17;https://lid.zoocdn.com/354/255/40ac58e1dcca68467820d92c3af46abaa9d169f7.jpg;2017-03-30 01:41:45;51.46335;51.46335;sale;-0.324869;false;0;3;0;0;TW1;Twickenham;995000;;Detached bungalow;for_sale;Haliburton Road St Margarets Twickenham