listing_id;agent_name;agent_phone;category;description;displayable_address;first_publish_date;image_url;last_publish_date;latitude;listing_status;longitude;new_home;num_bathrooms;num_beedrooms;num_floors;num_recepts;outcode;post_town;price;price_change;property_type;status;street_name43406372;Barnard Marcus;020 8166 7280;Residential;Summary*** open house 8th April ***descriptionBarnard Marcus are delighted to present this bright and airy two bedroom flat. This property comprises of two double bedrooms, large living room, bathroom, fully fitted kitchen and a private garden to the rear of the property. Within a short walking distance to Croydon and located near good transport links. Call now to avoid disappointment!Lease details are currently being compiled. For further information please contact the branch. Please note additional fees could be incurred for items such as leasehold packs.1. Money laundering regulations: Intending purchasers will be asked to produce identification documentation at a later stage and we would ask for your co-operation in order that there will be no delay in agreeing the sale. 2. General: While we endeavour to make our sales particulars fair, accurate and reliable, they are only a general guide to the property and, accordingly, if there is any point which is of particular importance to you, please contact the office and we will be pleased to check the position for you, especially if you are contemplating travelling some distance to view the property. 3. Measurements: These approximate room sizes are only intended as general guidance. You must verify the dimensions carefully before ordering carpets or any built-in furniture. 4. Services: Please note we have not tested the services or any of the equipment or appliances in this property, accordingly we strongly advise prospective buyers to commission their own survey or service reports before finalising their offer to purchase. 5. These particulars are issued in good faith but do not constitute representations of fact or form part of any offer or contract. The matters referred to in these particulars should be independently verified by prospective buyers or tenants. Neither sequence (UK) limited nor any of its employees or agents has any authority to make or give any representation or warranty whatever in relation to this property.Whitehall Road, Thornton Heath CR7;2017-03-31 08:46:34;https://lid.zoocdn.com/354/255/e33453961ef9ec59e31c2d7c479d949083b68f63.jpg;2017-04-02 16:44:20;51.391617;51.391617;sale;-0.115824;false;0;2;0;0;CR7;Thornton Heath;325000;;Flat;for_sale;Whitehall Road43406373;Barnard Marcus;020 8166 7280;Residential;Summary** open day 8th April **descriptionBarnard Marcus are delighted to bring to the market this one bedroom ground floor conversion flat. This property comprises of one bedroom, reception room, bathroom and access to the private garden. This is a fantastic opportunity for a superb first purchase/investment. Call now to avoid disappointment!Kitchen 11' 2" x 6' 9" ( 3.40m x 2.06m )Reception 12' x 9' ( 3.66m x 2.74m )Bedroom 12' 3" x 9' 11" ( 3.73m x 3.02m )1. Money laundering regulations: Intending purchasers will be asked to produce identification documentation at a later stage and we would ask for your co-operation in order that there will be no delay in agreeing the sale. 2. General: While we endeavour to make our sales particulars fair, accurate and reliable, they are only a general guide to the property and, accordingly, if there is any point which is of particular importance to you, please contact the office and we will be pleased to check the position for you, especially if you are contemplating travelling some distance to view the property. 3. Measurements: These approximate room sizes are only intended as general guidance. You must verify the dimensions carefully before ordering carpets or any built-in furniture. 4. Services: Please note we have not tested the services or any of the equipment or appliances in this property, accordingly we strongly advise prospective buyers to commission their own survey or service reports before finalising their offer to purchase. 5. These particulars are issued in good faith but do not constitute representations of fact or form part of any offer or contract. The matters referred to in these particulars should be independently verified by prospective buyers or tenants. Neither sequence (UK) limited nor any of its employees or agents has any authority to make or give any representation or warranty whatever in relation to this property.Lancing Road, Croydon CR0;2017-03-31 08:46:34;https://lid.zoocdn.com/354/255/76fba1cde4e32be38ddc9d68cc177627e2536bd5.jpg;2017-04-01 01:41:01;51.38692;51.38692;sale;-0.11961;false;0;1;0;0;CR0;Croydon;250000;;Flat;for_sale;Lancing Road43406355;Purplebricks, Head Office;01926 267659;Residential;Arranged on the top floor of a Victorian terrace, this charming split level conversion apartment boasts stylish accommodation including two double bedrooms, a modern galley kitchen with white units, and a lovely reception room with a high ceiling and an abundance of natural light from two sash windows. The property also features a smart three piece white bathroom suite with overhead shower.Valmar Road is well located for a range of amenities within central Camberwell, while the green open spaces of Myatt's Fields and Camberwell Green are easily accessible. Local transport links include Loughborough Junction and Denmark Hill stations, and there are numerous bus links into central London and beyond.The Leasehold of this property has been recently extended, with approximately 122 years left.Lounge12ft4 x 10ft5Light and airy, featuring a high ceiling, solid oak block flooring and 2 sash windows.Kitchen12ft7 x 5ft1Modern, bright and immaculate.Master Bedroom11ft2 x 16ftLarge double with fitted wooden wardrobe, large sash window and laminate flooring.Bedroom/Lounge Two10ft x 12ft4Double with sash window, cornice to ceiling, ceiling rose, picture rail, shelving to chimney breast and solid oak block flooring.BathroomModern three piece bathroom suite with overhead shower.Landing12ft1 x 5ft5Spacious, with high ceiling and large built in shelves. Window at ceiling height which allows for natural light and ventilation. Loft space access for storage onlyLease InformationApproximately 122 years remainingNo Service ChargeGround Rent ??250 per annumValmar Road, Camberwell SE5;2017-03-31 08:42:28;https://lid.zoocdn.com/354/255/3f0dc4d29036e70890e2d4528f18adfa05007b0e.jpg;2017-03-31 08:42:28;51.472347;51.472347;sale;-0.094299;false;1;2;0;1;SE5;London;495000;;Flat;for_sale;Valmar Road43406349;Blane, Rosen & Co;020 3641 5194;Residential;Northways is a substantial, purpose-built block situated on College Crescent opposite its junction with Buckland Crescent, just moments from Swiss Cottage Underground Station and a wide range of local shops and restaurants. Set on the first floor (with lift & entryphone) of this portered block, this apartment offers a reception room, two bedrooms, one bathroom, and a fully fitted kitchen.Long Lease 174 years approxGround Rent (Peppercorn) per annumService Charge ??3,800 approx per annumNorthways, College Crescent, Swiss Cottage NW3;2017-03-31 08:41:32;https://li.zoocdn.com/7c63b4a4a5efac855db67388a116e97e5dba0126_354_255.jpg;2017-04-03 08:58:22;51.54466;51.54466;sale;-0.175389;false;1;2;1;1;NW3;London;699950;;Flat;for_sale;Northways, College Crescent43406290;eMoov National;01277 699033;Residential;Guide price ??500,000 - ??550,000.  We are delighted to offer for sale this extremely smart one bedroom, first floor flat in Highbury's sought after Loxford Gardens development.The light and spacious accommodation comprises: Entrance hallway with two storage cupboards  tiled bathroom with demist mirror & heated towel rail  large double bedroom with generous built-in wardrobe  sizeable lounge/kitchen with wooden laminate flooring and high-standard fitted kitchen comprising  dishwasher, microwave, oven, ceramic hob and wine-cooler. Underfloor heating is fitted throughout.The property also benefits from a video entry phone system, 24hr concierge/security, internal bike storage and lift to all floors.Situated in an ideal location within easy walking distance of Arsenal and Highbury & Islington tubes, it's just 15mins door-to-door to Kings Cross. You are moments away from the village-like Highbury Barn, offering traditional local butchers, greengrocers, delis and acclaimed restaurants, while the green spaces of Clissold Park and Highbury Fields are perfectly placed for a game of tennis or barbeque.Completed in 2012, this boutique development has remained sympathetic to the original Regency family home of the Dents - renowned glovemakers. It benefits from a high standard finish inside whilst offering views over peaceful communal gardens with mature trees.Please see the many photographs that accompany this listing and the floor plan for further details. To fully appreciate this property please arrange a viewing appointment which you can do 24/7 by clicking on the contact link provided or by calling the office.Osborne House, Loxford Gardens, London N5;2017-03-31 08:32:59;https://lid.zoocdn.com/354/255/a2bcba4faff8dbed7ab757ccd6da66da09d75cc6.jpg;2017-04-01 01:40:58;51.55703;51.55703;sale;-0.099215;false;1;1;0;1;N5;London;500000;;Flat;for_sale;17 Loxford Gardens43406285;Barnfields;020 3463 7532;Residential;Situated in this quiet residential cul-de-sac just minutes from local shops, schools and Gordon Hill rail station, a spacious and extended three bedroom semi detached bungalow occupying a wide plot, within easy access of Enfield Town mutiple shopping facilities and the M25 motorway.The property has been extended and just some of its many pleasing features include:-Spacious Entrance HallFitted carpet, coving to ceiling, access to loft, double radiator, electric meter cupboard.Lounge (4.88m x 3.30m (16' x 10'10"))Double radiator, coving to ceiling. Door into Annex.Kitchen (3.35m x 2.84m (11' x 9'4"))Dual aspect with range of wooden base units and wall cabinets with work surfaces, breakfast bar, cooker space with extractor fan over, double drainer stainless steel sink unit, tiled splashback, plumbing for washing machine and dishwasher, wall mounted gas central heating boiler, space for fridge/freezer, casement door to garden, double radiator.Bedroom One (3.91m x 3.35m (12'10" x 11'))Fitted carpet, range of fitted wardrobes, radiator.Bedroom Two (3.05m x 2.26m (10' x 7'5"))Fitted carpet, radiator, fitted wardrobes.BathroomWhite suite comprising panelled bath with mixer tap and shower attachment, vanity basin with cupboards under, low flush wc, window to side, fully tiled walls, tiled floor.Annex (5.99m x 3.20m (19'8" x 10'6"))Comprising Bedroom area open to Kitchenette with separate bathroom.Bedroom AreaWood laminate flooring, double glazed window to front.KitchenetteRange of base units and wall cabinets, composite work surface with inset single bowl stainless steel sink unit and drainer, tiled splash back, inset gas hob with extractor fan over, space for fridge/freezer. Double glazed casement door to garden.BathroomComprising panelled bath, wc and wash basin, fully tiled walls and floor.OutsideFront GardenSmall lawned area, mainly gravelled providing off street parking for several vehicles, side pedestrian and vehicular access to hard standing (previous garage area).Rear GardenSecluded l-shaped rear garden, laid to lawn with mature tree screen to side and rear, barbecue area, crazy paved patio, brick-built shed.Shooters Road, Enfield EN2;2017-03-31 08:32:10;https://lid.zoocdn.com/354/255/7f92792283cccfaf4d29581847541fd20f586d0c.jpg;2017-04-03 15:01:30;51.66456;51.66456;sale;-0.099114;false;2;3;0;1;EN2;Enfield;499950;;Bungalow;for_sale;Shooters Road43406112;Hawes & Co - Wimbledon Broadway;020 3478 3352;Residential;A rare opportunity to acquire this truly stunning fully loft and rear extended four bedroom family home situated in the ever popular Merton Park. The ground floor has been skilfully extended to provide excellent living accommodation with a superb open plan kitchen/family room with bi-fold doors leading to a private garden. The house is well balanced over three immaculate floors, complete with four bedrooms and two luxury bathrooms, as well as double garage with rear access.Wessex Avenue, London SW19;2017-03-31 08:31:22;https://li.zoocdn.com/d4c33069b2351f58112b248f8589f3f6549f659f_354_255.jpg;2017-04-03 08:56:47;51.406258;51.406258;sale;-0.197078;false;2;4;0;1;SW19;London;1150000;;;for_sale;Wessex Avenue43406269;JOHNS&CO - Nine Elms;020 8022 5576;Residential;An impressive direct river facing, second floor, three bedroom/two bathroom apartment, situated within Riverlight Five.Due to complete in Q3 2017, the property will comprise approximately 1,126 sq ft of well proportioned living space and two balconies with direct views towards the river.Riverlight is a prestigious new development located within the heart of the Nine Elms Regeneration area. Residents will benefit from a luxurious swimming pool and spa, gymnasium, private cinema, virtual golf facility, communal gardens and 24 hour concierge.Riverlight is well located for access to local amenities including a Sainsbury???s local, Waitrose, Nine Elms Tavern and also the transport links of Battersea Park, Queenstown Road and Vauxhall. The Northern Line tube extensions have been granted, which will also add to the vast transport links.Riverlight Five, London SW8;2017-03-31 08:30:26;https://lid.zoocdn.com/354/255/7b3f57a26c45c294f4f8659f1e0e4b19bb5f40c9.jpg;2017-03-31 08:31:20;51.482143;51.482143;sale;-0.137746;true;2;3;0;1;SW8;London;1900000;;Flat;for_sale;Riverlight Quay40707943;Purplebricks, Head Office;01926 267659;Residential;Stunning three bedroom detached house located in a wonderful location on the borders of Whitton.Offered to the sales market for only the second time since it was built in 1937, this is a truly special property. An abundance of charm and wonderful features compliment the spacious living accommodation and sensational rear garden to offer the discerning buyer a wonderful opportunity to acquire a unique and much cared for home in a great location. Further benefits include recently replaced boiler, off road parking and scope to extend stpp.Argyle Avenue is a much requested residential area, conveniently located within walking distance of the area's amenities, local shops including a chemist, excellent schools and transport links (Hounslow station is within a short walking distance providing up to six trains per hour into London Waterloo). The towns of Twickenham, Richmond, Kingston and Hounslow, are all within easy reach, with the 281 bus service two minutes walk from the property - offering an abundance of shopping and leisure facilities.Internal viewings highly advised.Reception Room13'1 X 12'Front reception room, currently used as a dining room. Solid pine floor, attractive bay window, high quality, stylish light fittings.Reception Room Two16'1 X 10'9Wonderfully spacious principle reception room. Wood floor, high quality, stylish light fittings, access via sliding doors to sun room.Sun Room16'5 X 6'7With views of and access to the rear garden.Additional reception space with power and lighting.Kitchen10'4 X 9'Built in John Lewis five ring gas hob, built in Zanussi oven and grill. Space for all white goods, range of base and eye level units and recently fitted Worcester boiler, extractor fan, access to sun room.BathroomBath with electric shower above, wash hand basin, W.C, heated towel rail, spotlighting.UpstairsThree bedrooms 14'9 X 12' (built in wardrobes with additional eaves storage)12'3 X 12'2 (built in storage and views over the rear garden)7'6 X 7'4Upstairs W.CAccess to insulated loft area.OutsideOff road parking to the front (driveway)Side accessStunning and remarkably spacious rear garden measuring 125' x 25' with mature apple tree and various established fruit bushes . Lawn area, metal and wooden sheds, greenhouse, various raised beds.Vast, sunny and secluded.Argyle Avenue, Hounslow TW3;2017-03-31 08:19:11;https://lid.zoocdn.com/354/255/c74a1d7bf6d86ce2ef2efd30028435b498678088.jpg;2017-04-03 16:11:34;51.459866;51.459866;sale;-0.364842;false;1;3;0;3;TW3;Hounslow;529950;;Detached house;for_sale;Argyle Avenue43406191;GA Residential;020 8115 8669;Residential;Let by ga residentialThis spectacular home is fully air conditioned and includes a magnificent leisure complex with swimming pool, spa, sauna and steam room.We are delighted to present a spectacular fully air conditioned residence situated in this world- renowned location with outstanding leisure facilities.The ground floor opens up to a large reception hall with drawing room, dining room, family room, study, state of the art kitchen and morning/family room.The 1st floor has a galleried area leading to the master bedroom suite with his and hers dressing room and bathrooms, 3 further bedrooms all ensuite.The 2nd floor leads to 4 bedrooms all with ensuite shower rooms and a utility room.The basement level houses the leisure area, entertainment suite, swimming pool, gymnasium, secondary kitchen, utility room and staff quarters.A substantial rear garden approached by upper and lower terraces which have Italian style stone balustrading. The garden has been beautifully planted with a wide array of shrubs and plants. Carefully planned and concealed lighting illuminates the entire garden at night.Double garage and off-street parking for several cars.The Bishops Avenue, London N2;2017-03-31 08:18:18;https://li.zoocdn.com/0f1f14b24a6c55ea676fff3aaf56f93168a445b7_354_255.jpg;2017-03-31 08:19:54;51.585316;51.585316;sale;-0.165114;false;8;8;0;4;N2;London;10000000;;Detached house;for_sale;The Bishops Avenue43406077;eMoov National;01277 699033;Residential;We are delighted to offer for sale this spacious 5 bedroom semi-detached house in this sought after and convenient location within easy reach of local amenities and public transport links.The property is flooded with natural light and benefits from a double-sized reception room, with wood floors.There is a combi-boiler heating system and double glazing fitted throughout. Parking for three cars off road and an exceptional extra-wide garden with patio area and plenty of light.The impressive accommodation is well presented, versatile and of a good size and comprises ample living space and five well appointed bedrooms.An American-style fridge freezer, fitted kitchen and stunning floors show an attention to detail. The property has also been fitted with a Banhams alarm system and Banhams locks.There's ample loft space, with room for extension in the future (subject to attaining correct planning etc).Please see the many photographs that accompany this listing and the indicative floor plan for further detail.To fully appreciate this property please arrange a viewing appointment which you can do 24/7 by clicking on the contact link provided.The local 137 bus stop is nearby for easy access to Chelsea and the West End, and Clapham Common and Clapham North tube stations are within easy walking distance, as well as the many facilities of Abbeville Road and Clapham Common and High Street.This is an exceptional and sizable property in a well-sought after area, and available without a chain.Kings Avenue, Clapham SW4;2017-03-31 08:03:17;https://li.zoocdn.com/2e2752655ad4986d1684b2e5528dbd535cd4c8a1_354_255.jpg;2017-04-01 01:40:52;51.456627;51.456627;sale;-0.128795;false;2;5;0;1;SW4;London;1150000;;Semi-detached house;for_sale;Kings Avenue43406004;Hiltons Estates;01895 647568;Residential;Description  Rare to the market, this semi-detached character property, consists of 7 rooms over 3/4 floors, with further outbuilding to the rear with multiple rooms. The buildings both require considerable updating, but offers the opportunity for re-development into apartments or into an hmo, subject to planning consent.Accommodation  The property has parking to the rear for several cars and an outbuilding consisting of 7 rooms, which may also offer some re-development potential, subject to planning consent.Outside  The property has a rear garden area, currently arranged as hard standing, used for car parking.Situation   West Drayton's position on the western edge of the Capital means that it is superbly placed to access Central London with ease, with frequent services to London Paddington in less than 25 minutes from the West Drayton Mainline station. The property is situated in one of the areas most popular locations and offers the convenience of an excellent local bus service. The Station is within a short walking distance which is due to benefit from Crossrail. Other benefits include good access to West Drayton High Street, Yiewsley and Uxbridge with their wide range of shopping facilities and amenities. There is also excellent access to Stockley Business Park, local bus routes, London International Heathrow Airport, M4, M40 and M25 motorways.Terms and Notification of Sale Tenure: Freehold  Local Authority: London Borough Of HillingdonCurrent EPC Rating: E  Station Road, West Drayton UB7;2017-03-31 07:53:24;https://lid.zoocdn.com/354/255/3aaf6de2248ba991a4e6b530fb07c0d5f4988ebd.jpg;2017-04-01 05:41:18;51.50626;51.50626;sale;-0.469695;false;2;7;0;2;UB7;West Drayton;0;;Land;for_sale;43405939;Purplebricks, Head Office;01926 267659;Residential;A fantastic detached chalet bungalow in a highly desired residential location is being offered for you to enjoy living on a quiet road near all the amenities of Brent Cross and Golders Green.Live in a bright and airy, detached, chalet bungalow with plenty of room for children, guests and a home office. You'll find it a spacious house nestled in a sought after desirable residential location and close to Cricklewood Station, Golders Green underground, multiple bus services, and convenient for various local schools.The ground floor offers you a convenient lifestyle with a kitchen breakfast room and a large & spacious lounge and dining rooms with intercommunicating doors. It has a ground floor office or bedroom for Mum and Dad or guests as well as a bathroom, and guest W.C.The First floor has 3 bedrooms (with a fourth bedroom on the ground floor). There is also a shower room with toilet.You'll also find a lovely conservatory overlooking a spacious and private rear garden (approximately 80ft by 42ft). With a shed and greenhouse as well. You also have plenty of room for spreading out with two store rooms/workshops, and with the added bonus of a garage and off-street parking with a large brick paved driveway for 4 cars.This sort after property with character rarely comes on the market and should be viewed as soon as possible.*To book a viewing on this great property 24 hours a day, 7 days a week please visit the Purplebricks website for viewing availability and to confirm your date and appointment time*Sanderstead Avenue, London NW2;2017-03-31 07:36:35;https://li.zoocdn.com/db5cc1c727e08d5a92f257e29d972e1c2587a981_354_255.jpg;2017-04-05 13:18:57;51.56399;51.56399;sale;-0.209083;false;2;4;0;2;NW2;London;1150000;;Detached house;for_sale;Sanderstead   Avenue43405918;Hart;020 8033 7341;Residential;Beautifully presented mid terraced three bedroom family home. The property offers impressive bright and airy open plan living, bespoke real wood fitted kitchen, three double bedrooms, modern fitted upstairs family bathroom, downstairs cloakroom, utility room, wood burner, private rear garden. The house has been designed to complement flexible family living there is also added scope to develop the loft area (stpp). Situated within close proximity to the bustling High street Harlesden where you will find a variety of shops, coffee cafes, bars and restaurants, the open green spaces at Roundwood Park, St. Joseph & Leopold Primary School. Well connected to Harlesden or Willesden Junction Station (Zone 2, Bakerloo Line, London Overground).St. Thomas's Road, London NW10;2017-03-31 07:28:42;https://lid.zoocdn.com/354/255/ac51f29306ab3d754620d3fe2788c30560c78bcf.jpg;2017-04-07 01:34:48;51.540356;51.540356;sale;-0.252451;false;1;3;0;2;NW10;London;724950;;Terraced house;for_sale;43405919;Hart;020 8033 7341;Residential;Well presented one bedroom flat situated on the 2nd floor of this private purpose built block. Benefits include a bright spacious reception room, double bedroom, modern fitted kitchen, tiled bathroom, double glazed, laminated wood flooring, Moroccan landscape communal garden. Located on a quiet residential tree lined road, a short walk to the vibrant High street where you will find a variety of shops, coffee cafes, bars and restaurants, or why not relax in the open green spaces at Roundwood Park. Well connected to Willesden Junction Station (Zone 2, Bakerloo Line, London Overground). Other benefits include a 992 year lease and a Share of Freehold.Connaught Road, Gibraltar House, London NW10;2017-03-31 07:28:42;https://li.zoocdn.com/faa71a22128d5775d984be844f06f354e657bcc7_354_255.jpg;2017-04-05 05:35:30;51.536175;51.536175;sale;-0.251399;false;1;1;0;1;NW10;London;304950;;Flat;for_sale;Gibraltar House