listing_id;agent_name;agent_phone;category;description;displayable_address;first_publish_date;image_url;last_publish_date;latitude;listing_status;longitude;new_home;num_bathrooms;num_beedrooms;num_floors;num_recepts;outcode;post_town;price;price_change;property_type;status;street_name43402974;Waterfronts;020 3463 7513;Residential;Waterfronts are pleased to provide an exciting opportunity with this off plan and luxury two bedroom apartment with parking at this soon to be, brand new and eagerly anticipated development that is Vista, Chelsea Bridge Wharf.A new residential development of luxurious apartments boasting exemplar specification and unique design, with an enviable location - just a stone's throw from Chelsea Bridge. This property is made up of two double bedrooms, an en-suite and fitted wardrobe to the master bedroom, utility cupboard, services/coats cupboard, an open plan reception with fitted kitchen, a long private terrace.The innovative and striking architecture has been conceived by world-leading architects Scott Brownrigg, to incorporate extensive outdoor landscaping and feature terraces, where residents will benefit from spectacular views over Battersea Park and towards the River Thames.Located just over the water from Sloane Square and boasts a host of transport links to choose from, these superior residences are not only perfectly positioned but will also form a new landmark development within this sought-after area of London.Follow this link to view full brochure Completion is due for Spring/Summer 2017.Please give us a call on today to get more information or to book yourself in for a viewing2nd FloorReception4.98m x 5.68m (16' 4" x 18' 8") These light and airy apartments have been expertly planned with exceptional attention to detail. With their magnificent large windows, superb finishes and quality engineered timber flooring, the living areas are truly impressive: Beautiful rooms with exquisite viewsOpen Plan KitchenThe living space flows seamlessly through to the kitchen area. Cabinets in subtle satin finishes and beautiful stonework surfaces combine with high quality appliances to create the perfect balance of elegance and practicalityMaster BedroomA fusion of subtle lighting, muted tones and soft carpeting, with spacious fitted wardrobes, the master bedroom exudes luxury. Designed for sheer relaxation, a beautiful, private place in which to enjoy the perfects night sleepBedroomA fusion of subtle lighting, muted tones and soft carpeting, with spacious fitted wardrobes, the bedroom exudes luxury. Designed for sheer relaxation, a beautiful, private place in which to enjoy the perfects night sleepBathroomOffering superb levels of comfort and luxury, these contemporary bathrooms make a design statement of their own. The clean white tiles, polished chrome fittings and bespoke mirror cabinets are the epitome of elegance.En-suiteWrap-Around BalconyVista, Chelsea Bridge Wharf, Battersea SW8;2017-03-30 22:46:30;https://li.zoocdn.com/b62cf1e294de014c450c7285b66c7dece28d9eb6_354_255.jpg;2017-03-30 22:49:54;51.48293;51.48293;sale;-0.148141;true;0;2;0;0;SW8;London;1600000;;Flat;for_sale;Vista, Chelsea Bridge Wharf Battersea43402961;Waterfronts;020 3463 7513;Residential;We have an excellent and upcoming opportunity, to buy a delightful one bedroom apartment, in the luxurious Putney development called Putney Plaza.Finished to a high specification the flat provides an open-plan kitchen with fitted brand new appliances and a living area with full-height glass windows and a private West-facing balcony overlooking the internal courtyard and gardens. There is also a contemporary bathroom.Putney Plaza is ideally located on the Upper Richmond Road, adjacent to East Putney tube station with excellent transport links to central London and approx. 0.3 miles from Putney High Street and Putney mainline station.Please give us a call on today to get more information or to book yourself in for a viewingGround FloorBedroomBathroomReceptionGrand Tower Putney Plaza SW15;2017-03-30 22:46:30;https://lid.zoocdn.com/354/255/bbf182211e0cd453eac6909baac68b0713bc1bbc.jpg;2017-03-30 22:49:24;51.45968;51.45968;sale;-0.210204;true;0;1;0;0;SW15;;600000;;Flat;for_sale;Grand Tower Putney Plaza43402964;Waterfronts;020 3463 7513;Residential;Stratosphere, a luxurious collection of 307 suites, 1,2 and 3 bedroom apartments and penthouses in the 36-storey skyscraper offers spectacular and far reaching vistas towards the City of London, Canary Wharf and over Queen Elizabeth Park. Radical transformations at Stratosphere include Stratford International, Stratford London and the bus station becoming part of Zone 2, a year before Crossrail is set to join the extensive rail network, making the development and Stratford one of the most well-connected in London. Buyers range from city professionals, to buy-to-let investors, to first time buyers looking to live in an affordable and well-connected location with just 2 minutes stroll to one of London???s best connected transport hubs, providing easy access to Canary Wharf and The City of London.Stratford???s desirability as a location to purchase property has, and will continue to be, impressive. Queen Elizabeth Olympic Park is the largest park in Europe in 150 years and accompanied with the unparalleled Lee Valley Velopark, Hockey and Tennis Centre, Aquatics Centre and a brand new stadium, the iconic Olympic venues have an engaging programme of events and activities for everyone to enjoy.Each of the apartments at Stratosphere will offer an outstanding specification, including kitchens from London designer Urban Myth, with stone worktops and integrated Smeg appliances, bespoke cabinetry in the bathrooms and premium woodstrip laminate throughout the kitchen, living room and hallway. All residences will also benefit from under-floor heating, and a sophisticated video entry phone system. Residents will enjoy 24-hour concierge against the backdrop of a sleek and stylish ground floor reception as well as a private gymnasium, resident???s Wi-Fi lounge and private terrace all located on the roof-top at the pinnacle of the tower.Please give us a call on today to get more information or to book yourself in for a viewing15thBedroomBathroomReceptionBroadway, London E15;2017-03-30 22:46:30;https://lid.zoocdn.com/354/255/7a41dd7e98bb6b5e939a08a737f219f23f556cc7.jpg;2017-03-30 22:49:24;51.5404;51.5404;sale;0.00023;true;0;1;0;0;E15;London;445000;;Flat;for_sale;Stratosphere Startford43402970;Waterfronts;020 3463 7513;Residential;Waterfronts are delighted to present this outstanding three bedroom luxurious property in a building of unmistakable prestige and unparalleled distinction, known as the Tower at Chelsea Creek.A combination of visionary architecture and superb interior design, these exceptional residences represent the pinnacle of opulence and comfort. This is the ideal opportunity to live in a new waterside address within easy reach of the capital.Beautifully designed apartments set in impeccably manicured surroundings, close to the peace and tranquillity of the water.Perfectly proportioned, superbly appointed, these elegant apartments provide the perfect setting for living, relaxing and entertaining.Brochure Due for completion in October 2016.Please give us a call on today to get more information or to book yourself in for a viewing17th FloorReception??? Air conditioning to living room and bedrooms1??? Balconies or terraces??? Bespoke veneer finish full height, extra wideentrance door??? Bespoke internal doors??? Brushed steel ironmongery??? Aluminium powder coated double glazed patiodoors and windows??? Engineered timber flooring to living room,kitchen and hallway with carpet to bedrooms??? Feature architraves and skirting??? Bespoke bedroom wardrobes with leatherdoors and internal lighting??? Bespoke fitted coat cupboard to hallway??? Ten year warranty from date of legal completionKitchen??? Custom designed fully integrated Europeanfitted kitchen??? Marble, limestone or granite kitchen worktop2??? Stainless steel recessed sink??? Gessi instant hot water tap??? Integrated Miele fan assisted electric ovenand induction hob??? Integrated pop up extractor fan3??? Integrated Miele steam oven??? Integrated Miele warming drawer??? Integrated Miele coffee maker??? Integrated Miele microwave??? Integrated Miele dishwasher??? Integrated Miele wine cooler??? Miele full height fridge??? Miele full height freezer??? Feature lighting below high level cupboards??? Washer / dryer4Master BedroomIntegrated multi-room, iPad and touch screencontrolled, home automation system withremote iPod docking station and 5.1 surroundsound to living room. Facility to control audiovisual, heating, lighting and window dressing5??? Integrated Bowers and Wilkins ceiling speakersto living room and bedrooms. Single speaker tobathrooms and en suites??? Telephone / Home Network points to livingroom, kitchen and bedrooms??? Sky HD, Arabsat and Hot Bird enabledincluding Sky HD box with 1 yearpre-paid subscription??? Wall mounted TV position in master bedroomand additional TV points to bedrooms 2 and 3with return feed from the living roomentertainment system??? Integrated 19" LED / HD water resistanttelevision to master en suite??? Mood lighting control to living room??? Feature recessed lighting??? External lighting to terraces and balconies??? Brushed steel socketsEnsuite??? Villeroy and Boch bath, WC and basin??? Heated wall panel with chrome robe hooksand towel rails??? Interior designed marble panelling andvanity counter2??? Vado rain shower, body jets and hand showerto shower enclosure??? Bespoke frameless clear glass shower enclosure??? Vado wall mounted chrome taps andchrome bath filler??? Wall hung WC with soft closing toilet seat??? Integrated vanity cabinets with demisting mirror??? Feature bath panel with recessed lighting??? Marble floor tiles with under floor heating2BedroomIntegrated multi-room, iPad and touch screencontrolled, home automation system withremote iPod docking station and 5.1 surroundsound to living room. Facility to control audiovisual, heating, lighting and window dressing5??? Integrated Bowers and Wilkins ceiling speakersto living room and bedrooms. Single speaker tobathrooms and en suites??? Telephone / Home Network points to livingroom, kitchen and bedrooms??? Sky HD, Arabsat and Hot Bird enabledincluding Sky HD box with 1 yearpre-paid subscription??? Wall mounted TV position in master bedroomand additional TV points to bedrooms 2 and 3with return feed from the living roomentertainment system??? Integrated 19" LED / HD water resistanttelevision to master en suite??? Mood lighting control to living room??? Feature recessed lighting??? External lighting to terraces and balconies??? Brushed steel socketsEnsuite??? Villeroy and Boch bath, WC and basin??? Heated wall panel with chrome robe hooksand towel rails??? Interior designed marble panelling andvanity counter2??? Vado rain shower, body jets and hand showerto shower enclosure??? Bespoke frameless clear glass shower enclosure??? Vado wall mounted chrome taps andchrome bath filler??? Wall hung WC with soft closing toilet seat??? Integrated vanity cabinets with demisting mirror??? Feature bath panel with recessed lighting??? Marble floor tiles with under floor heating2Bedroom??? Villeroy and Boch bath, WC and basin??? Heated wall panel with chrome robe hooksand towel rails??? Interior designed marble panelling andvanity counter2??? Vado rain shower, body jets and hand showerto shower enclosure??? Bespoke frameless clear glass shower enclosure??? Vado wall mounted chrome taps andchrome bath filler??? Wall hung WC with soft closing toilet seat??? Integrated vanity cabinets with demisting mirror??? Feature bath panel with recessed lighting??? Marble floor tiles with under floor heating2BathroomIntegrated multi-room, iPad and touch screencontrolled, home automation system withremote iPod docking station and 5.1 surroundsound to living room. Facility to control audiovisual, heating, lighting and window dressing5??? Integrated Bowers and Wilkins ceiling speakersto living room and bedrooms. Single speaker tobathrooms and en suites??? Telephone / Home Network points to livingroom, kitchen and bedrooms??? Sky HD, Arabsat and Hot Bird enabledincluding Sky HD box with 1 yearpre-paid subscription??? Wall mounted TV position in master bedroomand additional TV points to bedrooms 2 and 3with return feed from the living roomentertainment system??? Integrated 19" LED / HD water resistanttelevision to master en suite??? Mood lighting control to living room??? Feature recessed lighting??? External lighting to terraces and balconies??? Brushed steel socketsPark Street, London SW6;2017-03-30 22:46:30;https://lid.zoocdn.com/354/255/eb5d667a0cdbef7db22487f026dd1d2298778bde.jpg;2017-03-30 22:49:54;51.475246;51.475246;sale;-0.18415;true;0;3;0;0;SW6;London;3550000;;Flat;for_sale;The Tower Chelsea Creek43402959;Waterfronts;020 3463 7513;Residential;Waterfronts is glad to offer this stunning Two Bedroom Apartment in Kidbrooke Village. 825 Sq ft interior, 2nd Floor, lake view, parking space and furniture included.Newly completed on March 2016 and currently tenanted till October 2017 achieving ??1580pcm.Kidbrooke Village - a completely new and vibrant London community, located in the Royal Borough of Greenwich, offering great open green space and village style livingThe property comprises of two good size bedrooms, one with ensuite, and open-plan kitchen and living area with big balcony overlooking the natural reservoir of Kidbrooke Park. Residence also benefits private gym and 24 hrs concierge provided in the development.The plans for Kidbrooke Village include 136 acres of parks, sports facilities such as tennis courts and residents' gyms, shops, a supermarket, bars, restaurants, schools, healthcare, community facilities and a hotel.The address is an integral part of the great city of London, with fast transport links into the City and West End - you can be at London Bridge in as little as 15 minutes*.Please give us a call on today to get more information or to book yourself in for a viewingProperty Ref:84_1556_4397581Embry Road, London SE9;2017-03-30 22:46:30;https://lid.zoocdn.com/354/255/b42d59fb339ba17c07c0b145bd01f422104865a6.jpg;2017-03-30 22:49:24;51.45681;51.45681;sale;0.032444;false;0;0;0;0;SE9;London;530000;;Studio;for_sale;Kidbrooke Village 3 Embry Road43402976;Waterfronts;020 3463 7513;Residential;A fantastic opportunity has arisen to rent this outstanding one bedroom apartment, in the prestigious area of London Paddington, in the Merchant Square Development.This property is finished to a high quality standard and offers spectacular views across the city skyline. With a white gloss finish throughout this professionally fitted kitchen, this property offers fantastic living space.The development comprises of some fantastic amenities, such as a private gym and pool area, as well as a private cinema for residents only.Please call us at Waterfronts for more information or to arrange a view in today! 7th floorBedroomAir conditioning, underfloor heating, mood lighing, designer built in wardrobes and stunning views across LondonBathroomHigh-end specifications, heated bathroom walls, bespoke vanity unit with unique use of storage space, tiled throughout, heated towel rail, bath/showerLiving RoomOak herringbone flooring, under floor heating, air conditioning, dual aspect views over London and BasinKitchenWhite finished fully integrated kitchen, equipped with wine cooler, oven&hob with extractor hood over, dishwasher, built in microwave and large fridge/freezer.Merchant Square East, London W2;2017-03-30 22:46:30;https://lid.zoocdn.com/354/255/8e16cdc71664e0785aca905951ed4152f00b64c7.jpg;2017-03-30 23:02:26;51.51912;51.51912;sale;-0.171811;true;0;1;0;0;W2;London;1000000;;Flat;for_sale;3 merchant square Paddington43402973;Waterfronts;020 3463 7513;Residential;Waterfronts are proud to present an exquisite one bedroom apartment within the exclusive new St Dunstan's Court development.This luxurious apartment is finished to a high specification and features the highest quality fixtures and fittings. This beautiful unit offers approximately 581 sq ft of living space comprising an open plan living/dining area opening onto a stunning balcony, with contemporary fully fitted kitchen to include Siemens appliances and spacious bedroom and bathroom.To the rear of St Dunstan???s Court, you will also benefit from private access to secluded, landscaped gardens, a perfect haven to retreat from the hustle and bustle of city living.Despite being in the core of the capital, residents can relax and unwind in their very own green oasis.This property also has stunning and unrivalled views of the Grade II listed King???s College Maughan Library.The residents also benefit from a 24 hour concierge service and exclusive club facilities.Please give us a call on today to get more information or to book yourself in for a viewing2nd floorBathroomBedroomKitchenReceptionFetter Lane, London EC4A;2017-03-30 22:46:30;https://li.zoocdn.com/1bb6a9f795b8e0e81bd39a37de6f80e0efa4a2c4_354_255.jpg;2017-03-30 22:49:54;51.514954;51.514954;sale;-0.109946;false;0;1;0;0;EC4A;London;1200000;;Flat;for_sale;St Dunstans House 133-137 Fetter Lane43402975;Waterfronts;020 3463 7513;Residential;Waterfronts are excited to present an exciting opportunity to purchase a brand new two bedroom, two bathroom apartment in the Embassy Gardens development.With an open-plan living area, two generous bedrooms with fitted wardrobes, floor to ceiling windows and a private balcony. This is a property with spectacular river views and superb location, perfect for either a new home to reside in or as an investment opportunity.The facilities are high-end and include a 24 hour concierge  cinema  library & lounge  business centre ??? and a health centre with an in-out swimming pool as well as a yoga studio and boxing ring. This property is also offered with a personal parking space.Located between the River Thames and the Nine Elms Linear Park, the development benefits from spectacular views of Westminster to the east, Chelsea and Pimlico to the north and the iconic Battersea Power Station and Park to the west. It is also only eight minutes' walk from Vauxhall Station, the riverside location of Embassy Gardens is a much prized rarity in London's Zone 1.Please give us a call on today to get more information or to book yourself in for a viewing12th FloorBathroomBedroomKitchenen suiteReceptionBalconyBedroomSouthbank Business Centre, Ponton Road, London SW8;2017-03-30 22:46:30;https://lid.zoocdn.com/354/255/558ea69505678081ac9b21064670198a2592a8c2.jpg;2017-03-30 23:02:26;51.482647;51.482647;sale;-0.132065;true;0;2;0;0;SW8;London;1100000;;Flat;for_sale;Capital Building Embassy Gardens43402960;Waterfronts;020 3463 7513;Residential;Waterfronts is pleased to offer this luxury 2 bedroom, 2 bathroom apartment in the brand new development at Manhattan Plaza. Located on the 13th floor with views of the City and Canary Wharf, available to purchase on contract reassignment basis.With close links to Blackwall DLR and only a stone???s throw from central Canary Wharf, this is an exciting opportunity to purchase a stylish apartment right at the heart of London financial district.With 773 Sq Ft of stunning internal space, you will be torn between the comfort of quality London living or the gorgeous views of London city from your 13th floor balcony and spending time between the gymnasium and the multitude of trendy restaurants close by.With completion expected in Q4 2017, this is a great opportunity to acquire an apartment opposite the new Crossrail proposed station.Please give us a call on today to get more information or to book yourself in for a viewing13th FloorBedroomBedroombathroomReceptionEnsuitePoplar Business Park, Prestons Road, London E14;2017-03-30 22:46:30;https://lid.zoocdn.com/354/255/603b86944a1655ec5eb3e96cd0fb8f5bccbbba58.jpg;2017-03-31 01:46:52;51.508083;51.508083;sale;-0.009933;true;0;2;0;0;E14;London;750000;;Flat;for_sale;Manhattan Plaza Canary Wharf43402967;Waterfronts;020 3463 7513;Residential;Waterfronts are delighted to bring to market this outstanding two bedroom duplex apartment located in the heart in the heart of the city of London.Offered for sale off-plan in one of the West End's most luxurious and upcoming developments, this spectacular apartment comprises of designer kitchen with integrated appliances, a spacious living area and modern bathroom. This beautiful apartment also benefits from comfort cooling, an integrated sound system, timber flooring and floor-to-ceiling windows.The development also offers a wide range of on site amenities, including a swimming pool, gymnasium, a private garden, 24 hour concierge, a wine cellar and a residents lounge over looking the tranquil private garden.This modern contemporary flat is located just 50 yards from Oxford Street offering occupants a vast selection of London's finest restaurants, bars and shops to choose from. The apartment is also easily accessible with Tottenham Court Road, Oxford Circus and Goodge Street underground stations all within 5 minutes walking distance.Due for completion in 2017Please give us a call on today to get more information or to book yourself in for a viewing5th floorReceptionKitchenW/C6th FloorBedroomBedroomEnSuiteEnsuiteRathbone Place, London W1T;2017-03-30 22:46:30;https://lid.zoocdn.com/354/255/1816d63a741ff643f616c7f994b602336c2e5dfa.jpg;2017-03-30 22:49:24;51.51777;51.51777;sale;-0.133958;true;0;2;0;0;W1T;London;3000000;;Flat;for_sale;Rathbone Place43402968;Waterfronts;020 3463 7513;Residential;Waterfronts are proud to present an exquisite two bedroom, 6th floor apartment within the exclusive new St Dunstan's Court development. This property has never been lived in since new.This luxurious apartment is finished to a high specification and features the highest quality fixtures and fittings. This beautiful unit offers approximately 581 sq ft of living space comprising an open plan living/dining area opening onto a stunning balcony, with contemporary fully fitted kitchen to include Siemens appliances and spacious bedroom and bathroom.To the rear of St Dunstan???s Court, you will also benefit from private access to secluded, landscaped gardens, a perfect haven to retreat from the hustle and bustle of city living.Despite being in the core of the capital, residents can relax and unwind in their very own green oasis.This property also has stunning and unrivalled views of the Grade II listed King???s College Maughan Library.The residents also benefit from a 24 hour concierge service and exclusive club facilities.Please give us a call on today to get more information or to book yourself in for a viewing6th FloorBathroomBedroomKitchenReceptionBedroomBathroomFetter Lane, London EC4A;2017-03-30 22:46:30;https://lid.zoocdn.com/354/255/faa1db6c777be4b1cea1ed908f7a4f82038ce38c.jpg;2017-03-30 22:49:24;51.514954;51.514954;sale;-0.109946;false;0;2;0;0;EC4A;London;1725000;;Flat;for_sale;St Dunstans House 133-137 Fetter Lane43402965;Waterfronts;020 3463 7513;Residential;An opportunity to purchase a contract reassignment in the Royal Wharf development.Royal Wharf is designed to be a new "village" in the up & coming Royal Docks area of London & is located close to the Thames Barrier & Pontoon Dock DLR station.A fantastic 2nd floor 1065sqft plus 164sqft of balcony space, 3 bedroom 2 bathroom apartment with direct river views from all principal rooms. The apartment is located in Thameside House in the Royal Wharf development & includes a parking space. Completion due Q2 2017.Please give us a call on today to get more information or to book yourself in for a viewing2nd FloorBedroomBedroomBedroomBathroomBathroomKitchenReceptionNorth Woolwich Road, London E16;2017-03-30 22:46:30;https://lid.zoocdn.com/354/255/349b82a4edbe55a312625a15c8f4334415d78c9c.jpg;2017-03-30 22:49:24;51.500954;51.500954;sale;0.028255;true;0;3;0;0;E16;London;710000;;Flat;for_sale;Thameside House Royal Wharf43402972;Waterfronts;020 3463 7513;Residential;Waterfronts are delighted to present this excellent opportunity to purchase a property in the widely anticipated and upcoming development, known as Principal Tower.The warm and quiet tones of this apartment creates a harmonious canvas for residents to display their own personality through their chosen furnishings. The apartment has been spatially configured to maximise the impact of the views, with the open-plan living area leading on to a balcony.Residents of this luxurious development will benefit from excellent facilities such as 24 hour concierge, private lounge, cinema, gym, pool & spa.A City address, within walking distance of trend-setting Shoreditch, Principal Tower offers fast, efficient transport links, as well as a wealth of cultural and culinary experiences on the doorstep.Due for completion in 2017.Follow the link below for the full brochure Please give us a call on today to get more information or to book yourself in for a viewing18thOpenplan Lounge & KitchenBedroomBathroomWorship Street, London EC2A;2017-03-30 22:46:30;https://li.zoocdn.com/f13bc9039c31cd5b1c3054a2f73525c8a07440d3_354_255.jpg;2017-03-31 01:46:52;51.52201;51.52201;sale;-0.085308;true;0;1;0;0;EC2A;London;975000;;Flat;for_sale;Principal Tower Worship Street