listing_id;agent_name;agent_phone;category;description;displayable_address;first_publish_date;image_url;last_publish_date;latitude;listing_status;longitude;new_home;num_bathrooms;num_beedrooms;num_floors;num_recepts;outcode;post_town;price;price_change;property_type;status;street_name43367384;Regent Letting & Property Management Ltd;020 8128 0890;Residential;Tenure: LeaseholdThis keenly-designed two bedroom, two bathroom apartment presents an ideal opportunity for investors. Finished to a high standard throughout, the apartment will enjoy engineered wood flooring, matte white walls and LED down-lighting.The property will comprise two fully-carpeted double bedrooms, an en-suite to the master bedroom and a separate full bathroom, both of which are fully-tiled. There will be open-plan living/ dining area with access to a private balcony. Additionally, residents will have the benefit of a fully-fitted kitchen, containing a Siemens oven and microwave, and integrated dishwasher and high gloss units.Set in over 9 acres of landscaped gardens, the development will see new cafes, restaurants and retail facilities along with its very own residents only gym and concierge service.Colindale Underground Station on the Northern line, is just a five minute walk away. Alternatively from Mill Hill Broadway station the Thameslink service south will take you to Kings Cross in 20 minutes.Ground rent ??300 p.A.Service Charge ??3.00 per sq. Ft.Colindale Avenue, London NW9;2017-03-28 03:43:58;https://lid.zoocdn.com/354/255/19442dc6413c0dca84e609dcbdc76559dec163a4.jpg;2017-03-29 01:41:36;51.59533;51.59533;sale;-0.249201;true;0;2;0;0;NW9;London;440000;;Flat;for_sale;Colindale Avenue43367226;Abbey Estates;020 3589 4050;Residential;Superb two double bedroom second floor apartment set within large communal gardens! Other features include a modern fitted kitchen, luxury upgraded shower room with corner double shower and 18ft x 12ft lounge/dinner with amazing views to the front. Externally there is a single garage en bloc, private in and out driveway and superb communal gardens surrounding the blocks with large areas of lawn, shrubs, mature trees and a number of seating areas. This home is located only minutes from Chislehurst br Station with its regular services to London and Kent and local shops are only a short walk away on Chislehurst Road as well as many fine pubs and restaurants and the beautiful Chislehurst Commons and ponds.Second FloorLounge/DinerModern KitchenBedroomBedroomShower RoomGarageCommunal Grounds35-49 Lubbock Road, Chislehurst, Kent BR7;2017-03-28 03:24:06;https://lid.zoocdn.com/354/255/4f419c2f2a5a599784c79c94004e330d61c9429f.jpg;2017-03-29 01:41:34;51.41224;51.41224;sale;0.053188;false;0;2;0;0;BR7;Chislehurst;375000;;Flat;for_sale;35-49 Lubbock Road Chislehurst43367183;Hunters - Stoke Newington;020 3478 3603;Residential;Requiring complete restoration, this charming three storey Victorian property is best suited to cash purchasers looking for an exciting project to get stuck into. Available chain free the property comprises, front reception room, back reception room/dining room, rear room kitchen (currently a bathroom), master bedroom, three further double bedrooms, half landing bedroom (currently kitchen area), separate WC, cellar storage and approximately 45ft garden. Osterley Road is a quiet residential street ideally placed in a the popular network of roads surrounding Shakespeare Walk and Milton Grove. Transport links include, Stoke Newington Station (Overground), Dalston Kingsland Station (Overground & East London Line) and a variety of bus routes into The City and West End.Osterley Road, London N16;2017-03-28 03:12:24;https://li.zoocdn.com/bc9592dad2961f68ebf2b3d4131ba90f9e9cbf7d_354_255.jpg;2017-03-29 01:41:33;51.556522;51.556522;sale;-0.079834;false;0;4;0;0;N16;London;1050000;;Terraced house;for_sale;London43367170;Cornerstone Estate Agents;020 8022 4282;Residential;Constructed in 1934, this art deco mansion block retains all the contemporary feature of yester years.Central to all transport links this is the perfect home for a professional individual with a hectic lifestyle. The apartment boasts two double bedrooms, recently installed kitchen and luxury bathroom suite.Long lease.Viewings are recommended to avoid disappointment.Broadway House, Bromley Road, Bromley BR1;2017-03-28 03:09:23;https://li.zoocdn.com/07bdde2467f43dc22740821fed49d1ea673ad832_354_255.jpg;2017-03-30 03:11:21;51.423954;51.423954;sale;-0.003996;false;0;2;0;0;BR1;Bromley;350000;;Flat;for_sale;12 Bromley Road Bromley43367169;Cornerstone Estate Agents;020 8022 4282;Residential;Cornerstone Estate Agents offer this three bedroom purpose-built flat is ideally located next to Peckham Rye Park. The property is located close to East Dulwich and offers great connections by trains to London Bridge, Blackfriars, Victoria via the Thames Link. This generous size accommodation with three bedrooms offers scope to improve with a cosmetic makeover. Being located in a position like this, it should readily rent.HallEntry phone, radiator and storage cupboardsSeparate WCBathroomBath, radiator, double glazed window and wash hand basinKitchenTiled floor, double glazed window, stainless steel sink with mixer tap and drainer, storage cupboards, radiator, spaces for fridge freezer and washing machine, floor and wall mounted units and cupboardsBedroom OneRadiator, double glazed windowBedroom TwoRadiator, double glazed windowBedroom ThreeRadiator, double glazed windowReceptionRadiator, double glazed windowEglington Court, East Dulwich Road SE15;2017-03-28 03:09:23;https://li.zoocdn.com/9855cebafd29ac9a8bb64868a40636e31322b6c4_354_255.jpg;2017-03-29 01:41:32;51.462494;51.462494;sale;-0.067516;false;0;3;0;0;SE15;London;475000;;Flat;for_sale;Eglington Court East Dulwich Road43367156;Equity Estate Agents;020 7768 1657;Residential;A spacious and well presented two double bedroom second floor flat, located off the ridgeway and easy reach of enfield town centre, enfield chase and gordon hill Train Station. Benefits include 16ft lounge/diner, modern kitchen, double glazing, gas central heating, garage and communal garden.EntranceVia communal door, stairs to second floor, front door into hallway.HallwayStorage cupboard, spotlights, wood style flooring, door to lounge/diner.Lounge/Diner16' x 15' 7" (4.88m x 4.75m) Double glazed window to front aspect, radiator, wood style flooring, spotlights, loft hatch, opening to kitchen.Kitchen9' 7" x 4' 8" (2.92m x 1.42m) Comprising wall and base units with work surfaces, sink with drainer, integrated electric hob, integrated electric oven, fridge freezer and washing machine, wood style flooring.Bedroom One15' 8" x 10' 8" (4.78m x 3.25m) Double glazed window to rear aspect, radiator, spotlights, wood style flooring.Bedroom Two12' 10" x 6' 8" (3.91m x 2.03m) Double glazed window to rear aspect, radiator, spotlights, wood style flooring.BathroomComprising low level WC, vanity wash basin, Jacuzzi style bath with shower, heated towel rail, frosted double glazed window to side aspect.OutsideCommunal garden.GarageBycullah Road, Enfield EN2;2017-03-28 03:08:31;https://lid.zoocdn.com/354/255/90fa31666133c056a77b6b78ea89b56cb1f976ba.jpg;2017-03-29 01:41:31;51.658875;51.658875;sale;-0.094682;false;1;2;0;1;EN2;Enfield;330000;;Flat;for_sale;Bycullah Road43367155;Equity Estate Agents;020 7768 1657;Residential;Situated on this sought after tree lined road is this spacious and well presented five bedroom semi detached family home. Benefits include 29ft lounge/diner, 20ft kitchen, cloakroom, good size bedrooms, two bathrooms, double glazing, gas central heating, well kept rear garden and off street parking.EntranceVia porch, front door into hallway.HallwayStairs to first floor, wood style flooring, radiator, doors toLounge/Diner29' 1" x 13' 5" (8.86m x 4.09m) Double glazed bay window to front aspect, feature fireplace, dado rail, coving, fitted carpet, double glazed doors to rear garden.Kitchen20' 3" x 9' (6.17m x 2.74m) Comprising wall and base units with work surfaces, sink with drainer, double oven, four ring gas hob, extractor, integrated fridge freezer, dishwasher, tumble dryer and washing machine, spotlights, radiator, double glazed windows to rear aspect, door to rear garden.CloakroomComprising low level WC, wall mounted wash basin, radiator, laminate flooring, double glazed window to rear aspect.LandingFitted carpet, doors to all first floor rooms, stairs to second floor.Bedroom One15' 5" x 9' 3" (4.70m x 2.82m) Double glazed bay window to front aspect, radiator, fitted wardrobes, coving, fitted carpet.Bedroom Two12' 8" x 11' 3" (3.86m x 3.43m) Double glazed window to rear aspect, radiator, coving, fitted carpet.Bedroom Three10' 8" x 7' 8" (3.25m x 2.34m) Double glazed window to front aspect, radiator, coving, fitted carpet.BathroomComprising low level WC, wash basin, panel enclosed bath with shower attachment, airing cupboard, spotlights, heated towel rail, obscure double glazed window to rear aspect.LandingCoving, fitted carpet, doors to all second floor rooms.Bedroom Four16' x 7' 9" (4.88m x 2.36m) Double glazed window to rear aspect, radiator, coving, fitted carpet.Bedroom Five13' 7" x 9' 4" (4.14m x 2.84m) Double glazed window to front aspect, fitted wardrobe, storage cupboard, radiator, coving, fitted carpet.BathroomComprising low level WC, pedestal wash basin, shower cubicle, heated towel rail, coving, spotlights, storage cupboard, obscure double glazed window to rear aspect.Front GardenPath to front door, off street parking.Rear GardenPatio remainder to lawn, shed.Edenbridge Road, Enfield EN1;2017-03-28 03:08:31;https://lid.zoocdn.com/354/255/3b6f57ea667fae0ef6d96b67bbfd9d24c7505b81.jpg;2017-04-07 03:05:42;51.639088;51.639088;sale;-0.076897;false;2;5;0;1;EN1;Enfield;625000;;Semi-detached house;sold;Edenbridge Road43367143;Hunters - Forest Hill;020 8022 6019;Residential;Hunters Exclusive are delighted to offer buyers an opportunity to purchase one of the rarest period style maisonette???s Forest Hill has to offer. Not only is the property a rare find, but it is also being sold with the freehold for the building.In this description, we will cover some information about the property, the local schools, transport links and recreational facilities, however for those buyers that may not know Forest Hill so well we would encourage you to do some research on the location as it???s become one of South East London???s gems.In a time when much of large houses have historically been converted into many small apartments, it???s an absolute pleasure to find a building of this size separated in to only two properties and retains some stunning period features.This period style maisonette on Mayow Road offers some of the following period features to name a few:Large period style windows with stain glass featurePanelled doors stripped back to the woodA cast iron fire place with inset period tiles and granite style hearthA variation of cornicing and coving stylesPicture rails and ornate ceiling rosePeriod style window shutters and sash windowsStripped and varnished floor boardsPeriod style skirting boards and door architravesThe front garden faces easterly capturing the morning light whilst the rear garden faces westerly capturing the afternoon sun with the front garden offering gated parking for multiple cars allocated to this maisonette.The private rear garden is almost 80 feet in length and 35 feet wide. There is a raised, decked patio area and a garden shed offering approximately 128 sq ft of storage space which could be converted to a studio, workshop or other out building subject to consents.At over 2550 sq ft of internal space, the maisonette offers the same space as approximately two, three bedroom houses combined making it an extremely generous sized property which would rival many four and five bedroom houses locally.Although the property is being marketed as a four bedroom it can also be utilised as a three bedroom with two reception rooms and you will note from the images that the current owner is currently using one of the rooms as a dedicated dining area which is great for entertaining.Located on a wide tree lined road only approximately 0.7 miles to Forest Hill station and Sydenham station in the opposite direction, the property is well located for amenities and transport links.Forest Hill features several small independent high street conveniences including an award-winning butcher, some fantastic cafes, several boutique shops selling clothing and furniture as well as a few great modern, gastro and family friendly pubs.The Sylvan Post, Canvas and Cream and Stag and Bow all variously host, music events, exhibitions and craft days.However, if you require the convenience of a large well known supermarket and other known high street names, you will find Sainsbury???s, Boots and wh Smith along the high street too.Schools are A big attraction in forest hill:Church Rise is in proximity of several local schools which are in Ofsted's top 10%. In our experience, it???s unusual to find a house that is located to this many highly-rated schools. Four of those schools are as follows however there are other well-known local schools including an independent Montessori just a few minutes away:St Dunstan's College - Church of England, mixed, primary and secondary. This is a private school.Fairlawn - Public, mixed, primary, rated Ofsted "Outstanding".Kilmorie - Public, mixed, primary, rated Ofsted "Good".Dalmain - Public, mixed, primary, rated Ofsted "Good".TransportApproximately 0.7 miles away in opposing directions, Forest Hill and Sydenham stations offer services from both London Overground and Southern Rail some of the following travel times are available:London Bridge in approximately 17 minutes.Canary Wharf in approximately in 23 minutes.Shoreditch High Street in approximately 22 minutes.Victoria station in approximately 30 minutes.Alongside the train links you will find several bus routes from along Mayow Road and on the South Circular which includes routes 122 and 185 to Crystal Palace and Victoria to name a few.Local recreation:Mayow Park located along Mayow Road itself is a very popular green space located approximately 0.1 miles from the property. It???s well known for its caf?? as well as a bowling green, outdoor gym, water feature, nature reserve, tennis courts, cricket pitch and meadow area to name a few highlights.Off the high street in Forest Hill town centre you'll find Forest Hill pools and library both of which have undergone refurbishment. Forest Hill pools is known for its swimming pool facilities but is also a local leisure centre with a gym and fitness classes.The Horniman Museum and Gardens is a well-known local point of interest and can be found just beyond the town centre. It???s recognized as popular family entertainment venue and has been featured in "Time Out". With regular events, such as a farmer???s market, live music and seasonal festivals to name a few, there is always something to enjoy at the Horniman.You can read more about the Horniman museum and gardens here:Blythe Hill Fields is also located in to local area and offers recreational facilities such as the "Trim trails" which is an exercise trail. It also hosts local events where the residents of SE23 get to know each other better and enjoy the community spirit. You may look up details about Blythe Hill Fields on their website:Please contact Hunters on to obtain more information and book a viewing.Mayow Road, Forest Hill SE23;2017-03-28 03:05:45;https://lid.zoocdn.com/354/255/853a794caaee6b51059e97f8b03c47f47db2fcd9.jpg;2017-04-01 03:00:26;51.43204;51.43204;sale;-0.045667;false;0;4;0;0;SE23;London;700000;;Flat;for_sale;London43367118;Hunters - Plaistow;020 8128 1939;Residential;Guide Price: ??440,000 - ??460,000Good size three bedroom house arranged over two storeys a separate bathroom and w.C on the first floor. On the ground floor there is a spacious kitchen and lounge with another w.C. Further boasting two storage areas accessible from the private garden. Being offered chain free.Lounge4.19m (13' 9") x 4.04m (13' 3")Good size lounge double glazed windows filling this room with great natural light, wall mounted gas central heating, door leading to garden.Kitchen3.05m (10' 0")x 2.64m (8' 8")Good size kitchen with a range of wall and base units, rolling worktop with stainless steel sink and mixer tap, four ring gas hob with oven and grill, large double glazed window to front aspect.Ground floor W.CLow flush w.C, wash hand basin.GardenAccess to storage area on side with shed to rear.First floor landingAccess to all first floor rooms.Bedroom one4.11m (13' 6") x 3.18m (10' 5")Good size bedroom with double glazed window to front aspect, wall mounted gas central heating.Bedroom two3.63m (11' 11") x 3.07m (10' 1")Double glazed window to rear aspect, wall mounted gas central heating.Bedroom three3.05m (10' 0")x 2.36m (7' 9")Double glazed window to rear aspect, wall mounted gas central heating.BathroomTwo piece suite comprising of panelled bath, wash hand basin, double glazed window to rear.Separate W.CLow flush w.C, hand wash basin, double glazed window to rear.Upper Road, Plaistow, London E13;2017-03-28 02:57:58;https://lid.zoocdn.com/354/255/deb8e37fe37c10acc38834e26fff5fa8d5f1ba70.jpg;2017-03-29 01:41:30;51.530563;51.530563;sale;0.018542;false;0;3;0;0;E13;London;440000;;Terraced house;for_sale;Plaistow London43367119;Hunters - Plaistow;020 8128 1939;Residential;Guide price ??490,000 - ??510,000 - We are delighted to offer this unique four bedroom home. Located perfectly for all local amenities including shopping, transport, schools and motoring links into London. Internally the property boasts bright and spacious accommodation throughout and in neutral decorative order. Call now to book your viewing to fully appreciate what this property has to offer.Living area5.38m (17' 8") x 3.05m (10' 0")Large double glazed window to front aspect, wood effect laminated flooring, wall mounted gas central heating, door leading to garden and side access.Kitchen3.20m (10' 6") x 2.97m (9' 9")Range of wall and base units, rolling worktop with integrated four ring gas hob, oven and grill, plumbing and space for washing machine.Shower areaThree pieces suite comprising of shower cubicle, low flush w.C, hand wash basin.Stairs down to basementbasement5.05m (16' 7") x 4.24m (13' 11")Wall mounted gas central heating, various power points, carpet flooring.BathroomDouble glazed window, three piece suite comprising of panelled bath, low flush w.C, hand wash basin.Ground floor W.CDouble glazed window, low flush w.C, hand wash basin.GardenPaved with shed (14'5" x 13'5").First floor landingAccess to all first floor rooms.Bedroom onebedroom one4.50m (14' 9") x 4.39m (14' 5")Spacious bedroom with three double glazed windows to front aspect, wall mounted gas central heating, carpet flooring.Bedroom two3.23m (10' 7") x 2.77m (9' 1")Double glazed window to rear aspect, carpet flooring, wall mounted gas central heating.Bedroom three3.25m (10' 8") x 2.03m (6' 8")Double glazed window to side aspect, carpet flooring, wall mounted central heating.Bedroom four3.05m (10' 0")x 1.65m (5' 5")Double glazed window to rear aspect, wall mounted gas central heating.Cheshunt Road, Forest Gate, London E7;2017-03-28 02:57:58;https://lid.zoocdn.com/354/255/d9665d79b7a6abfd38abd7ba314e96d972e48834.jpg;2017-03-29 03:01:52;51.54248;51.54248;sale;0.031601;false;0;4;0;0;E7;London;490000;;End terrace house;for_sale;Forest Gate London43367081;Barratt London - Nine Elms Point;020 8128 0895;Residential;This apartment offers a west facing balcony with views towards the new Embassy District. The modern kitchen comes with Nolte handleless units, aeg appliances and Amtico flooring. Both the bathroom and en suite feature Roca white sanitary ware and chrome finish towel rail. Further benefits include underfloor heating and fitted wardrobe to the master bedroom. Totalling 915 sq ft/84.9 sq m.RoomsFirstLiving (4.17 x 4.24m (13'8" x 13'10"))Kitchen/Dining (3 x 4.24m (9'10" x 13'10"))Bedroom 1 (5.48 x 3.34m (17'11" x 10'11"))En Suite (2.4 x 1.88m (7'10" x 6'2"))Bedroom 2 (3.65 x 3.07m (11'11" x 10'0"))Bathroom (2.1 x 2.4m (6'10" x 7'10"))Total Area (84.9 sq m (915sqft))Balcony (1.22 x 2.75m (4'0" x 9'0"))About Nine Elms PointNine Elms Point is a Zone 1 development in the heart of London's most exciting new district. Conveniently located next to the future Nine Elms underground station and with Vauxhall station just a five minute walk away, arrive at Oxford Circus in around 8 minutes to fulfil all of your shopping needs.Book an appointment to view our Show Apartments and experience the on-site amenities ??? already open for our residents to enjoy.Leisure'Nine Elms on the South Bank' will deliver a new district for central London, spanning 195 hectares along the South Bank of the Thames. Residents can enjoy green open spaces, caf??s, restaurants and a linear park sweeping from east to west. Residents at Nine Elms Point will be part of 'the greatest transformation at the heart of the world's greatest city'. Nine Elms Point offers private fitness suite, 24-hour concierge service, business suite, residents lounge, cinema room and a private dining room available for exclusive occasions.TransportNine Elms Point sits next to the planned Nine Elms Station (Zone 1). Vauxhall station is underhalf a mile away. You can be in Waterloo in 4 minutes, Oxford Circus in 9 minutes or London King's Cross St. Pancras in 13 minutes. Gatwick, Heathrow and London City Airport are all less than an hour's commute away.Opening HoursMon-Tue, Fri-Sat 10:00-18:00, Wed-Thu 10:00-20:00, Sun 10:00-16:00DirectionsHead southwest on S Lambeth Rd/?A3036 toward Vauxhall GroveContinue to follow the A3036 (0.2 miles). Go slight left onto Wandsworth Rd/?A3036 and Nine Elms Point will be on the right just past Covent Garden Market East Side bus stop (0.2 miles).DisclaimerPlease note that all images (where used) are for illustrative purposes only."Watts Apartments" at Wandsworth Road, London SW8;2017-03-28 02:49:01;https://li.zoocdn.com/9d7f7cb896d9f0a1e4654843691a2e8eb8479df7_354_255.jpg;2017-04-06 04:07:39;51.48153;51.48153;sale;-0.127949;true;2;2;1;2;SW8;London;910000;;Flat;for_sale;Nine Elms Point, Wandsworth Road, Lambeth43367080;Barratt London - Nine Elms Point;020 8128 0895;Residential;This apartment offers a balcony accessible from the spacious open plan living/dining room with views across the new Embassy District. The fitted kitchen includes Nolte handleless furniture and aeg appliances. Both the bathroom and en suite come with ceramic wall and floor tiling. Further features include amtico flooring to living area, kitchen and hall. Totalling 875 sq ft/81.3 sq m.RoomsFirstLiving/Dining (5.72 x 5.46m (18'9" x 17'11"))Kitchen (3.65 x 1.84m (11'11" x 6'0"))Bedroom 1 (3.78 x 3m (12'4" x 9'10"))En Suite (2.4 x 1.7m (7'10" x 5'6"))Bedroom 2 (3.27 x 4.16m (10'8" x 13'8"))Bathroom (2.1 x 2.4m (6'10" x 7'10"))Total Area (81.2 sq m (874sqft))Balcony (4.09 x 2.17m (13'5" x 7'1"))About Nine Elms PointNine Elms Point is a Zone 1 development in the heart of London's most exciting new district. Conveniently located next to the future Nine Elms underground station and with Vauxhall station just a five minute walk away, arrive at Oxford Circus in around 8 minutes to fulfil all of your shopping needs.Book an appointment to view our Show Apartments and experience the on-site amenities ??? already open for our residents to enjoy.Leisure'Nine Elms on the South Bank' will deliver a new district for central London, spanning 195 hectares along the South Bank of the Thames. Residents can enjoy green open spaces, caf??s, restaurants and a linear park sweeping from east to west. Residents at Nine Elms Point will be part of 'the greatest transformation at the heart of the world's greatest city'. Nine Elms Point offers private fitness suite, 24-hour concierge service, business suite, residents lounge, cinema room and a private dining room available for exclusive occasions.TransportNine Elms Point sits next to the planned Nine Elms Station (Zone 1). Vauxhall station is underhalf a mile away. You can be in Waterloo in 4 minutes, Oxford Circus in 9 minutes or London King's Cross St. Pancras in 13 minutes. Gatwick, Heathrow and London City Airport are all less than an hour's commute away.Opening HoursMon-Tue, Fri-Sat 10:00-18:00, Wed-Thu 10:00-20:00, Sun 10:00-16:00DirectionsHead southwest on S Lambeth Rd/?A3036 toward Vauxhall GroveContinue to follow the A3036 (0.2 miles). Go slight left onto Wandsworth Rd/?A3036 and Nine Elms Point will be on the right just past Covent Garden Market East Side bus stop (0.2 miles).DisclaimerPlease note that all images (where used) are for illustrative purposes only."Watts Apartments" at Wandsworth Road, London SW8;2017-03-28 02:49:01;https://lid.zoocdn.com/354/255/f0522f9d82616ed1e12362ff6e5baf36e55e6e12.jpg;2017-04-06 04:07:39;51.48153;51.48153;sale;-0.127949;true;2;2;1;1;SW8;London;900000;;Flat;for_sale;Nine Elms Point, Wandsworth Road, Lambeth