listing_id;agent_name;agent_phone;category;description;displayable_address;first_publish_date;image_url;last_publish_date;latitude;listing_status;longitude;new_home;num_bathrooms;num_beedrooms;num_floors;num_recepts;outcode;post_town;price;price_change;property_type;status;street_name43403419;Choices - Croydon;020 3478 3473;Residential;Beaufort Park is North West London's most established new destination by St George. This thriving new development is the ideal place to live, where residents enjoy exclusive health and fitness facilities, beautifully landscaped gardens and courtyards, all with the convenience of the shops, bars and restaurants at the heart of Beaufort Park.Beaufort Park is just a short journey from the veryheart of the world???s most exciting metropolis.A global centre for finance, theatre, music andculture with its unrivalled shopping and nightlife,Aerodrome Road, London NW9;2017-03-30 23:50:22;https://lid.zoocdn.com/354/255/3de4673e585033482bf6d4e3bd42dc04b5c5f8cd.jpg;2017-03-30 23:51:32;51.595512;51.595512;sale;-0.24339;true;1;1;0;1;NW9;London;420000;;Flat;for_sale;Beaufort Park Colindale43403420;Choices - Croydon;020 3478 3473;Residential;South Gardens comprises 360 homes ranging from three storey houses to a sixteen storey tower. One, two, three, and four-bedroom homes will be provided with a bias towards larger family homes.All the homes will include a private balcony, terrace or private garden and residents will also have access to a rooftop terrace, offering panoramic views of the London skyline, including Canary Wharf, St Paul???s Cathedral and the City.The homes will also showcase the latest sustainable building practices and innovations, including cross-laminated timber, a highly durable material which is designed to improve the energy efficiency of buildings. The homes will also feature water saving technology, with a strong focus on urban nature, including green roofs and green walls.South Garden View will feature 30 residences in total, split into one, two and three-bedroom apartments across six floors, all with private balconies. A cluster of shops at the base of the building will face onto the central shopping street. The east side of the building will enjoy views over the landscaped courtyards, while south-facing rooms will look towards Crystal Palace and those in the west will face the central shopping street.South Garden Mansions, Elephant Park, Elephant And Castle, London SE17;2017-03-30 23:50:22;https://lid.zoocdn.com/354/255/54b867b659785830e27293a454d131bc65ab4cae.jpg;2017-04-01 00:38:50;51.493996;51.493996;sale;-0.09854;true;1;2;0;1;SE17;London;630000;;Flat;for_sale;South Garden Mansions, West Grove43403414;Daniels - Dollis Hill & Neasden;020 3478 3471;Residential;A well presented end of terrace house located in Neasden. The property comprises of three bedrooms, a reception room, kitchen, family bathroom with a separate w/c and a private garden and has the added benefit of off street parking for two cars. Neasden Underground Station is served by the Jubilee Line (Zone 3). To avoid disappointment, call now to arrange a viewing.BedroomBedroomBedroomReceptionBathroomKitchenGardenNormans Close, London NW10;2017-03-30 23:49:43;https://lid.zoocdn.com/354/255/692517e5b00e59f61a1da86ce08dfdfddf4aced7.jpg;2017-03-31 01:47:17;51.54822;51.54822;sale;-0.262736;false;0;3;0;0;NW10;London;599950;;End terrace house;for_sale;Normans Close Neasden43403413;Daniels - Dollis Hill & Neasden;020 3478 3471;Residential;An immaculately presented semi detached family home located in Dollis Hill. The property comprises of four bedrooms, two bathrooms, two reception rooms, a family kitchen, conservatory, an office with a w/c and a private garden. Dollis Hill Underground Station is served by the Jubilee line (Zone 3). All in all this property is not one to be missed. Call now to avoid disappointment.BedroomBedroomBedroomBedroomReceptionReceptionBathroomBathroomKitchenGarageOfficeCrest Road, London NW2;2017-03-30 23:49:04;https://li.zoocdn.com/ef3680439e9aaf3fad3e2ddb015d1a2a5cad8a5d_354_255.jpg;2017-03-31 01:47:17;51.56511;51.56511;sale;-0.236626;false;0;4;0;0;NW2;London;800000;;Semi-detached house;for_sale;Crest Road Dollis Hill43403367;Vival Property;020 3478 3633;Residential;Vival Property is proud to present a luxurious double bed apartment set around new green squares in this exciting and highly sought modern development in the heart of Earls Court close to Kensington & Chelsea. Finished to a very high standard with amenities. Note: - CGIs for marketing purpose only.3rd FloorBedroomReceptionBathroomKitchenConciergeClubhouseBalconyUnderfloor heating and comfort coolingLillie Square, Lillie Road, Earls Court SW6;2017-03-30 23:40:46;https://lid.zoocdn.com/354/255/9d12628690b96ad2c773ea703a5dc7b8aa7cdeb7.jpg;2017-03-30 23:42:03;51.486263;51.486263;sale;-0.198289;true;0;1;0;0;SW6;London;760000;;Flat;for_sale;Lillie Square Lillie Road Earls Court43403323;Roberts Hunt & Co;020 3478 3553;Residential;A well presented and versatile halls adjoining four double bedroom semi-detached house, situated in A popular residential location and within minutes to bedfont town centre and transport links. Offered to the market with no onward chain. An early viewing is highly recommended.Entrance hallApproached via a UPVC front door, radiator, stairs rising to first floor, door to:Dining room - 11' 10'' x 11' 3'' (3.612m x 3.439m)Wood flooring, under stairs store cupboard housing meter, further store cupboard housing meter, wood effect flooring, open to:Living room - 13' 2'' x 11' 4'' (4.010m x 3.466m)Into double glazed front aspect bay window, wood effect flooring, radiator.Kitchen / breakfast room - 13' 10'' x 9' 10'' (4.204m x 2.995m)A modern range of eye and base level units with roll top work surfaces incorporating a one and half bowl sink with mixer tap, spaces for washing machine, upright fridge/freezer, dishwasher, tumble dryer and oven with hooded extractor above, wall mounted combination boiler, space for table and chairs, double glazed side and rear aspect windows.First floor landingStairs rising to second floor.Bedroom two - 14' 9'' x 11' 5'' (4.500m x 3.479m)Two double glazed front aspect windows, radiator.Bedroom three - 11' 1'' x 9' 2'' (3.380m x 2.796m)Double glazed rear aspect window, radiator.Bedroom four - 10' 1'' x 10' 2'' (3.075m x 3.100m)Narrowing to 4'8" - Double glazed rear aspect window, radiator.Shower roomA modern suite comprising of a low level WC, wash hand basin set into vanity unit with draws below and a large walk in shower with wall mounted shower and controls, extractor fan, part tiled walls and flooring, radiator, double glazed side aspect frosted window.Second floorDoor to large loft storage area, double glazed rear aspect window, further door to:Master bedroom - 17' 6'' x 11' 4'' (5.337m x 3.446m)Double glazed rear aspect window, double glazed front aspect velux window, wood flooring, two fitted double wardrobes, radiator, two doors to under eaves storage, door to:En-suiteA modern suite comprising of a low level WC, wash hand basin set into vanity unit with draws below and a shower cubicle with a wall mounted electric shower, part tiled walls, radiator, shaver point, door to store cupboard, extractor fan, double glazed front aspect velux window.Front gardenIs paved with a side alleyway with pedestrian gate giving access to rear garden.Rear gardenIs a good size with a large paved patio area, with the remainder being laid to lawn, timber store shed, pedestrian gate giving access to front garden, further pedestrian gate for neighbours agreed right of passage.The Firs, New Road, Bedfont, Feltham TW14;2017-03-30 23:36:41;https://lid.zoocdn.com/354/255/4305499825f358c2a51054e4fd512525001f403b.jpg;2017-04-02 20:32:49;51.45409;51.45409;sale;-0.431673;false;2;4;0;1;TW14;Feltham;425000;;Semi-detached house;for_sale;New Road Bedfont43403311;Gales Estate Agency;020 3478 3496;Residential;Exceptional modern three/four bedroom property of late 20th century design and construction presented throughout in an attractive, elegant and engaging functional, minimalist style with accommodation arranged over three floors, comprising large through lounge, three bedrooms, reception room/4th bedroom, large well fitted kitchen, garden room, modern bathroom, separate WC. The property further benefits from gas central heating, double glazing, 65ft rear garden, oak flooring and off street parking.White Lodge, Upper Norwood, London SE19;2017-03-30 23:34:39;https://lid.zoocdn.com/354/255/c500dce3eea461aaa061befa295e4b507840a179.jpg;2017-03-30 23:35:20;51.41734;51.41734;sale;-0.103865;false;2;4;0;2;SE19;London;529995;;;for_sale;White Lodge Upper Norwood43403270;Bladon Sears Ltd;020 8033 7620;Residential;A highly sought after raised ground floor apartment which has undergone a total refurbishment some 2 years ago. The property has the benefit of all modern requirements, including ensuite shower room, central heating, double glazed windows and more. Located within the Eruv. Chain free.Entrance Communal entrance to block with security door.Entrance hall: Bright and welcoming entrance hall with doors to all rooms. Storage cupboard/airing cupboard. Solid oak wood flooring.Lounge/dining room: 15???9 x 13??? Spacious reception with double window aspect.Kitchen/breakfast room: 12???5 x 8??? Modern kitchen with range of wooden wall and base units. Single bowl stainless steel sink unit with drainer set into contrasting worktops. Built-in breakfast bar with space for two to sit and eat. Integrated appliances including hob, oven, fridge/freezer, dishwasher and washing machine. Window aspect. Tiled flooring.Bedroom 1: 12???1 x 10???9 Bright and airy. Built in wardrobes. Access to :-ensuite shower room: Practical shower room with walk-in shower cubicle, WC, wash handbasin and tiled walls and floor.Bedroom 2: 11???1 x 8???1 Bright spacious second bedroom. Currently laid out as a multi purpose room. Solid oak wood flooring.Family bathroom: Spacious bathroom with panelled bath, wash handbasin, WC. Fully tiled walls and floor.Communal gardens:Communal parking:We have been informed by the Vendor of the following information but have seen no supporting documentation:Lease: Share of freehold with 999 year lease from creation ??? to be confirmedground rent: Not applicacleservice charge: ??1,680 per annum ??? to be confirmednb: Please note that the block has repair works carried out some 2 ??? 2.5 years ago and is insured. Building insurance costs are included in the service charge. Council tax: Band Doffer procedure:- Should you wish to make an offer, please contact our office on , where full details, including financial information, will be requested.For further details and an appointment to view please contact: Helen Bladon-Reid or Nigel Sears open 7 days A week Web Site:  These details have been prepared by the Main Agent with consideration to the Property Misdescription Act 1991. We have endeavoured to be accurate in their preparation. However, any buyer should be aware that there are limitations to the accuracy of these details and we would suggest that any items of particular importance are checked by themselves. The measurements of this property were taken with a sonic tape measure. The services and appliances have not been checked by Bladon Sears.Priory Field Drive, Edgware HA8;2017-03-30 23:29:34;https://lid.zoocdn.com/354/255/b32fda6c6d05b499e4c72966d8457b54075e50fe.jpg;2017-03-30 23:36:02;51.621876;51.621876;sale;-0.269112;false;2;2;0;2;HA8;Edgware;350000;;Flat;for_sale;Priory Field Drive43403266;Greenfield Estate Agents;020 3641 4259;Residential;One bedroom retirement apartment located on the ground floor. Parish Court was constructed by McCarthy & Stone (Developments) Ltd. The Development Manager can be contacted from various points within each property in the case of an emergency. For periods when the Development Manager is off duty there is a 24 hour emergency Appello call system. This one bedroom flat comprises an entrance hall, lounge, kitchen, one bedrooms and bathroom. It is a condition of purchase that residents be over the age of 60 years, or in the event of a couple, one must be over the age of 60 years and the other over 55 years.St. Marks Hill, Surbiton KT6;2017-03-30 23:28:50;https://lid.zoocdn.com/354/255/bce803765d102c97242cce60b7b09a266a4bbfa9.jpg;2017-04-05 20:24:28;51.393867;51.393867;sale;-0.30198;false;1;1;0;1;KT6;Surbiton;199000;;Flat;for_sale;43403249;Lawrence Rand;01895 262111;Residential;A detached two double bedroom bungalow situated on this quiet residential road in Northwood Hills with a secluded South West facing garden backing onto Haste Hill.The accommodation comprises of a spacious entrance hallway with doors to all rooms. There are two bedrooms to the front of the property with a bright spacious reception to the rear leading to the garden. There is a modern bathroom and a refitted kitchen with door to garden. To the front is off street parking and to the rear is a secluded garden with a raised decked area. The garden is mainly laid to lawn with flower and shrub borders and herbaceous borders.Rochester Road is conveniently positioned in a family friendly location, close to local parkland, good schools, shops and transport facilities and within easy reach of Northwood Hills Metropolitan line tube station.Rochester Road, Northwood, Middlesex HA6;2017-03-30 23:26:43;https://li.zoocdn.com/5cb3def5eec43f2b81e741dd9dd2b98039e82fcb_354_255.jpg;2017-04-04 23:30:21;51.59608;51.59608;sale;-0.41658;false;0;2;0;0;HA6;Northwood;600000;;Detached bungalow;sale_under_offer;Northwood Middlesex43403232;Docklands Real Estates Ltd;020 7768 0118;Residential;Detailed DescriptionDocklands Real Estates is pleased to present this 1 bedroom, 1 bathroom apartment located on the forth floor comprising of 310 . In the development of Rupert Street. The apartment boasts fully refurbished interiors whilst still retaining the Victorian facade that defines the area. In the very epicentre of Soho and right in the heart of London's entertainment district, many theatres, restaurants, shops are all on the doorstep. Piccadilly Circus underground station is just a few minutes short walk away.59 - 63, Rupert Street, Soho W1D;2017-03-30 23:23:25;https://lid.zoocdn.com/354/255/ab601ad6de4467cab9bec36c2ee21a179507488c.jpg;2017-03-31 13:09:45;51.511993;51.511993;sale;-0.133935;false;1;1;0;1;W1D;London;550000;;Flat;for_sale;Rupert Street43403173;Express Estate Agency;0161 300 3987;Residential;The Express Estate Agency is proud to offer this realistically priced opportunity ??? all interest and offers are invited.Semi Detached HouseEntrance Hall2 Reception RoomsFitted Kitchen with Integral Appliances3 BedroomsBathroomDouble Glazed & Centrally Heated (Where Specified)Front & Rear GardensOff Road ParkingGarageEarly viewing is highly recommended due to the property being realistically priced.NxxDisclaimer:These particulars, whilst believed to be accurate are set out as a general guideline and do not constitute any part of an offer or contract. Intending Purchasers should not rely on them as statements of representation of fact, but must satisfy themselves by inspection or otherwise as to their accuracy. Please note that we have not tested any apparatus, equipment, fixtures, fittings or services including gas central heating and so cannot verify they are in working order or fit for their purpose. Furthermore, Solicitors should confirm moveable items described in the sales particulars and, in fact, included in the sale since circumstances do change during the marketing or negotiations. Although we try to ensure accuracy, if measurements are used in this listing, they may be approximate. Therefore if intending Purchasers need accurate measurements to order carpeting or to ensure existing furniture will fit, they should take such measurements themselves. Photographs are reproduced general information and it must not be inferred that any item is included for sale with the property.TenureTo be confirmed by the Vendor???s SolicitorsPossessionVacant possession upon completionViewingViewing strictly by appointment through The Express Estate AgencyNorbury Avenue, Thornton Heath, Surrey CR7;2017-03-30 23:14:15;https://lid.zoocdn.com/354/255/54947ac6c058cab3264059ceda33d37a8d521e41.jpg;2017-03-31 01:47:00;51.402035;51.402035;sale;-0.103966;false;0;3;0;0;CR7;Thornton Heath;570000;;Semi-detached house;for_sale;Norbury Avenue Thornton Heath43403161;Cornerstone Realty;020 8022 6030;Residential;Royal Dockside is a brand new riverside development of apartments offering exclusive riverside living with panoramic views, a marina setting and cosmopolitan quayside promenades and an investment in executive living space in what is set to be the Capital's most prolific and dynamic new district for commerce, culture and leisure.This modern bright 1 bedroom 8th floor apartment (540sq ft) with partial River Thames view and Southwest aspect is fitted with woodstrip veneer flooring throughout.Each apartment has thermostatically controlled heating, a fresh air ventilation system and full double glazed. This property is newly completed.Flush panel chrome plated internal doors lead to the bedroom which has a fitted wardrobe with mirrored sliding doors and a fully fitted twist carpet.The kitchen incorporates high gloss lacquered units with straight bar chrome handles, square edge charcoal worktops and is fitted with Zanussi integrated appliances.The bathroom is fitted with a contemporary white suite, thermostatically controlled shower and heated towel rail.The development benefits from podium courtyards with contemporary landscaping, a secure external cycle store and a secure ground level car parking and electric car charging points.Its close proximity of the new ??14.8 billion Crossrail interchange provides potential for sustained growth and high performing residential property values.Residents at Royal Dockside will be 5 minutes walk from the DLR network at Gallions Reach - with an 11 minute journey time to connect to the Jubilee Line at Canning Town.Atlantis Avenue, London E16;2017-03-30 23:12:44;https://lid.zoocdn.com/354/255/68a6dade425ce90e336074ed18a6dcaa5fde55fa.jpg;2017-03-31 01:46:59;51.50695;51.50695;sale;0.07524;true;1;1;0;0;E16;London;325000;;Flat;for_sale;Atlantis Avenue43403157;Lawlors - Chigwell;020 3641 7907;Residential;Situated on the ever-popular Cathedral Estate is this extended well-maintained four bedroom family home. This property is within walking distance to Redbridge Central Line station and local amenities including great primary and secondary schools, bus routes in to Ilford and the M11, A406 and A12 just around the corner. On the ground floor, this bright and airy property comprises of two large reception rooms, a spacious and modern kitchen/diner and a guest cloakroom. On the first floor there are three double bedrooms, one with en-suite, a further single bedroom and a family bathroom.Porch - 6' 10'' x 3' 7'' (2.08m x 1.09m)Living Room - 17' 11'' x 13' 0'' max (5.46m x 3.96m)Dining Room - 17' 4'' to bay x 14' 7'' (5.28m x 4.44m)Kitchen/Dining Room - 20' 11'' max x 14' 11'' (6.37m x 4.54m)Guest Cloakroom - 4' 4'' x 2' 6'' (1.32m x 0.76m)Master Bedroom - 17' 4'' to bay x 10' 8'' (5.28m x 3.25m)En Suite - 9' 1'' max x 4' 3'' (2.77m x 1.29m)Bedroom Two - 16' 6'' x 8' 0'' (5.03m x 2.44m)Bedroom Three - 13' 5'' x 10' 9'' to wardrobes (4.09m x 3.27m)Bedroom Four - 10' 0'' to bay x 8' 5'' (3.05m x 2.56m)Bathroom - 9' 4'' x 8' 4'' (2.84m x 2.54m)Garden - 60' 0'' max x 36' 0'' (18.27m x 10.96m)Courtyard - 23' 0'' x 6' 7'' (7.01m x 2.01m)Garage - 17' 4'' x 8' 1'' (5.28m x 2.46m)Worcester Gardens, Cranbrook, Ilford IG1;2017-03-30 23:12:15;https://li.zoocdn.com/38f32457f76960a4e7e59ad0afd8944eaaf9a6ef_354_255.jpg;2017-03-31 01:46:59;51.572823;51.572823;sale;0.052782;false;2;4;0;2;IG1;Ilford;750000;;Semi-detached house;for_sale;Worcester Gardens43403156;Tatlers;020 3478 3158;Residential;Superbly located in the heart of Highgate village, just moments from the extensive amenities of the High Street and the open spaces of Waterlow Park and Hampstead Heath. A great opportunity to acquire a delightful and spacious mid terraced five bedroom Victorian residence designed over three floors by John Winter architects offering excellent living space with granted planning permission to further extend.Entrance HallwayAccess to wc and cellar (18???5 x 5??? (5.62m x 1.52).Reception14???3 x 12??? (4.35m x 3.65m). Front aspect, bright and modern reception room, double glazed sash windows leading onto second reception via folding doors.Reception12???3 x 10???1 (3.74m x 3.08m). Built in storage and original cornicing, leading through to kitchen via French doors.Kitchen/Diner21???2 x 16???4 (6.45m x 4.98m). Spacious modern fitted kitchen with integrated appliances, central island and granite worktops, ample storage, benefitting from an abundance of natural light and direct access to gardenMaster Bedroom16???8 x 14???5 (5.07m x 4.40m). A large bedroom with fitted wardrobes, double glazed sash windows and front aspect, with en-suite.En-Suite BathroomModern en-suite with bath and separate shower, tiled to ceiling, fitted storage units.Bedroom 210???2 x 9???9 (3.11m x 2.97m). Rear aspect via double glazed sash window.Bedroom 314??? x 9???3 (4.37m x 2.81m). Double bedroom with fitted wardrobes and sash windows overlooking garden.BathroomTiled walls, family bathroom, fitted storage units.Top Floor LandingBright landing leading on to final two bedroomsBedroom 410???11 x 10???4 (3.32m x 3.15m). Double bedroom with rear aspect.Bedroom 515???4 x 14???5 (4.68m x 4.40m). Large double bedroom, double glazed skylight and sash window to front.GardenPatio with steps leading to lawn.Bisham Gardens, Highgate, London N6;2017-03-30 23:11:14;https://lid.zoocdn.com/354/255/59c0a3c32b8138a100ef3ea50dc3028c321efbd6.jpg;2017-03-31 03:05:23;51.57013;51.57013;sale;-0.1475;false;0;5;0;0;N6;London;1900000;;Terraced house;for_sale;Bisham Gardens Highgate43403155;Tatlers;020 3478 3158;Residential;Tatlers are happy to be offering this two bedroom, split-level flat with communal garden forming part of a Victorian period property on this popular road on the borders of Crouch End and Highgate. The flat offers spacious rooms and has been tastefully modernized. Located within a ten minute walk of Highgate Underground station (Northern Line). There are various bus routes in close proximity and the shops of Crouch End are within walking distance or a short bus ride.ReceptionBright large room offering front aspect views via double glazed sash windows.BathroomModern fitted 3 piece suite with storage, tiled floor to ceiling.KitchenFront aspect sash windows, modern fitted kitchen with integrated appliances and tiled floor.Bedroom 1Large double bedroom with fitted wardrobes and access to balcony.Bedroom 2Double bedroom with fitted wardrobes.BalconyBalconyStanhope Road, Highgate, London N6;2017-03-30 23:11:14;https://lid.zoocdn.com/354/255/f9fe00ee1c561c9c72551f58f9cf6d0978739b67.jpg;2017-04-01 21:04:59;51.57596;51.57596;sale;-0.136439;false;0;2;0;0;N6;London;725000;;Flat;for_sale;Stanhope Road Highgate43403151;Victoria Knight;020 3478 3326;Residential;Victoria Knight are delighted to offer this luxury three bedroom house in Walthamstow. This property really takes the cake with three large bedrooms all with their own en suite bathrooms. You can guarantee every member of this home will be relaxed to the max with a toilet and shower in the convenience of their own living space. You???re also spoilt for space with three massive doubles and one good-sized double bedroom, including a beautiful loft room, an absolutely ideal space for a couple. Fitted with a gorgeous smoky wooden floor and brimming with features throughout, the property bears a smart and modern look. Features include a quirky abstract styled backdoor, feature wall and slick tile finish in the kitchen. What else? The garden is a little piece of paradise that features a friendly wooden cove, perfect for relaxing in the shade and looking out onto the long stretch of greenery. Where? Located in the heart of Walthamstow, you're well served for transport links into London and local amenities, as well as nature parks and reservoirs for your outdoor fix. This is the ideal area.Please call Victoria Knight and book a viewing to avoid disappointment, this is a unique a must see property.Reception - 11' 3'' x 11' 0'' (3.43m x 3.35m)Living room - 10' 8'' x 11' 10'' (3.25m x 3.60m)Kitchen - 9' 3'' x 8' 8'' (2.82m x 2.64m)Master bedroom - 10' 3'' x 14' 5'' (3.12m x 4.39m)Bedroom (loft) - 16' 3'' x 13' 2'' (4.95m x 4.01m)Bedroom 3 - 8' 3'' x 8' 8'' (2.51m x 2.64m)Havant Road, Walthamstow E17;2017-03-30 23:10:43;https://lid.zoocdn.com/354/255/013d91e80832570eec984aa5d708695b17287d08.jpg;2017-03-31 01:46:59;51.58858;51.58858;sale;-0.006952;false;4;4;0;1;E17;London;625000;;Terraced house;for_sale;Havant Road43403109;Chase Evans Canary Wharf;020 7768 2434;Residential;We are delighted to offer this 'off plan' two bedroom apartment arranged over 710 sq ft on the??16th floor of a new development in Stratford. Features will include a living room with wood flooring and an open plan kitchen, balcony, two bedrooms and bathroom. Completion estimated for Summer / Autumn 2017. ***Please call for more information***Glasshouse Gardens, West Tower, Stratford E20;2017-03-30 23:07:04;https://lid.zoocdn.com/354/255/f8f46cbaeea3635729ac6a8ebff49289e547425b.jpg;2017-03-30 23:10:13;51.54684;51.54684;sale;-0.008773138;true;2;2;0;1;E20;;580000;;Flat;for_sale;Cassia Point, 3 Glasshouse Gardens