listing_id;agent_name;agent_phone;category;description;displayable_address;first_publish_date;image_url;last_publish_date;latitude;listing_status;longitude;new_home;num_bathrooms;num_beedrooms;num_floors;num_recepts;outcode;post_town;price;price_change;property_type;status;street_name43403110;Chase Evans Pan Peninsula;020 3641 4650;Residential;A beautifully presented two bedroom, two bathroom apartment located within one of Canary Wharf's most prestigeous developments. The property is situated on the 6th floor and boasts approximately 688 sq ft of living space and a balcony. On-site facilities include 24 hour concierge service, extensive leisure complex with 16 meter ozone pool and split level gymnasium plus exclusive use of a designer cinema. The development also boasts a panoramic 48th floor cocktail bar and restaurant found on the lower floor.Pan Peninsula Square, East Tower, Canary Wharf E14;2017-03-30 23:07:04;https://li.zoocdn.com/a0a02a3660749d8450de1c4b3c0ce09bece2c1d6_354_255.jpg;2017-03-31 01:46:57;51.4998;51.4998;sale;-0.017368;false;1;2;0;1;E14;London;600000;;Flat;for_sale;3 Pan Peninsula Square43403085;Purplebricks, Head Office;01926 267659;Residential;This is a fantastic flat situated in a converted pub on a quiet cul-de-sac road off the Walworth Road. The property is in a beautiful historic building but the flat has a stylish modern feel. There is a large open kitchen/sitting room, bedroom, bathroom, boiler cupboard, and a mezzanine. A large 360?? lantern roof ensures the flat is incredibly light, with views out over extensive neighbourhood gardens. There is gas central heating, and a clean air certified wood burning stove. The property has both access to a shared cellar space, and its own cellar. It???s incredibly quiet. Burgess Park is close by. Oval underground station (Northern Line) is a short walk, Elephant & Castle (overground, Bakerloo and Northern) is easily accessible by foot or bus. There is an extensive regular bus network from the Walworth Road, giving the flat excellent access to Central London.Bedroom13'1ft x 8'6ft. The bedroom is situated at the back of the property, looking out over gardens, and is very quiet.Kitchen/Family Room24'2ft x 21'4ftBathroom8'4ft x 6'2ftMezzanine13'9fft x 4'1ft108 Grosvenor Terrace, London SE5;2017-03-30 23:06:31;https://lid.zoocdn.com/354/255/b5d4958e724c9ba54bf52b1a6a976d7a2932557e.jpg;2017-04-01 20:39:20;51.48132;51.48132;sale;-0.099801;false;1;1;0;1;SE5;London;485000;;Flat;for_sale;108 Grosvenor Terrace43403044;Cornerstone Realty;020 8022 6030;Residential;Royal Dockside is a brand new riverside development of apartments offering exclusive riverside living with panoramic views, a marina setting and cosmopolitan quayside promenades and an investment in executive living space in what is set to be the Capital's most prolific and dynamic new district for commerce, culture and leisure.This modern bright 4th floor 2 bedroom apartment (785 sq ft) is with River Thames view and East & West aspect, fitted with woodstrip veneer flooring throughout.Each apartment has thermostatically controlled heating, a fresh air ventilation system and full double glazed. This property is newly completed.Flush panel chrome plated internal doors lead to the bedroom which has a fitted wardrobe with mirrored sliding doors and a fully fitted twist carpet.The kitchen incorporates high gloss lacquered units with straight bar chrome handles, square edge charcoal worktops and is fitted with Zanussi integrated appliances.The bathroom is fitted with a contemporary white suite, thermostatically controlled shower and heated towel rail.The development benefits from podium courtyards with contemporary landscaping, a secure external cycle store and a secure ground level car parking and electric car charging points.Its close proximity of the new ??14.8 billion Crossrail interchange provides potential for sustained growth and high performing residential property values.Residents at Royal Dockside will be 5 minutes walk from the DLR network at Gallions Reach - with an 11 minute journey time to connect to the Jubilee Line at Canning TownAtlantis Avenue, London E16;2017-03-30 23:02:57;https://lid.zoocdn.com/354/255/be7235eed7f3e857d7783b7913a65f26ae28872d.jpg;2017-03-31 01:46:54;51.50695;51.50695;sale;0.07524;true;2;2;0;0;E16;London;399000;;Flat;for_sale;Atlantis Avenue43403046;Daniels - Kensal Rise & Queens Park;020 3478 3476;Residential;** ??500 Cashback on completion if you purchase this property via Daniels **Located within the ever popular College Park area in Kensal Green is this extended terraced house boasting three double bedrooms and providing over 1000 sq ft of living space, perfect for the growing family who want to update and improve a loving family home.The property boasts a 25ft double reception room with bay windows and original fireplace, fully fitted kitchen, extended bathroom, separate WC & a south facing garden.Situated on this quiet road close to Kensal Green & Chamberlayne Road with its numerous cafes, bars & restaurants. The house is also within the catchment area of good local schools.Ground FloorEntranceFront ReceptionDining AreaKitchenBathroomGardenFirst FloorBedroomBedroomBedroomWaldo Road, College Park, London NW10;2017-03-30 23:01:56;https://lid.zoocdn.com/354/255/644c9298d8c5dda6aec43b6c7bf8b0b4711fe45b.jpg;2017-03-31 02:53:02;51.5305;51.5305;sale;-0.235037;false;0;3;0;0;NW10;London;700000;;Terraced house;for_sale;Waldo Road College Park43403013;Cornerstone Realty;020 8022 6030;Residential;Royal Dockside is a brand new riverside development of apartments offering exclusive riverside living with panoramic views, a marina setting and cosmopolitan quayside promenades and an investment in executive living space in what is set to be the Capital's most prolific and dynamic new district for commerce, culture and leisure.This modern bright 2 bedroom 4th floor apartment (764sq ft) with partial River Thames view and Southwest aspect is fitted with woodstrip veneer flooring throughout.Each apartment has thermostatically controlled heating, a fresh air ventilation system and full double glazed. This property is newly completed.Flush panel chrome plated internal doors lead to the bedroom which has a fitted wardrobe with mirrored sliding doors and a fully fitted twist carpet.The kitchen incorporates high gloss lacquered units with straight bar chrome handles, square edge charcoal worktops and is fitted with Zanussi integrated appliances.The bathroom is fitted with a contemporary white suite, thermostatically controlled shower and heated towel rail.The development benefits from podium courtyards with contemporary landscaping, a secure external cycle store and a secure ground level car parking and electric car charging points.Its close proximity of the new ??14.8 billion Crossrail interchange provides potential for sustained growth and high performing residential property values.Residents at Royal Dockside will be 5 minutes walk from the DLR network at Gallions Reach - with an 11 minute journey time to connect to the Jubilee Line at Canning Town.Atlantis Avenue, London E16;2017-03-30 22:59:54;https://lid.zoocdn.com/354/255/e77329bc093c8c550449ba2c84d3e787bd18fb5c.jpg;2017-03-31 01:46:53;51.50695;51.50695;sale;0.07524;true;2;2;0;0;E16;London;440000;;Flat;for_sale;Atlantis Avenue43403034;Ashley Milton;020 3463 2699;Residential;A spacious (855 sq ft) two double bedroom property on the lower ground floor of this mansion block adjacent to the Regents Canal. The apartment comprises from a large reception room, two double bedrooms, separate fully eat-in kitchen, bathroom, guest cloakroom and access to communal gardens. Ideally located within close proximity to the shops and restaurants of Little Venice. The nearest underground station is Warwick Avenue (Bakerloo Line). Sheldon Square is within walking distance as is Paddington mainline station. EPC rating D.Maida Avenue, London W2;2017-03-30 22:59:24;https://lid.zoocdn.com/354/255/e0de1f303b6073dcb79a14b433e285c5fd8333b2.jpg;2017-03-31 01:46:54;51.523716;51.523716;sale;-0.177783;false;2;2;0;1;W2;London;925000;;Flat;for_sale;Maida Avenue Little Venice43403028;Home Castle Estate Agents;020 3463 0075;Residential;Fantastic opportunity to purchase a two bedroom apartment set in a stunning new development boasting a bright and airy interior with open plan living. Modern kitchen with integrated appliances along with a contemporary style bathroom and Ensuite leading from Bedroom one. Parking available Situated in close proximity to East Croydon Station which provides excellent links to London, the Whitgift Centre, the new proposed future Westfield and local amenities. This property must be viewed internally to be appreciated. Photos are computer generated.This property is sold on a leasehold basis. The lease length is 250 years.Please note that these are draft details and we are awaiting approval by the vendor.15 Lansdowne Road, Croydon, Surrey CR0;2017-03-30 22:57:52;https://lid.zoocdn.com/354/255/f99150c09591bcbdce4f827a73a09589be2392b4.jpg;2017-04-06 22:56:00;51.376602;51.376602;sale;-0.096123;false;0;2;0;0;CR0;Croydon;447750;;Flat;for_sale;15 Lansdowne Road43403007;Cornerstone Realty;020 8022 6030;Residential;Royal Dockside is a brand new riverside development of apartments offering exclusive riverside living with panoramic views, a marina setting and cosmopolitan quayside promenades and an investment in executive living space in what is set to be the Capital's most prolific and dynamic new district for commerce, culture and leisure.This modern bright 3 bedroom 4th floor apartment (1108 sq ft) with partial River Thames view and West & East aspect is fitted with woodstrip veneer flooring throughout.Each apartment has thermostatically controlled heating, a fresh air ventilation system and full double glazed. This property is newly completed.Flush panel chrome plated internal doors lead to the bedroom which has a fitted wardrobe with mirrored sliding doors and a fully fitted twist carpet.The kitchen incorporates high gloss lacquered units with straight bar chrome handles, square edge charcoal worktops and is fitted with Zanussi integrated appliances.The bathroom is fitted with a contemporary white suite, thermostatically controlled shower and heated towel rail.The development benefits from podium courtyards with contemporary landscaping, a secure external cycle store and a secure ground level car parking and electric car charging points.Its close proximity of the new ??14.8 billion Crossrail interchange provides potential for sustained growth and high performing residential property values.Residents at Royal Dockside will be 5 minutes walk from the DLR network at Gallions Reach - with an 11 minute journey time to connect to the Jubilee Line at Canning TownAtlantis Avenue, London E16;2017-03-30 22:55:53;https://lid.zoocdn.com/354/255/70ffc7256c43d74071116cc66efc45dd7ab71cd0.jpg;2017-03-31 01:46:53;51.50695;51.50695;sale;0.07524;true;2;3;0;0;E16;London;499995;;Flat;for_sale;Atlantis Avenue43403002;Cornerstone Realty;020 8022 6030;Residential;Royal Dockside is a brand new riverside development of apartments offering exclusive riverside living with panoramic views, a marina setting and cosmopolitan quayside promenades and an investment in executive living space in what is set to be the Capital's most prolific and dynamic new district for commerce, culture and leisure.This modern bright ground & first floor 4 bedroom duplex apartment (1367 sq ft) is with partial River Thames view and North & East aspect, fitted with woodstrip veneer flooring throughout.Each apartment has thermostatically controlled heating, a fresh air ventilation system and full double glazed. This property is newly completed.Flush panel chrome plated internal doors lead to the bedroom which has a fitted wardrobe with mirrored sliding doors and a fully fitted twist carpet.The kitchen incorporates high gloss lacquered units with straight bar chrome handles, square edge charcoal worktops and is fitted with Zanussi integrated appliances.The bathroom is fitted with a contemporary white suite, thermostatically controlled shower and heated towel rail.The development benefits from podium courtyards with contemporary landscaping, a secure external cycle store and a secure ground level car parking and electric car charging points.Its close proximity of the new ??14.8 billion Crossrail interchange provides potential for sustained growth and high performing residential property values.Residents at Royal Dockside will be 5 minutes walk from the DLR network at Gallions Reach - with an 11 minute journey time to connect to the Jubilee Line at Canning TownAtlantis Avenue, London E16;2017-03-30 22:48:55;https://lid.zoocdn.com/354/255/a570dc65c186931924000caf6a4b4534fe047ad5.jpg;2017-03-31 01:46:52;51.50695;51.50695;sale;0.07524;true;2;4;0;0;E16;London;539995;;Flat;for_sale;Atlantis Avenue43402962;Waterfronts;020 3463 7513;Residential;We are delighted to be able to present this 16th floor three bedroom premier property in a building of unmistakable prestige and unparalleled distinction, the grand and elegant Tower at Chelsea Creek sets new standards for contemporary living in this perfect waterside setting. A combination of visionary architecture and superb interior design, these exceptional residences represent the pinnacle of opulence and comfort.Beautifully designed apartments set in impeccably manicured surroundings, close to the peace and tranquillity of the water.Perfectly proportioned, superbly appointed, these elegant apartments provide the perfect setting for modern living, relaxing and entertaining.Please follow link to view full brochure Please give us a call on today to get more information or to book yourself in for a viewing17th FloorReception??? Air conditioning to living room and bedrooms1??? Balconies or terraces??? Bespoke veneer finish full height, extra wideentrance door??? Bespoke internal doors??? Brushed steel ironmongery??? Aluminium powder coated double glazed patiodoors and windows??? Engineered timber flooring to living room,kitchen and hallway with carpet to bedrooms??? Feature architraves and skirting??? Bespoke bedroom wardrobes with leatherdoors and internal lighting??? Bespoke fitted coat cupboard to hallway??? Ten year warranty from date of legal completionKitchen??? Custom designed fully integrated Europeanfitted kitchen??? Marble, limestone or granite kitchen worktop2??? Stainless steel recessed sink??? Gessi instant hot water tap??? Integrated Miele fan assisted electric ovenand induction hob??? Integrated pop up extractor fan3??? Integrated Miele steam oven??? Integrated Miele warming drawer??? Integrated Miele coffee maker??? Integrated Miele microwave??? Integrated Miele dishwasher??? Integrated Miele wine cooler??? Miele full height fridge??? Miele full height freezer??? Feature lighting below high level cupboards??? Washer / dryer4Master BedroomIntegrated multi-room, iPad and touch screencontrolled, home automation system withremote iPod docking station and 5.1 surroundsound to living room. Facility to control audiovisual, heating, lighting and window dressing5??? Integrated Bowers and Wilkins ceiling speakersto living room and bedrooms. Single speaker tobathrooms and en suites??? Telephone / Home Network points to livingroom, kitchen and bedrooms??? Sky HD, Arabsat and Hot Bird enabledincluding Sky HD box with 1 yearpre-paid subscription??? Wall mounted TV position in master bedroomand additional TV points to bedrooms 2 and 3with return feed from the living roomentertainment system??? Integrated 19" LED / HD water resistanttelevision to master en suite??? Mood lighting control to living room??? Feature recessed lighting??? External lighting to terraces and balconies??? Brushed steel socketsEnsuite??? Villeroy and Boch bath, WC and basin??? Heated wall panel with chrome robe hooksand towel rails??? Interior designed marble panelling andvanity counter2??? Vado rain shower, body jets and hand showerto shower enclosure??? Bespoke frameless clear glass shower enclosure??? Vado wall mounted chrome taps andchrome bath filler??? Wall hung WC with soft closing toilet seat??? Integrated vanity cabinets with demisting mirror??? Feature bath panel with recessed lighting??? Marble floor tiles with under floor heating2BedroomIntegrated multi-room, iPad and touch screencontrolled, home automation system withremote iPod docking station and 5.1 surroundsound to living room. Facility to control audiovisual, heating, lighting and window dressing5??? Integrated Bowers and Wilkins ceiling speakersto living room and bedrooms. Single speaker tobathrooms and en suites??? Telephone / Home Network points to livingroom, kitchen and bedrooms??? Sky HD, Arabsat and Hot Bird enabledincluding Sky HD box with 1 yearpre-paid subscription??? Wall mounted TV position in master bedroomand additional TV points to bedrooms 2 and 3with return feed from the living roomentertainment system??? Integrated 19" LED / HD water resistanttelevision to master en suite??? Mood lighting control to living room??? Feature recessed lighting??? External lighting to terraces and balconies??? Brushed steel socketsEnsuite??? Villeroy and Boch bath, WC and basin??? Heated wall panel with chrome robe hooksand towel rails??? Interior designed marble panelling andvanity counter2??? Vado rain shower, body jets and hand showerto shower enclosure??? Bespoke frameless clear glass shower enclosure??? Vado wall mounted chrome taps andchrome bath filler??? Wall hung WC with soft closing toilet seat??? Integrated vanity cabinets with demisting mirror??? Feature bath panel with recessed lighting??? Marble floor tiles with under floor heating2Bedroom??? Villeroy and Boch bath, WC and basin??? Heated wall panel with chrome robe hooksand towel rails??? Interior designed marble panelling andvanity counter2??? Vado rain shower, body jets and hand showerto shower enclosure??? Bespoke frameless clear glass shower enclosure??? Vado wall mounted chrome taps andchrome bath filler??? Wall hung WC with soft closing toilet seat??? Integrated vanity cabinets with demisting mirror??? Feature bath panel with recessed lighting??? Marble floor tiles with under floor heating2BathroomIntegrated multi-room, iPad and touch screencontrolled, home automation system withremote iPod docking station and 5.1 surroundsound to living room. Facility to control audiovisual, heating, lighting and window dressing5??? Integrated Bowers and Wilkins ceiling speakersto living room and bedrooms. Single speaker tobathrooms and en suites??? Telephone / Home Network points to livingroom, kitchen and bedrooms??? Sky HD, Arabsat and Hot Bird enabledincluding Sky HD box with 1 yearpre-paid subscription??? Wall mounted TV position in master bedroomand additional TV points to bedrooms 2 and 3with return feed from the living roomentertainment system??? Integrated 19" LED / HD water resistanttelevision to master en suite??? Mood lighting control to living room??? Feature recessed lighting??? External lighting to terraces and balconies??? Brushed steel socketsPark Street, London SW6;2017-03-30 22:46:30;https://lid.zoocdn.com/354/255/38f1928288c41f19b284eeeaa58474af9b3ebeb5.jpg;2017-03-30 22:49:24;51.475246;51.475246;sale;-0.18415;true;0;3;0;0;SW6;London;3100000;;Flat;for_sale;The Tower Chelsea Creek43402969;Waterfronts;020 3463 7513;Residential;Waterfronts are pleased to market this exquisite 2 bedroom property luxury apartment set in highly sought after development of Maple Quays Development.The property is consists of a openplan lounge/kitchen/diner leading to a private balcony overlooking courtyard. There are two good sized bedrooms both sharing one main bathroom.The development benefits from 24 hour concierge, gymnasium being on the doorstep of Canada Water station which is one stop from Canary Wharf and short walk to Surrey Quays Shopping Centre.Currently rented on a 12 month contract at a rate of ??1820.00pcmPlease give us a call on today to get more information or to book yourself in for a viewingLounge (Reception)BathroomBedroomBedroomKitchenMontreal House Surrey Quays SE16;2017-03-30 22:46:30;https://lid.zoocdn.com/354/255/3ed5a2cd24f5e0fc0de16b182626af8319161c8a.jpg;2017-03-30 22:49:54;51.49854;51.49854;sale;-0.048702;false;0;2;0;0;SE16;;675000;;Flat;for_sale;Montreal House Surrey Quays43402963;Waterfronts;020 3463 7513;Residential;Waterfronts are pleased to bring to the market this stunning 5th floor, one bedroom, with terrace,due to complete late 2018.Set in the heart of London, situated minutes from renowned King's Cross St Pancras station and the stunning streets of Angel Islington, the development is impeccably located.The centre of transport and the heart of design, King's Cross is London's fashionable new district. With vast open spaces and divine restaurants, residents' could want for nothing more.Known as the city for academic excellence, internationally renowned and celebrated universities are easily accessible from King's Cross Quarter, with lse, Central St Martins and ucl being particularly close. Education is further enhanced by critically acclaimed resources such as the British Library and British Museum.Each apartment has been created with luxury and functionality in mind, with the highest quality finishes sourced from our elite suppliers. Sumptuous and welcoming, living spaces are perfectly designed to entertain guests or to relax after an eventful day. Every room has been considered to maximise the space and showcase the surrounding scenery.- within A few minutes' walk to kings cross and st pancras stations- close to all shops, cafes, bars and restaurants that the regeneration area has to offer- manicured communal gardens- concierge service, 24 hours A day, 7 days A week- short travel times to all of london's leading universities- fully equipped residents' spa, gym and swimming pool- private residents' cinema- CCTV to communal entrances and external common areasPlease give us a call on today to get more information or to book yourself in for a viewing5th FloorBedroomReceptionBathroomKings Cross Quarters Pentonville Road N1;2017-03-30 22:46:30;https://li.zoocdn.com/7c4317598cfe23d0dc265110f2c2ae0389cf3a4b_354_255.jpg;2017-03-30 22:49:24;51.53165;51.53165;sale;-0.113696;true;0;1;0;0;N1;;950000;;Flat;for_sale;Kings Cross Quarters Pentonville Road43402966;Waterfronts;020 3463 7513;Residential;Waterfronts are pleased to present a fabulous three bedroom apartment in the stunning brand new development called Horizons Tower, E14.This luxury property overlooks The Thames, Canary Wharf and Poplar Dock Marina. This three bedroom property consists of three good sized bedrooms, two bathrooms, open plan living area with fitted kitchen and access to a long balcony stretching the width of the property.Horizons is proudly positioned as a prime waterside destination just minutes from all the amenities of Canary Wharf, London's impressive financial district.The Development benifits from a 24 hour concierge, stylish lobby, well equipped resident's gymnasium, video entry-phone system, CCTV and bicycle storage.Please give us a call on today to get more information or to book yourself in for a viewing22nd FloorBedroomBathroomReceptionKitchenBedroomBedroomensuiteBlackwall Way, London E14;2017-03-30 22:46:30;https://lid.zoocdn.com/354/255/61401c50f6bcaac61636d1ef85be4095883a5943.jpg;2017-03-30 22:49:24;51.505478;51.505478;sale;-0.0063;true;0;3;0;0;E14;London;1200000;;Flat;for_sale;Horizons Building Yabsley Street