listing_id;agent_name;agent_phone;category;description;displayable_address;first_publish_date;image_url;last_publish_date;latitude;listing_status;longitude;new_home;num_bathrooms;num_beedrooms;num_floors;num_recepts;outcode;post_town;price;price_change;property_type;status;street_name43363310;Rubicon;020 3544 7186;Residential;This new build is certainly an opportunity not to be passed upon, located on the 7th floor of this Marina development it is one of a very limited number of properties available within the sought after complex. The current owners have invested a lot to upgrade this to a high spec property with an open plan living room which creates flow all the way from the balcony through to the kitchen.Nestled nicely next to this space is the large master bedroom which features a large double wardrobe and window with a view of the city skyline.Basin Approach, London E14;2017-03-27 17:25:06;https://li.zoocdn.com/cca0f03690a5d6244804b964a07e908848f2297c_354_255.jpg;2017-04-04 14:56:29;51.51176;51.51176;sale;-0.03534;false;1;1;0;1;E14;London;0;;Flat;for_sale;Basin Approach43363307;TK International;020 3478 2905;Residential;Situated on the raised ground floor of this imposing detached period residence, a two double bedroom apartment presented in excellent order throughout. Benefits include a spacious 18' reception room with high ceilings, direct access to a large West facing communal garden and off street parking available on a first come first served basis.Fitzjohn's Avenue is a popular tree lined road, located conveniently for the amenities and transport links of Hampstead Village (Northern Line) and Swiss Cottage (Jubilee Line), and the many renowned schools in the area.Accommodation:Master Bedroom, Second Double Bedroom, Bathroom, Reception Room, Kitchen, Balcony, Communal Garden, Unreserved Off Street Parking.Bedroom 1 (3.96m x 3.38m)Bedroom 2 (3.68m x 3.53m)Reception 1 (5.61m x 4.88m)Kitchen (3.20m x 2.24m)Fitzjohns Avenue, Hampstead NW3;2017-03-27 17:24:05;https://lid.zoocdn.com/354/255/e696cb0fbd157e363cc92fbfd5e1ab0e4fc177f7.jpg;2017-03-28 08:52:39;51.547684;51.547684;sale;-0.176263;false;1;2;0;1;NW3;London;1175000;;Flat;for_sale;Fitzjohns Avenue43363266;Rocket Estate Agents;020 3641 5408;Residential;Rocket Estate Agents are delighted to present to the sales market this extended three / four bedroom semi detached house for saleThe property comprises of a large lounge area leading to a modern fitted kitchen and diner, ground floor shower room. On the first level three sizable fitted bedrooms, family shower space . Additional benefits are off street parking for two cars to the front, private rear garden and a brick built annex with 2 double bedroom and shower facilities.LocationLocated close to the junction with Brookside RoadA variety of shops, caf??s and restaurants can be found nearby and to a further extent in nearby SouthallThe open spaces of Minet Country Park are close by Southall, Hayes and Harlington Train stationWalking distance from Lombardy Retail Park, Hayes Bridge Retail Park.Blandford Waye, Hayes UB4;2017-03-27 17:15:49;https://lid.zoocdn.com/354/255/930b97382b6f7f513530e20c4da68c29c1eeb30a.jpg;2017-03-28 13:32:52;51.518417;51.518417;sale;-0.39568;false;2;4;0;1;UB4;Hayes;449995;;Semi-detached house;for_sale;Blandford Waye43363254;Brackenbury Estates Ltd;020 7768 7011;Residential;A charming 2 bedroom flat with its own entrance and shared patio garden. There is a contemporary open plan kitchen/reception, bathroom and the property is presented in good order throughout. Retaining many original features ??? a viewing is strongly recommended!General Description: A charming 2 bedroom flat with its own entrance and shared patio garden. There is a contemporary open plan kitchen/reception, bathroom and the property is presented in good order throughout. Retaining many original features ??? a viewing is strongly recommended!Valetta Road is a pretty tree-lined residential street situated to the north of Wendell Park. The bustling Askew Road is nearby with its variety of independent shops and restaurants. Transport links are Stamford Brook (District Line) and Shepherds Bush (Central Line), buses on Uxbridge, Askew and Goldhawk Roads and Westfield London is nearby with its own extensive retail, restaurant, leisure and transport facilities.Building insurance ??290 pa apxguide price ??600,000Lounge: Valetta Road, London W3;2017-03-27 17:13:48;https://lid.zoocdn.com/354/255/50024c528e1cbca92426726685680ba156c8e986.jpg;2017-03-30 17:13:41;51.504982;51.504982;sale;-0.248473;false;0;2;0;0;W3;London;600000;;Flat;for_sale;Valetta Road43363148;Tepilo;020 8128 1730;Residential;Split-level flat in Zone 1 in a peaceful close. Very centrally located with great transport links: A minute's walk from Brick Lane and a ten-minute walk from Spitalfields Market, five minutes' walk from Shoreditch High Street station, 10-15 minutes from Bethnal Green and Old Street underground stations and Liverpool Street station. Two generously sized double bedrooms, a spacious bathroom, a well-proportioned eat-in kitchen-diner with a small utility room and a living room opening to a sizeable and sunny West-facing private garden complete with raspberry bushes and raised vegetable beds. Renovated kitchen dining room comes with a small utility/ laundry room. Generous storage throughout. Outlook from all windows to an enclosed green with no public access.Goldman Close, London, London E2;2017-03-27 17:10:43;https://li.zoocdn.com/0dd679927d87d054898582e169ac0876615facd6_354_255.jpg;2017-03-28 08:00:16;51.52467;51.52467;sale;-0.068704;false;0;2;0;0;E2;London;625000;;Flat;for_sale;Goldman Close43363127;Oppida;020 3478 3196;Residential;A two double bedroom ground floor ex local authority apartment. The accommodation comprises a bright lounge with access to a private balcony, fitted kitchen and modern bathroom. This property would make an ideal investment or buy to live purchase. Located within a short walk of Surrey Quays Overground station and all the shopping facilities of Surreys Quays shopping centre.L/Shape HallwayHardwood door, gas radiator, storage cupboards, laminated floor.Lounge (15'2 x 10'00 (4.62m x 3.05m))Double glazed windows to rear, door to private balcony over communal garden, gas radiator, laminated flooring.Kitchen (10'5 x 7'0 (3.18m x 2.13m))Double glazed windows to front, inset single drainer one bowl sink unit with mixer tap, space for freestanding cooker with extractor hood above, a range of matching wall and base unit, slate floor tiles.Bedroom One (12'0 x 8'0 (3.66m x 2.44m))Double glazed window to rear, gas radiator, laminated flooring.Bedroom Two (13'6 x 8'9 (4.11m x 2.67m))Double glazed window to rear, gas radiator, laminated flooring.BathroomDouble glazed windows to front, pedestal was hand basin, low level W/C, panelled bath with shower attachment, heated towel rail, slate floor tiles.You may download, store and use the material for your own personal use and research. You may not republish, retransmit, redistribute or otherwise make the material available to any party or make the same available on any website, online service or bulletin board of your own or of any other party or make the same available in hard copy or in any other media without the website owner's express prior written consent. The website owner's copyright must remain on all reproductions of material taken from this website.Haddonfield, London SE8;2017-03-27 17:07:09;https://lid.zoocdn.com/354/255/097000cd3f2cd1edc10d802d4be136f0e40adb77.jpg;2017-03-27 20:57:59;51.490562;51.490562;sale;-0.045413;false;1;2;0;1;SE8;London;350000;;Flat;for_sale;Haddonfield Estate43363078;Roundtree Real Estate;020 8022 5895;Residential;Detailed DescriptionA delightful one bedroom first floor apartment situated within very close proximity of Golders Green Station. Being part of a brand new conversion the property internally boasts a luxury fitted open plan kitchen living room and shower room. High specification finishes throughout include acoustic double glazing, granite work surfaces, integrated Bosch appliances, period high ceilings engineered wood flooring to reception and iSense carpets to bedroom. The property is well located for all shopping facilities of Golders Green, Hampstead Heath and Golders Hill Park. Chain Free.North End Road, Golders Green NW11;2017-03-27 17:03:42;https://li.zoocdn.com/b0652f02b0e9e4b917b45275f9bcfbabe1a6409c_354_255.jpg;2017-03-28 01:40:19;51.571014;51.571014;sale;-0.189947;false;1;1;0;1;NW11;London;374950;;Flat;for_sale;North End Road43363076;Lifestyle Property;020 3544 7217;Residential;Lifestyle Property present for sale this excellent studio apartment located in a private block, close to the green open spaces of Beckton District Park South.Situated on the ground floor of a small block in the quiet and peaceful Emerald Close, this is a perfect starter home or investment opportunity. Comprising of a main living / sleeping area, with some useful fitted storage space. The corner kitchen has a range of high and low cabinets, electric oven & hob, free standing fridge/freezer and a handy breakfast bar area plus a nice view of the private courtyard from the window.The studio has further storage in the hallway next to the main bathroom with low level w/c, hand basin and bath tub. Offered chain free, this apartment needs a little bit of modernising and has the potential to be a cracking property indeed. (STC)Just a short stroll to Beckton Park, Newham City Farm and other amenities including Asda and Royal Albert DLR Station. Please call the sales team to book a viewing slot.Emerald Close, London E16;2017-03-27 17:03:42;https://lid.zoocdn.com/354/255/81f50d6000620494a3676599ce2d505881e0515f.jpg;2017-03-28 01:40:19;51.51144;51.51144;sale;0.045439;false;1;1;0;1;E16;London;179995;;Flat;for_sale;Emerald Close43363077;Roundtree Real Estate;020 8022 5895;Residential;Detailed DescriptionA delightful one bedroom ground floor apartment situated within very close proximity of Golders Green Station. Being part of a brand new conversion the property internally boasts a luxury fitted open plan kitchen living room and shower room. Externally there is a small courtyard garden. High specification finishes throughout include acoustic double glazing, granite work surfaces, Bosch integrated appliances period high ceilings, engineered wood flooring to reception and iSense carpets to bedroom. The property is well located for all shopping facilities of Golders Green, Hampstead Heath and Golders Hill Park. Chain Free.North End Road, Golders Green NW11;2017-03-27 17:03:42;https://li.zoocdn.com/7ef1e0bd1bbf6a88960abe6957668bce6806bfec_354_255.jpg;2017-03-28 01:40:19;51.571014;51.571014;sale;-0.189947;false;1;1;0;1;NW11;London;399950;;Flat;for_sale;North End Road43363045;Roundtree Real Estate;020 8022 5895;Residential;Detailed DescriptionA delightful two bedroom first floor apartment situated within close proximity of Golders Green Station. Being part of a brand new conversion the property internally boasts a luxury fitted open plan kitchen living room and shower room. High specification finishes throughout include acoustic double glazing, granite work surfaces, Bosch integrated appliances, period high ceilings, engineered wood flooring to reception and iSense carpets to bedrooms. The property is well located for all shopping facilities of Golders Green, Hampstead Heath and Golders Hill Park. Chain Free.North End Road, Golders Green NW11;2017-03-27 16:58:23;https://lid.zoocdn.com/354/255/97231e0e38d075a6642975269f14fc02d39af325.jpg;2017-03-28 01:40:17;51.571014;51.571014;sale;-0.189947;false;1;2;0;1;NW11;London;449950;;Flat;for_sale;North End Road43363046;Roundtree Real Estate;020 8022 5895;Residential;Detailed DescriptionA delightful one bedroom second floor apartment situated within very close proximity of Golders Green Station. Being part of a brand new conversion the property internally boasts a luxury fitted open plan kitchen living room and shower. High specification finishes throughout include acoustic double glazing with velux cabrio balcony, granite work surfaces, integrated appliances, period high ceilings engineered wood flooring to reception and iSense carpets to bedroom. The property is well located for all shopping facilities of Golders Green, Hampstead Heath and Golders Hill Park. Chain Free.North End Road, Golders Green NW11;2017-03-27 16:58:23;https://li.zoocdn.com/24f0e656bda9bcf340f8681850cfb6bb6b95eab5_354_255.jpg;2017-03-30 09:58:23;51.571014;51.571014;sale;-0.189947;false;1;1;0;1;NW11;London;374950;;Flat;for_sale;North End Road43363038;Homewise Ltd;01903 906571;Residential;Purchasing this property with A lifetime leaseThis property is offered at a reduced price for the over 60s under Homewise's Home for Life Plan. This is a lifetime lease.The above price represents a mid-range discount from the property's full market value, and is based on a single male applicant aged 69 years. The actual price you will pay depends on your age, personal circumstances and property criteria. Discounts range from 8.5% to 59%.For more information or a personalised quote, just give us a call. Alternatively, if you are under 60 or would like to purchase this property without a lifetime lease at its full market price of ??585,000, please contact Douglas Allen.Property descriptionIf peace and quiet is what you are after, then look no further than this beautifully presented two bedroom second floor apartment complete with its own lift access.The kitchen area is of a fully integrated high end specification.The bedrooms are spacious and for convenience, both have their own en-suite.The peaceful location offers great scenery in the local Chigwell countryside but at the same time offers easy access to local amenities as well as underground stations for transport links.This apartment is perfect for anyone looking for plenty of space and, together with the stunning views over the golf course, truly needs to be viewed to be appreciated.Please refer to the footnote regarding the services and appliances.Room sizes:Lounge/Kitchen Area 25'7 x 20'5 (7.80m x 6.23m)CloakroomBedroom 1 14'9 x 14'1 (4.50m x 4.30m)En-suite Bath/Shower RoomBedroom 2 (l-shaped) 14'9 x 7'8 (4.50m x 2.34m) plus 6'9 x 7'7 (2.06m x 2.31m)En-suite Bath/Shower RoomThe information provided about this property does not constitute or form part of an offer or contract, nor may be it be regarded as representations. All interested parties must verify accuracy and your solicitor must verify tenure/lease information, fixtures & fittings and, where the property has been extended/converted, planning/building regulation consents. All dimensions are approximate and quoted for guidance only as are floor plans which are not to scale and their accuracy cannot be confirmed. Reference to appliances and/or services does not imply that they are necessarily in working order or fit for the purpose. Suitable as a retirement home.Abridge Road, Chigwell, Essex IG7;2017-03-27 16:57:13;https://lid.zoocdn.com/354/255/e6078da15839d596eb5fc7239079d9089c5693a9.jpg;2017-04-07 04:17:07;51.64076;51.64076;sale;0.093138;true;0;2;0;0;IG7;Chigwell;386500;;Flat;for_sale;Abridge Road43363037;Homewise Ltd;01903 906571;Residential;Purchasing this property with A lifetime leaseThis property is offered at a reduced price for the over 60s under Homewise's Home for Life Plan. This is a lifetime lease.The above price represents a mid-range discount from the property's full market value, and is based on a single male applicant aged 69 years. The actual price you will pay depends on your age, personal circumstances and property criteria. Discounts range from 8.5% to 59%.For more information or a personalised quote, just give us a call. Alternatively, if you are under 60 or would like to purchase this property without a lifetime lease at its full market price of ??550,000, please contact Douglas Allen.Property descriptionLocation is the key to any purchaser and you can rest assured that this property is situated in a dream location, whether it???s commuting to work on a daily basis and having Chigwell central line tube station just a short stroll away, or even just to be able to live in Chigwell Village with great schools on your doorstep.When entering this home you will be surprised at the space it has on offer, with extremely large living space so you can really make the most of the area and with the large windows, the natural light just floods in.On the top floor you have 2 fantastically sized bedrooms that both share the use of the main bathroom. However the use of a 2nd bathroom will also come in handy on those buys mornings when everyone is getting ready for their day.The integral double garage is a great space for parking cars but as you have off road parking, this could be a great area to potentially convert into another spacious room, subject to planning permission.This unique style house is bound to sell quickly so call today to view.Room sizes:HallwayBedroom 3 11'0 x 8'0 (3.36m x 2.44m)Shower RoomLandingLounge / Diner (l-shaped) 13'8 x 12'10 (4.17m x 3.91m) plus 12'7 x 7'11 (3.84m x 2.41m)Kitchen 13'7 x 8'6 (4.14m x 2.59m)LandingBedroom 1 13'7 x 12'11 into fitted wardrobes (4.14m x 3.94m)Bedroom 2 13'8 x 10'1 (4.17m x 3.08m)BathroomFront GardenIntegral Double GarageOff Road ParkingThe information provided about this property does not constitute or form part of an offer or contract, nor may be it be regarded as representations. All interested parties must verify accuracy and your solicitor must verify tenure/lease information, fixtures & fittings and, where the property has been extended/converted, planning/building regulation consents. All dimensions are approximate and quoted for guidance only as are floor plans which are not to scale and their accuracy cannot be confirmed. Reference to appliances and/or services does not imply that they are necessarily in working order or fit for the purpose. Suitable as a retirement home.High Road, Chigwell, Essex IG7;2017-03-27 16:57:13;https://li.zoocdn.com/839f6adfa813e7972104343870225fb2724dae5b_354_255.jpg;2017-04-05 13:16:20;51.625614;51.625614;sale;0.082067;false;0;3;0;0;IG7;Chigwell;363500;;Town house;for_sale;High Road43363031;Keller Williams - Premier;020 8022 0784;Residential;Boasting good storage spaces as well as an excellent location, this spacious one bedroom ex local authority flat is situated on the first floor of a block conveniently close to Baker Street and Regents Park.Local Knowledge:Located just off Lisson Grove, the property is close to the shopping facilities of Church Street. There are good transport facilities nearby.Nearest Stations:Marylebone (Bakerloo Line & British Rail) zone 1Edgware Road (Circle, District, Bakerloo, Hammersmith & City Lines) zone 1Baker Street (Jubilee, Bakerloo, Circle, District, Metropolitan, Hammersmith & City Lines ) zone 1Local Authority: City of WestminsterCouncil Tax: ??520.19 p.A. (2016/17) band BTerms:Lease: 125 years from 09-12-1985  i.E. 93 years remainingGround Rent: ??10 per annumService Charge: ??1,200 per annumCeiling Height: 2.3 metersKitchen:Electric cooker with extractor fan over, washing machine and free-standing fridge/freezer.London Executive would like to give notice that in accordance with the Property Misdescriptions Act (1991), the above particulars are not intended to constitute part of an offer or contract. We therefore cannot accept liability for any of the photographs, measurements, virtual tours and descriptions. Such details, plus service charges, ground rent and lease (where applicable) should be checked and confirmed prior to exchange of offers or contracts.Jerome Crescent, London NW8;2017-03-27 16:57:13;https://li.zoocdn.com/b9723675c8b1c01c6e4593b9443d08a4b11c0ebc_354_255.jpg;2017-03-27 20:54:49;51.526085;51.526085;sale;-0.170538;false;1;1;0;0;NW8;London;375000;;Flat;for_sale;Jerome Crescent43363020;Your Move - Pereira;020 3463 9581;Residential;New home - Lovely brand new studio flat in a popular road in Camberwell. Just completed with fully integrated kitchen and storage cupboard. Plenty of windows allow the light to flood in. Would suit as a first time purchase or buy to let investment, well located for bus links on the Camberwell New Road towards Oval tube station, as well as Camberwell Road on the other side bus numerous bus links to all areas of London via Elephant and Castle and countless amenities.Give us a call to view this property today!EntranceEnter through own front door at ground level, entering into the main room.BathroomPanel enclosed bath with shower screen and shower attachment, hand wash sink with vanity unit, low level WC, heated towel rail, fully tiled walls and tiled flooring.Studio RoomThree sash windows to the side and one to the front, three double radiators.Kitchen area: Matching wall and base units, complimentary work surfaces, stainless steel sink with drainer and mixer tap, integrated gas hob and electric oven, washing machine and fridge freezer.Studio Area: Wood flooring, radiators.Additional PicAdditional Pic (2nd)Additional Pic (3rd)New Feature 11Important note to purchasers:We endeavour to make our sales particulars accurate and reliable, however, they do not constitute or form part of an offer or any contract and none is to be relied upon as statements of representation or fact. Any services, systems and appliances listed in this specification have not been tested by us and no guarantee as to their operating ability or efficiency is given. All measurements have been taken as a guide to prospective buyers only, and are not precise. Please be advised that some of the particulars may be awaiting vendor approval. If you require clarification or further information on any points, please contact us, especially if you are traveling some distance to view. Fixtures and fittings other than those mentioned are to be agreed with the seller./3Comber Grove, Camberwell, London SE5;2017-03-27 16:55:09;https://lid.zoocdn.com/354/255/95703bace098aaa21191612384b2d85f9ee252a6.jpg;2017-04-05 13:41:40;51.47646;51.47646;sale;-0.097743;false;0;0;0;0;SE5;London;325000;;Studio;for_sale;Comber Grove43362818;Birchills estate Agents;020 8022 0293;Residential;??500 cashback on this propertyopen 7 daysBirchills is Very Proud to Present This Stunning 2 Bedroom Ground Floor Apartment ideally located on the popular Wood Street. Mainline Station and Local Amenities Are All Within a Short Walking Distance.This Property Has Been Fully Refurbished to a Very High Standard, with a New Fully Integrated and Beautifully Designed Kitchen. The Property Also Boasts a Newly Installed 3 Piece Bathroom Suite and Heating System.Not Your Average Size Master Bedroom, Which Measures 15ft! This Property is Being Offered on a Chain Free Basis. With On street Parking to the Front of the Property.Guide price ??350k - ??400KSo Don't Delay, Call Birchills Today!Lounge (4.3 x 3.2 (14'1" x 10'5" ))Fully Fitted Kitchen (2.9 x 1.9 (9'6" x 6'2" ))Double Bedroom (4.7 x 3.6 (15'5" x 11'9" ))Single Bedroom (2.6 x 1.6 (8'6" x 5'2"))Wood Street, London E17;2017-03-27 16:53:08;https://lid.zoocdn.com/354/255/14aeea3712aad9665838f05b374a91d6d6312350.jpg;2017-03-31 08:25:06;51.58472;51.58472;sale;-0.000971;false;1;2;0;1;E17;London;350000;;Flat;for_sale;Wood Street43363005;Alliance Property Hub;020 8033 6055;Residential;Detailed DescriptionThree bedroom family home. Ideal for the A13, city commuter's and Barking tube station. Open plan lounge/dining room, Galley kitchen with appliances including gas hob, washing machine and family fridge/freezer. Upstairs Accommodation comprises of three bedrooms and three piece shower suite. Property also benefits from gas central heating, double glazing, rear garden and laminated flooring.Lounge : 24'5" x 10'8" (7.44m x 3.25m), Double glazed square bay window to front, two radiators, stairs leading to first floor, wood laminate flooring, carpets laid on landing and stairs.Enterance : Double glazed door, hallway, stairs rising to first floor landing.Kitchen : 8'6" x 6'4" (2.59m x 1.93m), Double glazed window to rear, double glazed door leading to garden, fitted four ring gas hob, built in oven, stainless steel sink unit with mixer taps, vinyl flooring and access to lobby.Garden : 40'0" x 0'0" (12.19m x 0.00m), Grass lawn and fence boundariesLanding : Leading to the three bedrooms and bathroomBedroom One : 13'9" x 9'9" (4.19m x 2.97m), Double glazed window to front, radiator and carpeted floor.Bedroom Two : 11'1" x 9'8" (3.38m x 2.95m), Double glazed window to front, radiator and carpeted floorBedroom Three : 9'1" x 6'0" (2.77m x 1.83m), Double glazed window to rear, radiator and carpeted floor.Bathroom : 6'0" x 6'0" (1.83m x 1.83m), Wash hand basin, walk in shower unit, Low level WC, double glazed window to rear of the house with lino flooring. And radiator.Craven Gardens, Barking IG11;2017-03-27 16:53:07;https://li.zoocdn.com/f06d51a6417834e8d9096ad38da871f215563f47_354_255.jpg;2017-03-30 16:58:06;51.528053;51.528053;sale;0.092088;false;1;3;0;1;IG11;Barking;365000;;Terraced house;for_sale;Craven Gardens