listing_id;agent_name;agent_phone;category;description;displayable_address;first_publish_date;image_url;last_publish_date;latitude;listing_status;longitude;new_home;num_bathrooms;num_beedrooms;num_floors;num_recepts;outcode;post_town;price;price_change;property_type;status;street_name43366083;The Address;020 3641 4013;Residential;A stunning 4 bed town house set in a private gated close. With parking, integrated garage, private patio garden to the rear and within 2 minutes walk to Chislehurst train station. This house has been presented and maintained to the highest standard by the current owners.Set over 3 floors this immaculate house has integral garage, utility room with storage, washing machine, sink and drainer, large cloakroom, double bedroom with ensuite shower room and double doors to the rear courtyard garden to the ground floor.The first floor benefits from the large, contemporary lounge with limestone fire surround and inset gas fire and double glazed french doors with Juliette balcony. Through the Archway to the dining room with open plan arch to the modern kitchen. Comprising of a range of high gloss cream wall and base units and a feature display unit with internal lighting. The units all benefit from under unit and floor level lighting. Integrated appliances such as fridge freezer, dishwasher and wine chiller. Black granite worktops with gold sparkle effect, red brick effect splash back and black slate floor tiles.The second floor is where the master bedroom suite can be found. With beautiful ensuite shower room with under floor heating and a dressing area with fully fitted wardrobes this really is a feature of this lovey home.The family bathroom has part tiled walls, tiled floor, panelled bath with shower attachment, low level WC and pedestal wash hand basin.Bedroom 3 is currently used as a dressing room with storage built to 2 walls and bedroom 4 is used as a study by the current owners but can easily be used as a single bedroom.To the rear of the property is a private, paved, courtyard garden with established shrubs and bushes.To the front of the property is a parking space plus a small landscaped area.Internal viewing is highly recommended as houses of this calibre rarely stay on the market for long.Imperial Place, Chislehurst BR7;2017-03-28 00:58:25;https://lid.zoocdn.com/354/255/e2c22e38fa216394aad4947ce844554e6c0112fc.jpg;2017-04-04 01:09:20;51.40725;51.40725;sale;0.05725;false;0;4;0;0;BR7;Chislehurst;750000;;Terraced house;for_sale;Imperial Place43366080;Proctors - Petts Wood;01689 867104;Residential;Key features:Detached Chalet HouseRear ConservatoryThree BedroomsAttached GarageTwo BathroomsAttractive GardensTwo ReceptionsChain Free PropertyGround FloorEntrance PorchSingle glazed, porch light.Entrance HallSingle glazed leaded light entrance door with side light windows, radiator.Lounge14' 11" x 12' 9" (4.54m x 3.88m) (Into bay window and alcove) Double glazed leaded light bay window to front, fireplace surround marble insert and hearth, gas coal fire, radiator, under stairs cupboard.Dining Room15' 5" x 11' 10" (4.70m x 3.61m) Single glazed French doors and windows leading to conservatory, decorative fireplace surround with raised marble hearth, door to kitchen.Kitchen10' 4" x 9' 0" (3.16m x 2.72m) Double glazed window to rear, range of contemporary wall and base units, built-in fan-assisted oven, gas hob unit set in work top, white single sink unit with mixer tap, stainless steel extractor chimney, built-under washing machine, radiator, part tiled walls, part glazed door to conservatory.Bedroom Three/ Study9' 10" x 7' 7" (3.00m x 2.31m) (Into recess (excludes bay)) Double glazed leaded light bay window to front, radiator.Conservatory11' 6" x 9' 3" (3.50m x 2.82m) Double glazed windows to rear and side aspect, double glazed French doors to garden, ceramic tiled floor, built-in pantry cupboard with gas meter, polycarbon roof.Shower Room9' 3" x 6' 10" (2.83m x 2.08m) Two double glazed windows to rear, open shower cubicle, electric shower unit, contemporary hand basin set on vanity unit, low level WC, radiator, tiled walls, extractor fan.First FloorLandingDouble glazed window to side, access to loft.Bedroom One15' 3" x 13' 5" (4.66m x 4.09m) (Into recess) Double glazed leaded light bay window to front, radiator, door to eaves storage room (potential loft conversion)En-Suite BathroomDouble glazed window to side, white suite comprising bath, hand basin, low level WC, bidet, radiator, recessed ceiling lighting, wall light and shaver point, door to bedroom two.Bedroom Two13' 5" x 12' 0" (4.10m x 3.63m) (Into wardrobe) Double glazed window to rear, built-in wardrobes, radiator, door to eaves storage room housing hot water cylinder, central heating controls.OutsideGardenPaved patio area, laid to lawn, mature shrubs and trees, door to garage, side gate.Garage26' 0" x 10' 6" (7.90m x 3.20m) Attached to side, brick built, up and over door, power and lighting, wall mounted central heating boiler.FrontagePrivate driveway, mature garden, laid to lawn.Forest Way, Orpington, Kent BR5;2017-03-28 00:58:25;https://lid.zoocdn.com/354/255/2be5054c3187a376b2a0d17786fe3588878c447f.jpg;2017-03-28 01:41:32;51.388924;51.388924;sale;0.096572;false;0;3;0;0;BR5;Orpington;560000;;Detached house;for_sale;Forest Way Orpington43366063;Benson & Partners;020 8166 7682;Residential;Benson and Partners are pleased to offer for sale this newly refurbished first floor 1 bedroom flat. Located close to local shops, amenities and West Croydon Station.First FloorCommunal EntranceStairs to first floor and access to flat.Living / Kitchen Area16' 10" x 10' 5" (4.90m x 3.20m) Newly laid laminate flooring, double glazed windows to front, double radiator and recessed spotlights.Kitchen AreaNewly fitted kitchen with integrated fridge freezer, washing machine, built in stainless steel gas hob, oven with extractor over, part tiled and tiled floor.Bedroom 113' 1" x 12' 5" (3.99m x 3.81m) Newly laid laminate flooring, double glazed windows to front, double radiator and recessed spotlights.Shower Room7' 6" x 6' 1" (2.31m x 1.85m) Tiled walls and floor, new fitted shower enclosure, low level wc, pedestal wash hand basin and double glazed opaque window to side.Tax Band B??1,212.49 per year.Thornhill Road, Croydon CR0;2017-03-28 00:55:20;https://li.zoocdn.com/f6f497b331debe826ce95401b6de76b9413dd44f_354_255.jpg;2017-03-28 01:41:32;51.384464;51.384464;sale;-0.099576;false;0;1;0;0;CR0;Croydon;250000;;Flat;for_sale;Thornhill Road Croydon39466946;Chase Buchanan, St Margarets;020 3463 9306;Residential;Key features:Attractive detached family houseFive bedroomsGenerous living and entertaining spaceSelf-contained one/two bedroom annexePretty frontage with off street parkingWest facing mature gardenDesirable location close to River ThamesPremier residential roadFull description:A wonderful six double bedroom detached family house, which incorporates a self-contained annexe and offers substantial and versatile accommodation.With bright and airy rooms, the main property comprises five double bedrooms, three reception rooms, kitchen/breakfast room, three bathrooms and a conservatory, whilst the annexe essentially provides a one bedroom apartment with a double bedroom, kitchen/breakfast room and bathroom suite.The property is situated on a large corner plot with a well maintained rear garden, ample off street parking, two outbuildings and potential to extend further, subject to the usual planning consents.Ailsa Road is situated within a short walk of the River Thames and Richmond Lock, whilst St Margarets village and Richmond town centre, both offering excellent local amenities and transport links into central London, are within a short walk.EPC Rating DBedroomBedroomBedroomBedroomBedroomBedroomBathroomBathroomReceptionReceptionReceptionReceptionBathroomReceptionBathroomAilsa Road, St Margarets, Twickenham TW1;2017-03-28 00:53:17;https://lid.zoocdn.com/354/255/d98847f097345f839228c0dd8c49cf34519cbcd4.jpg;2017-03-28 00:54:18;51.45953;51.45953;sale;-0.321324;false;0;6;0;0;TW1;Twickenham;1900000;;Detached house;for_sale;Ailsa Road St Margarets Twickenham43366042;Martyn Gerrard - North Finchley;020 3478 3235;Residential;Situated on a sought after cul de sac in the heart of Woodside Park is this extended four bedroom semi-detached family home. The property benefits from a garage, off street parking and a well-maintained interior.The Owners Love"The Scarp is tranquil with a warm community feel and the lovely green in the middle provides a safe place for children to play""The local park, shops and cafes are just around the corner. Woodside Park & West Finchley underground stations and local bus services are also a short walk from our house, providing excellent links into Central London""We're spoilt for choice with walks along the Dollis Valley. Our particular favourites are the picturesque walks towards Mill Hill Village and Totteridge Green"We've NoticedSingleton Scarp is a quiet cul de sac located in the heart of Woodside Park.Some houses on the road have converted the garage to increase the internal living accommodation.Singleton Scarp, London N12;2017-03-28 00:52:15;https://lid.zoocdn.com/354/255/c5e57bbd2d34401c99e056df41e024aa44331f52.jpg;2017-04-03 16:40:57;51.616238;51.616238;sale;-0.192236;false;0;4;0;0;N12;London;1150000;;Semi-detached house;for_sale;London43366045;Martyn Gerrard - Southgate;020 8128 9460;Residential;A five bedroom, two reception terraced house with own drive and garage to the rear.The Owners Love"Close to lots of great schools such as Osidge, Monkfrith & Ashmole Academy""Hampden Square offers lots of local amenities""The views at the back of the house are lovely as we overlook Waterfall Walk"We've NoticedAshmole Academy is close by.Southgate Underground Station is 0.8 miles away (Piccadilly Line).Hampden Way, Southgate N14;2017-03-28 00:52:15;https://lid.zoocdn.com/354/255/1f9ed9acfc1639ae9e3a6084c98eabc2b500890f.jpg;2017-04-03 16:41:44;51.630577;51.630577;sale;-0.14251;false;0;5;0;0;N14;London;675000;;Terraced house;for_sale;Southgate43366034;Martyn Gerrard - Muswell Hill;020 3478 3229;Residential;A three double bedroom two reception room Edwardian property with potential extend (stpp) located in a sought after location in Alexandra Park.The owners love"The main bedroom is full of sunlight in the mornings""The house has lots of interesting original features""There is a lovely community in the street with loads of families living here"we've noticedRhodes Avenue Primary and Alexandra Park Road Secondary schools are located nearby.This property has easy access to Muswell Hill Broadway, Alexandra Palace overground and Bounds Green underground stations.Victoria Road, London N22;2017-03-28 00:51:44;https://li.zoocdn.com/0c4c20d704b9b006b3bb3d5608146ac59b0179d8_354_255.jpg;2017-04-04 13:16:57;51.59995;51.59995;sale;-0.132714;false;0;3;0;0;N22;London;1125000;;;sold;London43366031;Martyn Gerrard - East Finchley;020 3478 3541;Residential;A Triple fronted semi-detached Grade II listed Regency Villa situated in the desirable Fortis Green Conservation area, well placed for the local amenities of East Finchley and Muswell Hill and has good local primary and secondary schools nearby. This historic c1834 property is full of original charm and character and Martyn Gerrard highly recommends early viewings, as properties like this rarely become available on the open market.The owner loves"The beautiful William IV period features of a Grade II listed building give us continual pleasure as we walk around the house.We love the way that the rooms face south directly on to the garden, connect with it and are flooded with light""In this house, Coventry Patmore entertained Pre Raphaelite painters and wrote his long poem The Angel of the House. (A photo of the house is shown against his name on Wikipedia!) Later on, it was the local school (before the "Board" School was set up in Grand Avenue, Muswell Hill)""A long, wide south facing garden belonging to a regency period house is very rare in this area.Our much loved garden is very peaceful as it backs on to a long strip of gardens - another rare feature"we've noticedIt is not necessary to have an EPC for a listed building.Confirmation about listed building status can be found at the Haringey website.Fortis Green, East Finchley, London N2;2017-03-28 00:51:13;https://lid.zoocdn.com/354/255/8e44a5967f7d499e6e39f924a0052a7b44a64618.jpg;2017-04-05 00:50:44;51.590233;51.590233;sale;-0.157654;false;0;5;0;0;N2;London;2149000;;;for_sale;East Finchley London43366030;Chase Buchanan, Twickenham Sales;020 3542 2137;Residential;Key features:Period propertySpacious living roomKitchen/breakfast roomTwo double bedroomsModern bathroom suiteWest facing gardenHuge potential for extension (stpp)Central TwickenhamFull description:We are delighted to offer for sale this charming period cottage situated in one of central Twickenham's most popular roads, within easy access of the high street and a short walk to Twickenham mainline station.The accommodation currently comprises a good size reception room, kitchen/breakfast room and utility room to the ground floor, whilst upstairs provides two double bedrooms and a generous modern bathroom suite.Further benefits include the potential for extension to both the ground floor and a loft conversion (stpp), West facing rear garden and plenty of internal charm.Properties on Laurel Avenue that have not yet been extended are rare, therefore anyone looking for a house that they can grow into and make their own, should arrange an early appointment to view with the vendors' Sole agents Chase Buchanan.EPC Rating - EBedroomBedroomBathroomReceptionLaurel Avenue, Twickenham TW1;2017-03-28 00:50:43;https://lid.zoocdn.com/354/255/237c5a1f1108bcf51f7a814cdd9de9559134d30b.jpg;2017-03-30 03:17:48;51.446312;51.446312;sale;-0.337192;false;0;2;0;0;TW1;Twickenham;795000;;Terraced house;for_sale;Laurel Avenue Twickenham41955249;Chase Buchanan, Twickenham Sales;020 3542 2137;Residential;Key features:Terraced period propertyVery well presentedLarge through reception roomKitchen/breakfast roomThree double bedroomsTwo bath/shower roomsPrivate courtyard gardenClose to Twickenham GreenFull description:This well presented Victorian terraced property is located in a popular residential road close to Twickenham Green and within walking distance of local shops and public transport links.The extended accommodation provides a large through reception room and kitchen/breakfast room to the ground floor, whilst the upper two floors offer three double bedrooms and two bath/shower rooms.Further benefits are a lovely private courtyard garden and ample storage throughout the property.An early appointment to view is highly recommended by the vendors' Sole agents Chase Buchanan.EPC Rating - DBedroomBedroomBedroomBathroomBathroomReceptionGould Road, Twickenham TW2;2017-03-28 00:50:43;https://li.zoocdn.com/09b3a395aa1ce645c86a5159aa1225c938f897b4_354_255.jpg;2017-04-07 00:17:30;51.44701;51.44701;sale;-0.343772;false;0;3;0;0;TW2;Twickenham;750000;;Terraced house;for_sale;Gould Road Twickenham43366022;Marsh & Parsons - Tooting;020 8022 0901;Residential;This fantastic flat would be ideal for first time buyers and comes with ample natural light throughout. Found on the second floor, the property briefly comprises  spacious living/dining area with kitchen to the left as you enter. You would then pass a generous bathroom where two double bedrooms can be found, one boasting its own en suite.Elderfield Place is a very sought-after development set within view of the wide open spaces of Tooting Bec Common. Tooting Bec Station (Northern line, Zone 3) is within walking distance as well as local bus routes, allowing easy access into and out of The City.Elderfield Place, London SW17;2017-03-28 00:49:43;https://lid.zoocdn.com/354/255/0b8f175e9c5fe7ec1237ea3299071485f0fe5f1e.jpg;2017-04-06 00:57:44;51.428783;51.428783;sale;-0.152115;true;2;2;0;1;SW17;London;465000;;Flat;for_sale;London43366021;Marsh & Parsons - Queens Park;020 8022 6057;Residential;This exceptionally bright property occupies the first and second floors of a charming Victorian conversion, located on a quiet residential street in Queen's Park. Comprises two large double bedrooms, a family bathroom, separate w/c, spacious reception room with bay window and well-appointed kitchen. The property boasts a neutral d??cor, wooden flooring throughout, high ceilings and planning permission for a roof terrace.Donaldson Road is a highly sought after location just moments from the green open spaces of Queen's Park and the many shops, caf??s and bars of Salusbury Road & Lonsdale road. Local transport links include Queen's Park (Bakerloo Line) & Brondesbury Park (London Overground).Donaldson Road, London NW6;2017-03-28 00:49:43;https://li.zoocdn.com/cb7bf7a8cfa98ad48819f10afd09dc5c00121a1d_354_255.jpg;2017-03-29 00:47:32;51.537457;51.537457;sale;-0.201545;false;1;2;0;1;NW6;London;749950;;Flat;for_sale;London43366018;Marsh & Parsons - Tooting;020 8022 0901;Residential;This charming family home retains its period features and comes with ample natural light throughout. The ground floor accommodates a front reception room boasting original coving, and feature fire place. The open-plan kitchen/dining area follows, with direct access into the beautiful private garden. The first floor boasts two spacious double bedrooms and one smaller bedroom with a large family bathroom as well.Located in one of Tooting's most popular roads, Vant Road can be found within walking distance of a plethora of local shops and bars. Local bus routes as well as Tooting Broadway (Northern line, Zone 3) are also within easy reach allowing frequent access into and out of The City.Vant Road, London SW17;2017-03-28 00:49:11;https://li.zoocdn.com/4bff29dde8f85f6edae6ae5a5a127fa4d66e003b_354_255.jpg;2017-04-05 00:48:38;51.42528;51.42528;sale;-0.162038;false;1;3;0;2;SW17;London;875000;;Terraced house;for_sale;London43366011;Marsh & Parsons - Balham & Clapham South;020 3542 2173;Residential;This superb fully detached home comprises of a larger than average reception room with ornate cornicing and period fireplace, separate dining room/ study, down stairs cloak room and a stylish fully-fitted kitchen. The kitchen overlooks a separate dining area with direct access through French doors to the landscaped 25 ft garden. The upper levels consist of four large double bedrooms all beautifully presented, a family bathroom and further en suite shower room.Rossiter Road is ideally positioned for Balham Station with the overground and underground (Zone 3). The shops, bars & restaurants are just a stone's throw making this location perfect for any lifestyle.Rossiter Road, London SW12;2017-03-28 00:48:41;https://lid.zoocdn.com/354/255/6719a76cc31eb4ed2faa53e29991cbfa6d3ff02c.jpg;2017-04-07 01:05:54;51.443348;51.443348;sale;-0.146059;false;2;4;0;2;SW12;London;1300000;;Detached house;for_sale;London43365992;Castles - Tottenham;020 3641 9024;Residential;Castles offer for sale this great garden maisonette that's situated on the Stamford Hill/Stoke Newington borders of South Tottenham. The maisonette has its own private entrance, comes with a shared freehold and offers 'very adaptable' living space. Features include: One double bedroom, reception room which can be used as the second bedroom, spacious lounge/diner with an extra space 'opened up' to compliment and utilise living space, bathroom and garden. Transport links are great with convenient access to Stamford Hill train station, Seven Sisters and Manor House tube and train stations. EPC D.Manchester Road, London N15;2017-03-28 00:45:47;https://lid.zoocdn.com/354/255/5ed051a4d217dba68b0070ef139971030885f1c0.jpg;2017-04-06 22:47:32;51.576836;51.576836;sale;-0.082456;false;1;1;0;2;N15;London;419950;;Maisonette;for_sale;Manchester Road43365981;Copes Estate Agents;01375 318837;Residential;Not A bad spot to be in! This 2 bedroom mid terraced Victorian style family home is located just a stones throw from Belmont Castle Academy and only 0.6 miles from the Grays Town Centre and c2c Railway Station! Offered with no onward chain this is a perfect opportunity for a first home, to downsize or even to up-size!Entrance HallStairs to first floor.Lounge - 10' 6'' x 10' 2'' (3.19m x 3.10m)Window to front.Dining Room - 10' 2'' x 10' 3'' (3.10m x 3.12m)Window to rearKitchen - 9' 0'' x 7' 6'' (2.74m x 2.28m)Fitted wall and base units. Sink/drainer. Recess for appliances. Window to side.Utility roomWindow to rear.CloakroomWc. Window to side.First Floor LandingMaster bedroom - 13' 5'' x 10' 5'' (4.08m x 3.17m)Two windows to front.Bedroom 2 - 10' 3'' x 8' 2'' (3.12m x 2.50m)Window to rear.Bathroom - 10' 9'' x 9' 0'' (3.27m x 2.75m)Bath tub. Wc. Pedestal wash hand basin. Window to rear.Parker Road, Grays RM17;2017-03-28 00:44:01;https://lid.zoocdn.com/354/255/f284e15257e05baf651d091f1a2e0eb0ee18c7c1.jpg;2017-03-28 22:25:36;51.477764;51.477764;sale;0.312433;false;1;2;0;1;RM17;Grays;244995;;Terraced house;for_sale;Parker Road43365986;Hetheringtons - Shenfield Sales;01277 298713;Residential;An attractive 4 bedroom detached character house situated in one of Emerson Parks' prestigious turnings. The spacious accommodation is arranged over two levels comprising: Entrance porch, entrance hallway, kitchen with cream high gloss units, through reception with a study area and patio doors overlooking the garden with French doors into a further reception currently used as a dining room, with access to the integral garage, cloakroom, three double bedrooms the master having a generous en suite and a single bedroom and a further family bathroom. Outside the rear garden is mainly laid to lawn with a patio and bordered by mature shrubs and specimen trees. To the front is a paved a driveway leading to the attached garage for off road parking.Emerson Park Station is 1 mile away with links into Romford which has commuter links to London Liverpool Street. Main road links provide easy access to the M25.Nelmes Crescent, Hornchurch RM11;2017-03-28 00:44:01;https://lid.zoocdn.com/354/255/34a7c673b6165ee23b1c8a982076344016fa2eef.jpg;2017-03-31 00:47:10;51.575623;51.575623;sale;0.232664;false;2;4;0;3;RM11;Hornchurch;800000;;Detached house;for_sale;Hornchurch43365987;Hetheringtons - South Woodford Sales;020 7768 1722;Residential;Situated in this quiet residential area is this two bedroom first floor purpose built flat complete with a secure parking space.The property is in good decorative order and offers two bedrooms, modern bathroom, through lounge and a separate modern kitchen. Highams Park Station is walking distance away along with shops and amenities.The property is ideal for first time buyers and investors alike and is offered chain free.Hawthorne Court, 117 Higham Station Avenue, London E4;2017-03-28 00:44:01;https://lid.zoocdn.com/354/255/6ac75ea4f0d9f53b5ccae99ff86133b326d1a5e1.jpg;2017-03-28 01:41:29;51.60847;51.60847;sale;-0.008955;false;1;2;0;1;E4;London;300000;;Flat;for_sale;117 Higham Station Avenue London43365979;Copes Estate Agents;01375 318837;Residential;Chafford hundred station side! This larger style 2 bedroom end of terrace property is offered for sale with No Onward Chain! Also included is gas central heating and 2 en-suites! Situated just 0.5 Miles from Chafford Hundred c2c Railway station this is perfectly located for commuters to the city or for a stroll in to Lakeside shopping centre! PorchLounge - 19' 0'' x 12' 6'' (5.79m x 3.82m)Window to front. Stairs to first floor.Kitchen - 10' 0'' x 6' 3'' (3.04m x 1.91m)Fitted wall and base units. Sink/drainer. Recess for appliances. Window to front.CloakroomWindow to rear. Wc. Wash hand basin.First Floor LandingStairs to ground floor. Loft access.Master bedroom - 12' 8'' x 12' 4'' (3.86m x 3.77m) MaxWindow to front. Airing cupboard.En-suite - 6' 1'' x 5' 11'' (1.86m x 1.81m) MaxWindow to side. Shower enclosure. Pedestal wash hand basin. Wc.Bedroom 2 - 12' 8'' x 8' 5'' (3.86m x 2.57m)Window to rear.En-suite - 6' 3'' x 6' 3'' (1.91m x 1.91m)Window to side. Panelled bath tub. Pedestal wash hand basin. Wc.ParkingSituated at rear, carport and one additional parking space.Sewell Close, Chafford Hundred, Grays RM16;2017-03-28 00:44:01;https://lid.zoocdn.com/354/255/9501d8c5793515190066793dd7d0de2952360e96.jpg;2017-04-06 22:50:30;51.479786;51.479786;sale;0.291364;false;2;2;0;1;RM16;Grays;304995;;Terraced house;for_sale;Sewell Close Chafford Hundred43365988;Hollyton;020 8022 3181;Residential;Key features:1 Bedroom1 Bathroom5th FloorPrivate Balcony ParkingLadbroke Grove Underground StationEpc-bApprox. 541 .Full description:Finished to an exceptionally high standard throughout, is this modern 1 bedroom, 1 bathroom apartment. Set on the 5th floor, it spans a sizeable 541 square feet in space and is well-lit throughout. This apartment boasts a spacious open plan reception room, a good size bedroom and a balcony with views over canal. The property also benefits from parking and residents' gymnasium.Nautilus House is in an enviable location, near the amenities offered by London's famous Notting Hill Gate area. Residents can enjoy the many boutiques and cafes.The property is a short walking distance from Ladbroke Grove underground stations (Circle, Hammersmith and City lines).Lease LengthApprox. 998 YearsService ChargeApprox. ??1630 Per AnnumGround Rent??300 Per AnnumPotential Yield3.95%Property Ref:84_2846_4361193Nautilus House, 14 West Row, London W10;2017-03-28 00:44:01;https://li.zoocdn.com/85b1ddcab10c8165b2f17e2747f742384bc94d54_354_255.jpg;2017-03-28 00:45:08;51.525738;51.525738;sale;-0.213943;false;0;1;0;0;W10;;725000;;Flat;for_sale;Nautilus House 14 West Row London