listing_id;agent_name;agent_phone;category;description;displayable_address;first_publish_date;image_url;last_publish_date;latitude;listing_status;longitude;new_home;num_bathrooms;num_beedrooms;num_floors;num_recepts;outcode;post_town;price;price_change;property_type;status;street_name43367060;Vanet Property Asset Management - Canary Wharf;020 3463 2726;Residential;Key features:1 Double Bedroom Antonine Heights Development7th Floor Private BalconyClose To London Bridge StationIntegrated Kitchen AppliancesClose To Local Amenities 1 BathroomParking SpaceBermondsey, SE1No Chain To View Call Full description:This is an excellent opportunity to purchase an outstanding one bedroom apartment with modern furnishings and fittings in the popular City Walk Development Antonine Heights. The property is located just off Bermondsey Street and very close to London Bridge mainline station, SE1.The apartment comprises a bright carpeted double bedroom with ample storage space, a white tiled family bathroom with a three piece suite and a separate kitchen fitted with high spec. Integrated appliances and elegant stainless steel finishes. The sizeable lounge has contemporary wooden flooring and a large floor to ceiling door leading to a private balcony. The unit is offered chain free and is finished to a high standard.The secure Antonine Heights Development is very close to either London Bridge or Borough stations and is conveniently located just off the fashionable Bermondsey Street with its array of bars, boutiques and restaurants. In addition, a great deal of bus routes can be found within walking distance, providing easy access to the City Centre and Canary Wharf.If you wish to arrange a viewing or to request further information about this stunning property, please contact Vanet on Area: 512 Sq. Ft.Price per Sq. Ft. TbcService Charge: ??1270.64 per annumGround Rent: ??150.00 per annumCouncil Tax Band: ELeasehold: 999 years from 2005DisclaimerVanet Property Asset Management endeavour to advertise accurate representations of properties in descriptions, virtual tours and floor plans, however, they are intended as a guide only and interested parties must satisfy themselves by undertaking personal inspection.Bedroom 1BathroomReceptionKitchenCity Walk, London SE1;2017-03-28 02:46:56;https://lid.zoocdn.com/354/255/c062bd261a0d252bb278d005683a6e1847abc441.jpg;2017-03-29 01:41:29;51.49909;51.49909;sale;-0.084151;false;0;1;0;0;SE1;London;550000;;Flat;for_sale;City Walk LONDON43367027;Garton Jones - Chelsea Bridge Wharf;020 8033 9128;Residential;Stylish three bedroom apartment located on the twelth floor in the Vista Cascade Building at Chelsea Bridge Wharf.Stylish three bedroom apartment located on the twelth floor in the Vista Cascade Building at Chelsea Bridge Wharf. Spacious open plan kitchen with beautiful stone work surface furnishes and a beautifully designed lounge area. Master bedroom has an en-suite with a further two bedrooms and separate bathroom in the property. Magnificent large windows. Terrace has picturesque views of Battersea Park. Fully equipped residents gym and 24 hour concierge.An opportunity to acquire an incredible brand new apartment, sculptural building called Vista, Chelsea Bridge Wharf. Located between the wide open spaces of Battersea Park and the exciting redevelopment of Battersea Power Station. The breath taking design of the building is matched by the luxurious furnishes internally and fabulous views.Lease 999 years, Service Charge ??4.38 per sq/ft approximately.Vista Cascade, Three Bedroom, Chelsea Bridge Wharf SW8;2017-03-28 02:42:54;https://lid.zoocdn.com/354/255/47ee2b97fd25105400621501a461af7aa765df1c.jpg;2017-03-31 02:47:01;51.48117;51.48117;sale;-0.148817;true;2;3;0;1;SW8;London;1800000;;Flat;for_sale;43367003;Cosway;020 3478 3582;Residential;New instructionAn appealing three bedroom end of terrace house, situated in a popular development off Bunns Lane, within easy reach of Mill Hill Broadway's shops and Thames link station and close to local schools.The property which is in need of modernising has a generous reception room, fitted Kitchen/Breakfast Room, a charming rear garden, a private garage and an allocated parking space.Ideal for first time buyers and investors.Sole agentsViewing recommended.Rowlands Close, Mill Hill, London NW7;2017-03-28 02:37:50;https://li.zoocdn.com/9968bb790b839bd82d70ab8a24df42c79821b29b_354_255.jpg;2017-03-29 01:41:28;51.606804;51.606804;sale;-0.237091;false;0;3;0;0;NW7;London;520000;;Semi-detached house;for_sale;Rowlands Close Mill Hill London43366865;Lawsons & Daughters;020 3542 2133;Residential;*** Investment Opportunity ***An upper floor (3rd and 4th) maisonette. Currently configured to maximise letting rooms, this property has 5 bedrooms and a kitchen. Bathroom. Shower Room. GCH. Rental income approx. ??27,000 per annum.Frensham Drive, London SW15;2017-03-28 02:22:51;https://li.zoocdn.com/4ea729f2b68c1d1ba2dafc4692eff9721ec8757d_354_255.jpg;2017-03-29 01:41:26;51.43849;51.43849;sale;-0.243507;false;2;5;0;0;SW15;London;350000;;Maisonette;sale_under_offer;Frensham Drive43366866;Lawsons & Daughters;020 3542 2133;Residential;*** Investment Opportunity *** An upper floor (3rd, 4th) maisonette. 4 Bedrooms, Kitchen/Reception, Bathroom, Shower Room. Current Rental Income ??25,200 per annum.Tildesley Road, London SW15;2017-03-28 02:22:51;https://li.zoocdn.com/5e848422326c916c32cd4d2aa0e33ecb2133ac86_354_255.jpg;2017-03-29 01:41:26;51.455124;51.455124;sale;-0.229655;false;2;4;0;0;SW15;London;400000;;Maisonette;sale_under_offer;Tildesley Road43366863;Lawsons & Daughters;020 3542 2133;Residential;*** Investment Opportunity *** A ground floor maisonette arranged over 2 floors with a good sized garden. Kitchen/Reception, Bathroom, Shower Room. GCH. Current rental income approx. ??23,400.Fontley Way, London SW15;2017-03-28 02:22:51;https://li.zoocdn.com/fdd90a157ee9a0096d29c30eae151fdfe6194b48_354_255.jpg;2017-03-29 01:41:26;51.446316;51.446316;sale;-0.24348;false;2;4;0;1;SW15;London;350000;;Maisonette;sale_under_offer;Fontley Way43366864;Lawsons & Daughters;020 3542 2133;Residential;*** Investment Opportunity *** An upper floor maisonette (3rd, 4th). 5 Bedrooms, Kitchen/Reception, 2 WCs, Bathroom, Shower. GCH. Current rental income approx. ??26,400 per annum.Arabella Drive, London SW15;2017-03-28 02:22:51;https://li.zoocdn.com/81892aa7a32067031f08b87d291d4e24ada9d3f3_354_255.jpg;2017-03-29 01:41:26;51.4642;51.4642;sale;-0.25372;false;1;5;0;1;SW15;London;400000;;Maisonette;sale_under_offer;Arabella Drive43366861;Lawsons & Daughters;020 3542 2133;Residential;*** Investment Opportunity *** A ground floor maisonette arranged over 2 floors with a garden. 4 Bedrooms, Kitchen/Reception, Bathroom, WC. Current rental Income approx. ??23,400.Bessborough Road, London SW15;2017-03-28 02:22:51;https://li.zoocdn.com/a03debdfa4df6b9b488974ba51dc63a7d7efc32f_354_255.jpg;2017-03-28 02:25:28;51.44428;51.44428;sale;-0.240968;false;1;4;0;1;SW15;London;350000;;Maisonette;sale_under_offer;Bessborough Road43366862;Lawsons & Daughters;020 3542 2133;Residential;*** Investment Opportunity*** A spacious second floor flat with balcony. 4 double bedrooms, Kitchen/Reception, Bathroom, WC. GCH.Mere Close, London SW15;2017-03-28 02:22:51;https://li.zoocdn.com/faf160173abfe1e88d3dbc0953e2c2c111d44adb_354_255.jpg;2017-03-29 01:41:26;51.450195;51.450195;sale;-0.218332;false;1;4;0;1;SW15;London;400000;;Flat;sale_under_offer;Mere Close43366860;Lawsons & Daughters;020 3542 2133;Residential;*** Investment Opportunity *** A spacious upper floor (3rd, 4th) maisonette with south west facing balcony. 4 Bedrooms, Reception/Kitchen, Bathroom, WC and GCH. The property has been generating an income of approx. ??20,400 per annum.Stoughton Close, London SW15;2017-03-28 02:22:51;https://li.zoocdn.com/3f37456f47e6ce3899ec612951cd1e9685adbcd3_354_255.jpg;2017-03-29 01:41:25;51.44528;51.44528;sale;-0.240411;false;1;4;0;1;SW15;London;350000;;Maisonette;sale_under_offer;Stoughton Close43366858;Lawsons & Daughters;020 3542 2133;Residential;*** Investment Opportunity *** A spacious second floor flat, comprising 4 double bedrooms, a large kitchen/reception room, 2 WCs and a bathroom. This property is tenanted and is achieving an income of ??25,200 per annum.Borrodaile Road, London SW18;2017-03-28 02:22:50;https://li.zoocdn.com/09e0c2056ece57e3b3d058b0a549a3ac7e3970d8_354_255.jpg;2017-03-28 02:26:39;51.453796;51.453796;sale;-0.189665;false;1;4;0;1;SW18;London;400000;;Flat;sale_under_offer;Borrodaile Road43366857;Lawsons & Daughters;020 3542 2133;Residential;*** Investment Opportunity *** A spacious first floor flat currently configured to maximise letting rooms. 5 Bedrooms, Kitchen, Bathroom, Shower Room. GCH. Rental income approx. ??33,600.Iron Mill Road, London SW18;2017-03-28 02:22:50;https://li.zoocdn.com/80c895f5fa718c0a2d08db9817a6fe2b04089f75_354_255.jpg;2017-03-29 01:41:25;51.45202;51.45202;sale;-0.188253;false;1;5;0;0;SW18;London;400000;;Flat;sale_under_offer;Iron Mill Road43366859;Lawsons & Daughters;020 3542 2133;Residential;*** Investment Opportunity *** A ground floor maisonette arranged over 2 floors and with a garden. 5 Bedrooms, Kitchen/Reception, 2 wcs, Bathroom, Shower cubicle. Rental income approx. ??26,400 per annum.Arabella Drive, London SW15;2017-03-28 02:22:50;https://li.zoocdn.com/7ff5fa153dcea3c0e8f215a5b1137ad34de2e3de_354_255.jpg;2017-03-29 01:41:25;51.46384;51.46384;sale;-0.251906;false;1;5;0;1;SW15;London;400000;;Maisonette;sale_under_offer;Arabella Drive43366856;Lawsons & Daughters;020 3542 2133;Residential;*** Investment Opportunity *** A ground floor maisonette arranged over 2 floors with access to a communal garden. 4 Bedrooms, Reception/Kitchen. Shower room, Bathroom. GCH. Current rental income approx. ??23,400 per annum.Harbridge Avenue, London SW15;2017-03-28 02:22:50;https://li.zoocdn.com/fd502fb46f8f19123deb422e2ab4032a5ff510e3_354_255.jpg;2017-03-29 01:41:25;51.45017;51.45017;sale;-0.243922;false;2;4;0;1;SW15;London;350000;;Maisonette;sale_under_offer;Harbridge Avenue43366781;Castles - Enfield;020 3463 8355;Residential;A warden assisted one bedroom retirement flat (over 55s only) located in a quiet cul-de-sac off Southbury Road, close to Ponders End High Street and Southbury br station (serving London Liverpool Street).  The property is offered for sale on a chain free basis.  Features include: Residents' parking area, security entryphone system, communal gardens, residents' lounge, 16' living room, 13' bedroom, lift, chain free sale. Please note: Shared Ownership at 70%Holmleigh Court, Glyn Road, Enfield EN3;2017-03-28 02:18:32;https://lid.zoocdn.com/354/255/5acbae282f74a644e55673906b7450860b11e54e.jpg;2017-03-30 01:18:10;51.649426;51.649426;sale;-0.047173;false;1;1;0;1;EN3;Enfield;90000;;;for_sale;Holmleigh Court Ponders End43366782;Castles - Enfield;020 3463 8355;Residential;A well presented and extended bay fronted 1930s family house located off the Hertford Road in Enfield Highway, within 1/2 mile of Brimsdown br station. An internal viewing is highly recommended. Features include: Front off-street parking, gas central heating (untested), double glazing, spacious and modern open plan kitchen/diner, ground floor WC, modern 1st floor bathroom, well kept 30' rear garden with timber summer house, chain free sale.Carterhatch Road, Enfield EN3;2017-03-28 02:18:32;https://lid.zoocdn.com/354/255/86d0148d38874652aff68f8553ae97fd9e677a4c.jpg;2017-03-29 01:41:25;51.660004;51.660004;sale;-0.042034;false;1;3;0;1;EN3;Enfield;420000;;Terraced house;for_sale;Carterhatch Road Enfield Highway43366780;Castles - Enfield;020 3463 8355;Residential;A well presented and chain free one bedroom 2nd floor modern purpose built flat located within easy reach of Turkey Street br station.  The property offers bright and spacious accommodation and an internal viewing is recommended.  Features include: Allocated parking space, double glazing, gas central heating (untested), 19' living room, own balcony with park views, 8' modern fitted kitchen, 12' bedroom, security entryphone system, chain free sale.Pipit Court, Teal Close, Enfield EN3;2017-03-28 02:18:32;https://li.zoocdn.com/adda452bae7c5204e7df2c7904840a94439d63a3_354_255.jpg;2017-03-29 01:41:25;51.67442;51.67442;sale;-0.046272;false;1;1;0;1;EN3;Enfield;220000;;Flat;for_sale;Pipit Court Turkey Street Area43366755;Castles - Hackney;020 3463 8353;Residential;This stunning two bedroom modern apartment is in superb condition and comprises open plan living/kitchen area with an abundance of natural light, master bedroom with en-suite, double guest bedroom, family bathroom, ample storage, private balcony and parking. Boasting wonderful views over Millfields Park and the River Lea and moments away from Chatsworth road with its aray of restaurants, bars and coffee shops.Southwold Road, London E5;2017-03-28 02:14:23;https://lid.zoocdn.com/354/255/99ff956c2ee6e117685293dbc7997ba62bd77cbe.jpg;2017-03-28 02:15:24;51.56294;51.56294;sale;-0.049063;false;2;2;0;1;E5;London;450000;;Flat;for_sale;149 Southwold Road43366722;Kurt Fuller, Ealing, London;020 8115 8742;Residential;A well presented two double bedroom third floor apartment located in a modern gated development with communal gardens and underground parking. The apartment offers a bright open plan lounge leading to a good size fully fitted kitchen, modern bathroom, master bedroom with ensuite shower room and access to a communal garden. The property benefits from a lift and secure entry phone system. No onward chain.Close to Northfields Tube (Piccadilly Line) and just a short walk to Brentford Station (National Rail).Windmill Road, Brentford TW8;2017-03-28 02:08:15;https://li.zoocdn.com/9ae99f71cf871667c17c0634b41cad631ac034f4_354_255.jpg;2017-04-04 02:12:47;51.49066;51.49066;sale;-0.310054;false;2;2;0;1;TW8;Brentford;475000;;Flat;for_sale;Mill Cross Court43366725;Bellgrange Estates;020 7768 6433;Residential;A newly built (off-plan) luxury 1 bedroom sixth floor apartment situated in the new Colindale Gardens development set in over 9 acres of landscape gardens and benefiting from a residents only gym, concierge service, cafes, restaurants and retail facilities. The property (590ft2) offers a contemporary open-plan kitchen with integrated appliances, 2 balconies, underfloor heating, 10 year building warranty and 999 year lease from January 2017. Completion due December 2017Serenity House, Colindale Gardens, Colindale, London NW9;2017-03-28 02:08:15;https://lid.zoocdn.com/354/255/1594d290d55c88c43f8ee627333138022c63f319.jpg;2017-03-28 02:09:15;51.59533;51.59533;sale;-0.249201;true;1;1;0;1;NW9;London;410000;;Flat;for_sale;Serenity House Colindale Gardens43366721;Kurt Fuller, Ealing, London;020 8115 8742;Residential;This three / four bedroom terraced home with off street parking, Offers a sleek style full of clean lines and modern living. On entering the hallway you will first encounter a bedroom/ study or play room which ever suites your family needs, with its wood flooring, the ground floor further offers both lounging area and dining leading to a conservatory which benefits from a modern kitchen which is bathed in light. The cabinets and integrated appliances are set off by worktop and splash backs. From double doors off the kitchen, there is a south facing garden, can be accessed. It is easy to imagine entertaining in this outdoor space. There is the added benefit of a guest cloakroom available on the ground floor. On the first floor you will find two bedrooms, while the master bedroom is situated on the floor above.. There are two full modern fitted bathrooms, both have bath with showers. This property also offers ample storage. As well as laying claim to a fashionable sense of style, this home is well situated to take advantage of Northfield Avenue with all the local shops and amenities plus travel links at the nearby Northfields Station Piccadilly Line and easy access Ealing Broadway .Entrance hallCranmer Avenue, London W13;2017-03-28 02:08:15;https://li.zoocdn.com/7ea1726b6b39407a65e614a7d0e95097cc782880_354_255.jpg;2017-04-04 02:12:47;51.50062;51.50062;sale;-0.316688;true;2;4;0;1;W13;London;775000;;Terraced house;for_sale;Cranmer Avenue43366717;The Mrktplace;020 8033 8766;Residential;The Mrktplace presents this fantastic investment located on a residential road in Harlesden.This four bedroom terraced house on Leghorn road is close to Willesden Junction Station(Overground & Bakerloo line).This large property is currently arranged as 2 x 2 bedroom flats.The property would offer scope to be converted back to one single dwelling with the potential to extend at the rear and the loft (stpp).Call us now to arrange an appointment.Leghorn Road, London NW10;2017-03-28 02:07:44;https://lid.zoocdn.com/354/255/884f7191d2f2e8fb498cc2e41eff304ee718308c.jpg;2017-03-30 02:41:36;51.535946;51.535946;sale;-0.242512;false;2;4;0;2;NW10;London;1000000;;Terraced house;for_sale;Leghorn road43366610;Docklands Prestige Residential Limited;020 3641 4510;Residential;An incredibly luxurious - 5 bedroom property within this brand new townhouse complex, set around 3 gated gardens with two grand arches at the entrance.* 5 Double Bedrooms* Open Plan Kitchen/Dining Room* Reception Room* Garage and allocated parking space in underground parking* 4 Bathrooms (3 En-Suite)* Underfloor Heating* Energy Efficiency: Band BDescription:An incredibly luxurious 5 bedroom property within this brand new townhouse complex, set around 3 gated gardens with two grand arches at the entrance.The property has been finished to an extremely luxurious standard throughout and includes a garage and a second allocated parking space. The property comprises 5 double bedrooms, 3 bathrooms (2 en-suite), a beautifully appointed open-plan kitchen/dining/living room as well as a separate reception room.Further features of this property include underfloor heating throughout, Comfort cooling to living areas and bedrooms, LED lights to underside of units, Intelligent mood lighting system with dimming facility controlled by Creston as well as a Crestron entertainment system.The local area:London Square Fulham is conveniently located just moments from the transport and entertainment hub of Fulham Broadway, and the idyllic village of Parsons Green. Stroll a little further and you reach the ever stylish King's Road, while a short tube or bus ride delivers you to the chic shopping destinations of Sloane Square and Knightsbridge.London Victoria can be reached in under 15 minutes, with connections to the South East and the Gatwick express. The South coast is also easily accessed from Victoria. Similarly, just a quarter of an hour on the westbound District line will deliver you to Paddington, the gateway to the West, and terminus for the Heathrow Express.Underground parking at London Square Fulham makes your travel options even more varied, with a short drive to the A4 making connections to the M4 for Reading, the West Country, and M3 for Southampton quick and easy. Local destinations are also close and convenient by car  for peace andtranquility the beautiful Richmond Park is just 16 minutes away, or for the culture of London's best museums, South Kensington is only 9 minutes in the opposite direction.Rainsbourough Square, 101 Farm Lane, Fulham SW6;2017-03-28 02:00:50;https://lid.zoocdn.com/354/255/ea24277e8b4171e4974c0b0cdab2d2855239c1dc.jpg;2017-04-04 02:04:19;51.48291;51.48291;sale;-0.197614;false;3;5;0;2;SW6;;5200000;;Terraced house;for_sale;101 Farm Lane43366617;Docklands Prestige Residential Limited;020 3641 4510;Residential;Docklands Prestige residential are pleased to bring to the market this off plan property located in Greenwich, SE10.Minutes from North Greenwich station, most of the iconic London landmarks, tourist spots, bars and restaurants can be accessed within less than 30 minutes, with the o2 offering good nightlife.Kitchen* Zanussi stainless steel electric fan oven* Zanussi ceramic hob and Electrolux stainless steel chimney extractor* Zanussi integrated fridge/freezer and washer/dryer* Integrated dishwasher* Worktop upstands and a stainless steel splash back to hob* Fascino stainless steel hand-finished sink, with oversized single bowl and integrated removable chopping board* Fascino designer curved tap with clipped hose-spray extension* Fascino instant boiling water tap* Integrated stainless steel soap dispenserLuxury Bathrooms & En-Suites* 'Laufen Pro' wall-hung basin with contemporary chrome wall-mounted tap* Concealed dual flush 'Roca Laura' wall-hung WC* Fitted mirror and shaver point* Heated chrome towel rails* Low level LED strip lighting to bathGeneral Specification* Television and telephone points to living area and master bedroom* Smoke alarm* Double-glazed uPVC windows* Communal heating system with radiators* Audio visual telephone entry systemExpected completion date - July 17- September 2017Christchurch Way, London SE10;2017-03-28 02:00:50;https://lid.zoocdn.com/354/255/c239cb2c66d60915e61ad5de4eb186f28ef26a2d.jpg;2017-03-28 02:19:35;51.490093;51.490093;sale;0.007174;false;1;1;0;1;SE10;London;390000;;Flat;for_sale;The Precision43366619;Docklands Prestige Residential Limited;020 3641 4510;Residential;An incredibly luxurious - brand new - 5 bedroom property within this brand new townhouse complex, set around 3 gated gardens with two grand arches at the entrance.* 5 Double Bedrooms* Open Plan Kitchen/Dining Room* Reception Room* Garage and allocated parking space in underground parking* 4 Bathrooms (3 En-Suite)* Underfloor Heating* Energy Efficiency: Band BDescription:An incredibly luxurious 5 bedroom property within this brand new townhouse complex, set around 3 gated gardens with two grand arches at the entrance.The property has been finished to an extremely luxurious standard throughout and includes a garage and a second allocated parking space. The property comprises 4 double bedrooms, 3 bathrooms (2 en-suite), a beautifully appointed open-plan kitchen/dining/living room as well as a separate reception room.Further features of this property include underfloor heating throughout, Comfort cooling to living areas and bedrooms, LED lights to underside of units, Intelligent mood lighting system with dimming facility controlled by Creston as well as a Crestron entertainment system.The local area:London Square Fulham is conveniently located just moments from the transport and entertainment hub of Fulham Broadway, and the idyllic village of Parsons Green. Stroll a little further and you reach the ever stylish King's Road, while a short tube or bus ride delivers you to the chic shopping destinations of Sloane Square and Knightsbridge.London Victoria can be reached in under 15 minutes, with connections to the South East and the Gatwick express. The South coast is also easily accessed from Victoria. Similarly, just a quarter of an hour on the westbound District line will deliver you to Paddington, the gateway to the West, and terminus for the Heathrow Express.Underground parking at London Square Fulham makes your travel options even more varied, with a short drive to the A4 making connections to the M4 for Reading, the West Country, and M3 for Southampton quick and easy. Local destinations are also close and convenient by car  for peace andtranquility the beautiful Richmond Park is just 16 minutes away, or for the culture of London's best museums, South Kensington is only 9 minutes in the opposite direction.Please note, all sales properties shown by dpr are subject to a 1% finder's fee, payable upon completion by your chosen solicitor. Should you choose dpr as your management company to let the property, this fee will be waived.Rainsbourough Square, 101 Farm Lane, Fulham SW6;2017-03-28 02:00:50;https://lid.zoocdn.com/354/255/ea24277e8b4171e4974c0b0cdab2d2855239c1dc.jpg;2017-04-04 02:04:19;51.48291;51.48291;sale;-0.197614;false;3;4;0;2;SW6;;5200000;;Terraced house;for_sale;101 Farm Lane43366621;Docklands Prestige Residential Limited;020 3641 4510;Residential;Docklands Prestige Residential are pleased to bring to the market this off plan, brand new, 1 bedroom apartment for sale in Hallsville Quarter E16. Moments away from Canning Town Station.Our property benefits from:* Bespoke Concierge Station* Reception area with sofas and coffee table* Fully fitted gym exclusive to Discovery Tower residents* 18th Floor Architect designed rooftop garden exclusive to Discovery Tower residents* Podium level landscaped courtyard* Fitted carpet to bedrooms* Ceramic floor tiling to bathrooms and ensuite* Built in sliding glass mirrored wardrobes to double bedrooms* Custom designed Manhattan kitchen* LED under cupboard lighting* High gloss, soft close handless doors and drawers to cupboards* Granite/natural stone worktop* Fully integrated appliances comprising of Ceramic 4 Zone touch control hob, stainless steel fan oven,* concealed extractor hood, dishwasher and washer dryer (located in hall cupboard where possible)* Embedded LED downlighters to all rooms, TV and telephone points to all living rooms and master bedrooms* with wiring to communal satellite dish with Sky+ HD facility** Colour video entry system, CCTV covers all external entrancesHallsville Quarter, London E16;2017-03-28 02:00:50;https://li.zoocdn.com/d44fa552952f2e0c402d62184f5a53a44209ea85_354_255.jpg;2017-03-28 02:19:36;51.514385;51.514385;sale;0.01124;false;1;1;0;1;E16;London;425000;;Flat;for_sale;Barking Road