listing_id;agent_name;agent_phone;category;description;displayable_address;first_publish_date;image_url;last_publish_date;latitude;listing_status;longitude;new_home;num_bathrooms;num_beedrooms;num_floors;num_recepts;outcode;post_town;price;price_change;property_type;status;street_name43362518;Settled;020 8022 6067;Residential;19A Gould Road is a charming 1-bedroom ground floor apartment with a south-facing garden and period features, on a quiet street near Twickenham Green and town centre.The living room boasts a sash windows to the front, a beautiful feature gas fireplace and alcoves either side perfect for shelving. The beautiful, recently installed kitchen is bright, spacious and modern throughout with all integrated appliances.The large bedroom is cosy and bright, with fitted double wardrobes. The bathroom to the rear is modern with bath and shower over, and window overlooking the garden. A door from there leads directly to the large rear garden. The property benefits from oak wood flooring throughout and many period features including the Victorian fireplace, old school radiators, plaster coving and ceiling roses.To the front the property is set away from the road with gated access and private frontgarden. To the rear is a large garden over two tiers, with a paved patio area at the bottom and laid lawn to the back, with high hedges around for added privacy.This apartment is situated in a popular residential street, ideally located for the popular local schools, Twickenham Green and Crane Park. It is also within half a mile of Twickenham town centre ??? with its array of shops, bars and restaurants in addition to its ???fast??? service into Waterloo. Nearest stations include Strawberry Hill, Whitton and Twickenham stations, all less than a mile away. It is within easy reach of Church Street with its selection of shops, bars and restaurants and the open spaces of Richmond Park, Marble Hill Park and the River Thames. Nearby schools include Archdeacon Primary School, Trafalgar Primary School, St Richard Reynolds Primary/Secondary and Waldegrave Girls Secondary School/Sixth Form.Gould Road, Twickenham TW2;2017-03-27 16:07:52;https://li.zoocdn.com/e0788a42bc8655141d5d4b6b3558f7287ed832e2_354_255.jpg;2017-03-28 01:39:57;51.446278;51.446278;sale;-0.344691;false;1;1;0;0;TW2;Twickenham;415000;;Flat;for_sale;Gould Road43362520;John D Wood & Co. - Earls Court Sales;020 3463 0462;Residential;This is a well presented two bedroom flat on the second floor of a mid terrace Victorian building, the exterior of which has been recently repainted, repointed and repaired. The flat benefits from elegantly proportioned rooms with good high ceilings and open views. There is a kitchen/breakfast room off the reception room, both overlooking the street, and the two bedrooms are situated to the rear of the building.Collingham Place is a located just north of Courtfield Gardens, well situated for the excellent local amenities with Gloucester Road and Earls Court underground stations a short walk away and many local shops and restaurants close by.2nd floor entrance hall  Entrance telephone, understairs linen cupboard with slated shelving, additional storage and housing the hot water cylinder. Access to extensive loft storage.Bathroom  Bath with overhead shower attachment, wash basin with mirror over and cupboard beneath. WC, heated towel rail, part tiled walls and tiled floor.Reception room  A bright and well proportioned room having one large sash window and one large casement window overlooking the street.Door to...Kitchen/breakfast room  With room for a table and two chairs, large sash window overlooking the street. Range of wall and base units with granite work surface incorporating 1?? bowl stainless steel sink. Appliances include Bosch dishwasher, Hotpoint washer/dryer, Bosch electric oven, Beko four ring ceramic hob with extractor hood over, Philips fridge/freezer. Further cupboard with slatted wood door housing the Worcester gas fired boiler.Bedroom  A good double bedroom situated quietly to the rear of the building having a large sash window.Bedroom 2  Stairs lead up to a further bedroom quietly situated to the rear of the building. Cupboard with hanging rail.Collingham Place, London SW5;2017-03-27 16:07:52;https://lid.zoocdn.com/354/255/638167eff3ccdc1198b1778050a108a3d72fb94c.jpg;2017-04-06 00:52:26;51.4939;51.4939;sale;-0.189142;false;1;2;0;1;SW5;London;885000;;Flat;for_sale;London43362515;John D Wood & Co. - Chelsea Green Sales;020 3463 0483;Residential;A fabulous two bedroom two bathroom, first floor apartment in the heart of Chelsea Harbour withsouth-west facing views of the tranquil marina. Rooms are well-proportioned and the flat has the benefit of a terrace and two parking spaces. Chelsea Harbour is located on the north bank of the river Thames adjacent to Imperial Wharf and close to the shops and restaurants of fashionable Chelsea.King's Quay, Chelsea Harbour, London SW10;2017-03-27 16:07:19;https://li.zoocdn.com/d9f601fb30b162e23d31605300da80eeadd29e36_354_255.jpg;2017-03-28 01:39:57;51.47584;51.47584;sale;-0.180728;false;2;2;0;1;SW10;London;1850000;;Flat;for_sale;Chelsea Harbour London43362512;Chain Residential;020 3641 7950;Residential;Rare to the market this 2 bedroom, Grade II listed maisonette occupies the lower ground and ground floor of this pretty Georgian house in central Clerkenwell.The property has its own entrance at street level, two double bedrooms, kitchen with space for dining, new bathroom and a private, secluded patio garden. The garden can also be accessed via French doors from the second bedroom.Ashby Street is a quiet turning just off the prestigious Northampton Square in the heart of Clerkenwell. The nearest Underground stations are Angel, Barbican and Old Street, with Exmouth Market and a vast array of shops, bars and restaurants close by. While those choosing to drive will enjoy rapid access to routes out of London and to the North via the A1.The property has recently been renovated and refurbished up to a very high standards.Ashby Street, Angel, London EC1V;2017-03-27 16:06:41;https://lid.zoocdn.com/354/255/f1e95ceaa00b32cde3abc5e17fa90b7801e1c564.jpg;2017-03-31 12:12:02;51.527573;51.527573;sale;-0.101192;false;1;2;0;1;EC1V;London;820000;;Flat;for_sale;Ashby Street 43362493;Century 21;020 8166 7400;Residential;Century 21 Stratford are pleased to present this spacious four bedroom town house. Boasting ground floor cloakroom, spacious kitchen/diner, garden, first floor family bathroom & the added benefit of an integral garage.Located a short walk from Abbey Road DLR and Plaistow underground stations. Stratford Town Centre & Westfield shopping centre are also a short bus / car journey away.Although in need of modernisation, we believe many would be pleased with the overall living space the property offers, the integral garage gives such hard to find off street parking in Stratford plus the potential to convert as many have done to usable living space.View now to avoid disappointment. EPC Rating EGround Floor:Kitchen/Diner: 15'07 x 13'11Garage: 20'11 x 8'01CloakroomGardenFirst Floor:Lounge: 15'08 x 12'01Bedroom: 17'01 max x 8'06Bathroom: UnmeasuredSecond Floor:Bedroom: 15'04 x 7'00Bedroom: 15'04 x 7'00Bedroom 12'06 x 8'05Napier Road, Stratford E15;2017-03-27 16:06:08;https://lid.zoocdn.com/354/255/7e7a26a853462dc71dfe61f0de14c6ed392c1412.jpg;2017-04-05 16:06:51;51.532555;51.532555;sale;0.008551;false;1;4;0;1;E15;London;500000;;Town house;for_sale;Napier Road43362470;R Whitley & Co;01895 262388;Residential;A brand new sleek and sophisticated two bedroom apartment boasting a large private entertainer's terrace - EPC B.DescriptionA brand new luxury second floor two bedroom apartment offering sleek and sophisticated living just moments from the mainline railway station which will benefit from Crossrail from 2019. Any discerning purchaser will be impressed with the specification of the apartment which was recently constructed to exacting standards by Carey Homes plc. The large private paved terrace is a real feature and would make the perfect area to entertain guests in the summer months. The easy flowing accommodation includes an entrance hall, generous light filled living room which is open plan to the kitchen which is fitted with a stylish range of modern wall and floor cupboard units (with built in appliances), master bedroom with well-appointed shower room, second double bedroom and luxury bathroom.Heating & hot waterA gas fired combination boiler serves the radiator system and provides the domestic hot water.WindowsDouble glazed sealed unit windows.OutsideSubstantial communal terrace to the top floor. Allocated undercroft parking space behind security gates.LocationThe town centre of West Drayton with mainline railway station (Crossrail from 2019), bus routes and shops is just a short walk. London Heathrow Airport, the motorway network, Uxbridge town centre and Stockley Business Park are all within easy motoring distance.Council Tax BandTo be confirmed.TenureWe understand that the property is held on a lease term of 125 years from 01/01/16.*Ground RentWe understand that there is a ground rent payable currently ??350 per annum. This figure will rise throughout the term.*Service ChargeWe understand the annual service charge payable is currently ??1150.06.** To the best of our knowledge this information is correct but will be confirmed by the solicitors during the conveyance.ServicesMains gas, electricity, water and drainage.ViewingsStrictly by appointment with R Whitley & Co.Kitchener House, West Drayton, Middlesex UB7;2017-03-27 16:04:19;https://lid.zoocdn.com/354/255/cc3dcddc3455f1b08f19af8e49ccad587acfd786.jpg;2017-04-07 14:08:54;51.5033;51.5033;sale;-0.46232462;false;2;2;0;1;UB7;West Drayton;395000;;Flat;for_sale;Kitchener House43362463;CityWest Residential Victoria;020 3542 2194;Residential;A superb ground floor one double bedroom apartment situated within a well maintained red brick building located on the popular Millbank Estate, SW1P. The accommodation comprises of an entrance hallway, modern kitchen/breakfast room with fully fitted appliances, double bedroom and a bathroom.Landseer House is an English Heritage listed building constructed in the Arts & Crafts and Queen Anne style, constructed of mainly redbrick with an impressive stonework entrance to the building itself which is approached via a classic granite cobbled courtyard and surrounded by elegant tree lined streets. It is a historic, unique and very attractive building.Over 90 years left on the lease, service charges approx. ??1000 per annum, ground rent ??10 per annum. Would rent for approx. ??1800pcm.Landseer House, Cureton Street, London SW1P;2017-03-27 16:04:19;https://lid.zoocdn.com/354/255/75987a0d7767c9f1aefd297d17ebb518ba344eee.jpg;2017-03-27 21:48:20;51.490845;51.490845;sale;-0.130016;false;0;1;0;0;SW1P;London;450000;;;for_sale;Cureton Street London43362448;Heathrow Estates;020 3641 4126;Residential;Heathrow Estates proudly present this four bedrooms mid terraced extended house, with loft conversation, two reception rooms, second reception room open to fitted kitchen & diner. Down stairs wc & hand basin, fitted wardrobes in the bedrooms. Off street parking. Must be seen.Meadow Bank Gardens, Cranford TW5;2017-03-27 16:03:06;https://lid.zoocdn.com/354/255/a8e170e92b1b9428ef84860d626d783dbdb02c10.jpg;2017-03-27 16:07:53;51.477882;51.477882;sale;-0.40953;false;3;4;0;2;TW5;Hounslow;474950;;Terraced house;for_sale;Meadow Bank Gardens43362423;Trading Places;020 3551 3271;Residential;Located conveniently for Wood Street shops and station, this one bedroom ground floor garden flat does require modernisation throughout. This property benefits from no onward chain, double glazing and gas central heating. For more information, please contact our dedicated sales team on alternatively send your email enquiry to Entrance hallwayCommunal door leading to communal entrance with door leading to flat. Doors to lounge, bedroom and kitchen, under-stairs storage, housing electricity meter and fuse box.Lounge14'7" into bay x 8'10" (4.45m into bay x 2.69m) Carpeted floor, power points, radiator, double glazed bay window to front aspect, ceiling rose and cornicing to ceiling.Kitchen12'3" x 8'2" (3.73m x 2.49m) Laminate floor, power points, two double glazed windows and side door to rear garden, wall and base units, work surfaces, tiled splash backs, plumbing for washing machine, space for gas cooker, cupboard housing Vaillant boiler, stainless steel single drainer sink unit with mixer tap and door to bathroom.Bedroom9'6" x 9'5" (2.90m x 2.87m) Carpeted floor, power points, radiator and double glazed window to rear aspect.Bathroom7'7" x 6'7" (2.31m x 2.01m) Lino floor, mostly tiled walls, radiator, double glazed window to rear aspect, three-piece bathroom suite consisting of panelled bath, wash/hand basin and low level wc.Rear gardenPatio and shedThese particulars have been prepared under instruction from the seller and are intended as a general guide. All measurements are approximate and Trading Places have not carried out any form of survey and have not tested any of the equipment, appliances or services mentioned. Photographs may have been taken using a wide angled lens and are for general information  it cannot be inferred items shown are included in the sale. Prospective buyers must conduct their own enquiries and seek advice through their appointed legal representative and surveyor.Walthamstow, London E17;2017-03-27 16:00:13;https://lid.zoocdn.com/354/255/7b69199c4edb9826a27efee73701dbc78baede14.jpg;2017-03-29 23:57:36;51.58849;51.58849;sale;-0.006306;false;0;1;0;0;E17;London;250000;;Flat;for_sale;43362402;Estates and Lets;020 3641 5212;Residential;( Estates and Lets )* Four double bedroom town house* Two large bathrooms* Large living area with open plan kitchen* Downstairs cloakroom* Wooden floor throughout the living area* Paved back garden* Large private roof terraceClemence Street, London E14;2017-03-27 15:56:59;https://li.zoocdn.com/c33e28f9a95d45bf7bf774b7373ae8e3dfe49348_354_255.jpg;2017-03-28 01:39:53;51.516193;51.516193;sale;-0.031776;false;2;4;0;1;E14;London;825000;;;for_sale;Clemence Street43362386;Your Move;020 3542 2201;Residential;For sale by modern method of auction starting bid ??170,000 plus reservation fee. Need a mortgage? Come and speak to our financial advisor! This property is for sale by the modern method of auction which is not to be confused with traditional method of auction. The modern method of auction is a flexible buyer friendly method of purchase. We do not require the purchaser to exchange contracts immediately, but grant 28 days to achieve exchange of contracts from the date the buyers solicitor is in receipt of the draft contract and a further 28 days thereafter to complete. Allowing the additional time to exchange on the property means interested parties can proceed with traditional residential finance. Upon close of a successful auction or if the vendor accepts an offer. Allowing the additional time to exchange on the property means interested parties can proceed with traditional residential finance. Upon close of a successful auction or if the vendor accepts an offer during the auction, the buyer will be required to put down a non-refundable Reservation Fee of 2.5% to a minimum of ??5,000.00 + VAT (??1,000.00) = (??6,000.00) which secures the transaction and takes the property off the market. Fees paid to the Auctioneer may be considered as part of the chargeable consideration for the property and be included in the calculation for stamp duty liability. Further clarification on this must be sought from your legal representative. The buyer will be required to sign an Acknowledgement of Reservation form to confirm acceptance of terms prior to solicitors being instructed. Copies of the Reservation from and all terms and conditions can be found in the Buyer Information Pack which can be downloaded for free from the auction section of our website or requested from our Auction Department. Please note this property is subject to an undisclosed reserve price which is generally no more than 10% in excess of the Starting Bid, both the Starting Bid and reserve price can be subject to change. Terms and conditions apply to the Modern Method of Auction, which is operated by London and South East Property Auction powered by iam-sold Ltd. A copy of the EPC will be available on request. EPC Grade C.LocationSituated just off Crossways with its ample buses and destinations it is also just a short distance from Thamesmead town with Morrisons Superstore, varied additional retail outlets and fast food restaurants. Additionally there are links to larger shopping facilities at Erith, Bexleyheath and WoolwichOur ViewYour Move in Abbey Wood are pleased to offer this larger than average one bedroom purpose built top floor flat situated in the North Thamesmead area. Accommodation comprises one double bedroom, modern bathroom/living room and fitted integrated kitchen. Additional benefits include double glazing, residents parking space, no forward chain and more. Call to view.Living Room / Dining Room (5.21m x 3.30m)Kitchen (2.66m x 2.57m)Bedroom (5.00m x 2.64m)Important note to purchasers:We endeavour to make our sales particulars accurate and reliable, however, they do not constitute or form part of an offer or any contract and none is to be relied upon as statements of representation or fact. Any services, systems and appliances listed in this specification have not been tested by us and no guarantee as to their operating ability or efficiency is given. All measurements have been taken as a guide to prospective buyers only, and are not precise. Please be advised that some of the particulars may be awaiting vendor approval. If you require clarification or further information on any points, please contact us, especially if you are traveling some distance to view. Fixtures and fittings other than those mentioned are to be agreed with the seller./3Fairway Drive, North Thamesmead, London SE28;2017-03-27 15:56:59;https://lid.zoocdn.com/354/255/719cbb13f8bfe2c8961cceef0350bd0d9e1029e0.jpg;2017-04-03 15:13:34;51.511257;51.511257;sale;0.129423;false;0;1;0;0;SE28;London;170000;;Flat;for_sale;Fairway Drive43362401;Agents R Us;020 7768 2920;Residential;This bright and airy two bedroom mews house comprises of a fabulous modern kitchen/lounge, downstairs WC and upstairs there are two bedrooms (one with en-suite). The property also has double glazing, storage and a front courtyard. The property includes white goods.All rooms are well proportioned and its white walls give way to an ideal backdrop for any furnishing/d??cor.Transportation links are very good, with tram (Beckenham Road) and br stations of Kent House and Clock House within walking distance.Birkbeck Road, Beckenham BR3;2017-03-27 15:56:59;https://lid.zoocdn.com/354/255/93cad04f79dbed52b53e8f9374ebc2bff4ebe125.jpg;2017-04-03 13:50:01;51.4094;51.4094;sale;-0.047064;false;1;2;0;0;BR3;Beckenham;449500;;Terraced house;for_sale;Birkbeck Road43362368;Estates and Lets;020 3641 5212;Residential;( Estates and Lets )* Four bedroom town house* Five bathrooms* Every room has its own en suite* Large kitchen / dining area* Small paved garden to rear* Large private roof terraceSarum Terrace, Bow Common Lane, London E3;2017-03-27 15:55:21;https://li.zoocdn.com/feb9b92af048d2c1614422560034930b65183ca1_354_255.jpg;2017-03-28 12:37:05;51.521427;51.521427;sale;-0.031594;false;5;4;0;1;E3;London;900000;;;for_sale;Bow Common Lane43362373;Ivory & Hatton;020 3641 9849;Residential;One elegant terraced house to rent.**This property is ideal for families or sharers **Ivory and Hatton are delighted to offer this charming three double bedroom terrace house, located in the heart of the Isle of Dogs.On the ground floor of this property there is a spacious lounge with wooden flooring, a modern and fully fitted kitchen with integrated appliances, a private conservatory and a gorgeous rear garden with decking and a large grass area.On the next floor  we have a large master bedroom over-looking Manchester Grove, one elegant bathroom suite with bathtub and a second bedroom leading to a converted bedroom with a fixed staircase and skylight windows.Being located on Manchester Grove, this property is within minutes walk from Mudchute and Island Gardens DLR stations for direct routes to Canary Wharf and links into The City and other surrounding areas. Many bus routes including D7,135, N550 also pass by the nearest main road, only a stones throw away.There are many amenities close by, including off-licences, dry cleaners, post office, fast-food restaurants and many more.For more information please contact the lettings team.Manchester Grove, London E14;2017-03-27 15:55:21;https://li.zoocdn.com/b19ca626cce14f0781e322bd8d21b9d597852e80_354_255.jpg;2017-03-27 15:57:13;51.48789;51.48789;sale;-0.012095;false;1;3;0;1;E14;London;580000;;Terraced house;sold;Manchester Grove43362351;Dexters - Chiswick;020 8166 7257;Residential;A first floor two bedroom apartment in this popular gated development by the river. The flat has residents parking and communal gardens overlooking the river.DirectionsHartington Court is located within 500 metres of Chiswick mainline station offering a regular service up to Waterloo.You may download, store and use the material for your own personal use and research. You may not republish, retransmit, redistribute or otherwise make the material available to any party or make the same available on any website, online service or bulletin board of your own or of any other party or make the same available in hard copy or in any other media without the website owner's express prior written consent. The website owner's copyright must remain on all reproductions of material taken from this website.Hartington Road, London W4;2017-03-27 15:53:16;https://li.zoocdn.com/130647e9301c27e0f2042e5853897e6a0dd6ac1f_354_255.jpg;2017-03-28 01:39:52;51.4813;51.4813;sale;-0.274886;false;1;2;0;1;W4;London;499950;;Flat;for_sale;Hartington Road43362320;Estates and Lets;020 3641 5212;Residential;( Estates and Lets )* Three bedroom apartment* Good size bedrooms* Two bathrooms* Wooden floors throughout* Underfloor heating* Large windows offering natural light* Good size balcony* Private bike store within the developmentRockland Apartments, 5 Lakenham Place, London E3;2017-03-27 15:50:11;https://lid.zoocdn.com/354/255/b3567d4c01393081bb910ccf98ff8913f190a419.jpg;2017-03-28 01:39:50;51.521355;51.521355;sale;-0.031092;false;2;3;0;1;E3;London;585000;;Flat;for_sale;Rockland Apartments43362295;Alliance Property Hub;020 8033 6055;Residential;Detailed DescriptionDescription coming shortlySherrard Road, London E7;2017-03-27 15:48:06;;2017-03-28 01:39:49;51.5456;51.5456;sale;0.038879;false;0;0;0;0;E7;London;190000;;Studio;sold;Sherrard Road43362285;Bairstow Eves - Stratford Sales;020 3463 0128;Residential;A delightful, three double bedroom, mid-terrace house is offered for sale with ample living space and a rear garden ideal for a a young family. The property is located within a walk distance of West Ham Park, Plaistow Underground Station and Abbey Road DLR. This property benefits from a large reception room with bay window to the front, a kitchen/dining room plus a good size utility room giving access to the garden. The first floor of the property boasts the master bedroom which also has a bay window and fitted wardrobe, two more double bedrooms, family bathroom and separate W/C.Reception Room 24'2" x 14'9" (max)Kitchen 20'4" x 8'5"Utility Room 18'5" x 5'2"Master Bedroom 12'5" x 12'1"Bedroom 2 11'6" x 8'5"Bedroom 3 11'2" x 8'4"Family Bathroom 5'4" x 5'1"Separate W/C 5'4" x 2'5"GardenStratford, London, England E15;2017-03-27 15:46:34;https://li.zoocdn.com/24fcaeee85905fc0990976aabbf1afda8215d186_354_255.jpg;2017-03-28 01:39:49;51.536247;51.536247;sale;0.013818;false;1;3;0;1;E15;London;575000;;Terraced house;for_sale;Stratford London England43362281;Estates and Lets;020 3641 5212;Residential;( Estates and Lets )* Three bedroom penthouse* Large reception room* Good size bedroom* Balcony bedroom with private balcony* Three bathrooms* Open plan kitchen* High ceilings throughout* Private cycle storeGrace Lodge, 181 Clarence Road, London E5;2017-03-27 15:46:02;https://lid.zoocdn.com/354/255/f5005d2e8a44ff17c65c342aeb1921f579ce78d7.jpg;2017-03-28 01:39:49;51.554653;51.554653;sale;-0.056298;false;3;3;0;1;E5;London;650000;;Flat;for_sale;Grace Lodge